,Unnamed: 0,JP_shortTitle,shortTitle,itemId,title,viewItemURL,currentPrice,currency,country,primaryCategory.categoryId,primaryCategory.categoryName,listingType,condition,model,TotalCounts,Target,Unnamed: 0,Unnamed: 0.1,Unnamed: 0.1.1,Unnamed: 0.1.1.1,Unnamed: 0.1.1.1.1,Title,CurrentPrice,BidOrBuy,shopName,ItemUrl,CategoryId,en_Title,en_short_Title,short_Title,Target_y
118,87.0,,NIKON NikkorS Auto 50 mm 14 Lens JAPAN 190092399762,173845301288.0,"""As Is"" NIKON Nikkor-S Auto 50mm f/ 1.4 Lens JAPAN #190092-399762",https://www.ebay.com/itm/As-Is-NIKON-Nikkor-S-Auto-50mm-f-1-4-Lens-JAPAN-190092-399762-/173845301288,59.99,USD,JP,3323.0,Lenses,StoreInventory,Used,NIKKOR non Ai,1073.0,20.0,115,115,115,115,15,CH-22306 ジャンク品 NIKON ニコン Micro-NIKKOR 2.8/55,1100.0,,,https://page.auctions.yahoo.co.jp/jp/auction/x644756650,2084261693,CH-22306 junk NIKON Nikon Micro-NIKKOR 2.8 / 55,junk NIKON Nikon MicroNIKKOR 28 55,CH ジャンク 品 NIKON ニコン Micro 2 8 55,20
119,75.0,,Mint Nikon AF NIKKOR 70210 mm f456 D Zoom Lens Hood New Filter JPN 2341,133141122727.0,*Mint* Nikon AF NIKKOR 70-210mm f4-5.6 D Zoom Lens w/ Hood New Filter JPN #2341,https://www.ebay.com/itm/Mint-Nikon-AF-NIKKOR-70-210mm-f4-5-6-D-Zoom-Lens-w-Hood-New-Filter-JPN-2341-/133141122727,89.0,USD,JP,3323.0,Lenses,StoreInventory,Used,Nikon AF Zoom NIKKOR D,1009.0,20.0,116,116,116,116,16,◇ Nikon ニコン F4S + AF NIKKOR 35-70mm F2.8 D フィルムカメラ 標準ズームレンズ セット AF一眼レフ,11075.0,,,https://page.auctions.yahoo.co.jp/jp/auction/421816140,2084044785,◇ Nikon Nikon F4S AF NIKKOR 35-70mm F2.8 D Film Camera Standard Zoom Lens Set AF SLR,Nikon Nikon F4S AF NIKKOR 3570 mm F28 D Film Camera Standard Zoom Lens Set AF SLR,Nikon ニコン 4 AF NIKKOR 35 70 mm F2 8 フィルム カメラ 標準 ズームレンズ セット AF 一 眼 レフ,10
120,33.0,,Nikon Nikkor 50 mm F14 NonAi MF Lens Japan 104371234,383137277034.0,Nikon Nikkor 50mm F1.4 Non-Ai MF Lens From Japan #104371/234,https://www.ebay.com/itm/Nikon-Nikkor-50mm-F1-4-Non-Ai-MF-Lens-Japan-104371-234-/383137277034,58.0,USD,JP,3323.0,Lenses,StoreInventory,Used,Nikon Nikkor 50mm F1.4,911.0,20.0,117,117,117,117,17,純正品！未使用！Nikon　ニコン　リチャージャブルバッテリーEN-EL9(EL9),1880.0,1880.0,,https://page.auctions.yahoo.co.jp/jp/auction/w322572393,2084261672,Genuine product! unused! Nikon Nikon Rechargeable Battery EN-EL9 (EL9),product Nikon Nikon Rechargeable Battery EL9,純正 品 未 Nikon ニコン リチャージャブル バッテリー EN EL 9 EL 9,10
121,25.0,,Mint Nikon F4 35 mm SLR Film Camera Finder DP20 Japan,273776519340.0,Near Mint Nikon F4 35mm SLR Film Camera Finder DP-20 from Japan,https://www.ebay.com/itm/Near-Mint-Nikon-F4-35mm-SLR-Film-Camera-Finder-DP-20-Japan-/273776519340,134.0,USD,JP,15230.0,Film Cameras,StoreInventory,Used,F4,840.0,10.0,118,118,118,118,18,◇ Nikon ニコン F2 アイレベル 730万台 ブラック + AI NIKKOR 50mm F1.4 フィルムカメラ MF一眼レフ 標準単焦点レンズ 大口径 セット,17930.0,,,https://page.auctions.yahoo.co.jp/jp/auction/w339598010,2084044778,◇ Nikon Nikon F2 Eye Level 7.3 million Black AI NIKKOR 50mm F1.4 Film Camera MF SLR Standard Single Focal Lens Large Aperture Set,Nikon Nikon F2 Eye Level 73 million Black AI NIKKOR 50 mm F14 Film Camera MF SLR Standard Single Focal Lens Aperture Set,Nikon ニコン 2 アイ レベル 730 万 台 ブラック AI NIKKOR 50 mm 1 4 フィルム カメラ MF 一 眼 レフ 標準 単 焦点 レンズ 大 口径 セット,10
122,69.0,,EXC5 NIKON Micro Nikkor AiS 55 mm f28 AiS MF Macro Lens JAPAN,352703371037.0,{EXC5} NIKON Micro Nikkor Ai-S 55mm f2.8 AiS MF Macro Lens from JAPAN #058f,https://www.ebay.com/itm/EXC5-NIKON-Micro-Nikkor-Ai-S-55mm-f2-8-AiS-MF-Macro-Lens-JAPAN-058f-/352703371037,99.99,USD,JP,3323.0,Lenses,StoreInventory,Used,Micro-Nikkor,783.0,20.0,119,119,119,119,19,★ハローカメラ★ 5486 Nippon Kogaku 非Ai NIKKOR-S Auto ( 55mm F1.2 ) 大口径 1.2 動作品 ジャンク 要清掃 要修理 1円スタート,5610.0,20350.0,,https://page.auctions.yahoo.co.jp/jp/auction/t676170667,2084261693,★ Hello Camera ★ 5486 Nippon Kogaku Non Ai NIKKOR-S Auto (55mm F1.2) Large Diameter 1.2 Operational Product Junk Cleaning Required Repair 1 Yen Start,Camera 5486 Nippon Kogaku Non Ai NIKKORS Auto 55 mm F12 Large Diameter 12 Operational Product Junk Cleaning Required Repair 1 Yen Start,ハロー カメラ 5486 Nippon Kogaku 非 Ai NIKKOR Auto 55mm F1 2 大 口径 1 2 動作 品 ジャンク 要 清掃 要 修理 1 円 スタート,20
123,78.0,,SIGMA mm F28 EX DC OS HSM NIKON F mount Excellent JAPAN 742,183876048742.0,SIGMA AF17-50mm F/2.8 EX DC OS HSM For NIKON F mount Excellent From JAPAN #742,https://www.ebay.com/itm/SIGMA-AF17-50mm-F-2-8-EX-DC-OS-HSM-NIKON-F-mount-Excellent-JAPAN-742-/183876048742,195.0,USD,JP,3323.0,Lenses,StoreInventory,Used,DC HSM,762.0,20.0,120,120,120,120,0,◇ Canon キヤノン IV S型 (4S) + SERENAR 50mm F1.8 レンジファインダーカメラ 標準単焦点レンズ セット クラシックカメラ バルナック式,5401.0,,,https://page.auctions.yahoo.co.jp/jp/auction/h424313394,2084204375,◇ Canon Canon IV S type (4S) SERENAR 50mm F1.8 Rangefinder camera Standard single focus lens set Classic camera Barnac type,Canon Canon IV S type 4S SERENAR 50 mm F18 Rangefinder camera Standard focus lens camera Barnac type,Canon キヤノン IV S型 4 SERENAR 50 mm 1 8 レンジファインダー カメラ 標準 単 焦点 レンズ セット クラシック カメラ バルナック 式,20
124,23.0,,ExcellentNikon SERIES E Zoom 3672 mm F35 AIS Lens Japan 13,133064219105.0,「Excellent++++」Nikon SERIES E Zoom 36-72mm F3.5 AI-S Lens From Japan #13,https://www.ebay.com/itm/Excellent-Nikon-SERIES-E-Zoom-36-72mm-F3-5-AI-S-Lens-Japan-13-/133064219105,29.99,USD,JP,3323.0,Lenses,FixedPrice,Used,Ai-S MF,750.0,20.0,121,121,121,121,1,■ニコン NIkon Ai-S NIKKOR 100-300mm F5.6,1.0,,,https://page.auctions.yahoo.co.jp/jp/auction/w341213163,2084261693,Nikon NIkon Ai-S NIKKOR 100-300mm F5.6,Nikon NIkon AiS NIKKOR 100300 mm F56,ニコン NIkon Ai NIKKOR 100 300 mm F 5 6,20
125,7.0,,F2 35 mm SLR Film MF Camera Silver Body NIKON STRAP JP,323871413840.0,【Excellent+】NIKON F2 35mm SLR Film MF Camera Only Silver Body + NIKON STRAP JP,https://www.ebay.com/itm/Excellent-NIKON-F2-35mm-SLR-Film-MF-Camera-Only-Silver-Body-NIKON-STRAP-JP-/323871413840,50.0,USD,JP,15230.0,Film Cameras,StoreInventory,Used,Nikon F2,661.0,10.0,122,122,122,122,2,◇ NIKON ニコン FE2 253万台 フィルムカメラ MF一眼レフ,16200.0,,,https://page.auctions.yahoo.co.jp/jp/auction/e383560711,2084044778,◇ NIKON Nikon FE2 2.53 million film camera MF SLR,NIKON Nikon 253 million film camera MF SLR,NIKON ニコン FE 2 253 万 台 フィルム カメラ MF 一 眼 レフ,10
126,45.0,,Nikon F2 Photomic 35 mm SLR Film Camera Body SN7691160 Excellent,254370573066.0,Nikon F2 Photomic 35mm SLR Film Camera Body Only  SN7691160 **Excellent+**,https://www.ebay.com/itm/Nikon-F2-Photomic-35mm-SLR-Film-Camera-Body-Only-SN7691160-Excellent-/254370573066,149.8,USD,JP,15230.0,Film Cameras,StoreInventory,Used,Nikon F2,661.0,10.0,123,123,123,123,3,◆ Nikon ニコン AF NIKKOR 300mm F2.8 望遠単焦点レンズ Fマウント AFレンズ AF一眼レフ用,66000.0,,,https://page.auctions.yahoo.co.jp/jp/auction/g373138541,2084261684,◆ Nikon Nikon AF NIKKOR 300mm F2.8 telephoto single focus lens F mount AF lens For AF SLR,Nikon Nikon AF NIKKOR 300 mm F28 telephoto focus lens F mount AF lens AF SLR,Nikon ニコン AF NIKKOR 300 mm F2 8 望遠 単 焦点 レンズ マウント AF レンズ AF 一 眼 レフ 用,20
127,35.0,,Pinocchiorosso VINTAGE Nikon F2 Photomic 35 mm Camera 50 mm F14 JAPAN,264473906014.0,【For Pinocchiorosso】 VINTAGE Nikon F2 Photomic 35mm Camera 50mm F/1.4 From JAPAN,https://www.ebay.com/itm/For-Pinocchiorosso-VINTAGE-Nikon-F2-Photomic-35mm-Camera-50mm-F-1-4-JAPAN-/264473906014,150.0,USD,JP,15230.0,Film Cameras,StoreInventory,Used,Nikon F2,660.0,10.0,124,124,124,124,4,◇ Nikon ニコン 非AI NIKKOR-S Auto 50mm F1.4 Fマウント 標準単焦点レンズ MF一眼レフ用 大口径,3240.0,,,https://page.auctions.yahoo.co.jp/jp/auction/p710640685,2084261693,◇ Nikon Nikon Non-AI NIKKOR-S Auto 50mm F1.4 F mount Standard single focus lens Large aperture for MF SLR,Nikon Nikon NonAI NIKKORS Auto 50 mm F14 F focus lens aperture MF SLR,Nikon ニコン 非 AI NIKKOR Auto 50 mm 1 . 4 マウント 標準 単 焦点 レンズ MF 一 眼 レフ 用 大 口径,20
128,29.0,,Nikon F2 Black camera body Exc Japan7574,293230322690.0,"Nikon F2 Black camera body only ""Exc+"" From Japan#7574",https://www.ebay.com/itm/Nikon-F2-Black-camera-body-only-Exc-Japan-7574-/293230322690,119.0,USD,JP,15230.0,Film Cameras,FixedPrice,Used,Nikon F2,660.0,10.0,125,125,125,125,5,■ Nikon ニコン NIKONOS IV-A+W-NIKKOR 35mm F2.5 + UW-NIKKOR 28mm F3.5 フィルムカメラ 水中カメラ 防水,8800.0,,,https://page.auctions.yahoo.co.jp/jp/auction/r347914377,2084044778,■ Nikon Nikon NIKONOS IV-A W-NIKKOR 35mm F2.5 UW-NIKKOR 28mm F3.5 Film Camera Underwater Camera Waterproof,Nikon Nikon NIKONOS IVA 35 mm F25 UWNIKKOR 28 mm F35 Film Camera Underwater Camera Waterproof,Nikon ニコン NIKONOS IV NIKKOR 35 mm 2 5 UW NIKKOR 28 mm F 3 5 フィルム カメラ 水中 カメラ 防水,10
129,64.0,,Nikon F2 Photomic DP1 Black Body 35 mm SLR film Camera Japan 297,202675998751.0,Excellent Nikon F2 Photomic DP-1 Black Body 35mm SLR film Camera Japan #297,https://www.ebay.com/itm/Excellent-Nikon-F2-Photomic-DP-1-Black-Body-35mm-SLR-film-Camera-Japan-297-/202675998751,138.0,USD,JP,15230.0,Film Cameras,StoreInventory,Used,Nikon F2,660.0,10.0,126,126,126,126,6,◆ Tokina トキナー AT-X PRO 28-70mm F2.8 ズームレンズ ニコンFマウント AFレンズ AF一眼レフ用,4430.0,,,https://page.auctions.yahoo.co.jp/jp/auction/g374948768,2084261690,◆ Tokina Tokina AT-X PRO 28-70mm F2.8 Zoom Lens Nikon F Mount AF Lens For AF SLR,Tokina Tokina ATX PRO 2870 mm F28 Zoom Lens Nikon F Mount AF Lens AF SLR,Tokina トキナー AT PRO 28 70 mm F2 8 ズームレンズ ニコン マウント AF レンズ AF 一 眼 レフ 用,20
130,90.0,,Exc Nikon L35 AD 35 mm Point Shoot Film camera Lens JAPAN1248,113898301980.0,*Exc++++* Nikon L35 AD 35mm Point & Shoot Film camera f2.8 Lens from JAPAN*1248,https://www.ebay.com/itm/Exc-Nikon-L35-AD-35mm-Point-Shoot-Film-camera-f2-8-Lens-JAPAN-1248-/113898301980,94.9,USD,JP,15230.0,Film Cameras,StoreInventory,Used,Nikon F2,660.0,10.0,127,127,127,127,7,● Nikon ニコン AI-S NIKKOR 35mm F1.4 Fマウント MF交換レンズ 広角単焦点レンズ,27500.0,,,https://page.auctions.yahoo.co.jp/jp/auction/o344949116,2084261693,● Nikon Nikon AI-S NIKKOR 35mm F1.4 F mount MF interchangeable lens Wide-angle single focus lens,Nikon Nikon AIS NIKKOR 35 mm F14 F mount MF lens Wideangle focus lens,Nikon ニコン AI NIKKOR 35 mm 1 4 マウント MF 交換 レンズ 広角 単 焦点 レンズ,20
131,25.0,,Nikon F2 35 mm SLR Film Camera Body SN7684333,323900837093.0,Nikon F2 35mm SLR Film Camera Body Only SN7684333,https://www.ebay.com/itm/Nikon-F2-35mm-SLR-Film-Camera-Body-Only-SN7684333-/323900837093,29.8,USD,JP,15230.0,Film Cameras,StoreInventory,Used,Nikon F2,660.0,10.0,128,128,128,128,8,◇ Nikon ニコン AF MICRO NIKKOR 105mm F2.8 D Fマウント 中望遠単焦点レンズ AF一眼レフ用,16200.0,,,https://page.auctions.yahoo.co.jp/jp/auction/j594340941,2084261684,◇ Nikon Nikon AF MICRO NIKKOR 105mm F2.8 DF mount Medium telephoto single focus lens for AF SLR,Nikon Nikon AF MICRO NIKKOR 105 mm F28 DF mount telephoto focus lens AF SLR,Nikon ニコン AF MICRO NIKKOR 105 mm F 2 8 マウント 中 望遠 単 焦点 レンズ AF 一 眼 レフ 用,20
132,11.0,,NEAR MINT Nikon F2 Photomic DP1 35 mm SLR Film Camera Japan 85,123902032207.0,[NEAR MINT] Nikon F2 Photomic DP-1 35mm SLR Film Camera from Japan #85,https://www.ebay.com/itm/NEAR-MINT-Nikon-F2-Photomic-DP-1-35mm-SLR-Film-Camera-Japan-85-/123902032207,149.99,USD,JP,15230.0,Film Cameras,FixedPrice,Used,Nikon F2,660.0,10.0,129,129,129,129,9,◇ Nikon ニコン EM ブラック + AI NIKKOR 50mm F1.8 MF一眼レフカメラ フィルムカメラ 標準単焦点レンズ セット,4780.0,,,https://page.auctions.yahoo.co.jp/jp/auction/c775199022,2084044778,◇ Nikon Nikon EM Black AI NIKKOR 50mm F1.8 MF SLR Camera Film Camera Standard Single Focal Lens Set,Nikon Nikon EM Black AI NIKKOR 50 mm F18 MF SLR Camera Film Camera Standard Single Focal Lens Set,Nikon ニコン EM ブラック AI NIKKOR 50 mm 1 . 8 MF 一 眼 レフ カメラ フィルム カメラ 標準 単 焦点 レンズ セット,10
133,97.0,,N Mint Nikon F2 Photomic AI NIKKORH 50 mm f2 SLR 35 mm Film Camera Japan 0028,312697363444.0,<N Mint> Nikon F2 Photomic AI NIKKOR-H 50mm f/2 SLR 35mm Film Camera Japan #0028,https://www.ebay.com/itm/N-Mint-Nikon-F2-Photomic-AI-NIKKOR-H-50mm-f-2-SLR-35mm-Film-Camera-Japan-0028-/312697363444,199.99,USD,JP,15230.0,Film Cameras,FixedPrice,Used,Nikon F2,660.0,10.0,130,130,130,130,10,★ＮＩＫＯＮ　Ｄ４０　ボディ+充電器★ジャンク扱,1100.0,,,https://page.auctions.yahoo.co.jp/jp/auction/d390465770,2084261636,★ NIKON D40 body charger ★ Junk treatment,NIKON body charger Junk treatment,ＮＩＫＯＮ ４０ ボディ 充電器 ジャンク 扱,10
134,68.0,,Nikon F2 35 mm SLR Film Camera Body Lever Modification Japan 494852,254370929649.0,Nikon F2 35mm SLR Film Camera Body DE-1 Lever Modification from Japan 494852,https://www.ebay.com/itm/Nikon-F2-35mm-SLR-Film-Camera-Body-DE-1-Lever-Modification-Japan-494852-/254370929649,198.0,USD,JP,15230.0,Film Cameras,StoreInventory,Used,Nikon F2,660.0,10.0,131,131,131,131,11,◇ Nikon ニコン F80 + AF NIKKOR 28-80mm F3.3-5.6 G + AF NIKKOR 70-300mm F4-5.6 D 標準 望遠 ズームレンズ セット AF一眼レフ,3240.0,,,https://page.auctions.yahoo.co.jp/jp/auction/u304529815,2084044785,◇ Nikon Nikon F80 AF NIKKOR 28-80mm F3.3-5.6 G AF NIKKOR 70-300mm F4-5.6 D Standard Telephoto Zoom Lens Set AF SLR,Nikon Nikon F80 AF NIKKOR 2880 mm F3356 G AF NIKKOR 70300 mm F456 D Standard Telephoto Zoom Lens Set AF SLR,Nikon ニコン 80 AF NIKKOR 28 80 mm F3 . 3 5. 6 AF NIKKOR 70 300 mm F 4 5. 6 標準 望遠 ズームレンズ AF 一 眼 レフ,20
135,96.0,,RARE MINT Nikon F2 SB DP3 Photomic Black 35 mm SLR Film Camera JAPAN,383169431973.0,【RARE!! MINT】 Nikon F2 SB DP-3 Photomic Black 35mm SLR Film Camera From JAPAN,https://www.ebay.com/itm/RARE-MINT-Nikon-F2-SB-DP-3-Photomic-Black-35mm-SLR-Film-Camera-JAPAN-/383169431973,384.99,USD,JP,15230.0,Film Cameras,StoreInventory,Used,Nikon F2,660.0,10.0,132,132,132,132,12,☆希少極上美品☆Nikon　ニコン NIKKOR　S.C　Auto 50ｍｍ F1.4　単焦点,12800.0,14800.0,,https://page.auctions.yahoo.co.jp/jp/auction/h255235608,2084261693,☆ rare exquisite beauty ☆ Nikon Nikon NIKKOR S.C Auto 50mm F1.4 single focus,beauty Nikon Nikon NIKKOR SC Auto 50 mm F14 focus,極上 美品 Nikon ニコン Auto 50 ｍｍ 1 4 単 焦点,20
136,81.0,,Nikon F2 35 mm SLR Film Camera Body Excellent,254358288054.0,Nikon F2 35mm SLR Film Camera Body Only SN7150182 **Excellent++**,https://www.ebay.com/itm/Nikon-F2-35mm-SLR-Film-Camera-Body-Only-SN7150182-Excellent-/254358288054,94.8,USD,JP,15230.0,Film Cameras,StoreInventory,Used,Nikon F2,660.0,10.0,133,133,133,133,13,CH-22305 ジャンク品 NIKON ニコン F3 本体のみ,4730.0,,,https://page.auctions.yahoo.co.jp/jp/auction/q317982213,2084044778,CH-22305 Junk product NIKON Nikon F3 main unit only,CH22305 Junk product NIKON Nikon F3 unit,CH 22305 ジャンク 品 NIKON ニコン 3 本体,8
137,54.0,,NEAR MINT Nikon F2 Photomic DP1 35 mm SLR Film Camera Japan 85,123902032207.0,[NEAR MINT] Nikon F2 Photomic DP-1 35mm SLR Film Camera from Japan #85,https://www.ebay.com/itm/NEAR-MINT-Nikon-F2-Photomic-DP-1-35mm-SLR-Film-Camera-Japan-85-/123902032207,149.99,USD,JP,15230.0,Film Cameras,FixedPrice,Used,Nikon F2,660.0,10.0,134,134,134,134,14,◆ Nikon ニコン 非AI NIKKOR-O・C Auto 35mm F2 広角単焦点レンズ Fマウント MFレンズ MF一眼レフ用,3240.0,,,https://page.auctions.yahoo.co.jp/jp/auction/o345029820,2084261693,◆ Nikon Nikon Non-AI NIKKOR-OC Auto 35mm F2 Wide-angle single focus lens F mount MF lens For MF SLR,Nikon Nikon NonAI NIKKOROC Auto 35 mm F2 Wideangle focus lens F mount MF lens MF SLR,Nikon ニコン 非 AI NIKKOR 35 mm 2 広角 単 焦点 レンズ マウント MF レンズ MF 一 眼 レフ 用,20
138,28.0,,NMINTNikon F2 Photomic A DP11 Black SLR Late Ais 50 mm F14 Japan 345,264254615864.0,【N/MINT】Nikon F2 Photomic A DP-11 Black SLR  Late Ai-s 50mm F/1.4 From Japan 345,https://www.ebay.com/itm/N-MINT-Nikon-F2-Photomic-DP-11-Black-SLR-Late-Ai-s-50mm-F-1-4-Japan-345-/264254615864,249.99,USD,JP,15230.0,Film Cameras,StoreInventory,Used,Nikon F2,660.0,10.0,135,135,135,135,15,1円 Nikon Zoom-NIKKOR・C Auto F4.5 80-200mm SIGMA MULTI-COATED F3.5 39-80mm ZOOM-K F4.5 100-200mm カメラレンズ,1.0,,,https://page.auctions.yahoo.co.jp/jp/auction/h419566160,2084261693,1 yen Nikon Zoom-NIKKOR ・ C Auto F4.5 80-200mm SIGMA MULTI-COATED F3.5 39-80mm ZOOM-K F4.5 100-200mm Camera lens,1 yen Nikon ZoomNIKKOR C Auto F45 80200 mm SIGMA MULTICOATED F35 3980 mm ZOOMK F45 100200 mm Camera lens,1 円 Nikon Zoom NIKKOR C Auto F 4 5 80 200 mm SIGMA MULTI COATED F 3 5 39 80 mm K F 4 5 100 200 mm カメラ レンズ,20
139,90.0,,Mint Nikon F2 Photomic SB Black DP3 Finder SLR 35 mm Japan H022409,352753588592.0,"""Near Mint"" Nikon F2 Photomic SB Black DP-3 Finder SLR 35mm From Japan #H022409",https://www.ebay.com/itm/Near-Mint-Nikon-F2-Photomic-SB-Black-DP-3-Finder-SLR-35mm-Japan-H022409-/352753588592,399.99,USD,JP,15230.0,Film Cameras,StoreInventory,Used,Nikon F2,660.0,10.0,136,136,136,136,16,★ Nikon ニコン F3P 900万台 + MD-4 報道受け特別仕様 スペシャルモデル プロ機 35mm SLR,33000.0,,,https://page.auctions.yahoo.co.jp/jp/auction/o344426999,2084044778,★ Nikon Nikon F3P 9 million MD-4 newsletter special specification special model professional machine 35mm SLR,Nikon Nikon F3P 9 million newsletter specification model machine 35 mm SLR,Nikon ニコン 3 900 万 台 MD 4 報道 仕様 スペシャル モデル プロ 機 35 mm SLR,20
140,3.0,,NEAR MINTNIKON F2 PHOTOMIC 35 mm SLR FILM Black Body Japan,333238182434.0,【NEAR MINT】NIKON F2 PHOTOMIC 35mm SLR FILM CAMERA Black Body From Japan,https://www.ebay.com/itm/NEAR-MINT-NIKON-F2-PHOTOMIC-35mm-SLR-FILM-CAMERA-Black-Body-Japan-/333238182434,158.9,USD,JP,15230.0,Film Cameras,StoreInventory,Used,Nikon F2,660.0,10.0,137,137,137,137,17,純正中古良い品！Nikon　ニコン　リチャージャブルバッテリーEN-EL14　　(EL14－１),1880.0,1880.0,,https://page.auctions.yahoo.co.jp/jp/auction/v640811380,2084261661,Genuine used good product! Nikon Nikon Rechargeable Battery EN-EL14 (EL14-1),Genuine product Nikon Nikon Rechargeable Battery ENEL14 EL141,純正 中古 品 Nikon ニコン リチャージャブル バッテリー EN EL 14 EL 14 １,10
141,90.0,,Problem Nikon F2 35 mm SLR Film Camera Body SN7694823,223662696286.0,**Problem** Nikon F2 35mm SLR Film Camera Body Only SN7694823,https://www.ebay.com/itm/Problem-Nikon-F2-35mm-SLR-Film-Camera-Body-Only-SN7694823-/223662696286,27.8,USD,JP,15230.0,Film Cameras,StoreInventory,Used,Nikon F2,660.0,10.0,138,138,138,138,18,◇ Nikon ニコン F アイレベル 677万台 中期 + 非AI NIKKOR-H Auto 50mm F2 MF一眼レフ フィルムカメラ 標準単焦点レンズ セット,7305.0,,,https://page.auctions.yahoo.co.jp/jp/auction/w339598002,2084044778,◇ Nikon Nikon F Eye level 67.77 million Medium term Non-AI NIKKOR-H Auto 50mm F2 MF SLR film camera Standard single focus lens set,Nikon Nikon F Eye level 6777 million term NonAI NIKKORH Auto 50 mm F2 MF SLR film camera Standard focus lens,Nikon ニコン F アイ レベル 677 万 台 中期 非 AI NIKKOR 50 mm 2 MF 一 眼 レフ フィルム カメラ 標準 単 焦点 レンズ セット,10
142,10.0,,N Mint Nikon F2 Photomic AI NIKKORH 50 mm f2 SLR 35 mm Film Camera Japan 0028,312697363444.0,<N Mint> Nikon F2 Photomic AI NIKKOR-H 50mm f/2 SLR 35mm Film Camera Japan #0028,https://www.ebay.com/itm/N-Mint-Nikon-F2-Photomic-AI-NIKKOR-H-50mm-f-2-SLR-35mm-Film-Camera-Japan-0028-/312697363444,199.99,USD,JP,15230.0,Film Cameras,FixedPrice,Used,Nikon F2,660.0,10.0,139,139,139,139,19,◆ Nikon ニコン F アイレベル 694万台 + 非AI NIKKOR-S Auto 50mm F1.4 フィルムカカメラ 標準単焦点レンズ セット MF一眼レフ,10800.0,,,https://page.auctions.yahoo.co.jp/jp/auction/c775199062,2084044778,◆ Nikon Nikon F Eye Level 6.49 million Non-AI NIKKOR-S Auto 50mm F1.4 Film Camera Camera Standard Single Focal Lens Set MF SLR,Nikon Nikon F Eye Level 649 million NonAI NIKKORS Auto 50 mm F14 Film Camera Camera Standard Single Focal Lens Set MF SLR,Nikon ニコン F アイ レベル 694 万 台 非 AI NIKKOR Auto 50 mm 1 4 フィルム カカメラ 標準 単 焦点 レンズ セット MF 一 眼 レフ,10
143,23.0,,Problem Nikon F2 35 mm SLR Film Camera Body SN7513623,323932696385.0,**Problem** Nikon F2 35mm SLR Film Camera Body Only  SN7513623,https://www.ebay.com/itm/Problem-Nikon-F2-35mm-SLR-Film-Camera-Body-Only-SN7513623-/323932696385,47.8,USD,JP,15230.0,Film Cameras,StoreInventory,Used,Nikon F2,660.0,10.0,140,140,140,140,0,〓外観綺麗　フード付〓Tokina トキナー AT-X PRO AF 28-70 F2.8 ニコン用,7980.0,24800.0,,https://page.auctions.yahoo.co.jp/jp/auction/h426383048,2084261684,〓Beautiful hooded kinTokina Tokina AT-X PRO AF 28-70 F2.8 for Nikon,kinTokina Tokina ATX PRO AF 2870 F28 Nikon,外観 フード 付 Tokina トキナー AT PRO AF 28- 70 F 2. 8 ニコン 用,20
144,45.0,,Mint Nikon F2 Photomic DP11 Silver Body 35 mm Camera Japan 1063,401885733045.0,"""Near Mint"" Nikon F2 Photomic DP-11 Silver Body 35mm Camera From Japan #1063",https://www.ebay.com/itm/Near-Mint-Nikon-F2-Photomic-DP-11-Silver-Body-35mm-Camera-Japan-1063-/401885733045,197.99,USD,JP,15230.0,Film Cameras,StoreInventory,Used,Nikon F2,660.0,10.0,141,141,141,141,1,★ Nikon ニコン Binoculars ポロプリズム 双眼鏡 10x35E 6.6° WF &#169;&#65039; 元箱,11000.0,,,https://page.auctions.yahoo.co.jp/jp/auction/o345868379,2084263451,"<!DOCTYPE html><html><head><link rel=""shortcut icon"" href=""//ssl.gstatic.com/docs/script/images/favicon.ico""><title>Error</title><style type=""text/css"">body {background-color: #fff; margin: 0; padding: 0;}.errorMessage {font-family: Arial,sans-serif; font-size: 12pt; font-weight: bold; line-height: 150%; padding-top: 25px;}</style></head><body style=""margin:20px""><div><img alt=""Google Apps Script"" src=""//ssl.gstatic.com/docs/script/images/logo.png""></div><div style=""text-align:center;font-family:monospace;margin:50px auto 0;max-width:600px"">無効な引数: source (line 3, file &quot;コード&quot;, project &quot;Translation&quot;)</div></body></html>",DOCTYPE relshortcut icon typetextcssbody backgroundcolor fff margin 0 padding 0errorMessage Arialsansserif fontsize fontweight lineheight 150 paddingtop 25pxstyleheadbody stylemargin20pxdivimg altGoogle Apps Script srcsslgstaticcomdocsscriptimageslogopngdivdiv auto 0maxwidth600px source line 3 file quotquot project quotTranslationquotdivbodyhtml,Nikon ニコン Binoculars ポロ プリズム 双眼鏡 10 x 35 E 6 6 ° WF 169 65039 元箱,20
145,0.0,,Nikon F2 35 mm SLR Film Camera Body SN7106070,323929574674.0,Nikon F2 35mm SLR Film Camera Body Only  SN7106070,https://www.ebay.com/itm/Nikon-F2-35mm-SLR-Film-Camera-Body-Only-SN7106070-/323929574674,49.8,USD,JP,15230.0,Film Cameras,StoreInventory,Used,Nikon F2,660.0,10.0,142,142,142,142,2,◆ Nikon ニコン F3 アイレベル 153万台 フィルムカメラ ボディのみ MF一眼レフ,13510.0,,,https://page.auctions.yahoo.co.jp/jp/auction/c775199066,2084044778,◆ Nikon Nikon F3 Eye level 1.53 million Film camera Body only MF SLR,Nikon Nikon F3 Eye level 153 million Film camera Body MF SLR,Nikon ニコン 3 アイ レベル 153 万 台 フィルム カメラ ボディ MF 一 眼 レフ,10
146,44.0,,UNUSED BOX Nikon F2 Titan F2 T SLR 35 mm Film Camera Body Japan 111,392382267313.0,【UNUSED in BOX】 Nikon F2 Titan F2T SLR 35mm Film Camera Body From Japan 111,https://www.ebay.com/itm/UNUSED-BOX-Nikon-F2-Titan-F2T-SLR-35mm-Film-Camera-Body-Japan-111-/392382267313,1989.99,USD,JP,15230.0,Film Cameras,StoreInventory,Used,Nikon F2,660.0,10.0,143,143,143,143,3,★ Nikon ニコン 35Ti NIKKOR 35mm F2.8 NIKKORレンズ クルクル針 アナログメーター 高級コンパクトフィルムカメラ ジャンク品,37800.0,,,https://page.auctions.yahoo.co.jp/jp/auction/k413827380,2084005100,★ Nikon Nikon 35Ti NIKKOR 35mm F2.8 NIKKOR Lens Kurukuru Needle Analog Meter Luxury Compact Film Camera Junk,Nikon Nikon 35Ti NIKKOR 35 mm F28 NIKKOR Lens Kurukuru Needle Analog Meter Luxury Compact Film Camera Junk,Nikon ニコン 35 Ti NIKKOR 35 mm F 2 8 NIKKOR レンズ 針 アナログ メーター 高級 コンパクト フィルム カメラ ジャンク 品,10
147,73.0,,Exc Nikon F2 Eyelevel Silver 35 mm SLR Film Camera Japan,323908222183.0,*Exc+++++* Nikon F2 Eyelevel Silver 35mm SLR Film Camera From Japan,https://www.ebay.com/itm/Exc-Nikon-F2-Eyelevel-Silver-35mm-SLR-Film-Camera-Japan-/323908222183,249.99,USD,JP,15230.0,Film Cameras,StoreInventory,Used,Nikon F2,660.0,10.0,144,144,144,144,4,Nikon COOLPIX P100 コンパクトデジタルカメラ ボディ 充電器付属 ニコン,9170.0,,,https://page.auctions.yahoo.co.jp/jp/auction/d389879761,2084261644,Nikon COOLPIX P100 Compact Digital Camera Body Charger included Nikon,Nikon COOLPIX P100 Compact Digital Camera Body Charger Nikon,Nikon COOLPIX 100 コンパクトデジタルカメラ ボディ 充電器 付属 ニコン,6
