,Unnamed: 0,JP_shortTitle,shortTitle,itemId,title,viewItemURL,currentPrice,currency,country,primaryCategory.categoryId,primaryCategory.categoryName,listingType,condition,model,TotalCounts,Target,Unnamed: 0,Unnamed: 0.1,Unnamed: 0.1.1,Unnamed: 0.1.1.1,Unnamed: 0.1.1.1.1,Title,CurrentPrice,BidOrBuy,shopName,ItemUrl,CategoryId,en_Title,en_short_Title,short_Title,Target_y
373,58.0,,Mint Nikon AF MICOR NIKKOR 60 mm f28 Prime Macro Lens Japan,352795139041.0,Near Mint Nikon AF MICOR NIKKOR 60mm f/2.8 Prime Macro Lens From Japan,https://www.ebay.com/itm/Near-Mint-Nikon-AF-MICOR-NIKKOR-60mm-f-2-8-Prime-Macro-Lens-Japan-/352795139041,179.0,USD,JP,3323.0,Lenses,StoreInventory,Used,Nikon AF 60mm F/2.8,195.0,20.0,370,370,370,370,10,Nikon ニコン 昔の一眼レフカメラ F-401xボディ + F50ボディ + 純正レンズ3本まとめて,200.0,,,https://page.auctions.yahoo.co.jp/jp/auction/m362773328,2084044785,Nikon Nikon old single-lens reflex camera F-401x body F50 body 3 original lenses,Nikon Nikon singlelens camera F401x body F50 body 3 lenses,Nikon ニコン 昔 一 眼 レフ カメラ 401 ボディ 50 ボディ 純正 レンズ 3 本,6
374,2.0,,Mint Nikon AF Nikkor 80200 mm f28 D ED New Lens Hood Japan,372782153532.0,Near Mint Nikon AF Nikkor 80-200mm f/2.8 D ED New Lens with Hood from Japan,https://www.ebay.com/itm/Near-Mint-Nikon-AF-Nikkor-80-200mm-f-2-8-D-ED-New-Lens-Hood-Japan-/372782153532,429.0,USD,JP,3323.0,Lenses,StoreInventory,Used,Nikkor 80-200mm f/2.8 D ED,190.0,20.0,371,371,371,371,11,Nikon ニコン 昔の高級AF一眼レフカメラ F4専用バッテリーパック MB-21 ジャンク,200.0,,,https://page.auctions.yahoo.co.jp/jp/auction/423426068,2084044785,Nikon Nikon old high-end AF single-lens reflex camera F4 dedicated battery pack MB-21 junk,Nikon Nikon highend AF singlelens camera F4 battery pack MB21 junk,Nikon ニコン 昔 高級 AF 一 眼 レフ カメラ 4 専用 バッテリーパック MB 21 ジャンク,1
375,87.0,,Nikon AF Nikkor 80200 mm F28 ED D Lens Excellent wCase Japan Tested 3975,153631469797.0,Nikon AF Nikkor 80-200mm F/2.8 ED D Lens Excellent+++ w/Case Japan Tested #3975,https://www.ebay.com/itm/Nikon-AF-Nikkor-80-200mm-F-2-8-ED-D-Lens-Excellent-w-Case-Japan-Tested-3975-/153631469797,274.9,USD,JP,3323.0,Lenses,StoreInventory,Used,Nikon AF Nikkor 80-200mm F/2.8 ED D,188.0,20.0,372,372,372,372,12,Nikon ニコン 純正 レンズ保護フィルター(52mm) 5セットまとめて,500.0,,,https://page.auctions.yahoo.co.jp/jp/auction/m363273326,2084261693,Nikon Nikon Genuine Lens protection filter (52mm) 5 sets,Nikon Nikon Genuine Lens protection filter 52 mm 5 sets,Nikon ニコン レンズ 保護 フィルター 52 mm 5 セット,18
376,43.0,,MINT Nikon AFS NIKKOR 2470 mm f28 G ED SWM IF N Lens wCase Hood JAPAN,264458969567.0,"MINT+ Nikon AF-S NIKKOR 24-70mm f/2.8 G ED SWM IF N Lens w/Case, Hood From JAPAN",https://www.ebay.com/itm/MINT-Nikon-AF-S-NIKKOR-24-70mm-f-2-8-G-ED-SWM-IF-N-Lens-w-Case-Hood-JAPAN-/264458969567,860.0,USD,JP,3323.0,Lenses,StoreInventory,Used,AF-S NIKKOR 24-70mm f/2.8 G ED,188.0,20.0,373,373,373,373,13,【シャッター・露出OK】 Nikon ニコン F2 フォトミック ブラック + Micro NIKKOR 55mm F/3.5 レンズ セット 管理041,1.0,,,https://page.auctions.yahoo.co.jp/jp/auction/399907466,2084044778,[Shutter / Exposure OK] Nikon Nikon F2 Photomic Black Micro NIKKOR 55mm F / 3.5 Lens Set Management 041,Shutter Exposure Nikon Nikon F2 Photomic Black Micro NIKKOR 55 mm F 35 Lens Set Management 041,シャッター 露出 OK Nikon ニコン 2 フォトミック ブラック Micro NIKKOR 55 mm 3 5 レンズ セット 管理 041,10
377,12.0,,Mint BOX Nikon ED AF 80200 mm f28 D New Lens Hood Japan 09,283613931217.0,"""Near Mint in BOX "" Nikon ED AF 80-200mm f/2.8 D New w/ Lens Hood from Japan #09",https://www.ebay.com/itm/Near-Mint-BOX-Nikon-ED-AF-80-200mm-f-2-8-D-New-w-Lens-Hood-Japan-09-/283613931217,469.8,USD,JP,3323.0,Lenses,StoreInventory,Used,Nikon ED AF Nikkor 80-200mm f/2.8 D,188.0,20.0,374,374,374,374,14,【送料無料!!】★ Nikon ニコン 単焦点レンズ AF-S NIKKOR 400mm f/2.8E FL ED VR ★,220000.0,880000.0,,https://page.auctions.yahoo.co.jp/jp/auction/f376371546,2084261684,[Free Shipping !!] ★ Nikon Nikon single focus lens AF-S NIKKOR 400mm f / 2.8E FL ED VR ★,Shipping Nikon Nikon focus lens AFS 400 mm 28E FL ED VR,送料 無料 Nikon ニコン 単 焦点 レンズ AF NIKKOR 400 mm f 2 8 FL ED VR,20
378,25.0,,Nikon AF Nikkor 80200 mm F28 ED D Lens wHood Exce Japan Tested FS 4035,153658420856.0,Nikon AF Nikkor 80-200mm F/2.8 ED D Lens w/Hood Exce+++ Japan Tested F/S #4035,https://www.ebay.com/itm/Nikon-AF-Nikkor-80-200mm-F-2-8-ED-D-Lens-w-Hood-Exce-Japan-Tested-F-S-4035-/153658420856,259.0,USD,JP,3323.0,Lenses,StoreInventory,Used,Nikon AF Nikkor 80-200mm F/2.8 ED D,188.0,20.0,375,375,375,375,15,Nikon ニコン 人気の一眼レフカメラ FG 銀ボディ 作動品 （腐食無し）,500.0,,,https://page.auctions.yahoo.co.jp/jp/auction/k415248084,2084044778,Nikon popular single-lens reflex camera FG silver body operation product (no corrosion),Nikon singlelens camera FG silver body operation product corrosion,Nikon ニコン 人気 一 眼 レフ カメラ FG 銀 ボディ 作動 品 腐食 無し,6
379,15.0,,Top MintNikon F3HP 35 mm Body Film Camera Black Japan 1007,113913529044.0,【Top Mint】Nikon F3HP 35mm Body Only Film Camera Black from Japan #1007,https://www.ebay.com/itm/Top-Mint-Nikon-F3HP-35mm-Body-Only-Film-Camera-Black-Japan-1007-/113913529044,379.99,USD,JP,15230.0,Film Cameras,StoreInventory,Used,Nikon F3HP,187.0,10.0,376,376,376,376,16,★質屋出品★NIKON ニコン AI AF Micro-Nikkor 60㎜ F2.8 D 単焦点 マイクロレンズ 中古★1円～売切り,1.0,,,https://page.auctions.yahoo.co.jp/jp/auction/c763555573,2084261684,★ Pawnshop exhibition ★ NIKON Nikon AI AF Micro-Nikkor 60㎜ F2.8 D single focus micro lens used ★ 1 yen-sold out,Pawnshop exhibition NIKON Nikon AI AF MicroNikkor 60 F28 D focus lens 1 yensold,質屋 NIKON ニコン AI AF Micro 60 ㎜ 2 8 単 焦点 マイクロ レンズ 中古 1 円 売,20
380,41.0,,Nikon F3 HP F3HP 35 mm SLR Film Camera Body Users Manual Japan,202781225362.0,Nikon F3 HP F3HP 35mm SLR Film Camera Body w/ Users Manual from Japan,https://www.ebay.com/itm/Nikon-F3-HP-F3HP-35mm-SLR-Film-Camera-Body-w-Users-Manual-Japan-/202781225362,305.88,USD,JP,15230.0,Film Cameras,StoreInventory,Used,Nikon F3HP,187.0,10.0,377,377,377,377,17,★質屋出品★Nikon ニコン SPEED LIGHT スピードライト SB-600 動作OK 中古☆１円～売り切り,1.0,,,https://page.auctions.yahoo.co.jp/jp/auction/o346495680,2084261969,★ Pawnshop exhibition ★ Nikon Nikon SPEED LIGHT Speedlight SB-600 Operation OK Used ☆ 1 yen ~ sold out,Pawnshop exhibition Nikon Nikon SPEED LIGHT Speedlight SB600 Operation OK 1 yen,質屋 出品 Nikon ニコン SPEED LIGHT スピードライト SB 600 動作 OK 中古 １ 円 切り,8
381,26.0,,NEAR MINT Nikon F3 HP 35 mm SLR Film Camera Body SN1877836 Japan,401855922072.0,[NEAR MINT] Nikon F3 HP 35mm SLR Film Camera Body SN1877836 from Japan,https://www.ebay.com/itm/NEAR-MINT-Nikon-F3-HP-35mm-SLR-Film-Camera-Body-SN1877836-Japan-/401855922072,287.0,USD,JP,15230.0,Film Cameras,FixedPrice,Used,Nikon F3HP,187.0,10.0,378,378,378,378,18,★質屋出品★Nikon ニコン 望遠 ズームレンズ AF Zoom Nikkor ED 80-200mm F2.8 Ⅰ型 中古★1円～売切り,12.0,,,https://page.auctions.yahoo.co.jp/jp/auction/j595323462,2084261684,★ Pawnshop exhibition ★ Nikon Nikon telephoto zoom lens AF Zoom Nikkor ED 80-200mm F2.8 Type I Used ★ 1 yen-sold out,Pawnshop exhibition Nikon Nikon telephoto lens AF Zoom Nikkor ED 80200 mm F28 Type 1 yensold,質屋 出品 Nikon ニコン 望遠 ズームレンズ AF Zoom Nikkor ED 80 200 mm F2 8 Ⅰ 型 中古 1 円 売,20
382,39.0,,NEAR MINT Nikon F3 HP Higheye Point 35 mm Film Camera SLR Japan,383190056940.0,[NEAR MINT]  Nikon F3 HP Higheye Point 35mm Film Camera SLR From Japan,https://www.ebay.com/itm/NEAR-MINT-Nikon-F3-HP-Higheye-Point-35mm-Film-Camera-SLR-Japan-/383190056940,299.9,USD,JP,15230.0,Film Cameras,FixedPrice,Used,Nikon F3HP,187.0,10.0,379,379,379,379,19,★質屋出品★Nikon ニコン AF MICRO Nikkor 105mm F2.8 中望遠単焦点 Dレンズ 中古★1円～売切り,1.0,,,https://page.auctions.yahoo.co.jp/jp/auction/p716941111,2084261684,★ Pawnshop exhibition ★ Nikon Nikon AF MICRO Nikkor 105mm F2.8 Medium telephoto single focus D lens Used ★ 1 yen-sold out,Pawnshop exhibition Nikon Nikon AF MICRO Nikkor 105 mm F28 Medium telephoto focus lens 1 yensold,質屋 出品 Nikon ニコン AF MICRO Nikkor 105 mm 2 8 中 望遠 単 焦点 レンズ 中古 1 円 売,20
383,80.0,,MINT Nikon F3 HP 35 mm SLR Film Camera CF22 Case Japan 1095,392391114066.0,[MINT] Nikon F3 HP 35mm SLR Film Camera w/ CF-22 Case  From Japan #1095,https://www.ebay.com/itm/MINT-Nikon-F3-HP-35mm-SLR-Film-Camera-w-CF-22-Case-Japan-1095-/392391114066,399.9,USD,JP,15230.0,Film Cameras,StoreInventory,Used,Nikon F3HP,187.0,10.0,380,380,380,380,0,16226カタログ◆ニコン　Ｎｉｋｏｎ◆ZOOM７００　ＶＲ　ＱＤ◆1994.2発行◆6ページ,300.0,,,https://page.auctions.yahoo.co.jp/jp/auction/b335659277,2084313032,16226 catalog ◆ Nikon Nikon ◆ ZOOM700 VR QD ◆ 1994.2 issued ◆ Page 6,16226 catalog Nikon Nikon VR QD 19942 Page 6,16226 カタログ ニコン Ｎｉｋｏｎ ZOOM ７００ ＶＲ ＱＤ 1994 2 発行 6 ページ,8
384,85.0,,MINT Nikon F3 HP 35 mm SLR Film Camera w AI 50 mm F14 JAPAN 435,163874791669.0,"""Near MINT"" Nikon F3 HP 35mm SLR Film Camera w/ AI 50mm F/1.4 From JAPAN #435",https://www.ebay.com/itm/Near-MINT-Nikon-F3-HP-35mm-SLR-Film-Camera-w-AI-50mm-F-1-4-JAPAN-435-/163874791669,449.9,USD,JP,15230.0,Film Cameras,StoreInventory,Used,Nikon F3HP,187.0,10.0,381,381,381,381,1,16234カタログ◆ニコン　Ｎｉｋｏｎ◆レンズ総合　ＮＩＫＫＯＲ◆2012.1発行◆35ページ,500.0,,,https://page.auctions.yahoo.co.jp/jp/auction/j513366960,2084313032,16234 catalog ◆ Nikon Nikon ◆ Lens General NIKKOR ◆ 2012.1 issued ◆ Page 35,16234 catalog Nikon Nikon Lens General NIKKOR 20121 Page 35,16234 カタログ ニコン Ｎｉｋｏｎ レンズ 総合 ＮＩＫＫＯＲ 2012 1 発行 35 ページ,20
385,17.0,,TOP MINT Nikon F3 HP F3HP 35 mm SLR Film Camera Body JAPAN E0365,323896028513.0,【TOP MINT】 Nikon F3 HP F3HP 35mm SLR Film Camera Body From JAPAN E-0365,https://www.ebay.com/itm/TOP-MINT-Nikon-F3-HP-F3HP-35mm-SLR-Film-Camera-Body-JAPAN-E-0365-/323896028513,423.9,USD,JP,15230.0,Film Cameras,StoreInventory,Used,Nikon F3HP,187.0,10.0,382,382,382,382,2,16241カタログ◆ニコン　Ｎｉｋｏｎ◆クールピクス３１００＊◆2003.2発行◆,300.0,,,https://page.auctions.yahoo.co.jp/jp/auction/o263221562,2084313032,16241 catalog ◆ Nikon Nikon ◆ Coolpix 3100 * ◆ 2003.2 issued ◆,16241 catalog Nikon Nikon Coolpix 3100 20032,16241 カタログ ニコン Ｎｉｋｏｎ ピクス ３１００ 2003 2 発行,6
386,19.0,,NIKON AF MICRO NIKKOR 60 mm,163839081548.0,NIKON AF MICRO NIKKOR 60mm f/2.8 Excellent,https://www.ebay.com/itm/NIKON-AF-MICRO-NIKKOR-60mm-f-2-8-Excellent-/163839081548,210.6,USD,JP,3323.0,Lenses,StoreInventory,Used,,186.0,20.0,383,383,383,383,3,16235カタログ◆ニコン　Ｎｉｋｏｎ◆レンズ総合　ＮＩＫＫＯＲ◆2003.3発行◆31ページ,500.0,,,https://page.auctions.yahoo.co.jp/jp/auction/d308088358,2084313032,16235 catalog ◆ Nikon Nikon ◆ Lens General NIKKOR ◆ 2003.3 issued ◆ 31 pages,16235 catalog Nikon Nikon Lens General NIKKOR 20033 31 pages,16235 カタログ ニコン Ｎｉｋｏｎ レンズ 総合 ＮＩＫＫＯＲ 2003. 3 発行 31 ページ,20
387,68.0,,Near MintNikon AiS Nikkor AiS 50 mm f18 Pancake MF Lens Japan1394,283617027900.0,【Near Mint】Nikon Ai-S Nikkor AiS 50mm f/1.8 Pancake MF Lens from Japan-#1394,https://www.ebay.com/itm/Near-Mint-Nikon-Ai-S-Nikkor-AiS-50mm-f-1-8-Pancake-MF-Lens-Japan-1394-/283617027900,139.99,USD,JP,3323.0,Lenses,StoreInventory,Used,Nikkor 50mm f1.8 AiS Pancake,183.0,20.0,384,384,384,384,4,A5741カタログ*ニコン*Ｄ８１０×NIKKOR2014.9発行51P,400.0,400.0,,https://page.auctions.yahoo.co.jp/jp/auction/k182209474,2084313032,A5741 catalog * Nikon * D810 × NIKKOR2014.9 issued 51P,A5741 catalog Nikon D810 NIKKOR20149 51P,5741 カタログ ニコン ８１０ NIKKOR 2014 9 発行 51,8
388,21.0,,Mint Nikon Speedlight SB800 Shoe Mount Flash Soft Case JAPAN,352689513965.0,[Near Mint] Nikon Speedlight SB-800 Shoe Mount Flash w/ Soft Case from JAPAN,https://www.ebay.com/itm/Near-Mint-Nikon-Speedlight-SB-800-Shoe-Mount-Flash-w-Soft-Case-JAPAN-/352689513965,138.9,USD,JP,48515.0,Flashes,FixedPrice,Used,800 Speedlight,182.0,14.0,385,385,385,385,5,[送料140円] Fマウント レンズリアキャップ 5 ニコン Nikon F レンズキャップ キャップ 裏ぶた レンズ裏ぶた LF-4 LF-1 互換品,420.0,420.0,,https://page.auctions.yahoo.co.jp/jp/auction/w340947533,2084261995,[140 yen postage] F mount lens rear cap 5 Nikon Nikon F lens cap cap back lid lens back lid LF-4 LF-1 compatible product,140 yen postage F mount lens cap 5 Nikon Nikon F lens cap cap lens lid LF4 LF1 product,送料 140 円 マウント レンズ リア キャップ 5 ニコン Nikon レンズ キャップ キャップ 裏ぶた レンズ 裏ぶた LF 4 LF 1 互換 品,20
389,94.0,,EXC5 NIKON F Eyelevel Chrome Model 35 mm SLR Film Camera Japan 182,174011489326.0,[EXC+5] NIKON F Eyelevel Chrome Early Model 35mm SLR Film Camera from Japan #182,https://www.ebay.com/itm/EXC-5-NIKON-F-Eyelevel-Chrome-Early-Model-35mm-SLR-Film-Camera-Japan-182-/174011489326,129.9,USD,JP,15230.0,Film Cameras,StoreInventory,Used,Nikon F Eyelevel,180.0,10.0,386,386,386,386,6,A5695カタログ*ニコン*アクセサリー総合2011.4発行47P,400.0,400.0,,https://page.auctions.yahoo.co.jp/jp/auction/r124627101,2084313032,A5695 catalog * Nikon * Accessories 2011.4 issued 47 pages,A5695 catalog Nikon Accessories 20114 47 pages,5695 カタログ ニコン アクセサリー 総合 2011 4 発行 47,8
390,71.0,,EXCNikon AF Micro Nikkor 60 mm 28 Lens Hood HN22 JAPAN i33,123913453358.0,【EXC+++++】Nikon AF Micro Nikkor 60mm f/ 2.8 Lens w/ Hood HN-22 from JAPAN #i33,https://www.ebay.com/itm/EXC-Nikon-AF-Micro-Nikkor-60mm-f-2-8-Lens-w-Hood-HN-22-JAPAN-i33-/123913453358,184.99,USD,JP,3323.0,Lenses,StoreInventory,Used,Nikon AF Micro Nikkor 60mm f/ 2.8,177.0,20.0,387,387,387,387,7,A5696カタログ*ニコン*Ｄ５２００＊2012.11発行,400.0,400.0,,https://page.auctions.yahoo.co.jp/jp/auction/f144847886,2084313032,A5696 catalog * Nikon * D5200 * 2012.11 issued,A5696 catalog Nikon D5200 201211,5696 カタログ ニコン ５２００ 2012 11 発行,8
391,66.0,,ExcellentNikon AF Micro Nikkor 60 mm Macro Lens Japan 346831,153625163167.0,【Excellent+++++】Nikon AF Micro Nikkor 60mm f/2.8 Macro Lens from Japan #346831,https://www.ebay.com/itm/Excellent-Nikon-AF-Micro-Nikkor-60mm-f-2-8-Macro-Lens-Japan-346831-/153625163167,174.99,USD,JP,3323.0,Lenses,StoreInventory,Used,Nikon AF Micro Nikkor 60mm f/2.8,177.0,20.0,388,388,388,388,8,[送料140円] Fマウント ボディキャップ レンズリアキャップ x3 ニコン Nikon ボディーキャップ BF-1B BF-1A レンズ裏ぶた LF-4 LF-1 互換品,500.0,500.0,,https://page.auctions.yahoo.co.jp/jp/auction/c763342356,2084261995,[Shipping 140 yen] F mount Body cap Lens rear cap x3 Nikon Nikon Body cap BF-1B BF-1A Lens back lid LF-4 LF-1 Compatible products,140 yen F mount Body cap Lens cap Nikon Nikon Body cap BF1B Lens LF4 LF1 products,送料 140 円 マウント ボディ キャップ レンズ リア キャップ 3 ニコン Nikon ボディー キャップ BF 1 BF 1 レンズ 裏ぶた LF 4 LF 1 互換 品,18
392,48.0,,Nikon 35 mm SLR Film Camera Silver Body JAPAN Exc 492284A,254365087267.0,Nikon FE2 35mm SLR Film Camera Silver Body Only from JAPAN [Exc+++++] #492284A,https://www.ebay.com/itm/Nikon-FE2-35mm-SLR-Film-Camera-Silver-Body-Only-JAPAN-Exc-492284A-/254365087267,189.9,USD,JP,15230.0,Film Cameras,FixedPrice,Used,Nikon FE2,176.0,10.0,389,389,389,389,9,A5677カタログ*ニコン*Ｄ３２００＊2012.4発行15P,400.0,400.0,,https://page.auctions.yahoo.co.jp/jp/auction/194453705,2084313032,A5677 catalog * Nikon * D3200 * 2012.4 published 15P,A5677 catalog Nikon D3200 20124 15P,5677 カタログ ニコン Ｄ３ ２００ 2012 4 発行 15,8
393,62.0,,NEAR MINT Nikon Black 35 mm SLR Film Camera Japan,223692146375.0,【NEAR MINT+】 Nikon FE2 Black 35mm SLR Film Camera from Japan,https://www.ebay.com/itm/NEAR-MINT-Nikon-FE2-Black-35mm-SLR-Film-Camera-Japan-/223692146375,239.9,USD,JP,15230.0,Film Cameras,FixedPrice,Used,Nikon FE2,176.0,10.0,390,390,390,390,10,ニコン　ストラップ　黒に黄色文字,1200.0,,,https://page.auctions.yahoo.co.jp/jp/auction/b214807373,2084261684,Nikon strap black with yellow letters,Nikon strap letters,ニコン ストラップ 黒 黄色 文字,32
394,1.0,,Near MINTNikon Honeycomb Titanium Shutter Camera Body JAPAN 1725,333339175927.0,"【Near MINT】Nikon FE2 ""Honeycomb Titanium Shutter Camera Body From JAPAN #1725",https://www.ebay.com/itm/Near-MINT-Nikon-FE2-Honeycomb-Titanium-Shutter-Camera-Body-JAPAN-1725-/333339175927,234.99,USD,JP,15230.0,Film Cameras,StoreInventory,Used,Nikon FE2,176.0,10.0,391,391,391,391,11,[送料120円] Fマウント レンズリアキャップ x1 ニコン Nikon F レンズキャップ リアキャップ キャップ 裏ぶた LF-4 LF-1 互換品,170.0,170.0,,https://page.auctions.yahoo.co.jp/jp/auction/p716403858,2084261995,[Shipping 120 yen] F mount lens rear cap x1 Nikon Nikon F lens cap rear cap cap Back lid LF-4 LF-1 compatible product,120 yen F mount lens cap x1 Nikon Nikon F lens cap cap cap lid LF4 LF1 product,送料 120 円 マウント レンズ リア キャップ x1 ニコン Nikon レンズ キャップ リア キャップ キャップ 裏ぶた LF 4 LF 1 互換 品,20
395,61.0,,Top Mint Nikon SLR 35 mm Film Camera NikkorHC 50 mm f2 JAPAN 0521,372775547955.0,[Top Mint] Nikon FE2 SLR 35mm Film Camera + Nikkor-H.C 50mm f/2 from JAPAN 0521,https://www.ebay.com/itm/Top-Mint-Nikon-FE2-SLR-35mm-Film-Camera-Nikkor-H-C-50mm-f-2-JAPAN-0521-/372775547955,299.99,USD,JP,15230.0,Film Cameras,StoreInventory,Used,Nikon FE2,176.0,10.0,392,392,392,392,12,16373カタログ◆ニコン　Ｎｉｋｏｎ◆F-601　オートフォーカス◆1992.7.1発行◆15ページ,550.0,550.0,,https://page.auctions.yahoo.co.jp/jp/auction/x566606403,2084313032,16373 Catalog ◆ Nikon Nikon ◆ F-601 Autofocus ◆ Published July 1992 ◆ Page 15,16373 Catalog Nikon Nikon F601 Autofocus July 1992 Page 15,16373 カタログ ニコン Ｎｉｋｏｎ 601 オートフォーカス 1992 7 1 発行 15 ページ,8
396,3.0,,Top Mint Nikon SLR 35 mm Film Camera NikkorHC 50 mm f2 JAPAN 0521,372775547955.0,[Top Mint] Nikon FE2 SLR 35mm Film Camera + Nikkor-H.C 50mm f/2 from JAPAN 0521,https://www.ebay.com/itm/Top-Mint-Nikon-FE2-SLR-35mm-Film-Camera-Nikkor-H-C-50mm-f-2-JAPAN-0521-/372775547955,299.99,USD,JP,15230.0,Film Cameras,StoreInventory,Used,Nikon FE2,176.0,10.0,393,393,393,393,13,★ 超望遠単焦点レンズ ★ Nikon ニコン Reflex-NIKKOR 500mm F8 Fマウント ミラーレンズ,19800.0,19800.0,,https://page.auctions.yahoo.co.jp/jp/auction/h411257464,23692,★ Super telephoto single focus lens ★ Nikon Nikon Reflex-NIKKOR 500mm F8 F mount mirror lens,Super telephoto focus lens Nikon Nikon ReflexNIKKOR 500 mm F8 F mount mirror lens,超 望遠 単 焦点 レンズ Nikon ニコン Re flex NIKKOR 500 mm 8 マウント ミラー レンズ,20
397,0.0,,EXC Nikon SLR Body TITANIUM HONEYCOMB SHUTTER JAPAN 473,273961012261.0,"【EXC+++++】 Nikon FE2 SLR Body , TITANIUM & HONEYCOMB SHUTTER , from JAPAN  #473",https://www.ebay.com/itm/EXC-Nikon-FE2-SLR-Body-TITANIUM-HONEYCOMB-SHUTTER-JAPAN-473-/273961012261,229.9,USD,JP,15230.0,Film Cameras,StoreInventory,Used,Nikon FE2,176.0,10.0,394,394,394,394,14,16278カタログ◆ニコン　Ｎｉｋｏｎ◆Ｄ７０　デジタル一眼◆2004.2.3発行◆15ページ,550.0,550.0,,https://page.auctions.yahoo.co.jp/jp/auction/v580783842,2084313032,16278 Catalog ◆ Nikon Nikon D70 Digital SLR ◆ Published 2004.2.3 ◆ Page 15,16278 Catalog Nikon Nikon D70 Digital SLR 200423 Page 15,16278 カタログ ニコン Ｎｉｋｏｎ ７０ デジタル 一 眼 2004. 2. 3 発行 15 ページ,6
398,25.0,,Excellent Nikon Black SLR 35 mm Film Camera Ai 50 mm Japan,401903529393.0,Excellent+++++ Nikon FE2 Black SLR 35mm Film Camera + Ai 50mm f/1.4 From Japan,https://www.ebay.com/itm/Excellent-Nikon-FE2-Black-SLR-35mm-Film-Camera-Ai-50mm-f-1-4-Japan-/401903529393,299.0,USD,JP,15230.0,Film Cameras,StoreInventory,Used,Nikon FE2,176.0,10.0,395,395,395,395,15,16279カタログ◆ニコン　Ｎｉｋｏｎ◆Ｄ８０　デジタル一眼◆2006.8.9発行◆15ページ,550.0,550.0,,https://page.auctions.yahoo.co.jp/jp/auction/p633096432,2084313032,16279 Catalog ◆ Nikon Nikon ◆ D80 Digital SLR ◆ Issued Aug. 2006 ◆ Page 15,16279 Catalog Nikon Nikon D80 Digital SLR Aug 2006 Page 15,16279 カタログ ニコン Ｎｉｋｏｎ ８０ デジタル 一 眼 2006 8. 9 発行 15 ページ,6
399,6.0,,EXC5 Nikon SLR Film Camera Black Body wMD12 Moter Drive JAPAN 159,383142794546.0,[EXC+5] Nikon FE2 SLR Film Camera Black Body w/MD-12 Moter Drive From JAPAN #159,https://www.ebay.com/itm/EXC-5-Nikon-FE2-SLR-Film-Camera-Black-Body-w-MD-12-Moter-Drive-JAPAN-159-/383142794546,199.99,USD,JP,15230.0,Film Cameras,StoreInventory,Used,Nikon FE2,176.0,10.0,396,396,396,396,16,"色B NEEWER カメラ/一眼レンズカメラ用 TT560 フラッシュ・スピードライト Nikon,Canon,Pentax,Ol",3359.0,,,https://page.auctions.yahoo.co.jp/jp/auction/m347609331,2084261981,"Color B NEEWER Camera / Single Lens Camera TT560 Flash Speedlight Nikon, Canon, Pentax, Ol",Color B NEEWER Camera Single Lens Camera Flash Speedlight Nikon Canon Pentax Ol,色 NEEWER カメラ 一 眼 レンズ カメラ 用 TT 560 フラッシュ スピードライト Nikon Canon Pentax Ol,6
400,47.0,,NEAR MINT Nikon Honeycomb Titanium Shutter Camera Black Body Japan,283627030315.0,"[NEAR MINT] Nikon FE2 ""Honeycomb Titanium Shutter"" Camera Black Body from Japan",https://www.ebay.com/itm/NEAR-MINT-Nikon-FE2-Honeycomb-Titanium-Shutter-Camera-Black-Body-Japan-/283627030315,244.99,USD,JP,15230.0,Film Cameras,StoreInventory,Used,Nikon FE2,176.0,10.0,397,397,397,397,17,色ブラック Nikon ミラーレス一眼 Nikon1 J5 標準パワーズームレンズキット ブラック J5HPLKBK,45999.0,,,https://page.auctions.yahoo.co.jp/jp/auction/g368599472,2084305451,Color black Nikon mirrorless interchangeable-lens camera Nikon1 J5 standard power zoom lens kit black J5HPLKBK,Color Nikon mirrorless interchangeablelens camera Nikon1 J5 power zoom lens kit J5HPLKBK,色 ブラック Nikon ミラー 一 眼 Nikon 1 5 標準 パワー ズームレンズ キット ブラック 5 HPLKBK,6
401,24.0,,NMINT Titanium Shutter SN 255xxxx Nikon Black Late Model Camera Japan 515,273774319948.0,[NMINT Titanium Shutter S/N 255xxxx] Nikon FE2 Black Late Model Camera Japan 515,https://www.ebay.com/itm/NMINT-Titanium-Shutter-S-N-255xxxx-Nikon-FE2-Black-Late-Model-Camera-Japan-515-/273774319948,279.9,USD,JP,15230.0,Film Cameras,StoreInventory,Used,Nikon FE2,176.0,10.0,398,398,398,398,18,114◆【2個セット】NikonEN-EL9/EN-EL9a互換バッテリーD40 D40X D60 D3000 D5000等対応Nikon一眼レフカメラ対応 battery 新品 MH-23対応,1639.0,1639.0,,https://page.auctions.yahoo.co.jp/jp/auction/n366260296,2084261672,114 ◆ [Set of 2] NikonEN-EL9 / EN-EL9a compatible battery D40 D40X D60 D3000 D5000 compatible Nikon SLR camera compatible battery New MH-23 compatible,114 Set 2 NikonENEL9 ENEL9a battery D60 D3000 D5000 Nikon SLR camera battery New MH23,114 2 個 セット NikonEN EL 9 EN EL 9 a 互換 バッテリー 40 40 60 D3 000 5000 等 対応 Nikon 一 眼 レフ カメラ 対応 新品 MH 23 対応,10
402,82.0,,NEAR MINT HoodNikon AF Nikkor 80200 mm f28 ED Zoom Lens Japan 117,123911806699.0,【NEAR MINT w/ Hood】Nikon AF Nikkor 80-200mm f/2.8 ED Zoom Lens from Japan #117,https://www.ebay.com/itm/NEAR-MINT-w-Hood-Nikon-AF-Nikkor-80-200mm-f-2-8-ED-Zoom-Lens-Japan-117-/123911806699,244.99,USD,JP,3323.0,Lenses,StoreInventory,Used,Nikon AF Nikkor 80-200mm f/2.8 ED Zoom Lens,175.0,20.0,399,399,399,399,19,ニコン　メタルフード　ＨＮ－２４,1000.0,,,https://page.auctions.yahoo.co.jp/jp/auction/n113769761,2084261994,Nikon Metal Food HN-24,Nikon Metal Food HN24,ニコン メタル フード ＨＮ ２４,8
403,66.0,,EXC NIKON Ai Nikkor 50 mm F2 Manual Focus Lens SLR JAPAN,113896552808.0,【 EXC+++ 】 NIKON Ai Nikkor 50mm F2 Manual Focus Lens For SLR from JAPAN,https://www.ebay.com/itm/EXC-NIKON-Ai-Nikkor-50mm-F2-Manual-Focus-Lens-SLR-JAPAN-/113896552808,59.9,USD,JP,3323.0,Lenses,StoreInventory,Used,Nikon Nikkor 50mm f/2 Ai,174.0,20.0,304,304,304,304,4,Nikon ニコン 純正NIKKOR 35-105mm MF ズームレンズ (MACRO) 良好品 (Ai),509.0,,,https://page.auctions.yahoo.co.jp/jp/auction/k414136119,2084261693,Nikon Nikon Genuine NIKKOR 35-105mm MF Zoom lens (MACRO) Good (Ai),Nikon Nikon Genuine NIKKOR 35105 mm MF Zoom lens MACRO Good Ai,Nikon ニコン 純正 NIKKOR 35 105 mm MF ズームレンズ MACRO 品 Ai,20
