,Unnamed: 0,JP_shortTitle,shortTitle,itemId,title,viewItemURL,currentPrice,currency,country,primaryCategory.categoryId,primaryCategory.categoryName,listingType,condition,model,TotalCounts,Target,Unnamed: 0,Unnamed: 0.1,Unnamed: 0.1.1,Unnamed: 0.1.1.1,Unnamed: 0.1.1.1.1,Title,CurrentPrice,BidOrBuy,shopName,ItemUrl,CategoryId,en_Title,en_short_Title,short_Title,Target_y
0,82.0,,MINT Nikon Ai Nikkor 24 mm f28 Manual Focus MF Wide Lens WHood Japan 1911,153652407836.0,【MINT+++】 Nikon Ai Nikkor 24mm f/2.8 Manual Focus MF Wide Lens W/Hood Japan 1911,https://www.ebay.com/itm/MINT-Nikon-Ai-Nikkor-24mm-f-2-8-Manual-Focus-MF-Wide-Lens-W-Hood-Japan-1911-/153652407836,139.99,USD,JP,3323.0,Lenses,StoreInventory,Used,Nikon F,18132.0,20.0,273,273,273,273,13,ニコン ニッコール Nikon AF NIKKOR 18-35mm F3.5-4.5 D ED オートフォーカス / AF 広角 レンズ + フード（HB-23)付き [209011],1400.0,36800.0,,https://page.auctions.yahoo.co.jp/jp/auction/d392468280,2084261684,Nikon Nikkor Nikon AF NIKKOR 18-35mm F3.5-4.5 D ED Autofocus / AF Wide Angle Lens With Hood (HB-23) [209011],Nikon Nikkor Nikon AF NIKKOR 1835 mm F3545 D ED Autofocus AF Wide Angle Lens Hood HB23 209011,ニコン ニッコール Nikon AF NIKKOR 18 35 mm F 3 5 4 5 ED オートフォーカス AF 広角 レンズ フード HB 23 付き 209011,20
1,13.0,,Nikon NIKKOR H Auto 28 cm f35 Non Ai Lens Mnanual Focus 28 mm F35 Japan,202747264727.0,Nikon NIKKOR H Auto 2.8cm f/3.5 Non Ai Lens Mnanual Focus 28mm F3.5 from Japan,https://www.ebay.com/itm/Nikon-NIKKOR-H-Auto-2-8cm-f-3-5-Non-Ai-Lens-Mnanual-Focus-28mm-F3-5-Japan-/202747264727,70.0,USD,JP,3323.0,Lenses,StoreInventory,Used,Nikon F,18132.0,20.0,338,338,338,338,18,★美品★ ニコン Nikon AF-S DX NIKKOR 35mm f1.8G ◆完動品◆,5250.0,16880.0,,https://page.auctions.yahoo.co.jp/jp/auction/t662343058,2084261684,★ Beautiful ★ Nikon Nikon AF-S DX NIKKOR 35mm f1.8G,Nikon Nikon AFS DX NIKKOR 35 mm G,美品 ニコン Nikon AF DX NIKKOR 35mm f 1 8 完動 品,20
2,51.0,,NEAR MINT Tokina ATX PRO AF 2870 mm f28 Zoom Lens Nikon Japan,352802288653.0,NEAR MINT Tokina AT-X PRO AF 28-70mm f/2.8 Zoom Lens for Nikon from Japan,https://www.ebay.com/itm/NEAR-MINT-Tokina-AT-X-PRO-AF-28-70mm-f-2-8-Zoom-Lens-Nikon-Japan-/352802288653,169.0,USD,JP,3323.0,Lenses,StoreInventory,Used,Nikon F,18132.0,20.0,126,126,126,126,6,◆ Tokina トキナー AT-X PRO 28-70mm F2.8 ズームレンズ ニコンFマウント AFレンズ AF一眼レフ用,4430.0,,,https://page.auctions.yahoo.co.jp/jp/auction/g374948768,2084261690,◆ Tokina Tokina AT-X PRO 28-70mm F2.8 Zoom Lens Nikon F Mount AF Lens For AF SLR,Tokina Tokina ATX PRO 2870 mm F28 Zoom Lens Nikon F Mount AF Lens AF SLR,Tokina トキナー AT PRO 28 70 mm F2 8 ズームレンズ ニコン マウント AF レンズ AF 一 眼 レフ 用,20
3,52.0,,Nikon Nikkor O C Auto 35 mm F2 MF Non Ai Lens Japan,202750054101.0,Nikon Nikkor O C Auto 35mm F2 MF Non Ai Lens from Japan,https://www.ebay.com/itm/Nikon-Nikkor-O-C-Auto-35mm-F2-MF-Non-Ai-Lens-Japan-/202750054101,135.0,USD,JP,3323.0,Lenses,StoreInventory,Used,Nikon F,18132.0,20.0,0,0,0,0,0,ニコン MFカメラレンズ、ジャンク扱い,8838.0,,,https://page.auctions.yahoo.co.jp/jp/auction/d391533853,2084261693,"Nikon MF camera lens, junk treatment",Nikon MF camera lens junk treatment,ニコン MF カメラ レンズ ジャンク 扱い,6
4,95.0,,EXCELLENT Nikon Nikkor 50 mm Ais Ais MF Lens Japan,202781237275.0,EXCELLENT Nikon Nikkor 50mm f/1.2 Ai-s Ais MF Lens from Japan,https://www.ebay.com/itm/EXCELLENT-Nikon-Nikkor-50mm-f-1-2-Ai-s-Ais-MF-Lens-Japan-/202781237275,324.88,USD,JP,3323.0,Lenses,StoreInventory,Used,Nikon NIKKOR,14204.0,20.0,1,1,1,1,1,Nikon ニコン 純正 AF NIKKOR 28-85mm オートフォーカス高級ズームレンズ 1:3.5-4.5,3000.0,,,https://page.auctions.yahoo.co.jp/jp/auction/f376078688,2084261684,Nikon Nikon Genuine AF NIKKOR 28-85mm Autofocus luxury zoom lens 1: 3.5-4.5,Nikon Nikon Genuine AF NIKKOR 2885 mm Autofocus luxury zoom lens 1 3545,Nikon ニコン 純正 AF NIKKOR 28 85 mm オートフォーカス 高級 ズームレンズ 1 3. 5 4 5,20
5,68.0,,Excellent Nikon Nikkor 200 mm f4 Ai Manual Focus Telephoto Lens Japan,303276676663.0,"""Excellent"" Nikon Nikkor 200mm f/4 Ai Manual Focus Telephoto Lens from Japan",https://www.ebay.com/itm/Excellent-Nikon-Nikkor-200mm-f-4-Ai-Manual-Focus-Telephoto-Lens-Japan-/303276676663,108.0,USD,JP,3323.0,Lenses,StoreInventory,Used,Nikon NIKKOR,14204.0,20.0,2,2,2,2,2,Nikon D5300 ボディ ジャンク品 AF不良 ライブビューAF撮影は可能です。,12000.0,,,https://page.auctions.yahoo.co.jp/jp/auction/d390852914,2084261636,Nikon D5300 Body Junk AF failure Live View AF shooting is possible.,Nikon D5300 Body Junk AF failure Live View AF shooting,Nikon 5300 ボディ ジャンク 品 AF 不良 ライブ ビュー AF 撮影,20
6,48.0,,MINT Nikon AF Nikkor 28105 mm f3545 D AF Standard Zoom Lens Japan 89,193001226905.0,【MINT】 Nikon AF Nikkor 28-105mm f/3.5-4.5 D AF Standard Zoom Lens Japan #89,https://www.ebay.com/itm/MINT-Nikon-AF-Nikkor-28-105mm-f-3-5-4-5-D-AF-Standard-Zoom-Lens-Japan-89-/193001226905,99.99,USD,JP,3323.0,Lenses,FixedPrice,Used,Nikon NIKKOR,14204.0,20.0,3,3,3,3,3,【送無】Nikon AF-S 200-500mm f5.6E ED VR 美品,104800.0,,,https://page.auctions.yahoo.co.jp/jp/auction/k414448295,2084261684,[Not sent] Nikon AF-S 200-500mm f5.6E ED VR beautiful goods,Nikon AFS 200500 mm f56E ED VR goods,送無 Nikon AF 200 500 mm f 5 6 ED VR 美品,20
7,68.0,,AS Nikon AF Nikkor 3570 mm 28 Zoome Lens Japan 202 B,401888942574.0,"""AS IS"" Nikon AF Nikkor 35-70mm f 2.8 Zoome Lens From Japan #202 B",https://www.ebay.com/itm/AS-IS-Nikon-AF-Nikkor-35-70mm-f-2-8-Zoome-Lens-Japan-202-B-/401888942574,84.99,USD,JP,3323.0,Lenses,StoreInventory,Used,Nikon NIKKOR,14204.0,20.0,4,4,4,4,4,【ニコン】ニッコール NIKKOR-W135mmF5.6大判カメラ用レンズ レンズボード付き,11800.0,,,https://page.auctions.yahoo.co.jp/jp/auction/w335522609,23692,[Nikon] Nikkor NIKKOR-W135mmF5.6 large format camera lens with lens board,Nikon Nikkor NIKKORW135mmF56 format camera lens lens board,ニコン ニッコール NIKKOR 135 mmF 5 6 大判 カメラ 用 レンズ レンズ ボード 付き,6
8,37.0,,EXCELLENT Nikon Nikkor 50 mm Ais Ais MF Lens Japan,202781237275.0,EXCELLENT Nikon Nikkor 50mm f/1.2 Ai-s Ais MF Lens from Japan,https://www.ebay.com/itm/EXCELLENT-Nikon-Nikkor-50mm-f-1-2-Ai-s-Ais-MF-Lens-Japan-/202781237275,324.88,USD,JP,3323.0,Lenses,StoreInventory,Used,Nikon NIKKOR,14204.0,20.0,5,5,5,5,5,★ほぼ新品★ ニコン Nikon COOLPIX A10 レッド ★即決特典有り！★（19Au25M-RZ）,8800.0,10000.0,,https://page.auctions.yahoo.co.jp/jp/auction/s690661669,2084261644,★ Almost new ★ Nikon Nikon COOLPIX A10 Red ★ There is a prompt decision bonus! ★ (19Au25M-RZ),Nikon Nikon COOLPIX A10 Red decision bonus 19Au25MRZ,新品 ニコン Nikon COOLPIX 10 レッド 即決 特典 有り 19 Au M RZ,6
9,82.0,,zoom nikkor 3672 mm lens nikon mount Eseries ais 4805803123,323892166283.0,zoom nikkor 36-72mm f/3.5 lens for nikon f mount E-series ais ai-s 480580-3123,https://www.ebay.com/itm/zoom-nikkor-36-72mm-f-3-5-lens-nikon-f-mount-E-series-ais-ai-s-480580-3123-/323892166283,38.0,USD,JP,3323.0,Lenses,StoreInventory,Used,nikkor,14057.0,20.0,6,6,6,6,6,シグマ Sigma 24-70mm f/2.8 DG HSM EX DG ニコン用 (324-W762),47800.0,47800.0,,https://page.auctions.yahoo.co.jp/jp/auction/q316451467,2084261684,Sigma Sigma 24-70mm f / 2.8 DG HSM EX DG for Nikon (324-W762),Sigma Sigma 2470 mm 28 DG HSM EX DG Nikon 324W762,70mm 2. 8 DG HS EX DG ニコン 用 324 W 762,20
10,0.0,,Nikon AFS Nikkor 55200 mm F456 G ED DX VR SWM Lens Japan 492814,312777530797.0,Nikon AF-S afs Nikkor 55-200mm F4-5.6 G ED DX VR IF SWM Lens from Japan #492814,https://www.ebay.com/itm/Nikon-AF-S-afs-Nikkor-55-200mm-F4-5-6-G-ED-DX-VR-IF-SWM-Lens-Japan-492814-/312777530797,88.0,USD,JP,3323.0,Lenses,StoreInventory,Used,Nikkor,14057.0,20.0,7,7,7,7,7,★超希少★シュナイダー Schneider KREUZACH PC-SUPER ANGULON 2.8/28★ニコンFマウント★ドイツ製,35750.0,,,https://page.auctions.yahoo.co.jp/jp/auction/c775776986,2084261693,★ Super rare ★ Schneider KREUZACH PC-SUPER ANGULON 2.8 / 28 ★ Nikon F mount ★ Made in Germany,Super Schneider KREUZACH ANGULON 28 28 Nikon F mount Germany,超 シュナイダー Schneider KREUZACH PC SUPER ANGULON 2 8 28 ニコン マウント ドイツ 製,10
11,83.0,,Nikon Ai Nikkor 35 mm f2 MF Wide Angle Lens w Cap Excellent Japan,174005420970.0,Nikon Ai Nikkor 35mm f/2 MF Wide Angle Lens w/ Cap [Excellent-] From Japan,https://www.ebay.com/itm/Nikon-Ai-Nikkor-35mm-f-2-MF-Wide-Angle-Lens-w-Cap-Excellent-Japan-/174005420970,139.99,USD,JP,3323.0,Lenses,StoreInventory,Used,Nikkor,14057.0,20.0,8,8,8,8,8,正規品 Nikon ニコン カメラ レンズ NIKKOR 28mm 1:2 レンズキャップ リアキャップ付き,5250.0,,,https://page.auctions.yahoo.co.jp/jp/auction/j594919892,2084261693,Genuine Nikon Nikon Camera Lens NIKKOR 28mm 1: 2 Lens Cap With Rear Cap,Genuine Nikon Nikon Camera Lens NIKKOR 28 mm 1 2 Lens Cap Rear Cap,正規 品 Nikon ニコン カメラ レンズ NIKKOR 28 mm 1 2 レンズ キャップ リア キャップ 付き,18
12,78.0,,Nikon AF NIKKOR 28105 mm F3545 13545 D Lens Japan,312780238150.0,Nikon AF NIKKOR 28-105mm F3.5-4.5 1:3.5-4.5 D Lens from Japan #486703[very good],https://www.ebay.com/itm/Nikon-AF-NIKKOR-28-105mm-F3-5-4-5-1-3-5-4-5-D-Lens-Japan-486703-very-good-/312780238150,90.0,USD,JP,3323.0,Lenses,StoreInventory,Used,Nikkor,14057.0,20.0,9,9,9,9,9,正規品 Nikon ニコン F3用 ウエストレベルファインダー DW-3 カメラ 一眼レフ アクセサリー,1100.0,,,https://page.auctions.yahoo.co.jp/jp/auction/n372092297,23760,Genuine Nikon Nikon F3 Waist Level Finder DW-3 Camera SLR Accessories,Genuine Nikon Nikon F3 Waist Level Finder DW3 Camera SLR Accessories,正規 品 Nikon ニコン 3 用 ウエスト レベル ファインダー DW 3 カメラ 一 眼 レフ アクセサリー,6
13,28.0,,AS Nikon NIKKOR S Auto 50 mm F14 NonAi Lens Japan 487632,202750812907.0,AS IS Nikon NIKKOR S Auto 50mm F1.4 Non-Ai Lens from Japan #487632,https://www.ebay.com/itm/Nikon-NIKKOR-S-Auto-50mm-F1-4-Non-Ai-Lens-Japan-487632-/202750812907,30.0,USD,JP,3323.0,Lenses,StoreInventory,Used,Nikkor,14057.0,20.0,10,10,10,10,10,正規品 Nikon ニコン F3用 高倍率ファインダー DW-4 カメラ 一眼レフ アクセサリー,1000.0,,,https://page.auctions.yahoo.co.jp/jp/auction/d391010232,23760,Genuine Nikon Nikon F3 high magnification viewfinder DW-4 camera SLR accessories,Genuine Nikon Nikon F3 magnification viewfinder DW4 camera SLR accessories,正規 品 Nikon ニコン 3 用 高 倍率 ファインダー DW 4 カメラ 一 眼 レフ アクセサリー,6
14,90.0,,AS Nikon NIKKOR S Auto 50 mm F14 NonAi Lens Japan 357214,202750815580.0,AS IS Nikon NIKKOR S Auto 50mm F1.4 Non-Ai Lens from Japan #357214,https://www.ebay.com/itm/Nikon-NIKKOR-S-Auto-50mm-F1-4-Non-Ai-Lens-Japan-357214-/202750815580,30.0,USD,JP,3323.0,Lenses,StoreInventory,Used,Nikkor,14057.0,20.0,11,11,11,11,11,マニュアルレンズ　２２本セット　キャノン ニコン シグマ タムロン まとめて CANON NIKON SIGMA TAMRON,41.0,,,https://page.auctions.yahoo.co.jp/jp/auction/x644779534,2084261692,CANON NIKON SIGMA TAMRON Manual lens set of 22 Canon Nikon Sigma Tamron,CANON NIKON SIGMA TAMRON lens 22 Canon Nikon Sigma Tamron,マニュアル レンズ ２２ 本 セット キャノン ニコン タムロン CANON NIKON SIGMA TAMRON,18
15,50.0,,Nikon MF Ai Zoom Nikkor Auto 80200 mm f45 Film Lens Japan,202747283871.0,Nikon MF Ai Zoom Nikkor Auto 80-200mm f/4.5 Film Lens From Japan,https://www.ebay.com/itm/Nikon-MF-Ai-Zoom-Nikkor-Auto-80-200mm-f-4-5-Film-Lens-Japan-/202747283871,55.0,USD,JP,3323.0,Lenses,StoreInventory,Used,Nikkor,14057.0,20.0,12,12,12,12,12,☆超極上品☆ ニコン Nikon 1 J4 10-30mm F3.5-5.6 VR レンズセット #1006-1,17800.0,17980.0,,https://page.auctions.yahoo.co.jp/jp/auction/e384850917,2084305445,"<!DOCTYPE html><html><head><link rel=""shortcut icon"" href=""//ssl.gstatic.com/docs/script/images/favicon.ico""><title>Error</title><style type=""text/css"">body {background-color: #fff; margin: 0; padding: 0;}.errorMessage {font-family: Arial,sans-serif; font-size: 12pt; font-weight: bold; line-height: 150%; padding-top: 25px;}</style></head><body style=""margin:20px""><div><img alt=""Google Apps Script"" src=""//ssl.gstatic.com/docs/script/images/logo.png""></div><div style=""text-align:center;font-family:monospace;margin:50px auto 0;max-width:600px"">無効な引数: source (line 3, file &quot;コード&quot;, project &quot;Translation&quot;)</div></body></html>",DOCTYPE relshortcut icon typetextcssbody backgroundcolor fff margin 0 padding 0errorMessage Arialsansserif fontsize fontweight lineheight 150 paddingtop 25pxstyleheadbody stylemargin20pxdivimg altGoogle Apps Script srcsslgstaticcomdocsscriptimageslogopngdivdiv auto 0maxwidth600px source line 3 file quotquot project quotTranslationquotdivbodyhtml,超 極上 品 ニコン Nikon 1 4 10 30 mm F3 5 5. 6 VR レンズ セット 1006 1,20
16,60.0,,Nikon AF Nikkor 3570 mm f3345 AF Zoom Lens Japan,202761950049.0,Nikon AF Nikkor 35-70mm f3.3-4.5 AF Zoom Lens From Japan,https://www.ebay.com/itm/Nikon-AF-Nikkor-35-70mm-f3-3-4-5-AF-Zoom-Lens-Japan-/202761950049,30.0,USD,JP,3323.0,Lenses,StoreInventory,Used,Nikkor,14057.0,20.0,13,13,13,13,13,● ニコン CANON NIKON ペンタックス 等 カメラ 大量まとめ,270.0,,,https://page.auctions.yahoo.co.jp/jp/auction/f377092125,2084044777,● Nikon CANON NIKON Pentax and other cameras,Nikon CANON NIKON Pentax cameras,ニコン CANON NIKON ペンタックス 等 カメラ 大量 まとめ,8
17,74.0,,Nikon Reflex Nikkor C 500 mm F8 18 Lens wcaps Japan 481524,312755614064.0,Nikon Reflex Nikkor C 500mm F8 1:8 Lens w/caps from Japan #481524,https://www.ebay.com/itm/Nikon-Reflex-Nikkor-C-500mm-F8-1-8-Lens-w-caps-Japan-481524-/312755614064,181.0,USD,JP,3323.0,Lenses,StoreInventory,Used,Nikkor,14057.0,20.0,14,14,14,14,14,Nikon カメラバッグ ブラック ショルダーバッグ 状態良し EC36-446jy/F4,1.0,,,https://page.auctions.yahoo.co.jp/jp/auction/o332307476,2084261931,Nikon Camera Bag Black Shoulder Bag Good Condition EC36-446jy / F4,Nikon Camera Bag Black Shoulder Bag Good Condition EC36446jy F4,Nikon カメラ バッグ ブラック ショルダーバッグ 状態 良し EC 36 446 4,10
18,96.0,,Exc Nikon Ai Nikkor 200 mm F4 Prime MF Telephoto Lens Japan 559,233331054682.0,[Exc++++] Nikon Ai Nikkor 200mm F4 Prime MF Telephoto Lens from Japan # 559,https://www.ebay.com/itm/Exc-Nikon-Ai-Nikkor-200mm-F4-Prime-MF-Telephoto-Lens-Japan-559-/233331054682,69.9,USD,JP,3323.0,Lenses,StoreInventory,Used,NIKKOR,14057.0,20.0,15,15,15,15,15,美品 Nikon FA ブラックボディ フィルム 一眼レフ☆tamron sp 28-80mm F3.5-4.2☆スピードライトSB-15 セット,1500.0,10000.0,,https://page.auctions.yahoo.co.jp/jp/auction/j596095960,2084044778,Beautiful goods Nikon FA black body film SLR ☆ tamron sp 28-80mm F3.5-4.2 ☆ Speedlight SB-15 set,goods Nikon FA body film SLR tamron 2880 mm F3542 Speedlight SB15,美品 Nikon FA ブラック ボディ フィルム 一 眼 レフ tamron sp 28 80 mm 5 4 2 スピードライト SB 15 セット,10
19,33.0,,N Mint Nikon Nikkor 50 mm f2 NonAi MF Manual FoucusLens Japan 59,202768849116.0,[N Mint++] Nikon Nikkor 50mm f/2 Non-Ai MF Manual FoucusLens From Japan #59,https://www.ebay.com/itm/N-Mint-Nikon-Nikkor-50mm-f-2-Non-Ai-MF-Manual-FoucusLens-Japan-59-/202768849116,59.8,USD,JP,3323.0,Lenses,StoreInventory,Used,Nikkor,14057.0,20.0,16,16,16,16,16,☆新品☆送料無料☆Nikon AF-S DX NIKKOR 18-300mm f/3.5-5.6G ED VR [AFSDXVR18-300G],79800.0,,,https://page.auctions.yahoo.co.jp/jp/auction/d377995033,23716,☆ New ☆ Free Shipping ☆ Nikon AF-S DX NIKKOR 18-300mm f / 3.5-5.6G ED VR [AFSDXVR18-300G],New Shipping Nikon AFS DX NIKKOR 18300 mm f 3556 G ED VR AFSDXVR18300 G,新品 送料 無料 Nikon AF DX NIKKOR 18 300 mm f/ 3. 5 5 6 ED VR AFSDXVR 18 300,20
20,65.0,,Nikon AFS VR Zoom Nikkor ED 70300 mm F4556 G lens Japan 492810,312773847661.0,Nikon AF-S VR Zoom Nikkor ED 70-300mm F4.5-5.6 G IF lens from Japan #492810,https://www.ebay.com/itm/Nikon-AF-S-VR-Zoom-Nikkor-ED-70-300mm-F4-5-5-6-G-IF-lens-Japan-492810-/312773847661,233.5,USD,JP,3323.0,Lenses,StoreInventory,Used,Nikkor,14057.0,20.0,17,17,17,17,17,● ニコン CANON NIKON PENTAX 等 カメラ 大量まとめ,11.0,,,https://page.auctions.yahoo.co.jp/jp/auction/s690559811,2084044777,● Nikon CANON NIKON PENTAX and other cameras,Nikon CANON NIKON PENTAX cameras,ニコン CANON NIKON PENTAX 等 カメラ 大量 まとめ,8
21,6.0,,AS Nikon NIKKOR S Auto 50 mm F14 NonAi Lens Japan 357214,202750815580.0,AS IS Nikon NIKKOR S Auto 50mm F1.4 Non-Ai Lens from Japan #357214,https://www.ebay.com/itm/Nikon-NIKKOR-S-Auto-50mm-F1-4-Non-Ai-Lens-Japan-357214-/202750815580,30.0,USD,JP,3323.0,Lenses,StoreInventory,Used,Nikkor,14057.0,20.0,18,18,18,18,18,NIKKOR Z 14-30mm f/4 Zマウント 未使用 開封のみ,100000.0,119000.0,,https://page.auctions.yahoo.co.jp/jp/auction/n373720930,2084261684,NIKKOR Z 14-30mm f / 4 Z mount Unused Open only,NIKKOR Z 1430 mm 4 Z mount Unused Open,NIKKOR 14 30 mm 4 マウント 未 使用,20
22,58.0,,NIKON AF NIKKOR 3570 mm 128 ZOOM lens Japan 494282,312783265068.0,NIKON AF NIKKOR 35-70mm f2.8 1:2.8 ZOOM lens from Japan #494282,https://www.ebay.com/itm/NIKON-AF-NIKKOR-35-70mm-f2-8-1-2-8-ZOOM-lens-Japan-494282-/312783265068,150.0,USD,JP,3323.0,Lenses,StoreInventory,Used,Nikkor,14057.0,20.0,19,19,19,19,19,中古美品 Nikon AF-S NIKKOR 50mm f/1.8G 単焦点レンズ,12000.0,18000.0,,https://page.auctions.yahoo.co.jp/jp/auction/c763113077,2084261684,Used beautiful goods Nikon AF-S NIKKOR 50mm f / 1.8G single focus lens,goods Nikon AFS 50 mm 18 G focus lens,中古 美品 Nikon AF NIKKOR 50 1 8 単 焦点 レンズ,20
23,69.0,,Excellent Nikon ZoomNIKKOR AiS 3570 mm f3345 Japan,202747273747.0,Excellent Nikon Zoom-NIKKOR Ai-S 35-70mm f/3.3-4.5 From Japan,https://www.ebay.com/itm/Excellent-Nikon-Zoom-NIKKOR-Ai-S-35-70mm-f-3-3-4-5-Japan-/202747273747,45.0,USD,JP,3323.0,Lenses,StoreInventory,Used,Nikkor,14057.0,20.0,20,20,20,20,0,■増税キャンペーン■ ニコン Nikon D750 ボディ 元箱付 付属品多数 #A9791N01133,81000.0,128000.0,,https://page.auctions.yahoo.co.jp/jp/auction/n373977984,2084261636,"<!DOCTYPE html><html><head><link rel=""shortcut icon"" href=""//ssl.gstatic.com/docs/script/images/favicon.ico""><title>Error</title><style type=""text/css"">body {background-color: #fff; margin: 0; padding: 0;}.errorMessage {font-family: Arial,sans-serif; font-size: 12pt; font-weight: bold; line-height: 150%; padding-top: 25px;}</style></head><body style=""margin:20px""><div><img alt=""Google Apps Script"" src=""//ssl.gstatic.com/docs/script/images/logo.png""></div><div style=""text-align:center;font-family:monospace;margin:50px auto 0;max-width:600px"">無効な引数: source (line 3, file &quot;コード&quot;, project &quot;Translation&quot;)</div></body></html>",DOCTYPE relshortcut icon typetextcssbody backgroundcolor fff margin 0 padding 0errorMessage Arialsansserif fontsize fontweight lineheight 150 paddingtop 25pxstyleheadbody stylemargin20pxdivimg altGoogle Apps Script srcsslgstaticcomdocsscriptimageslogopngdivdiv auto 0maxwidth600px source line 3 file quotquot project quotTranslationquotdivbodyhtml,増税 キャンペーン ニコン Nikon 750 ボディ 元箱 付 付属品 多数 9791 01133,20
24,45.0,,AS NIKON NIKKOR 70300 mm f456 AF G Silver Zoom Lens Japan,401887410886.0,【AS IS】 NIKON NIKKOR 70-300mm f/4-5.6 AF G Silver Zoom Lens From Japan,https://www.ebay.com/itm/AS-IS-NIKON-NIKKOR-70-300mm-f-4-5-6-AF-G-Silver-Zoom-Lens-Japan-/401887410886,49.39,USD,JP,3323.0,Lenses,StoreInventory,Used,Nikkor,14057.0,20.0,21,21,21,21,1,【ecoま】ニコン NIKON Micro-Nikkor 55mm F2.8 no.516882 Ai-s マイクロニッコール マニュアルレンズ,15680.0,,,https://page.auctions.yahoo.co.jp/jp/auction/t676066377,2084261693,[Eco] Nikon NIKON Micro-Nikkor 55mm F2.8 no.516882 Ai-s Micro Nikkor Manual Lens,Eco Nikon NIKON MicroNikkor 55 mm F28 no516882 Ais Micro Nikkor Manual Lens,eco ま ニコン Micro Nikkor 55 mm 2 8 no. 516882 - s マイクロ ニッコール マニュアル レンズ,20
25,12.0,,Nikon NIKKOR 70210 mm f4056 AF Lens japan 433874,383138891081.0,Nikon NIKKOR 70-210mm f/4.0-5.6 AF Lens w/cap from japan 433874 [very good],https://www.ebay.com/itm/Nikon-NIKKOR-70-210mm-f-4-0-5-6-AF-Lens-w-cap-japan-433874-very-good-/383138891081,60.0,USD,JP,3323.0,Lenses,StoreInventory,Used,nikon af,10509.0,20.0,22,22,22,22,2,AF-S NIKKOR 80 - 200mm f/2.8 D 箱付き,12000.0,,,https://page.auctions.yahoo.co.jp/jp/auction/d391163410,2084261684,AF-S NIKKOR 80-200mm f / 2.8 D with box,AFS NIKKOR 80200 mm 28 D box,AF NIKKOR 80 200 mm f 2 8 箱 付き,20
26,62.0,,Nikon AF D Zoom Nikkor 2485 mm f284 FX lens Japan Exc 456487A,254271713243.0,Nikon AF D Zoom Nikkor 24-85mm f/2.8-4 macro FX lens Japan [Exc+++++] #456487A,https://www.ebay.com/itm/Nikon-AF-D-Zoom-Nikkor-24-85mm-f-2-8-4-macro-FX-lens-Japan-Exc-456487A-/254271713243,219.9,USD,JP,3323.0,Lenses,FixedPrice,Used,Nikon AF,10509.0,20.0,23,23,23,23,3,ニコン Nikon D7000 D 7000 ◇ 1930,16000.0,,,https://page.auctions.yahoo.co.jp/jp/auction/x645638722,2084261636,Nikon Nikon D7000 D 7000 ◇ 1930,Nikon Nikon D7000 D 7000 1930,ニコン Nikon 7000 7000 1930,8
27,64.0,,Nikon AF Nikkor 2450 mm f3345 D Lens wHood 619 Japan,113865928409.0,Nikon AF Nikkor 24-50mm f/3.3-4.5 D Lens w/Hood  [excellent] #619 from Japan !!,https://www.ebay.com/itm/Nikon-AF-Nikkor-24-50mm-f-3-3-4-5-D-Lens-w-Hood-excellent-619-Japan-/113865928409,114.0,USD,JP,3323.0,Lenses,StoreInventory,Used,Nikon AF,10509.0,20.0,24,24,24,24,4,★美品★ Nikon ニコン MD-2 MB-1 モータードライブ 完動品 A352-3,6250.0,,,https://page.auctions.yahoo.co.jp/jp/auction/n352912347,2084044778,★ Beautiful ★ Nikon Nikon MD-2 MB-1 Motor drive Complete product A352-3,Nikon Nikon MD2 MB1 Motor product A3523,美品 Nikon ニコン MD 2 MB 1 モータードライブ 完動 品 352 3,10
28,27.0,,Mint Nikon AF Micro NIKKOR 105 mm f28 D Telephoto Lens Japan,174023566227.0,【 Mint 】Nikon AF Micro NIKKOR 105mm f/2.8 D Telephoto Lens from Japan,https://www.ebay.com/itm/Mint-Nikon-AF-Micro-NIKKOR-105mm-f-2-8-D-Telephoto-Lens-Japan-/174023566227,249.99,USD,JP,3323.0,Lenses,StoreInventory,Used,Nikon AF,10509.0,20.0,25,25,25,25,5,★NIKON ニコン FM2 シルバーボディ + NIKON LENZ SERIES E Zoom Ai-s 36 ～72mm 1:3.5 #01412,2200.0,29800.0,,https://page.auctions.yahoo.co.jp/jp/auction/d392372460,2084044778,"<!DOCTYPE html><html><head><link rel=""shortcut icon"" href=""//ssl.gstatic.com/docs/script/images/favicon.ico""><title>Error</title><style type=""text/css"">body {background-color: #fff; margin: 0; padding: 0;}.errorMessage {font-family: Arial,sans-serif; font-size: 12pt; font-weight: bold; line-height: 150%; padding-top: 25px;}</style></head><body style=""margin:20px""><div><img alt=""Google Apps Script"" src=""//ssl.gstatic.com/docs/script/images/logo.png""></div><div style=""text-align:center;font-family:monospace;margin:50px auto 0;max-width:600px"">無効な引数: source (line 3, file &quot;コード&quot;, project &quot;Translation&quot;)</div></body></html>",DOCTYPE relshortcut icon typetextcssbody backgroundcolor fff margin 0 padding 0errorMessage Arialsansserif fontsize fontweight lineheight 150 paddingtop 25pxstyleheadbody stylemargin20pxdivimg altGoogle Apps Script srcsslgstaticcomdocsscriptimageslogopngdivdiv auto 0maxwidth600px source line 3 file quotquot project quotTranslationquotdivbodyhtml,NIKON ニコン FM 2 シルバー ボディ LENZ SERIES Ai 36 72 mm 1 3 5 01412,20
29,41.0,,Nikon AF Nikkor 2450 mm F3345 D Zoom Lens JAPAN Exc 487163A,254353378004.0,Nikon AF Nikkor 24-50mm F/3.3-4.5 D Zoom Lens from JAPAN [Exc+++++] #487163A,https://www.ebay.com/itm/Nikon-AF-Nikkor-24-50mm-F-3-3-4-5-D-Zoom-Lens-JAPAN-Exc-487163A-/254353378004,69.9,USD,JP,3323.0,Lenses,FixedPrice,Used,Nikon Nikkor  AF,8224.0,20.0,26,26,26,26,6,★希少美品★NIKON★ニコン★NIKKOR Q・Ｃ AUTO 135mm f2.8 135/2.8 フィルター付★#497991,1000.0,,,https://page.auctions.yahoo.co.jp/jp/auction/o345380256,2084261693,"<!DOCTYPE html><html><head><link rel=""shortcut icon"" href=""//ssl.gstatic.com/docs/script/images/favicon.ico""><title>Error</title><style type=""text/css"">body {background-color: #fff; margin: 0; padding: 0;}.errorMessage {font-family: Arial,sans-serif; font-size: 12pt; font-weight: bold; line-height: 150%; padding-top: 25px;}</style></head><body style=""margin:20px""><div><img alt=""Google Apps Script"" src=""//ssl.gstatic.com/docs/script/images/logo.png""></div><div style=""text-align:center;font-family:monospace;margin:50px auto 0;max-width:600px"">無効な引数: source (line 3, file &quot;コード&quot;, project &quot;Translation&quot;)</div></body></html>",DOCTYPE relshortcut icon typetextcssbody backgroundcolor fff margin 0 padding 0errorMessage Arialsansserif fontsize fontweight lineheight 150 paddingtop 25pxstyleheadbody stylemargin20pxdivimg altGoogle Apps Script srcsslgstaticcomdocsscriptimageslogopngdivdiv auto 0maxwidth600px source line 3 file quotquot project quotTranslationquotdivbodyhtml,美品 NIKON ニコン NIKKOR 135 mm f 2 135 2 8 フィルター 付 497991,20
