,Unnamed: 0,JP_shortTitle,shortTitle,itemId,title,viewItemURL,currentPrice,currency,country,primaryCategory.categoryId,primaryCategory.categoryName,listingType,condition,model,TotalCounts,Target,Unnamed: 0,Unnamed: 0.1,Unnamed: 0.1.1,Unnamed: 0.1.1.1,Unnamed: 0.1.1.1.1,Title,CurrentPrice,BidOrBuy,shopName,ItemUrl,CategoryId,en_Title,en_short_Title,short_Title,Target_y
245,79.0,,Mint NIKON F4 E 35 mm SLR Film Camera Body F4E w Strap Japan,233340433288.0,[Near Mint] NIKON F4 E 35mm SLR Film Camera Body F4E w/ Strap from Japan,https://www.ebay.com/itm/Near-Mint-NIKON-F4-E-35mm-SLR-Film-Camera-Body-F4E-w-Strap-Japan-/233340433288,218.9,USD,JP,15230.0,Film Cameras,StoreInventory,Used,Nikon F4,349.0,10.0,242,242,242,242,2,〓極美級〓 ★ ニコン Nikon D610 超望遠 Wレンズセット ★ ダブルレンズセット ♪,75800.0,80800.0,,https://page.auctions.yahoo.co.jp/jp/auction/w334326330,2084261636,Nikon Nikon D610 Super telephoto W lens set ★ Double lens set ♪,Nikon Nikon D610 Super telephoto W lens lens,極美 級 ニコン D 610 超 望遠 レンズ セット ダブル レンズ セット,20
246,5.0,,Excellent Nikon F 4S 35 mm TAMRON AF ASPHERICAL2880 mm Japan 19,383142329059.0,Excellent+++++ Nikon F 4S 35mm TAMRON AF ASPHERICAL28-80mm From Japan  #19,https://www.ebay.com/itm/Excellent-Nikon-F-4S-35mm-TAMRON-AF-ASPHERICAL28-80mm-Japan-19-/383142329059,129.0,USD,JP,15230.0,Film Cameras,FixedPrice,Used,Nikon F4,349.0,10.0,243,243,243,243,3,〓極美級〓 ★ トキナー TOKINA AT-X 80-400mm F4.5-5.6D ニコン用 ★,22800.0,25800.0,,https://page.auctions.yahoo.co.jp/jp/auction/g364600385,2084261684,〓Extreme Beauty Class ★ Tokina TOKINA AT-X 80-400mm F4.5-5.6D For Nikon ★,Extreme Beauty Class Tokina TOKINA ATX 80400 mm F4556D Nikon,〓 極美 級 〓 トキナー TOKINA AT 80 400 mm 5 5. 6 ニコン 用,20
247,40.0,,Nikon F4 35 mm SLR Film Camera Body SN2284569,223663663670.0,Nikon F4 35mm SLR Film Camera Body Only  SN2284569,https://www.ebay.com/itm/Nikon-F4-35mm-SLR-Film-Camera-Body-Only-SN2284569-/223663663670,27.8,USD,JP,15230.0,Film Cameras,StoreInventory,Used,Nikon F4,349.0,10.0,244,244,244,244,4,〓実用良品〓 Nikon ニコン D600 超望遠 Wレンズセット ★ ダブルレンズセット ♪ 付属品多数！！！,63800.0,67800.0,,https://page.auctions.yahoo.co.jp/jp/auction/w336935680,2084261636,〓 Practical Good 〓 Nikon Nikon D600 Super telephoto W lens set ★ Double lens set ♪ Many accessories! ! !,Practical Good Nikon Nikon D600 Super telephoto W lens lens accessories,実用 良品 Nikon ニコン 600 超 望遠 レンズ セット ダブル レンズ セット 付属品 多数,20
248,96.0,,NMINTNikon MB21 Battery Grip Nikon F4 F4s JAPAN 111,401875587210.0,【N.MINT】Nikon MB-21 Battery Grip For Nikon F4 F4s From JAPAN #111,https://www.ebay.com/itm/N-MINT-Nikon-MB-21-Battery-Grip-Nikon-F4-F4s-JAPAN-111-/401875587210,69.9,USD,JP,15230.0,Film Cameras,StoreInventory,Used,Nikon F4,349.0,10.0,245,245,245,245,5,〓超美級〓 ニコン Nikon NIKKOR-P 600mm F5.6　♪,22800.0,26800.0,,https://page.auctions.yahoo.co.jp/jp/auction/s661699570,2084261693,〓Super beauty class Nikon Nikon NIKKOR-P 600mm F5.6 ♪,beauty class Nikon Nikon NIKKORP 600 mm F56,超 美 級 ニコン NIKKOR 600 mm F5 6,20
249,80.0,,Nikon F4 35 mm SLR Film Camera Body SN2550991,264472859783.0,Nikon F4 35mm SLR Film Camera Body Only SN2550991,https://www.ebay.com/itm/Nikon-F4-35mm-SLR-Film-Camera-Body-Only-SN2550991-/264472859783,157.8,USD,JP,15230.0,Film Cameras,StoreInventory,Used,Nikon F4,349.0,10.0,246,246,246,246,6,〓AF不良〓 ★ ニコン Nikon Ai AF-S ED 28-70mm F2.8D ★,22800.0,25800.0,,https://page.auctions.yahoo.co.jp/jp/auction/c758286870,2084261693,〓 AF failure 〓 ★ Nikon Nikon Ai AF-S ED 28-70mm F2.8D ★,AF failure Nikon Nikon Ai AFS ED 2870 mm,AF ニコン Nikon Ai AF ED 28 70 mm F2 8,20
250,59.0,,MINT Nikon F4 35 mm SLR Body DP20 Cap SN 2485453 Tokyo JAPAN C029,174040687673.0,[MINT] Nikon F4 35mm SLR Body w/ DP-20 + Cap S/N 2485453 From Tokyo JAPAN C029,https://www.ebay.com/itm/MINT-Nikon-F4-35mm-SLR-Body-w-DP-20-Cap-S-N-2485453-Tokyo-JAPAN-C029-/174040687673,164.99,USD,JP,15230.0,Film Cameras,StoreInventory,Used,Nikon F4,349.0,10.0,247,247,247,247,7,USED★ ニコン Nikomat ニコマート FT 一眼レフカメラ＋レンズ　実働,1000.0,,,https://page.auctions.yahoo.co.jp/jp/auction/r352426588,2084044778,USED ​​★ Nikon Nikomat Nikomat FT SLR camera + lens,Nikon Nikomat Nikomat FT SLR camera lens,USED ニコン Nikomat ニコマート FT 一 眼 レフ カメラ レンズ 実働,6
251,10.0,,MINT SN 258xxxx Nikon F4 Camera Body DP20 Finder Strap Japan,323930311054.0,[Top MINT S/N 258xxxx] Nikon F4 Camera Body w/ DP-20  Finder & Strap from Japan,https://www.ebay.com/itm/Top-MINT-S-N-258xxxx-Nikon-F4-Camera-Body-w-DP-20-Finder-Strap-Japan-/323930311054,299.9,USD,JP,15230.0,Film Cameras,StoreInventory,Used,Nikon F4,349.0,10.0,248,248,248,248,8,ほぼ未使用 Nikon D5 CF-Type・256GB CFカード付き,398000.0,404000.0,,https://page.auctions.yahoo.co.jp/jp/auction/s691221336,2084261636,Almost unused Nikon D5 CF-Type · 256GB with CF card,Nikon D5 CFType 256 GB CF card,未 使用 Nikon 5 CF Type 256 GB CF カード 付き,10
252,94.0,,Nikon F4 35 mm SLR Film Camera Body SN2297322,264474630515.0,Nikon F4 35mm SLR Film Camera Body Only SN2297322,https://www.ebay.com/itm/Nikon-F4-35mm-SLR-Film-Camera-Body-Only-SN2297322-/264474630515,34.8,USD,JP,15230.0,Film Cameras,StoreInventory,Used,Nikon F4,349.0,10.0,249,249,249,249,9,★超極上美品★Nikon D7000 AF-S DX 18-140mm F3.5-5.6G ED VR ★完動品★ #149,39800.0,40800.0,,https://page.auctions.yahoo.co.jp/jp/auction/e384793091,2084261636,"<!DOCTYPE html><html><head><link rel=""shortcut icon"" href=""//ssl.gstatic.com/docs/script/images/favicon.ico""><title>Error</title><style type=""text/css"">body {background-color: #fff; margin: 0; padding: 0;}.errorMessage {font-family: Arial,sans-serif; font-size: 12pt; font-weight: bold; line-height: 150%; padding-top: 25px;}</style></head><body style=""margin:20px""><div><img alt=""Google Apps Script"" src=""//ssl.gstatic.com/docs/script/images/logo.png""></div><div style=""text-align:center;font-family:monospace;margin:50px auto 0;max-width:600px"">無効な引数: source (line 3, file &quot;コード&quot;, project &quot;Translation&quot;)</div></body></html>",DOCTYPE relshortcut icon typetextcssbody backgroundcolor fff margin 0 padding 0errorMessage Arialsansserif fontsize fontweight lineheight 150 paddingtop 25pxstyleheadbody stylemargin20pxdivimg altGoogle Apps Script srcsslgstaticcomdocsscriptimageslogopngdivdiv auto 0maxwidth600px source line 3 file quotquot project quotTranslationquotdivbodyhtml,超 極上 美品 Nikon 7000 AF DX 18 140 mm F3 5 5 6 ED VR 完動 品 149,20
253,3.0,,MINT Box SN 246xxxx Nikon F4 35 mm SLR Film Camera Body JAPAN 0043,312736032329.0,【MINT in Box S/N 246xxxx】 Nikon F4 35mm SLR Film Camera Body From JAPAN #0043,https://www.ebay.com/itm/MINT-Box-S-N-246xxxx-Nikon-F4-35mm-SLR-Film-Camera-Body-JAPAN-0043-/312736032329,354.9,USD,JP,15230.0,Film Cameras,StoreInventory,Used,Nikon F4,349.0,10.0,250,250,250,250,10,AF-P DX NIKKOR 70-300mm f/4.5-6.3G ED VR 美品,10000.0,,,https://page.auctions.yahoo.co.jp/jp/auction/423467581,2084261684,AF-P DX NIKKOR 70-300mm f / 4.5-6.3G ED VR beautiful goods,AFP DX NIKKOR 70300 mm 4563 G ED VR goods,AF DX NIKKOR 70 300 mm f 4 5 6. 3 ED VR 美品,20
254,9.0,,Nikon F4E 35 mm SLR film camera wMB23 Japan 100,352810466247.0,【Excellent+++++】 Nikon F4E 35mm SLR film camera w/MB-23 from Japan #100,https://www.ebay.com/itm/Excellent-Nikon-F4E-35mm-SLR-film-camera-w-MB-23-Japan-100-/352810466247,149.99,USD,JP,15230.0,Film Cameras,StoreInventory,Used,Nikon F4,349.0,10.0,251,251,251,251,11,ジャンク 双眼鏡 NIKON ニコン SPRINT Ⅳ 8Ｘ21　6.3° 即決送料無料,1.0,2200.0,,https://page.auctions.yahoo.co.jp/jp/auction/k414789624,2084263451,Junk binoculars NIKON Nikon SPRINT Ⅳ 8X21 6.3 ° prompt decision free shipping,Junk NIKON Nikon SPRINT 8X21 63 decision shipping,ジャンク 双眼鏡 NIKON ニコン SPRINT Ⅳ 8 21 6. 3 ° 即決 送料 無料,8
255,87.0,,MINT SN 258xxxx Nikon F4 Camera Body DP20 Finder Strap Japan,323930311054.0,[Top MINT S/N 258xxxx] Nikon F4 Camera Body w/ DP-20  Finder & Strap from Japan,https://www.ebay.com/itm/Top-MINT-S-N-258xxxx-Nikon-F4-Camera-Body-w-DP-20-Finder-Strap-Japan-/323930311054,299.9,USD,JP,15230.0,Film Cameras,StoreInventory,Used,Nikon F4,349.0,10.0,252,252,252,252,12,Nikon×MILLET カメラバッグ リュック KULA 20 N ブラック,12300.0,,,https://page.auctions.yahoo.co.jp/jp/auction/h426212940,2084233233,Nikon × MILLET camera bag rucksack KULA 20 N black,Nikon MILLET camera bag rucksack KULA 20 N black,Nikon MILLE カメラ バッグ リュック KULA 20 ブラック,10
256,20.0,,Exc5 Nikon F4S SN 255xxxx 35 mm film SLR Camera body JAPAN A0142,352772332720.0,Exc+5 Nikon F4S  SN 255xxxx 35mm film SLR Camera body from JAPAN A0142,https://www.ebay.com/itm/Exc-5-Nikon-F4S-SN-255xxxx-35mm-film-SLR-Camera-body-JAPAN-A0142-/352772332720,69.99,USD,JP,15230.0,Film Cameras,StoreInventory,Used,Nikon F4,349.0,10.0,253,253,253,253,13,Nikon ニコン昔の高級一眼レフカメラFEボディ ＋ Tokina製28-70mmズームレンズ付,3650.0,,,https://page.auctions.yahoo.co.jp/jp/auction/b418083534,2084044778,Nikon old high-end SLR camera FE body + Tokina 28-70mm zoom lens included,Nikon highend SLR camera FE body Tokina 2870 mm zoom lens,Nikon ニコン 昔 高級 一 眼 レフ カメラ FE ボディ Tokina 製 28 70 mm ズームレンズ 付,10
257,21.0,,Nikon F4 Condition 1874,303212164355.0,Nikon F4 Very Good Condition #1874,https://www.ebay.com/itm/Nikon-F4-Very-Good-Condition-1874-/303212164355,140.4,USD,JP,15230.0,Film Cameras,StoreInventory,Used,Nikon F4,349.0,10.0,254,254,254,254,14,Nikon ニコン高級一眼レフカメラF.F2.F3専用 フラッシュカプラー AS-1　2個まとめて 希少品,500.0,,,https://page.auctions.yahoo.co.jp/jp/auction/q317821017,2084044778,Nikon Nikon luxury single-lens reflex camera F.F2.F3 dedicated flash coupler AS-1,Nikon Nikon luxury singlelens camera flash coupler AS1,Nikon ニコン 眼 レフ カメラ F. 2 3 専用 フラッシュ カプラー AS 1 2 個 品,6
258,29.0,,Exc Nikon F4 35 mm SLR Film Camera Body Japan 018,153643537463.0,【Exc+++++】 Nikon F4 35mm SLR Film Camera Body From Japan #018,https://www.ebay.com/itm/Exc-Nikon-F4-35mm-SLR-Film-Camera-Body-Japan-018-/153643537463,125.0,USD,JP,15230.0,Film Cameras,FixedPrice,Used,Nikon F4,349.0,10.0,255,255,255,255,15,ニコン Nikon 1 J2 オレンジ 本体のみ動作OK(レンズはジャンクの為おまけ)　デジタル一眼,7980.0,15000.0,,https://page.auctions.yahoo.co.jp/jp/auction/c761895980,2084305445,Nikon Nikon 1 J2 Orange Only works properly (Lens is a bonus for junk) Digital SLR,Nikon Nikon 1 J2 Orange Lens bonus junk Digital SLR,ニコン Nikon 1 2 オレンジ 本体 動作 OK レンズ ジャンク 為 おまけ デジタル 一 眼,18
259,66.0,,Nikon F4 35 mm SLR Film Camera Body wStrap Japan 749,123906428086.0,Excellent+++ Nikon F4 35mm SLR Film Camera Body Only w/Strap from Japan # 749,https://www.ebay.com/itm/Excellent-Nikon-F4-35mm-SLR-Film-Camera-Body-Only-w-Strap-Japan-749-/123906428086,129.99,USD,JP,15230.0,Film Cameras,StoreInventory,Used,Nikon F4,349.0,10.0,256,256,256,256,16,AF-S VR 70-300mm F4.5-5.6G IF-ED ニコン 純正 レンズ,14000.0,19800.0,,https://page.auctions.yahoo.co.jp/jp/auction/421474589,2084261684,AF-S VR 70-300mm F4.5-5.6G IF-ED Nikon Genuine Lens,AFS VR 70300 mm F4556 G IFED Nikon Lens,AF VR 70 300 mm F4 5 5 6 IF ED ニコン 純正 レンズ,18
260,77.0,,Nikon F4 SLR 35 mm Film Camera w Cap Body JAPAN MH133,283610288659.0,[Excellent+++++] Nikon F4 SLR 35mm Film Camera w/ Cap Body Only from JAPAN MH133,https://www.ebay.com/itm/Excellent-Nikon-F4-SLR-35mm-Film-Camera-w-Cap-Body-Only-JAPAN-MH133-/283610288659,139.99,USD,JP,15230.0,Film Cameras,FixedPrice,Used,Nikon F4,349.0,10.0,257,257,257,257,17,coolpix S8200 EN-EL12（純正充電器）　1610万画素　（光学14倍、1920x1080(フルHD)、笑顔自動シャッター　等）,2900.0,,,https://page.auctions.yahoo.co.jp/jp/auction/n372826276,2084261644,"coolpix S8200 EN-EL12 (genuine charger) 16.1 million pixels (14x optical, 1920x1080 (full HD), smile automatic shutter, etc.)",coolpix S8200 charger 161 million pixels 14x 1920x1080 HD smile shutter,coolpix 8200 EN EL 12 純正 充電器 1610 万 画素 光学 14 倍 1920 x1 080 フル HD 笑顔 自動 シャッター 等,20
261,63.0,,NEAR MINT SN255xxxx Nikon F4 35 mm SLR Film Camera body cap Japan,223683058120.0,【NEAR MINT SN255xxxx】 Nikon F4 35mm SLR Film Camera w/ body cap from Japan,https://www.ebay.com/itm/NEAR-MINT-SN255xxxx-Nikon-F4-35mm-SLR-Film-Camera-w-body-cap-Japan-/223683058120,199.8,USD,JP,15230.0,Film Cameras,StoreInventory,Used,Nikon F4,349.0,10.0,258,258,258,258,18,★☆光学83倍超望遠ズーム☆★ ニコン Nikon COOLPIX P900 ブラック（19Oc03Y-SRI）,1.0,46000.0,,https://page.auctions.yahoo.co.jp/jp/auction/p712111877,2084261644,★ ☆ Optical 83x super telephoto zoom ☆ ★ Nikon Nikon COOLPIX P900 Black (19Oc03Y-SRI),Optical telephoto Nikon Nikon COOLPIX P900 Black 19Oc03YSRI,光学 83 倍 超 望遠 ニコン Nikon COOLPIX 900 ブラック 19 Oc 03 SRI,6
262,25.0,,EXC Nikon F4 35 mm SLR Film Camera Body F4S F4E Japan 1553,153538227479.0,【EXC+++++】 Nikon F4 35mm SLR Film Camera Body Only F4S F4E from Japan 1553,https://www.ebay.com/itm/EXC-Nikon-F4-35mm-SLR-Film-Camera-Body-Only-F4S-F4E-Japan-1553-/153538227479,69.99,USD,JP,15230.0,Film Cameras,StoreInventory,Used,Nikon F4,349.0,10.0,259,259,259,259,19,【919-TG】 Nikon　ニコン　TELECONVERTER　TC-201　箱説明書付,2000.0,,,https://page.auctions.yahoo.co.jp/jp/auction/l550553279,2084261693,[919-TG] Nikon Nikon TELECONVERTER TC-201 with box instructions,919TG Nikon Nikon TELECONVERTER box instructions,919 TG Nikon ニコン TELE CONVERTER TC 201 箱 説明 書付,10
263,22.0,,Nikon F4 35 mm SLR Film Camera Body SN2550991,264472859783.0,Nikon F4 35mm SLR Film Camera Body Only SN2550991,https://www.ebay.com/itm/Nikon-F4-35mm-SLR-Film-Camera-Body-Only-SN2550991-/264472859783,157.8,USD,JP,15230.0,Film Cameras,StoreInventory,Used,Nikon F4,349.0,10.0,260,260,260,260,0,極美品 ニコン Nikon F5 50周年記念モデル ボディ 全世界3000台限定 元箱付 一眼レフフィルムカメラ,4200.0,,,https://page.auctions.yahoo.co.jp/jp/auction/r333970416,2084044785,Goku Nikon Nikon F5 50th Anniversary Model Body Limited to 3000 units worldwide SLR camera with original box,Goku Nikon Nikon F5 Anniversary Model Body 3000 units SLR camera box,極美 品 ニコン Nikon 5 50 周年 記念 モデル ボディ 全 世界 3000 台 限定 元箱 付 一 眼 レフ フィルム カメラ,6
264,3.0,,NIKON F4 35 mm SLR Film Camera Body SN 26xxxx Japan Exc,233298082107.0,NIKON F4 35mm SLR Film Camera Body Only S/N 26xxxx from Japan Exc+,https://www.ebay.com/itm/NIKON-F4-35mm-SLR-Film-Camera-Body-Only-S-N-26xxxx-Japan-Exc-/233298082107,178.4,USD,JP,15230.0,Film Cameras,StoreInventory,Used,Nikon F4,349.0,10.0,261,261,261,261,1,ニコンNikon COOLPIX W300 人気のカモフラージュ,25000.0,,,https://page.auctions.yahoo.co.jp/jp/auction/v663690770,2084261644,Nikon Nikon COOLPIX W300 Popular camouflage,Nikon Nikon COOLPIX W300 Popular camouflage,ニコン Nikon COOLPIX 300 人気 カモフラージュ,6
265,28.0,,Mint Nikon F4 CF41B SLR 35 mm Film Camera Body JAPAN 238,143393328158.0,[Near Mint] Nikon F4 w/ CF41B SLR 35mm Film Camera Body from JAPAN #238,https://www.ebay.com/itm/Near-Mint-Nikon-F4-w-CF41B-SLR-35mm-Film-Camera-Body-JAPAN-238-/143393328158,149.9,USD,JP,15230.0,Film Cameras,StoreInventory,Used,Nikon F4,349.0,10.0,262,262,262,262,2,【新品】 Nikon　ニコン D850 デジタル一眼レフカメラ 本体,280000.0,,,https://page.auctions.yahoo.co.jp/jp/auction/v654736788,2084261636,[New] Nikon Nikon D850 digital SLR camera body,New Nikon Nikon D850 SLR camera body,新品 Nikon ニコン 850 デジタル 一 眼 レフ カメラ 本体,6
266,78.0,,Nikon F4S 35 mm SLR Film Camera Japan,293167703664.0,Excellent!! Nikon F4S 35mm SLR Film Camera from Japan,https://www.ebay.com/itm/Excellent-Nikon-F4S-35mm-SLR-Film-Camera-Japan-/293167703664,159.0,USD,JP,15230.0,Film Cameras,StoreInventory,Used,Nikon F4,349.0,10.0,263,263,263,263,3,Nikon ニコン 純正 NIKKOR-S 35mm 単焦点ワイドレンズ 1:2.8 希少な完動品,2530.0,,,https://page.auctions.yahoo.co.jp/jp/auction/b419013459,2084261693,Nikon Nikon Genuine NIKKOR-S 35mm single focus wide lens 1: 2.8,Nikon Nikon Genuine NIKKORS 35 mm focus lens 1 28,Nikon ニコン 純正 NIKKOR 35 mm 単 焦点 ワイド レンズ 1 2. 8 完動 品,18
267,91.0,,Sigma AF Macro 90 mm Lens Nikon Excellent Japan,202758584499.0,Sigma AF Macro 90mm f/2.8 Lens For Nikon Excellent from Japan,https://www.ebay.com/itm/Sigma-AF-Macro-90mm-f-2-8-Lens-Nikon-Excellent-Japan-/202758584499,130.0,USD,JP,3323.0,Lenses,StoreInventory,Used,Sigma AF Macro,335.0,20.0,264,264,264,264,4,NIKON D5300 デジタル一眼レフカメラ ボディ ノーチェック、動作不明のジャンク扱いです。,1.0,,,https://page.auctions.yahoo.co.jp/jp/auction/m363353590,2084261636,"NIKON D5300 DSLR Camera Body No check, junk treatment is unknown.",NIKON DSLR Camera Body check junk treatment,NIKON 5300 デジタル 一 眼 レフ カメラ ボディ ノー チェック 動作 不明 ジャンク 扱い,6
268,39.0,,Tamron AF 24135 mm F3556 Macro Lens Nikon Anniversary Model,233349973066.0,Tamron AF 24-135 mm F/3.5-5.6 Macro Lens For Nikon 50th Anniversary Model,https://www.ebay.com/itm/Tamron-AF-24-135-mm-F-3-5-5-6-Macro-Lens-Nikon-50th-Anniversary-Model-/233349973066,76.0,USD,JP,3323.0,Lenses,StoreInventory,Used,AF Aspherical IF,330.0,20.0,265,265,265,265,5,★貴重・極上美品★ NIKON ニコン F5 ボディ 付属品付 ★新品級の綺麗な外観! ファインダー内カビ・クモリなし! 完動品! B891,1.0,69800.0,,https://page.auctions.yahoo.co.jp/jp/auction/b410824090,2084044785,★ Precious and finest beauty products ★ NIKON Nikon F5 body with accessories ★ Beautiful appearance of new grade! No mold or spider in the finder! Complete product! B891,beauty products NIKON Nikon F5 body accessories appearance grade mold spider finder product B891,極上 美品 NIKON ニコン 5 ボディ 付属品 付 新品 級 外観 ファインダー 内 カビ クモリ なし 完動 品 891,35
269,51.0,,Near MintNikon NIKKOR Ai 24 mm f28 MF Lens Japan,183909097820.0,【Near Mint】Nikon NIKKOR Ai 24mm f/2.8 MF Lens From Japan,https://www.ebay.com/itm/Near-Mint-Nikon-NIKKOR-Ai-24mm-f-2-8-MF-Lens-Japan-/183909097820,139.99,USD,JP,3323.0,Lenses,FixedPrice,Used,Nikon Nikkor 24mm F2.8,324.0,20.0,266,266,266,266,6,NIKON COOLPIX Ｓ700 現状ジャンク（充電器がない為）,1000.0,10000.0,,https://page.auctions.yahoo.co.jp/jp/auction/t676405887,2084261644,NIKON COOLPIX S700 current junk (because there is no charger),NIKON COOLPIX junk charger,NIKON COOLPIX 700 現状 ジャンク 充電器 為,6
270,72.0,,Mint Nikon Ai Micro Nikkor 55 mm Manual MF Macro Lens w Cap JAPAN MH129,283612943269.0,[Mint] Nikon Ai Micro Nikkor 55mm f/3.5 Manual MF Macro Lens w/ Cap JAPAN MH129,https://www.ebay.com/itm/Mint-Nikon-Ai-Micro-Nikkor-55mm-f-3-5-Manual-MF-Macro-Lens-w-Cap-JAPAN-MH129-/283612943269,79.99,USD,JP,3323.0,Lenses,FixedPrice,Used,Nikon Ai Micro Nikkor,305.0,20.0,267,267,267,267,7,▼Nikon 大判レンズ ニコン 箱付き NIKKOR-W 135mm 1:5.6 プレートTOYOVIEW 現状品 105M310,1100.0,,,https://page.auctions.yahoo.co.jp/jp/auction/n373972948,23692,▼ Nikon large format lens Nikon with box NIKKOR-W 135mm 1: 5.6 plate TOYOVIEW current product 105M310,format lens Nikon box NIKKORW 135 mm 1 56 plate product 105M310,Nikon 大判 レンズ ニコン 箱 付き NIKKOR 135 mm 1 5. 6 プレート TOYOVIEW 現状 品 105 M3 10,20
271,31.0,,Mint Nikon Ai Micro Nikkor 55 mm Manual MF Macro Lens w Cap JAPAN MH129,283612943269.0,[Mint] Nikon Ai Micro Nikkor 55mm f/3.5 Manual MF Macro Lens w/ Cap JAPAN MH129,https://www.ebay.com/itm/Mint-Nikon-Ai-Micro-Nikkor-55mm-f-3-5-Manual-MF-Macro-Lens-w-Cap-JAPAN-MH129-/283612943269,79.99,USD,JP,3323.0,Lenses,FixedPrice,Used,Nikon Ai Micro Nikkor,305.0,20.0,268,268,268,268,8,★希少！超美品★ニコン Nikon NIKKOR-N.C Auto 24mm F2.8 フード・ポーチ付き/#1741/0830,1.0,14800.0,,https://page.auctions.yahoo.co.jp/jp/auction/m354746392,2084261693,"<!DOCTYPE html><html><head><link rel=""shortcut icon"" href=""//ssl.gstatic.com/docs/script/images/favicon.ico""><title>Error</title><style type=""text/css"">body {background-color: #fff; margin: 0; padding: 0;}.errorMessage {font-family: Arial,sans-serif; font-size: 12pt; font-weight: bold; line-height: 150%; padding-top: 25px;}</style></head><body style=""margin:20px""><div><img alt=""Google Apps Script"" src=""//ssl.gstatic.com/docs/script/images/logo.png""></div><div style=""text-align:center;font-family:monospace;margin:50px auto 0;max-width:600px"">無効な引数: source (line 3, file &quot;コード&quot;, project &quot;Translation&quot;)</div></body></html>",DOCTYPE relshortcut icon typetextcssbody backgroundcolor fff margin 0 padding 0errorMessage Arialsansserif fontsize fontweight lineheight 150 paddingtop 25pxstyleheadbody stylemargin20pxdivimg altGoogle Apps Script srcsslgstaticcomdocsscriptimageslogopngdivdiv auto 0maxwidth600px source line 3 file quotquot project quotTranslationquotdivbodyhtml,超 美品 ニコン Nikon NIKKOR N Auto 24 mm F2 . 8 フード ポーチ 付き 1741 0830,20
272,32.0,,Nikon D7000 1855 mm f3556 g VR DX SLR Nikkor Battery x2 Japan 493433,383172148939.0,Nikon D7000 18-55mm f3.5-5.6g VR DX SLR Nikkor Battery x2 from Japan #493433,https://www.ebay.com/itm/Nikon-D7000-18-55mm-f3-5-5-6g-VR-DX-SLR-Nikkor-Battery-x2-Japan-493433-/383172148939,200.0,USD,JP,31388.0,Digital Cameras,StoreInventory,Used,Nikon D7000,302.0,6.0,269,269,269,269,9,★超美品★Nikon ニコン F2 フォトミックA + AI改 NEW NIKKOR 50mm F1.4 フィルムカメラ 標準焦点レンズセット/#1735/0823,2600.0,29800.0,,https://page.auctions.yahoo.co.jp/jp/auction/t669578750,2084044778,"<!DOCTYPE html><html><head><link rel=""shortcut icon"" href=""//ssl.gstatic.com/docs/script/images/favicon.ico""><title>Error</title><style type=""text/css"">body {background-color: #fff; margin: 0; padding: 0;}.errorMessage {font-family: Arial,sans-serif; font-size: 12pt; font-weight: bold; line-height: 150%; padding-top: 25px;}</style></head><body style=""margin:20px""><div><img alt=""Google Apps Script"" src=""//ssl.gstatic.com/docs/script/images/logo.png""></div><div style=""text-align:center;font-family:monospace;margin:50px auto 0;max-width:600px"">無効な引数: source (line 3, file &quot;コード&quot;, project &quot;Translation&quot;)</div></body></html>",DOCTYPE relshortcut icon typetextcssbody backgroundcolor fff margin 0 padding 0errorMessage Arialsansserif fontsize fontweight lineheight 150 paddingtop 25pxstyleheadbody stylemargin20pxdivimg altGoogle Apps Script srcsslgstaticcomdocsscriptimageslogopngdivdiv auto 0maxwidth600px source line 3 file quotquot project quotTranslationquotdivbodyhtml,超 美品 Nikon ニコン 2 フォトミック A AI 改 NEW NIKKOR 50 mm . 4 フィルム カメラ 標準 焦点 レンズ セット 1735 0823,20
273,72.0,,Excellent Nikon FM2 35 mm SLR Film Camera Japan 109172,283588163109.0,Excellent+ Nikon FM2 35mm SLR Film Camera From Japan!! 109172,https://www.ebay.com/itm/Excellent-Nikon-FM2-35mm-SLR-Film-Camera-Japan-109172-/283588163109,239.99,USD,JP,15230.0,Film Cameras,StoreInventory,Used,Nikon FM2,300.0,10.0,270,270,270,270,10,124 Nikon COOLPIX8700,1000.0,,,https://page.auctions.yahoo.co.jp/jp/auction/u305727648,2084261636,124 Nikon COOLPIX8700,124 Nikon COOLPIX8700,124 Nikon COO LP IX 8700,8
274,2.0,,EXC Nikon New FM2 Black Ais 50 mm Lens Japan 1771,123911777597.0,[EXC++++] Nikon New FM2 Black with Ai-s 50mm f1.4 Lens From Japan #177-1,https://www.ebay.com/itm/EXC-Nikon-New-FM2-Black-Ai-s-50mm-f1-4-Lens-Japan-177-1-/123911777597,258.0,USD,JP,15230.0,Film Cameras,StoreInventory,Used,Nikon FM2,300.0,10.0,271,271,271,271,11,Nikon AF-S DX NIKKOR 18- 55mm f3.5-5.6G VR Ⅱ (2型) 動作も写りもOK 概ねクリア&新品時のマット感ありキレイです。前後キャップ付き,1.0,,,https://page.auctions.yahoo.co.jp/jp/auction/t677700354,2084261684,Nikon AF-S DX NIKKOR 18-55mm f3.5-5.6G VR II (Type 2) Operation and reflection are almost clear,Nikon AFS DX NIKKOR 1855 mm f3556 G VR II Type 2 Operation reflection,Nikon AF DX NIKKOR 18- 55mm f 3 5 5 6 VR Ⅱ 2 型 動作 写り OK 概ね クリア 新品 時 マット 感 前後 キャップ 付き,20
275,23.0,,Nikon New FM2 Silver 35 mm nikkor 35 70 mm 33 45 japan 26,383167060066.0,Excellent+++++ Nikon New FM2 Silver 35mm nikkor 35 70mm 3.3 4.5 from japan #26,https://www.ebay.com/itm/Excellent-Nikon-New-FM2-Silver-35mm-nikkor-35-70mm-3-3-4-5-japan-26-/383167060066,258.0,USD,JP,15230.0,Film Cameras,FixedPrice,Used,Nikon FM2,300.0,10.0,272,272,272,272,12,112 Nikon D800 MH-25,43500.0,,,https://page.auctions.yahoo.co.jp/jp/auction/h425226243,2084261636,112 Nikon D800 MH-25,112 Nikon D800 MH25,112 Nikon 800 MH 25,8
