,Title,CurrentPrice,BidOrBuy,shopName,ItemUrl,CategoryId,en_Title,en_short_Title,short_Title
14,〓実用良品〓 Nikon ニコン D600 超望遠 Wレンズセット ★ ダブルレンズセット ♪ 付属品多数！！！,63800.00,67800.00,,https://page.auctions.yahoo.co.jp/jp/auction/w336935680,2084261636,〓 Practical Good 〓 Nikon Nikon D600 Super telephoto W lens set ★ Double lens set ♪ Many accessories! ! !,Nikon Nikon D600 Super telephoto W lens set lens accessories,実用 良品 Nikon ニコン 600 超 望遠 レンズ セット ダブル レンズ セット 付属品 多数
15,【超美品 4286ショット・付属品完備】Nikon ニコン D610,47500.00,,,https://page.auctions.yahoo.co.jp/jp/auction/l552862335,2084261636,[Super beautiful goods 4286 shots and accessories complete] Nikon Nikon D610,goods 4286 shots accessories Nikon Nikon D610,超 美品 4286 ショット 付属品 完備 Nikon ニコン 610
16,特価品 送料無料 1年保証 ユアサバッテリー FTX14-BS FTZ14-BS互換 YTX14-BS 初期充電済 ZRX1200R ZRX1100 ZX-12R シャドウ400 CB1300SF等,6655.00,6655.00,,https://page.auctions.yahoo.co.jp/jp/auction/c763928692,2084005528,Specials Free shipping 1 year warranty Yuasa Battery FTX14-BS FTZ14-BS compatible YTX14-BS Initial charged ZRX1200R ZRX1100 ZX-12R Shadow 400 CB1300SF etc.,Specials shipping 1 year warranty Yuasa Battery FTX14BS FTZ14BS YTX14BS Initial ZRX1200R ZX12R Shadow 400 CB1300SF,特価 品 送料 無料 1 年 保証 ユアサ バッテリー FT X1 4 BS FTZ 14 BS 互換 YTX 14 BS 初期 充電 済 ZRX 1200 ZRX 1100 ZX 12 シャドウ 400 CB 1300 SF 等
17,Canon ZOOM LENS EF 55-200㎜ 1:4.5-5.6 Ⅱ USM MINOLTA MD TELE ROKKOR 200㎜ 1:4 カメラ レンズ 含 まとめ セット,3000.00,,,https://page.auctions.yahoo.co.jp/jp/auction/t671581888,2084261683,Canon ZOOM LENS EF 55-200㎜ 1: 4.5-5.6 II USM MINOLTA MD TELE ROKKOR 200㎜ 1: 4 Camera Lens Including set,Canon ZOOM LENS EF 55200 1 4556 II USM MINOLTA MD TELE ROKKOR 200 1 4 Camera Lens,Canon ZOOM LENS EF 55- 200㎜ 1 4 5 5 6 Ⅱ USM MINOLTA MD TELE 200 ㎜ 1 4 カメラ レンズ まとめ セット
18,◇ Nikon ニコン AI-S NIKKOR 28mm F2.8 Fマウント MFレンズ 単焦点レンズ 交換レンズ,11000.00,,,https://page.auctions.yahoo.co.jp/jp/auction/d391775913,2084261693,◇ Nikon Nikon AI-S NIKKOR 28mm F2.8 F mount MF lens Single focus lens Interchangeable lens,Nikon Nikon AIS NIKKOR 28 mm F28 F mount MF lens focus lens lens,Nikon ニコン AI NIKKOR 28 mm F 2 8 マウント MF レンズ 単 焦点 レンズ 交換 レンズ
19,〓極美級〓 ★ トキナー TOKINA AT-X 80-400mm F4.5-5.6D ニコン用 ★,21800.00,25800.00,,https://page.auctions.yahoo.co.jp/jp/auction/g364600385,2084261684,〓Extreme Beauty Class ★ Tokina TOKINA AT-X 80-400mm F4.5-5.6D For Nikon ★,Extreme Beauty Class Tokina TOKINA ATX 80400 mm F4556D Nikon,〓 極美 級 〓 トキナー TOKINA AT 80 400 mm 5 5. 6 ニコン 用
0,純正新品！未使用！ニコン Li-ionリチャージャブルバッテリーEN-EL20 (EN-EL20 ),1980.00,1980.00,,https://page.auctions.yahoo.co.jp/jp/auction/m344189636,2084261661,Genuine new article! unused! Nikon Li-ion Rechargeable Battery EN-EL20 (EN-EL20),article Nikon Liion Rechargeable Battery ENEL20 ENEL20,純正 新品 未 ニコン Li リチャージャブル バッテリー EN EL 20 EN EL 20
1,特価品 送料無料 1年保証 ユアサバッテリー YT12A-BS FT12A-BS 互換 初期充電済 スカイウェイブ GSX1300R ハヤブサ TL1000R等,7139.00,7139.00,,https://page.auctions.yahoo.co.jp/jp/auction/g376816516,2084005528,Specials Free shipping 1 year warranty Yuasa Battery YT12A-BS FT12A-BS Compatible Initially charged Skywave GSX1300R Hayabusa TL1000R etc.,Specials shipping 1 year warranty Yuasa Battery YT12ABS FT12ABS Compatible Skywave GSX1300R Hayabusa TL1000R,特価 品 送料 無料 1 年 保証 ユアサ バッテリー YT 12 BS FT 12 BS 互換 初期 充電 済 スカイ GS X1 300 ハヤブサ TL 1000 等
2,〓極美級〓 ★ ニコン Nikon D610 超望遠 Wレンズセット ★ ダブルレンズセット ♪,75800.00,79800.00,,https://page.auctions.yahoo.co.jp/jp/auction/w334326330,2084261636,Nikon Nikon D610 Super telephoto W lens set ★ Double lens set ♪,Nikon Nikon D610 Super telephoto W lens set lens,極美 級 ニコン D 610 超 望遠 レンズ セット ダブル レンズ セット
3,〓至高の名機〓 ★ ニコン Nikon F3 + Ai-s 28mm F2.8 ＆ モータードライブ付　★,23800.00,28800.00,,https://page.auctions.yahoo.co.jp/jp/auction/o328170736,2084044778,〓 Supreme famous machine ★ Nikon Nikon F3 Ai-s 28mm F2.8 & with motor drive ★,machine Nikon Nikon F3 Ais 28 mm F28 motor drive,至高 名機 ニコン Nikon 3 28 mm F2 8 モータードライブ 付
4,● Canon キヤノン NEW FD 24mm F2.8 FDマウント MF 交換レンズ 広角 単焦点レンズ,4510.00,,,https://page.auctions.yahoo.co.jp/jp/auction/u304221106,2084261692,● Canon Canon NEW FD 24mm F2.8 FD Mount MF Interchangeable Lens Wide Angle Single Focal Length Lens,Canon Canon FD 24 mm F28 FD Mount MF Interchangeable Lens Wide Angle Single Focal Length Lens,Canon キヤノン NEW FD 24 mm F 2 . 8 FD マウント MF 交換 レンズ 広角 単 焦点 レンズ
5,Tokina FISHEYE 10-17 F3.5-4.5 DX AT-X カメラレンズ 魚眼レンズ キャノンマウント トキナー,20000.00,,,https://page.auctions.yahoo.co.jp/jp/auction/p711343688,2084261684,Tokina FISHEYE 10-17 F3.5-4.5 DX AT-X Camera Lens Fisheye Canon Mount Tokina,Tokina FISHEYE 1017 F3545 DX ATX Camera Lens Fisheye Canon Mount Tokina,Tokina FISH EYE 10 17 F 3 5 4 5 DX AT カメラ レンズ 魚眼 レンズ キャノン マウント トキナー
6,Nikon Nikomat FTN フィルムカメラ ボディ NIKKOR-H Auto 1:２ 50㎜ レンズ ニコン,2800.00,,,https://page.auctions.yahoo.co.jp/jp/auction/d391677984,2084044778,Nikon Nikomat FTN Film Camera Body NIKKOR-H Auto 1: 2 50mm Lens Nikon,Nikon Nikomat FTN Film Camera Body NIKKORH Auto 1 2 50 mm Lens Nikon,Nikon Nikomat FTN フィルム カメラ ボディ NIKKOR Auto 1 ２ 50 ㎜ レンズ ニコン
7,フォルツァZ　MF08　マニュアルモード　スマートキー　現状,58000.00,64000.00,,https://page.auctions.yahoo.co.jp/jp/auction/s689804749,2084008692,Forza Z MF08 Manual Mode Smart Key Current status,Forza Z MF08 Manual Mode Smart status,フォルツァ MF 08 マニュアル モード キー 現状
8,◇ Nikon ニコン F3 アイレベル 133万台 + AI-S NIKKOR 50mm F1.4 MF一眼レフカメラ フィルムカメラ 標準単焦点レンズ 大口径 セット,19800.00,,,https://page.auctions.yahoo.co.jp/jp/auction/r352481086,2084044778,◇ Nikon Nikon F3 Eye level 1.33 million AI-S NIKKOR 50mm F1.4 MF SLR camera Film camera Standard single focus lens Large aperture set,Nikon Nikon F3 Eye level 133 million AIS NIKKOR 50 mm F14 MF SLR camera Film camera focus aperture set,Nikon ニコン 3 アイ レベル 133 万 台 AI 50 mm 1 . 4 MF 一 眼 レフ カメラ フィルム カメラ 標準 単 焦点 レンズ 大 口径 セット
9,■Nikon ニコン Nikkor AF 35-70mm F3.3-4.5+28-85mm F3.5-4.5■,3001.00,,,https://page.auctions.yahoo.co.jp/jp/auction/h425803906,2084261684,Nikon Nikkor AF 35-70mm F3.3-4.5 28-85mm F3.5-4.5,Nikon Nikkor AF 3570 mm F3345 2885 mm F3545,Nikon ニコン Nikkor AF 35 70 mm F3 . 3 4. 5 28 85 mm F3 5 4 5
10,〓外観綺麗 三脚座付〓ニコン Nikon ED AF NIKKOR 300mm F4,23980.00,44980.00,,https://page.auctions.yahoo.co.jp/jp/auction/r353861002,2084261684,〓Appearance beautiful tripod with seat Nikon ED AF NIKKOR 300mm F4,Appearance tripod seat Nikon ED AF NIKKOR 300 mm F4,外観 三脚 座付 ニコン ED AF NIKKOR 300 mm 4
11,★ Canon キヤノン A-1 + CANON LENS FD 50mm F1.4 S.S.C. + CANON ZOOM LENS NEW FD 70-210mm F4 標準単焦点 望遠ズーム 大口径,8110.00,,,https://page.auctions.yahoo.co.jp/jp/auction/s689977698,2084044777,★ Canon Canon A-1 CANON LENS FD 50mm F1.4 S.S.C.CANON ZOOM LENS NEW FD 70-210mm F4 Standard single focus telephoto zoom Large aperture,Canon Canon A1 CANON LENS FD 50 mm F14 SSCCANON ZOOM LENS FD 70210 mm F4 focus telephoto aperture,Canon キヤノン 1 + CANON LENS FD 50 mm 1 4 S S C. CANON ZOOM LENS NEW FD 70 210 mm 4 標準 単 焦点 望遠 ズーム 大 口径
12,Nikon Nikomat EL ニコマート フィルムカメラ ブラックボディ NIKKOR F1.4 50mm 他 レンズ セット ニコン,9000.00,,,https://page.auctions.yahoo.co.jp/jp/auction/424461843,2084044778,Nikon Nikomat EL Nikon Mart Film Camera Black Body NIKKOR F1.4 50mm Other Lens Set Nikon,Nikon Nikomat EL Nikon Mart Film Camera Black Body NIKKOR F14 50 mm Lens Nikon,Nikon Nikomat EL ニコマート フィルム カメラ ブラック ボディ NIKKOR F1 4 50 mm 他 レンズ セット ニコン
13,★ Nikon ニコン AF NIKKOR 18-35mm F3.5-4.5D ED 広角ズームレンズ Fマウント AFレンズ AF一眼レフ用,19800.00,,,https://page.auctions.yahoo.co.jp/jp/auction/u305305543,2084261684,★ Nikon Nikon AF NIKKOR 18-35mm F3.5-4.5D ED Wide-angle zoom lens F mount AF lens For AF SLR,Nikon Nikon AF NIKKOR 1835 mm F3545D ED Wideangle lens F mount AF lens AF SLR,Nikon ニコン AF NIKKOR 18 35 mm F3 5 4 5 ED 広角 ズームレンズ マウント AF レンズ AF 一 眼 レフ 用
14,◆当日発送 フロアマット MRワゴン MF22S/MF33S H18.01-【全国一律送料無料】【色 選択式】トランクマット有,5940.00,5940.00,,https://page.auctions.yahoo.co.jp/jp/auction/t678120310,2084203798,◆ Same-day shipment Floor mat MR Wagon MF22S / MF33S H18.01- [Free shipping nationwide] [Color selection type] Trunk mat available,Sameday shipment Floor mat MR Wagon MF22S MF33S H1801 shipping Color selection type Trunk mat,当日 発送 フロア マット MR ワゴン MF 22 S MF 33 18 01 全国 一律 送料 無料 色 選択 式 トランク マット 有
15,美品 TOSHIBA MF-10V キッチンシーラー キッチン用具 東芝,920.00,,,https://page.auctions.yahoo.co.jp/jp/auction/t674850342,2084006000,Beautiful goods TOSHIBA MF-10V kitchen sealer kitchen tools TOSHIBA,goods TOSHIBA MF10V kitchen sealer kitchen tools TOSHIBA,美品 TO SHI BA MF 10 キッチン シーラー キッチン 用 具 東芝
16,セール 12ヶ月保証付 フュージョン ドライブフェイスプーリー,3531.00,3542.00,,https://page.auctions.yahoo.co.jp/jp/auction/425364587,2084244701,Sale 12 Month Warranty Fusion Drive Face Pulley,Sale 12 Month Warranty Fusion Drive Face Pulley,セール 12 ヶ月 保証 付 フュージョン ドライブ フェイス プーリー
17,■ Nikon ニコン F2 ブラック フォトミックA 一眼レフ カメラ 35mm フィルムカメラ,16200.00,,,https://page.auctions.yahoo.co.jp/jp/auction/d391713881,2084044778,■ Nikon Nikon F2 Black Photomic A SLR Camera 35mm Film Camera,Nikon Nikon F2 Black Photomic SLR Camera 35 mm Film Camera,Nikon ニコン F 2 ブラック フォトミック 一 眼 レフ カメラ 35 mm フィルム カメラ
18,CANON FTb QL FT CANON LENS FD 50mm 1:1.4 KYOCERA Campus 70 フィルムカメラ 2点セット,5000.00,,,https://page.auctions.yahoo.co.jp/jp/auction/w325917798,2084044777,CANON FTb QL FT CANON LENS FD 50mm 1: 1.4 KYOCERA Campus 70 Film Camera 2 piece set,CANON FTb QL FT CANON LENS FD 50 mm 1 14 KYOCERA Campus 70 Film Camera 2 piece,CANON FTb QL FT LENS FD 50 mm 1 1. 4 KYOCERA Campus 70 フィルム カメラ 2 点 セット
19,セール フュージョン MF02 メッキサイドバイザー ピボットカバー,1650.00,1760.00,,https://page.auctions.yahoo.co.jp/jp/auction/g377296551,2084282351,Sale Fusion MF02 Plating side visor Pivot cover,Sale Fusion MF02 Plating side visor Pivot cover,セール フュージョン MF 02 サイド バイザー ピボット カバー
0,◇ MINOLTA ミノルタ MD ROKKOR 85mm F1.7 SRマウント MF一眼レフ用 中望遠単焦点レンズ 大口径,18700.00,,,https://page.auctions.yahoo.co.jp/jp/auction/e384337435,2084261695,◇ MINOLTA Minolta MD ROKKOR 85mm F1.7 SR mount MF single lens reflex medium telephoto single focus lens large aperture,MINOLTA Minolta MD ROKKOR 85 mm F17 SR mount MF lens reflex telephoto focus lens aperture,MINOLTA ミノルタ MD ROKKOR 85 mm F 1 . 7 SR マウント MF 一 眼 レフ 用 中 望遠 単 焦点 レンズ 大 口径
1,◇ Nikon ニコン AI-S Micro-NIKKOR 105mm F2.8 Fマウント MF一眼レフ用 中望遠単焦点レンズ,11000.00,,,https://page.auctions.yahoo.co.jp/jp/auction/b419469787,2084261693,◇ Nikon Nikon AI-S Micro-NIKKOR 105mm F2.8 F mount MF SLR for medium telephoto single focus lens,Nikon Nikon AIS MicroNIKKOR 105 mm F28 F mount MF SLR telephoto focus lens,Nikon ニコン AI Micro 105 mm 2 8 F マウント MF 一 眼 レフ 用 中 望遠 単 焦点 レンズ
2,◇ Nikon ニコン FE + AI-S NIKKOR 50mm F1.8 フィルムカメラ 単焦点レンズ セット MF一眼レフ,6325.00,,,https://page.auctions.yahoo.co.jp/jp/auction/n373320187,2084044778,◇ Nikon Nikon FE AI-S NIKKOR 50mm F1.8 film camera single focus lens set MF SLR,Nikon Nikon FE AIS NIKKOR 50 mm F18 film camera focus lens MF SLR,Nikon ニコン FE AI NIKKOR 50 mm 1 8 フィルム カメラ 単 焦点 レンズ セット MF 一 眼 レフ
3,CANON EF-S LENS 55-250mm F4-5.6 カメラレンズ キャノン,10697.00,,,https://page.auctions.yahoo.co.jp/jp/auction/q316639089,2084261683,CANON EF-S LENS 55-250mm F4-5.6 Camera Lens Canon,CANON EFS LENS 55250 mm F456 Camera Lens Canon,CANON EF LENS 55 250 mm F4 5. 6 カメラ レンズ キャノン
4,Nikon EL-NIKKOR 80㎜ 1:5.6 ニコン PENTAX-M 1:3.5 135㎜ ペンタックス カメラ レンズ 含む まとめ セット,5601.00,,,https://page.auctions.yahoo.co.jp/jp/auction/422449348,2084261693,Nikon EL-NIKKOR 80㎜ 1: 5.6 Nikon PENTAX-M 1: 3.5 135㎜ Pentax Camera Lens Including Set,Nikon ELNIKKOR 80 1 56 Nikon PENTAXM 1 35 135 Pentax Camera Lens Including,Nikon EL 80 ㎜ 1 5. 6 ニコン PENTAX M 1 3. 5 135 ㎜ ペンタックス カメラ レンズ まとめ セット
5,特価品 送料無料 1年保証 ユアサバッテリー YTX7L-BS 初期充電済み バリオス2 グラストラッカー Dトラッカー ジャイロキャノピー等,4554.00,4554.00,,https://page.auctions.yahoo.co.jp/jp/auction/b419802885,2084005528,Specials Free shipping 1 year warranty Yuasa Battery YTX7L-BS Initially charged Barrios 2 Glass Tracker D Tracker Gyro Canopy etc.,Specials shipping 1 year warranty Yuasa Battery YTX7LBS Barrios 2 Glass Tracker D Tracker Gyro Canopy etc,特価 品 送料 無料 1 年 保証 ユアサ バッテリー YTX 7 BS 初期 充電 済み バリ オス 2 グラス トラッカー トラッカー ジャイロ キャノピー 等
6,■ＡＣデルコ同工場品■送料 本州/四国一律■M24MF■HEXA M24 ディープサイクル　バスボート　キャンピングカー　サブバッテリ　ボイジャー,9130.00,9130.00,,https://page.auctions.yahoo.co.jp/jp/auction/q319013975,2084228242,■ AC Delco factory product ■ Shipping Honshu / Shikoku uniform ■ M24MF ■ HEXA M24 Deep cycle bus boat camper sub battery voyager,AC Delco factory product Shipping Honshu Shikoku uniform M24MF HEXA M24 cycle bus boat camper sub battery voyager,ＡＣ デルコ 同 工場 品 送料 本州 四国 一律 M2 4 MF HEXA 4 ディープ サイクル バス ボート キャンピング カー サブ バッテリ ボイジャー
7,Nikon COOLPIX L16 コンパクトデジタルカメラ ニコン,1201.00,,,https://page.auctions.yahoo.co.jp/jp/auction/q317986713,2084261644,Nikon COOLPIX L16 Compact Digital Camera Nikon,Nikon COOLPIX L16 Compact Digital Camera Nikon,Nikon COOLPIX 16 コンパクトデジタルカメラ ニコン
8,Apple MacBook Pro Retina 13インチ Early 2015 MF839J/A Core i5-5257U 2.7GHz/8G/SSD128GB/Yosemite【栃木出荷】,60500.00,,,https://page.auctions.yahoo.co.jp/jp/auction/b419577786,2084212699,Apple MacBook Pro Retina 13 inch Early 2015 MF839J / A Core i5-5257U 2.7GHz / 8G / SSD128GB / Yosemite [Tochigi Shipping],Apple MacBook Pro Retina 13 inch 2015 Core i55257U 27GHz 8 G SSD128 GB Yosemite Tochigi Shipping,Apple Mac Book Pro Retina 13 インチ Early 2015 MF 839 J U 2 7 GHz 8 SSD 128 GB Yosemite 栃木 出荷
9,◇ CANON キヤノン EOS55 + ZOOM LENS EF 35-135mm F4-5.6 + ZOOM LENS EF 75-300mm F4-5.6 Ⅱ AF 一眼レフ レンズ 2本 セット,3782.00,,,https://page.auctions.yahoo.co.jp/jp/auction/m362172052,2084044784,◇ CANON Canon EOS55 ZOOM LENS EF 35-135mm F4-5.6 ZOOM LENS EF 75-300mm F4-5.6 II AF single lens reflex lens two set,CANON Canon EOS55 ZOOM LENS EF 35135 mm F456 ZOOM LENS EF 75300 mm F456 II AF lens reflex two set,CANON キヤノン EOS 55 ZOOM LENS EF 35 135 mm F4 5. 6 ZOOM LENS EF 75 300 mm 4- 5. 6 Ⅱ AF 一 眼 レフ レンズ 2 本 セット
10,特価品 送料無料 1年保証 ユアサバッテリー FTZ10S YTZ10S GTZ10S互換 TTZ10S 初期充電済 CB400SF NC39 MAXAM マグザム マジェスティ SG20J,5467.00,5467.00,,https://page.auctions.yahoo.co.jp/jp/auction/o346896136,2084005528,Bargain Item Free Shipping 1 Year Warranty Yuasa Battery FTZ10S YTZ10S GTZ10S Compatible TTZ10S Initial Charged CB400SF NC39 MAXAM Magzam Majesty SG20J,Bargain Item Shipping 1 Year Warranty Yuasa Battery FTZ10S YTZ10S GTZ10S TTZ10S Initial CB400SF NC39 MAXAM Magzam Majesty SG20J,特価 品 送料 無料 1 年 保証 ユアサ バッテリー FTZ 10 YTZ 10 S GTZ 10 互換 TTZ 10 初期 充電 済 CB 400 SF NC 39 MAX AM マグ ザム マジェ SG 20
11,■■ＡＣデルコ同工場品■本州/四国送料一律■M31MF■HEXA M31MF Voyger　バスボート　キャンピングカー　サブバッテリー　ボイジャー,12650.00,12650.00,,https://page.auctions.yahoo.co.jp/jp/auction/l552904100,2084047908,■■ AC Delco factory products ■ Honshu / Shikoku shipping uniform ■ M31MF ■ HEXA M31MF Voyger bus boat camper sub battery voyager,AC Delco factory products Honshu Shikoku shipping uniform M31MF HEXA M31MF Voyger bus boat camper sub battery voyager,ＡＣ デルコ 同 工場 品 本州 四国 送料 一律 M3 1 MF HEXA M3 1 MF Voyger バス ボート キャンピング カー サブ バッテリー ボイジャー
12,◇ MINOLTA ミノルタ SHIFT CA ROKKOR 35mm F2.8 MDマウント 広角単焦点レンズ シフトレンズ 希少 MFレンズ MF一眼レフ用,57200.00,,,https://page.auctions.yahoo.co.jp/jp/auction/e384337443,2084261695,◇ MINOLTA MINOLTA SHIFT CA ROKKOR 35mm F2.8 MD mount Wide angle single focus lens Shift lens Rare MF lens For MF SLR,MINOLTA MINOLTA SHIFT CA ROKKOR 35 mm F28 MD angle focus lens Shift lens Rare MF lens MF SLR,MINOLTA ミノルタ CA 35 mm 2 8 MD マウント 広角 単 焦点 レンズ シフト レンズ MF レンズ MF 一 眼 レフ 用
13,セール 6ヶ月保証 フュージョン セミショートスモークスクリーン,2618.00,2618.00,,https://page.auctions.yahoo.co.jp/jp/auction/425364791,2084282350,Sale 6 month warranty Fusion Semi short smoke screen,Sale 6 month warranty Fusion Semi smoke screen,セール 6 ヶ月 保証 フュージョン セミ ショート スモーク スクリーン
14,★ Nikon ニコン F3 154万台 + MD-4 + MF-14 プロ機 マニュアルフォーカス 一眼レフ,22000.00,,,https://page.auctions.yahoo.co.jp/jp/auction/420065655,2084044778,★ Nikon Nikon F3 1.54 million MD-4 MF-14 Pro Manual Focus SLR,Nikon Nikon F3 154 million MD4 MF14 Pro Manual Focus SLR,Nikon ニコン F 3 154 万 台 MD 4 MF 14 プロ 機 マニュアル フォーカス 一 眼 レフ
15,フォルツァ FORZA MF06 MF08 立体 社外エンブレム 2点セット,704.00,704.00,,https://page.auctions.yahoo.co.jp/jp/auction/d392858233,2084282352,Forza FORZA MF06 MF08 Solid External emblem 2 piece set,Forza FORZA MF06 MF08 Solid emblem 2 piece,フォルツァ FORZA MF 06 MF 08 立体 社外 エンブレム 2 点 セット
16,★美品★ ニコン Nikon FE2 ・AF Nikkor 50mmレンズセット ■メンテ済■ K-08OC19-370,14003.00,46800.00,,https://page.auctions.yahoo.co.jp/jp/auction/l553373458,2084044778,★ Beauty ★ Nikon Nikon FE2 ・ AF Nikkor 50mm lens set ■ Maintenance ■ K-08OC19-370,Beauty Nikon Nikon FE2 AF Nikkor 50 mm lens Maintenance K08OC19370,美品 ニコン Nikon FE 2 AF Nikkor 50 mm レンズ セット メンテ 済 08 OC 19 370
17,130982 H19 BMW ミニ MF16 6速AT ミッション 69528km 即決,33000.00,33000.00,,https://page.auctions.yahoo.co.jp/jp/auction/t674208751,2084016980,130982 H19 BMW Mini MF16 6 Speed ​​AT Mission 69528km Prompt decision,130982 H19 BMW Mini MF16 6 Speed AT Mission 69528 km Prompt decision,130982 19 BMW ミニ MF 16 6 速 AT ミッション 69528 km 即決
18,MRワゴン DBA-MF33S 左ドアミラー　ZGF 84702-50MA0-ZGF,12100.00,13200.00,,https://page.auctions.yahoo.co.jp/jp/auction/x585298705,2084201200,MR Wagon DBA-MF33S Left door mirror ZGF 84702-50MA0-ZGF,MR Wagon DBAMF33S door mirror ZGF 8470250MA0ZGF,MR ワゴン DBA MF 33 左 ドアミラー ZGF 84702 50 MA 0 ZGF
19,MRワゴン DBA-MF33S スターターモーター　セルモーター　31100-72MA1,2420.00,2640.00,,https://page.auctions.yahoo.co.jp/jp/auction/j530765337,2084017113,MR Wagon DBA-MF33S Starter Motor Cell Motor 31100-72MA1,MR Wagon DBAMF33S Starter Motor Cell Motor 3110072MA1,MR ワゴン DBA MF 33 スターター モーター セルモーター 31100 72 MA 1
0,MRワゴン DBA-MF33S 左フロントロアアーム 45201-85K11,2420.00,2640.00,,https://page.auctions.yahoo.co.jp/jp/auction/w276514799,2084198586,MR Wagon DBA-MF33S Left front lower arm 45201-85K11,MR Wagon DBAMF33S arm 4520185K11,MR ワゴン DBA MF 33 左 フロント ロア アーム 45201 85 11
1,MRワゴン DBA-MF33S エンジンASSY,36300.00,39600.00,,https://page.auctions.yahoo.co.jp/jp/auction/x583758256,2084199171,MR Wagon DBA-MF33S Engine ASSY,MR Wagon DBAMF33S Engine ASSY,MR ワゴン DBA MF 33 エンジン AS SY
2,MRワゴン DBA-MF33S オルタネーター　31400-50M00,3630.00,3960.00,,https://page.auctions.yahoo.co.jp/jp/auction/g312481182,2084017113,MR Wagon DBA-MF33S Alternator 31400-50M00,MR Wagon DBAMF33S Alternator 3140050M00,MR ワゴン DBA MF 33 オルタネーター 31400 50 00
3,MRワゴン DBA-MF33S 右リアドアAssy　ZSF 68003-50M00,4840.00,5280.00,,https://page.auctions.yahoo.co.jp/jp/auction/t612278492,2084196919,MR Wagon DBA-MF33S Right rear door assembly ZSF 68003-50M00,MR Wagon DBAMF33S door assembly ZSF 6800350M00,MR ワゴン DBA MF 33 右 リア ドア Assy ZSF 68003 50 M 00
4,MRワゴン DBA-MF33S リアバンパーAssy　ZSF 71811-50M00,4840.00,5280.00,,https://page.auctions.yahoo.co.jp/jp/auction/t612278504,2084196918,MR Wagon DBA-MF33S Rear bumper assembly ZSF 71811-50M00,MR Wagon DBAMF33S Rear bumper assembly ZSF 7181150M00,MR ワゴン DBA MF 33 リア バンパー Assy ZSF 71811 50 M 00
5,▼色選択自由▼ 互換トナーカートリッジ331II/331《4本セット》MF8280Cw/MF8230Cn/MF628Cw/MF8280Cw/MF8230Cn/MF628Cw用,6480.00,6480.00,,https://page.auctions.yahoo.co.jp/jp/auction/u307182488,2084193605,▼ Free color selection ▼ Compatible toner cartridge 331II / 331 << 4 sets >> For MF8280Cw / MF8230Cn / MF628Cw / MF8280Cw / MF8230Cn / MF628Cw,color selection toner cartridge 331II 331 4 sets MF8230Cn MF628Cw MF8230Cn MF628Cw,色 選択 自由 互換 トナー カートリッジ 331 II 331 4 本 セット MF 8280 Cw MF 8230 Cn MF 628 Cw MF 8280 Cw MF 8230 Cn MF 628 Cw 用
6,ワゴンR MC21S MC22S MH21S MH22S / MRワゴン MF21S MF22S / Kei HN21S HN22S ダイレクトイグニッションコイル & プラグ セット【02】,7618.00,7618.00,,https://page.auctions.yahoo.co.jp/jp/auction/c763267915,2084017113,Wagon R MC21S MC22S MH21S MH22S / MR Wagon MF21S MF22S / Kei HN21S HN22S Direct Ignition Coil,Wagon R MC21S MH21S MH22S MR Wagon MF21S MF22S Kei HN21S Ignition Coil,ワゴン MC 21 MC 22 MH 21 MH 22 MR ワゴン MF 21 MF 22 Kei HN 21 HN 22 イグニッションコイル プラグ セット 02
7,ワゴンR MH23S / ラパン HE22S / MRワゴン MF33S / パレット MK21S パワーウィンドウスイッチ 18ピン 【16】,2536.00,2536.00,,https://page.auctions.yahoo.co.jp/jp/auction/f376953917,2084064587,Wagon R MH23S / Lapin HE22S / MR Wagon MF33S / Pallet MK21S Power window switch 18 pin [16],Wagon R MH23S Lapin HE22S MR Wagon Pallet MK21S Power window switch 18 pin 16,ワゴン MH 23 ラパン HE 22 MR ワゴン MF 33 パレット MK 21 パワー ウィンドウ スイッチ 18 ピン 16
8,ワゴンR MC11S MC12S MC21S MC22S / MRワゴン MF21S / アルト HA12S HA22S HA23S HA23V ブロアモーター ブロワモーター ブロアファン 01,1965.00,1965.00,,https://page.auctions.yahoo.co.jp/jp/auction/g376223235,2084017113,Wagon R MC11S MC12S MC21S MC22S / MR Wagon MF21S / Alto HA12S HA22S HA23S HA23V Blower Motor Blower Motor Blower Fan 01,Wagon R MC11S MC12S MR Wagon MF21S Alto HA12S HA22S HA23S Blower Motor Blower Motor Blower Fan 01,ワゴン MC 11 MC 12 S MC 21 MC 22 MR ワゴン MF 21 アルト HA 12 HA 22 HA 23 HA 23 ブロア モーター ブロワ モーター ブロア ファン 01
9,送料無料 S3 即日発送 ワゴンR MH21S MH22S MH23S MRワゴン MF22S MF33S アルトHA24S HA24V HA25S HA25V HA35S フロントブレーキパッド,1550.00,1550.00,,https://page.auctions.yahoo.co.jp/jp/auction/b419675826,2084208395,Free shipping S3 Same day shipping Wagon R MH21S MH22S MH23S MR Wagon MF22S MF33S Alto HA24S HA24V HA25S HA25V HA35S Front brake pad,shipping S3 day Wagon R MH21S MH22S MR Wagon MF22S MF33S Alto HA24S HA24V HA25S HA25V brake pad,送料 無料 3 発送 ワゴン MH 21 MH 22 MH 23 MR ワゴン MF 22 MF 33 アルト HA 24 HA 24 HA 25 HA 25 HA 35 フロント ブレーキ パッド
