,Title,CurrentPrice,BidOrBuy,shopName,ItemUrl,CategoryId,en_Title,en_short_Title,short_Title
0,603 1円 NIKON FE ブラック ボディ NIKKOR 28mm 1:2.8 200mm 1:4 50mm 1:1.4 105mm 1:2.5,17050.00,,,https://page.auctions.yahoo.co.jp/jp/auction/j595338936,2084044778,603 1 yen NIKON FE Black Body NIKKOR 28mm 1: 2.8 200mm 1: 4 50mm 1: 1.4 105mm 1: 2.5,603 1 yen NIKON FE Black Body NIKKOR 28 mm 1 28 200 mm 1 4 50 mm 1 14 105 mm 1 25,603 1 円 NIKON FE ブラック ボディ NIKKOR 28 mm 1 2. 8 200 mm 1 4 50 mm 1 1. 4 105 mm 1 2. 5
1,MRワゴン　MF21S　フロントローター＆パットセット(ディスクパッド ＣＡＣ/専用グリス付),5993.00,5993.00,,https://page.auctions.yahoo.co.jp/jp/auction/u278989174,2084208395,MR Wagon MF21S Front rotor & pad set (with disk pad CAC / grease),MR Wagon MF21S rotor pad disk pad CAC grease,MR ワゴン MF 21 フロント ローター パット セット ディスク パッド ＣＡＣ 専用 グリス 付
2,▼色選択自由▼ 互換トナー カートリッジ045H CRG-045H《4本セット》LBP611C / LBP612C / MF632Cdw / MF634Cdw 対応品,10620.00,10620.00,,https://page.auctions.yahoo.co.jp/jp/auction/v664375899,2084193605,▼ Free color selection ▼ Compatible toner cartridge 045H CRG-045H << 4 pcs set >> LBP611C / LBP612C / MF632Cdw / MF634Cdw,color selection toner cartridge 045H CRG045H 4 pcs set LBP611C LBP612C MF632Cdw MF634Cdw,色 選択 自由 互換 トナー カートリッジ 045 CRG 045 4 本 セット BP 611 LBP 612 MF 632 Cdw MF 634 Cd 対応 品
3,新品78DT-600 サイドターミナル 74-72 78-6MF 78-7MF 78-600 互換 シボレー アストロ キャデラック サバーバン タホ ユーコン エスカレード,6480.00,6480.00,,https://page.auctions.yahoo.co.jp/jp/auction/g374718285,2084228240,New 78DT-600 Side Terminal 74-72 78-6MF 78-7MF 78-600 Compatible Chevrolet Astro Cadillac Suburban Tahoe Yukon Escalade,New 78DT600 Side Terminal 7472 786MF 787MF 78600 Chevrolet Astro Cadillac Suburban Tahoe Yukon Escalade,新品 78 DT 600 サイド ターミナル 74 72 78 6 MF 78 7 MF 78 600 互換 シボレー アストロ キャデラック サバー バン ユーコン エス カレー ド
4,税込 即決 最短 即日発送 新品 バッテリー MF 60B24L ( 46B24L 50B24L 55B24L 58B24L 60B24L 65B24L )適合 ミニバン コンパクトカー 国産車,3980.00,3980.00,,https://page.auctions.yahoo.co.jp/jp/auction/m361265152,2084228224,Tax included prompt decision shortest same day shipping new battery MF 60B24L (46B24L 50B24L 55B24L 58B24L 60B24L 65B24L) compatible minivan compact car domestic car,Tax decision day battery MF 60B24L 46B24L 50B24L 55B24L 58B24L 60B24L 65B24L car car,税込 即決 最短 即日 発送 新品 バッテリー MF 60 24 46 24 50 24 55 24 58 24 60 24 65 24 適合 ミニバン コンパクトカー 国産車
5,身元不明テイスト油紙付デッド全貌未解明 1940s 大戦期前後 ベークライトパーツ採用&彫金模様パント型アビエーターMINT GREENガラスLENS入,22000.00,22000.00,,https://page.auctions.yahoo.co.jp/jp/auction/407936047,2084063607,Unidentified taste with oil paper dead full picture unexplained 1940s Around the war period Bakelite parts adopted,taste oil paper picture 1940s war period Bakelite parts,身元 不明 テイスト 油紙 付 デッド 全貌 未 解明 1940 s 大戦 期 前後 ベークライト パーツ 採用 模様 パント 型 アビ MINT GREEN ガラス LENS 入
6,最短 即日発送 アトラス 新品バッテリー MF 75D23R ( 50D23R 55D23R 60D23R 65D23R 70D23R 75D23R 80D23R ) 互換 キャラバン エルグランド,5380.00,5380.00,,https://page.auctions.yahoo.co.jp/jp/auction/d392526609,2084228231,Shortest same day shipping Atlas new battery MF 75D23R (50D23R 55D23R 60D23R 65D23R 70D23R 75D23R 80D23R) Compatible caravan Elgrand,day Atlas battery MF 75D23R 50D23R 55D23R 60D23R 65D23R 70D23R 75D23R 80D23R caravan Elgrand,最短 即日 発送 アトラス 新品 バッテリー MF 75 23 50 23 55 23 60 23 65 23 70 23 75 23 80 23 互換 キャラバン エルグランド
7,即日発送 高性能 新品バッテリー 満充電 アトラス MF80D26R 互換 46D26R 48D26R 50D26R 55D26R 60D26R 65D26R 70D26R 75D26R 80D26R ATLAS,5480.00,5480.00,,https://page.auctions.yahoo.co.jp/jp/auction/b418963148,2084228234,Same day shipping High performance New battery Fully charged Atlas MF80D26R Compatible 46D26R 48D26R 50D26R 55D26R 60D26R 65D26R 70D26R 75D26R 80D26R ATLAS,day performance battery Atlas MF80D26R 46D26R 48D26R 50D26R 55D26R 60D26R 65D26R 70D26R 75D26R 80D26R ATLAS,発送 高性能 新品 バッテリー 満 充電 アトラス MF 80 26 互換 46 26 48 26 50 26 55 26 60 26 65 26 70 26 75 26 80 26 ATLAS
8,即日発送 高性能 新品バッテリー 満充電 アトラス MF80D26L 互換 46D26L 48D26L 50D26L 55D26L 60D26L 65D26L 70D26L 75D26L 80D26L ATLAS,5480.00,5480.00,,https://page.auctions.yahoo.co.jp/jp/auction/364106705,2084228233,Ships same day High performance New battery Fully charged Atlas MF80D26L Compatible 46D26L 48D26L 50D26L 55D26L 60D26L 65D26L 70D26L 75D26L 80D26L ATLAS,Ships day performance battery Atlas MF80D26L 46D26L 48D26L 50D26L 55D26L 60D26L 65D26L 70D26L 75D26L 80D26L ATLAS,発送 高性能 新品 バッテリー 満 充電 アトラス MF 80 26 互換 46 26 48 26 50 26 55 26 60 26 65 26 70 26 75 26 80 26 ATLAS
9,▼選択自由▼互換トナーカートリッジ418 CRG-418 《4本セット》MF8570Cdw/MF8530Cdn/MF8380Cdw/MF8340Cdn/MF8350Cdn/MF8330Cdn 対応品,7821.00,7821.00,,https://page.auctions.yahoo.co.jp/jp/auction/424307969,2084193605,▼ Selectable ▼ Compatible Toner Cartridge 418 CRG-418 《Set of 4》 MF8570Cdw / MF8530Cdn / ​​MF8380Cdw / MF8340Cdn / ​​MF8350Cdn / ​​MF8330Cdn,Toner Cartridge 418 CRG418 Set 4 MF8570Cdw MF8530Cdn MF8380Cdw MF8340Cdn MF8350Cdn MF8330Cdn,選択 自由 互換 トナー カートリッジ 418 CRG 418 4 本 セット MF 8570 Cdw MF 8530 MF 8380Cd w MF 8340Cd n MF n MF 8330Cd n 対応 品
10,▼色選択自由▼ 互換トナーカートリッジ046H CRG-046H《4本セット》LBP654C/LBP652C/LBP651C/MF735Cdw/MF733Cdw/MF731Cdw 対応品,12881.00,12881.00,,https://page.auctions.yahoo.co.jp/jp/auction/q319389958,2084193605,▼ Free color selection ▼ Compatible toner cartridge 046H CRG-046H << 4 sets >> LBP654C / LBP652C / LBP651C / MF735Cdw / MF733Cdw / MF731Cdw,color selection toner cartridge 046H CRG046H 4 sets LBP654C LBP652C LBP651C MF733Cdw MF731Cdw,色 選択 自由 互換 トナー カートリッジ 046 CRG 046 4 本 セット BP 654 LBP 652 LBP 651 MF 735 Cdw MF 733 Cdw MF 731 Cdw 対応 品
11,CANON EOS KISS デジタルN CANON ZOOM LENS EF 55-200mm セット,5250.00,,,https://page.auctions.yahoo.co.jp/jp/auction/q319024281,2084261635,CANON EOS KISS Digital N CANON ZOOM LENS EF 55-200mm set,CANON EOS KISS Digital N CANON ZOOM LENS EF 55200 mm,CANON EOS デジタル CANON ZOOM LENS EF 55 200 mm セット
12,当社在庫、充電発送♪ メンテナンスフリー ハイパワーバッテリー 75AH #MF78DT-670 シボレー アストロ・GMC サファリ,12100.00,12100.00,,https://page.auctions.yahoo.co.jp/jp/auction/v656475052,2084017112,"<!DOCTYPE html><html><head><link rel=""shortcut icon"" href=""//ssl.gstatic.com/docs/script/images/favicon.ico""><title>Error</title><style type=""text/css"">body {background-color: #fff; margin: 0; padding: 0;}.errorMessage {font-family: Arial,sans-serif; font-size: 12pt; font-weight: bold; line-height: 150%; padding-top: 25px;}</style></head><body style=""margin:20px""><div><img alt=""Google Apps Script"" src=""//ssl.gstatic.com/docs/script/images/logo.png""></div><div style=""text-align:center;font-family:monospace;margin:50px auto 0;max-width:600px"">無効な引数: source (line 3, file &quot;コード&quot;, project &quot;Translation&quot;)</div></body></html>",DOCTYPE htmlhtmlheadlink relshortcut icon typetextcssbody backgroundcolor fff margin 0 fontfamily Arialsansserif fontsize 12pt fontweight bold lineheight 150 paddingtop 25pxstyleheadbody stylemargin20pxdivimg altGoogle Apps Script srcsslgstaticcomdocsscriptimageslogopngdivdiv auto 0maxwidth600px source line 3 file quotquot project quotTranslationquotdivbodyhtml,当社 在庫 充電 発送 メンテナンス フリー ハイパワー バッテリー 75 AH MF 78 DT 670 シボレー アストロ GMC サファリ
13,充電済み！即納できます♪ メンテナンスフリー ハイパワーバッテリー 75AH #MF78DT-670 99-06y キャデラック エスカレード,12100.00,12100.00,,https://page.auctions.yahoo.co.jp/jp/auction/e385623306,2084228240,"<!DOCTYPE html><html><head><link rel=""shortcut icon"" href=""//ssl.gstatic.com/docs/script/images/favicon.ico""><title>Error</title><style type=""text/css"">body {background-color: #fff; margin: 0; padding: 0;}.errorMessage {font-family: Arial,sans-serif; font-size: 12pt; font-weight: bold; line-height: 150%; padding-top: 25px;}</style></head><body style=""margin:20px""><div><img alt=""Google Apps Script"" src=""//ssl.gstatic.com/docs/script/images/logo.png""></div><div style=""text-align:center;font-family:monospace;margin:50px auto 0;max-width:600px"">無効な引数: source (line 3, file &quot;コード&quot;, project &quot;Translation&quot;)</div></body></html>",DOCTYPE htmlhtmlheadlink relshortcut icon typetextcssbody backgroundcolor fff margin 0 fontfamily Arialsansserif fontsize 12pt fontweight bold lineheight 150 paddingtop 25pxstyleheadbody stylemargin20pxdivimg altGoogle Apps Script srcsslgstaticcomdocsscriptimageslogopngdivdiv auto 0maxwidth600px source line 3 file quotquot project quotTranslationquotdivbodyhtml,充電 済み メンテナンス ハイパワー バッテリー 75 AH MF 78 DT 670 99 06 y キャデラック エス カレー ド
14,超実用向け 無骨ミリタリーSTYLE 1970sデッドCANADA製AOアメリカンオプティカル Wブリッジ ウェリントンsize50/20 眼鏡 GREEN LENS入 a6256,22000.00,22000.00,,https://page.auctions.yahoo.co.jp/jp/auction/n347526146,2084302035,Ultra-practical Bone Military STYLE 1970s Dead CANADA AO American Optical W Bridge Wellington size 50/20 Glasses GREEN LENS a6256,Ultrapractical Bone Military STYLE 1970s Dead CANADA AO American Optical W Bridge Wellington size 5020 Glasses GREEN LENS,超 実用 向け ミリタリー STYLE 1970 s デッド CANADA 製 AO アメリカン オプティカル W ブリッジ ウェリントン size 50 20 眼鏡 GREEN LENS 入 6256
15,[即日発送16時迄]純正品質★日産/スズキ/マツダ/鍵/3種類/ブランクキー/367/421/382/ワゴンR/ピノ/MH22/MC22S/MH22S/MH21S/MF22/MG22/MH21,498.00,498.00,,https://page.auctions.yahoo.co.jp/jp/auction/x618627694,2084291408,[Same day shipping until 16:00] Genuine quality ★ Nissan / Suzuki / Mazda / key / 3 types / blank key / 367/421/382 / Wagon R / Pinot / MH22 / MC22S / MH22S / MH21S / MF22 / MG22 / MH21,day 1600 quality Nissan Suzuki Mazda 3 types 367421382 Wagon R Pinot MH22 MC22S MH22S MH21S MF22 MG22 MH21,即日 発送 16 時 純正 品質 日産 スズキ マツダ 鍵 3 種類 ブランク キー 367 421 382 ワゴン ピノ MH 22 MC 22 MH 22 MH 21 MF 22 MG 22 MH 21
16,即決 美品 保証動作 Nikon ニコン Nikon AF VR 80-400mm F4.5-5.6D E 箱、ケース付き,61000.00,61000.00,,https://page.auctions.yahoo.co.jp/jp/auction/n374245551,2084261684,Prompt decision beautiful goods guarantee operation Nikon Nikon Nikon AF VR 80-400mm F4.5-5.6D E with box and case,decision goods operation Nikon Nikon Nikon AF VR 80400 mm F4556D E box case,即決 美品 保証 動作 Nikon ニコン Nikon AF VR 80 400 mm F4 5 5 . 6 E 箱 ケース 付き
17,即決 美品 動作保証 ニコン AF-S NIKKOR 24-70mm F2.8G ED 箱、ケース付き,96800.00,96800.00,,https://page.auctions.yahoo.co.jp/jp/auction/m363101820,2084261684,Prompt decision beautiful goods operation guarantee Nikon AF-S NIKKOR 24-70mm F2.8G ED box with case,decision goods operation guarantee Nikon AFS NIKKOR 2470 mm F28 G ED box case,美品 動作 保証 ニコン AF NIKKOR 24 70 mm F2 8 ED 箱 ケース 付き
18,即決 美品 動作保証 ニコン AF-S NIKKOR 24-70mm F2.8G ED 箱、ケース、おまけ保護フィルター付き,97800.00,97800.00,,https://page.auctions.yahoo.co.jp/jp/auction/r343082558,2084261684,"Prompt decision beautiful goods operation guarantee Nikon AF-S NIKKOR 24-70mm F2.8G ED box, case, with extra protection filter",decision goods operation guarantee Nikon AFS NIKKOR 2470 mm F28 G ED box case protection filter,美品 動作 保証 ニコン AF NIKKOR 24 70 mm F2 8 ED 箱 ケース おまけ 保護 フィルター 付き
19,即決 Nikon ニコン AF-S VR ED 70-200mm F2.8G（IF）フード付 実用品,71000.00,71000.00,,https://page.auctions.yahoo.co.jp/jp/auction/p713434015,2084261684,Prompt decision Nikon Nikon AF-S VR ED 70-200mm F2.8G (IF) with hood,decision Nikon Nikon AFS VR ED 70200 mm F28 G hood,Nikon ニコン AF VR ED 70 200 mm F2 8 IF フード 付 実用品
0,即決 美品 動作保証 Nikon ニコン PC-E NIKKOR 24mm F3.5D ED 平行型,157000.00,157000.00,,https://page.auctions.yahoo.co.jp/jp/auction/j593088596,2084261693,Prompt decision beautiful goods operation guarantee Nikon Nikon PC-E NIKKOR 24mm F3.5D ED parallel type,decision goods operation Nikon Nikon PCE NIKKOR 24 mm F35D ED type,美品 動作 保証 Nikon ニコン PC NIKKOR 24 mm 3 5 ED 型
1,即決 良品 動作保証 ニコン Nikon AF VR 80-400mm F4.5-5.6D ED ケース付き,56800.00,56800.00,,https://page.auctions.yahoo.co.jp/jp/auction/o316803009,2084261684,Prompt decision good product operation guarantee Nikon Nikon AF VR 80-400mm F4.5-5.6D ED with case,decision product operation guarantee Nikon Nikon AF VR 80400 mm F4556D ED case,即決 良品 動作 保証 ニコン Nikon AF VR 80 400 mm F4 5 5 6 ED ケース 付き
2,BOSCH♪BMW MINI　MF16/ME14　ブレーキパッド　フロント/リア　R56/R55系　ワン　クーパー,11880.00,11880.00,,https://page.auctions.yahoo.co.jp/jp/auction/v656218988,2084016878,BOSCH ♪ BMW MINI MF16 / ME14 Brake pad Front / Rear R56 / R55 series One Cooper,BOSCH BMW MINI MF16 ME14 Brake pad Rear R56 R55 series One Cooper,BOSCH BMW MINI MF 16 ME 14 ブレーキ パッド フロント リア 56 55 系 ワン クーパー
3,■ほぼ新品■ タムロン TAMRON SP AF 200-500mm F5-6.3 Di（A08）Nikon ニコン用 ケース付 #F03502K01279,20500.00,42800.00,,https://page.auctions.yahoo.co.jp/jp/auction/u307600045,2084261684,"<!DOCTYPE html><html><head><link rel=""shortcut icon"" href=""//ssl.gstatic.com/docs/script/images/favicon.ico""><title>Error</title><style type=""text/css"">body {background-color: #fff; margin: 0; padding: 0;}.errorMessage {font-family: Arial,sans-serif; font-size: 12pt; font-weight: bold; line-height: 150%; padding-top: 25px;}</style></head><body style=""margin:20px""><div><img alt=""Google Apps Script"" src=""//ssl.gstatic.com/docs/script/images/logo.png""></div><div style=""text-align:center;font-family:monospace;margin:50px auto 0;max-width:600px"">無効な引数: source (line 3, file &quot;コード&quot;, project &quot;Translation&quot;)</div></body></html>",DOCTYPE htmlhtmlheadlink relshortcut icon typetextcssbody backgroundcolor fff margin 0 fontfamily Arialsansserif fontsize 12pt fontweight bold lineheight 150 paddingtop 25pxstyleheadbody stylemargin20pxdivimg altGoogle Apps Script srcsslgstaticcomdocsscriptimageslogopngdivdiv auto 0maxwidth600px source line 3 file quotquot project quotTranslationquotdivbodyhtml,新品 タムロン TAMRON SP AF 200 500 mm F 5 6. 3 Di 08 Nikon ニコン 用 ケース 付 03502 01279
4,【新品】ニコン クールショットプロ スタビライズド（手ブレ補正機能搭載モデル,44000.00,49500.00,,https://page.auctions.yahoo.co.jp/jp/auction/f377794879,2084063253,[New] Nikon Cool Shot Pro Stabilized (model with camera shake correction function,New Nikon Cool Shot Pro Stabilized model camera shake correction function,新品 ニコン ショット プロ スタビライズド 手ブレ 補正 機能 搭載 モデル
5,★極上外観★ニコン NIKON AF NIKKOR 28-200mm f3.5-5.6 D ★完動★#6865,6000.00,6200.00,,https://page.auctions.yahoo.co.jp/jp/auction/q319739206,2084261684,"<!DOCTYPE html><html><head><link rel=""shortcut icon"" href=""//ssl.gstatic.com/docs/script/images/favicon.ico""><title>Error</title><style type=""text/css"">body {background-color: #fff; margin: 0; padding: 0;}.errorMessage {font-family: Arial,sans-serif; font-size: 12pt; font-weight: bold; line-height: 150%; padding-top: 25px;}</style></head><body style=""margin:20px""><div><img alt=""Google Apps Script"" src=""//ssl.gstatic.com/docs/script/images/logo.png""></div><div style=""text-align:center;font-family:monospace;margin:50px auto 0;max-width:600px"">無効な引数: source (line 3, file &quot;コード&quot;, project &quot;Translation&quot;)</div></body></html>",DOCTYPE htmlhtmlheadlink relshortcut icon typetextcssbody backgroundcolor fff margin 0 fontfamily Arialsansserif fontsize 12pt fontweight bold lineheight 150 paddingtop 25pxstyleheadbody stylemargin20pxdivimg altGoogle Apps Script srcsslgstaticcomdocsscriptimageslogopngdivdiv auto 0maxwidth600px source line 3 file quotquot project quotTranslationquotdivbodyhtml,極上 外観 ニコン NIKON AF NIKKOR 28- 200mm f 3 5 5 . 6 完動 6865
6,♪ジャンク Nikon COOLPIX S8100 ニコン クールピクス コンパクトデジタルカメラ 90310A-1♪,1000.00,,,https://page.auctions.yahoo.co.jp/jp/auction/414818405,2084261644,♪ Junk Nikon COOLPIX S8100 Nikon Coolpix Compact digital camera 90310A-1 ♪,Junk Nikon COOLPIX S8100 Nikon Coolpix Compact camera 90310A1,ジャンク Nikon COOLPIX 8100 ニコン ピクス コンパクトデジタルカメラ 90310 1
7,☆新品☆送料無料☆Nikon AF-S DX NIKKOR 18-300mm f/3.5-5.6G ED VR [AFSDXVR18-300G],79800.00,,,https://page.auctions.yahoo.co.jp/jp/auction/d377995033,23716,☆ New ☆ Free Shipping ☆ Nikon AF-S DX NIKKOR 18-300mm f / 3.5-5.6G ED VR [AFSDXVR18-300G],Shipping Nikon AFS DX NIKKOR 18300 mm 3556 G ED VR G,新品 送料 無料 Nikon AF DX NIKKOR 18 300 mm f/ 3. 5 5 6 ED VR AFSDXVR 18 300
8,★新品級★ニコン NIKON AF NIKKOR 75-300mm f4.5-5.6 ★完動★#6877,6000.00,6200.00,,https://page.auctions.yahoo.co.jp/jp/auction/v664727019,2084261684,"<!DOCTYPE html><html><head><link rel=""shortcut icon"" href=""//ssl.gstatic.com/docs/script/images/favicon.ico""><title>Error</title><style type=""text/css"">body {background-color: #fff; margin: 0; padding: 0;}.errorMessage {font-family: Arial,sans-serif; font-size: 12pt; font-weight: bold; line-height: 150%; padding-top: 25px;}</style></head><body style=""margin:20px""><div><img alt=""Google Apps Script"" src=""//ssl.gstatic.com/docs/script/images/logo.png""></div><div style=""text-align:center;font-family:monospace;margin:50px auto 0;max-width:600px"">無効な引数: source (line 3, file &quot;コード&quot;, project &quot;Translation&quot;)</div></body></html>",DOCTYPE htmlhtmlheadlink relshortcut icon typetextcssbody backgroundcolor fff margin 0 fontfamily Arialsansserif fontsize 12pt fontweight bold lineheight 150 paddingtop 25pxstyleheadbody stylemargin20pxdivimg altGoogle Apps Script srcsslgstaticcomdocsscriptimageslogopngdivdiv auto 0maxwidth600px source line 3 file quotquot project quotTranslationquotdivbodyhtml,新品 級 ニコン NIKON AF NIKKOR 75 300mm 4 5 5 6 完動 6877
9,BEAMS　Forza Si (MF12)　マフラー中古,9800.00,29800.00,,https://page.auctions.yahoo.co.jp/jp/auction/w341404727,2084282163,BEAMS Forza Si (MF12) muffler used,BEAMS Forza Si MF12 muffler,BE AMS Forza MF 12 マフラー 中古
10,MasakiMatsushima マサキマツシマ 眼鏡フレーム MF1174-3 お洒落,19800.00,38880.00,,https://page.auctions.yahoo.co.jp/jp/auction/p648438691,2084063608,Masaki Matsushima glasses frame MF1174-3 fashionable,Masaki Matsushima glasses frame,MasakiMatsushima マサキ マツシマ 眼鏡 フレーム MF 1174 3 お洒落
11,◆◇【AF動作OK♪】Nikon ニコン AF-S DX NIKKOR 35mm 1:1.8G◇◆,11980.00,13980.00,,https://page.auctions.yahoo.co.jp/jp/auction/424452283,2084261684,◆ ◇ [AF operation OK ♪] Nikon Nikon AF-S DX NIKKOR 35mm 1: 1.8G ◇ ◆,AF operation Nikon Nikon AFS DX NIKKOR 35 mm 1 18 G,AF 動作 OK Nikon ニコン AF DX NIKKOR 35 mm 1. 8
12,#3743★ 実用美品 ★ タムロン TAMRON SP AF 70-200mm F2.8 Di IF MACRO A001 NIKON ニコン用（フード・元箱・ポーチ付き）,25800.00,26800.00,,https://page.auctions.yahoo.co.jp/jp/auction/c772831782,2084261684,,,3743 美品 タムロン TAMRON SP AF 70 200 mm 8 Di IF MACRO 001 NIKON ニコン 用 フード 元箱 ポーチ 付き
13,#3560★ 美品 ★ シグマ SIGMA ZOOM 24-70mm F2.8 EX DG MACRO ニコン Nikon（フード付き）,21800.00,24800.00,,https://page.auctions.yahoo.co.jp/jp/auction/m354053931,2084261684,,,3560 美品 SIGMA 24 70 mm F2 8 EX DG MACRO ニコン Nikon フード 付き
14,●限定1点【新品】ミニセラミックヒーター D.MF-SA0.65(RA) レトロブルー ⑭,1870.00,,,https://page.auctions.yahoo.co.jp/jp/auction/v652054208,2084215692,● Limited 1 [New] Mini Ceramic Heater D.MF-SA0.65 (RA) Retro Blue,1 New Mini Ceramic Heater DMFSA065 RA Retro Blue,限定 1 点 新品 ミニ セラミック ヒーター D MF 0. 65 RA レトロ ブルー ⑭
15,Nikon 双眼鏡 Action EX 12×50CF、三脚アダプター付き,18000.00,,,https://page.auctions.yahoo.co.jp/jp/auction/n373321566,2084263451,Nikon Binoculars Action EX 12 × 50CF with tripod adapter,Nikon Binoculars Action EX 12 50CF tripod adapter,Nikon 双眼鏡 Action EX 12 50 CF 三脚 アダプター 付き
16,ニコン Nikon AF-S ED NIKKOR 17-35mm F2.8 D フルサイズ対応 オートフォーカス レンズ,44829.00,,,https://page.auctions.yahoo.co.jp/jp/auction/b419504806,2084261684,Nikon Nikon AF-S ED NIKKOR 17-35mm F2.8 D Full-size autofocus lens,Nikon Nikon AFS ED NIKKOR 1735 mm F28 D Fullsize autofocus lens,ニコン Nikon AF ED NIKKOR 17 35mm 2 8 フルサイズ 対応 オートフォーカス レンズ
17,ニコン Nikon AF Nikkor 75-300ｍｍ　望遠レンズ　防湿庫保管品　保護フィルタ付き,3200.00,,,https://page.auctions.yahoo.co.jp/jp/auction/u307392917,2084261684,"Nikon Nikon AF Nikkor 75-300mm telephoto lens, moisture-proof storage, with protective filter",Nikon Nikon AF Nikkor 75300 mm telephoto lens storage filter,ニコン Nikon AF Nikkor 75 300 ｍｍ 望遠 レンズ 防湿 庫 保管 品 保護 フィルタ 付き
18,P.Angenieux F.70 1:3.3 Type Z5 (ニコン Fマウント AF 改造 ) ( Nikon アンジェニュー Angenieux 70mm F3.3 単焦点 ),85000.00,90000.00,,https://page.auctions.yahoo.co.jp/jp/auction/c775911426,2084261684,P.Angenieux F.70 1: 3.3 Type Z5 (Nikon F mount AF modified) (Nikon Angenie Angenieux 70mm F3.3 single focus),PAngenieux F70 1 33 Type Z5 Nikon F mount AF Nikon Angenie Angenieux 70 mm F33 focus,P Angenieux F . 70 1 3. 3 Type 5 ニコン マウント AF 改造 Nikon アンジェ ニュー Angenieux 70 mm . 3 単 焦点
19,Forza Si (MF12)純正ロングシールド　中古,4980.00,,,https://page.auctions.yahoo.co.jp/jp/auction/h426145991,2084282350,Forza Si (MF12) genuine long shield used,Forza Si MF12 shield,Forza MF 12 純正 ロング シールド 中古
0,ワゴンR MC11S MC21S MC22S / MRワゴン MF21S ダイレクトイグニッションコイル & スパークプラグセット【02】,6702.00,6702.00,,https://page.auctions.yahoo.co.jp/jp/auction/h425538074,2084017113,Wagon R MC11S MC21S MC22S / MR Wagon MF21S Direct ignition coil,Wagon R MC11S MC21S MR Wagon MF21S ignition coil,ワゴン MC 11 MC 21 MC 22 MR ワゴン MF 21 イグニッションコイル スパークプラグ セット 02
1,ワゴンR MC21S MC22S MH21S MH22S / MRワゴン MF21S MF22S / Kei HN21S HN22S ダイレクトイグニッションコイル & NGKプラグ セット【02】,10978.00,10978.00,,https://page.auctions.yahoo.co.jp/jp/auction/399668654,2084017113,Wagon R MC21S MC22S MH21S MH22S / MR Wagon MF21S MF22S / Kei HN21S HN22S Direct Ignition Coil,Wagon R MC21S MH21S MH22S MR Wagon MF21S MF22S Kei HN21S Ignition Coil,ワゴン MC 21 MC 22 MH 21 MH 22 MR ワゴン MF 21 MF 22 Kei HN 21 HN 22 イグニッションコイル NGK プラグ セット 02
2,"【完全新品】AF-P DX NIKKOR 18-55mm f/3.5-5.6G VR　Nikon ニコン標準ズームレンズ　希望小売価格40,500円 ■保証書付き",7150.00,,,https://page.auctions.yahoo.co.jp/jp/auction/g377737137,2084261684,"[Completely new] AF-P DX NIKKOR 18-55mm f / 3.5-5.6G VR Nikon Nikon standard zoom lens Suggested retail price 40,500 yen ■ With warranty",AFP DX NIKKOR 1855 mm 3556 G VR Nikon Nikon zoom lens price 40500 yen warranty,新品 AF DX NIKKOR 18- 55 mm f 3. 5 5 6 VR Nikon ニコン 標準 ズームレンズ 希望 小売 価格 40 500 円 保証書 付き
3,Nikon D200 とレンズ２本 (Nikon Nikkor、TAMRON)、保証書、マルチパワーバッテリー付,7250.00,,,https://page.auctions.yahoo.co.jp/jp/auction/r353134243,2084261684,"Nikon D200 with 2 lenses (Nikon Nikkor, TAMRON), warranty card, multi-power battery",Nikon D200 2 lenses Nikon Nikkor TAMRON warranty card multipower battery,Nikon 200 レンズ ２ 本 Nikon Nikkor TAMRON 保証書 マルチ パワー バッテリー 付
4,#3402★ 外観美品 ★ ニコン Nikon NIKKOR-H Auto 50mm F2,980.00,1800.00,,https://page.auctions.yahoo.co.jp/jp/auction/t661333715,2084261693,,,3402 外観 美品 ニコン Nikon NIKKOR Auto 50 mm 2
5,Nikon 双眼鏡 MONARCH 5 モナーク 8×42 三脚アダプター付き,22000.00,,,https://page.auctions.yahoo.co.jp/jp/auction/o346055913,2084263451,Nikon binoculars MONARCH 5 Monarch 8 × 42 with tripod adapter,Nikon MONARCH 5 Monarch 8 42 tripod adapter,Nikon MONARCH 5 モナーク 8 42 三脚 アダプター 付き
