,Unnamed: 0,Title,CurrentPrice,BidOrBuy,shopName,ItemUrl,CategoryId,en_Title,en_short_Title
217,17,◆極上 ニコン NIKON D7000 + 純正Wズーム#969,2001.0,42800.0,,https://auctions.yahooapis.jp/AuctionWebService/V2/auctionItem?auctionID=s687294976,2084261636,"<!DOCTYPE html><html><head><link rel=""shortcut icon"" href=""//ssl.gstatic.com/docs/script/images/favicon.ico""><title>エラー</title><style type=""text/css"">body {background-color: #fff; margin: 0; padding: 0;}.errorMessage {font-family: Arial,sans-serif; font-size: 12pt; font-weight: bold; line-height: 150%; padding-top: 25px;}</style></head><body style=""margin:20px""><div><img alt=""Google Apps Script"" src=""//ssl.gstatic.com/docs/script/images/logo.png""></div><div style=""text-align:center;font-family:monospace;margin:50px auto 0;max-width:600px"">無効な引数: source（行 3、ファイル「コード」、プロジェクト「Translation」）</div></body></html>",DOCTYPE relshortcut icon hrefsslgstaticcomdocsscriptimagesfaviconicotitletitlestyle typetextcssbody backgroundcolor fff margin 0 padding 0errorMessage Arialsansserif fontsize fontweight lineheight 150 paddingtop 25pxstyleheadbody stylemargin20pxdivimg altGoogle Apps Script srcsslgstaticcomdocsscriptimageslogopngdivdiv auto 0maxwidth600px source 3Translationdivbodyhtml
218,18,●Nikon AFカメラ F5 ボディ オートフォーカス一眼カメラ ニコン シャッターOK 中古 93N398,7398.0,,,https://auctions.yahooapis.jp/AuctionWebService/V2/auctionItem?auctionID=p712713911,2084044785,● Nikon AF Camera F5 Body Autofocus SLR Camera Nikon Shutter OK Used 93N398,Nikon AF Camera F5 Body Autofocus SLR Camera Nikon Shutter 93N398
219,19,■■Nikon / ニコン NIKKOR-SW 90mm 1:8 大判カメラ用 交換レンズ ニッコール 現状品 中古 92K6116,1080.0,,,https://auctions.yahooapis.jp/AuctionWebService/V2/auctionItem?auctionID=p707900705,23692,■■ Nikon / Nikon NIKKOR-SW 90mm 1: 8 Interchangeable Lens for large format Nikkor Current product Used 92K6116,Nikon Nikon NIKKORSW 90 mm 1 8 Interchangeable Lens format Nikkor Current product 92K6116
220,0,★極上美品★ NIKON ニコン AI NIKKOR 50mm F1.4 S Ai-s 美品マニュアルレンズ クリアーな光学 動作問題なし 1909009,1.0,24000.0,,https://auctions.yahooapis.jp/AuctionWebService/V2/auctionItem?auctionID=c758938360,2084261693,★ Exquisite beauty ★ NIKON Nikon AI NIKKOR 50mm F1.4 S Ai-s Beauty manual lens Clear optics No operation problems 1909009,beauty NIKON Nikon AI NIKKOR 50 mm F14 S Ais Beauty lens optics operation problems 1909009
221,1,☆ニコン　Nikon Ｆ２　ボディ,5250.0,,,https://auctions.yahooapis.jp/AuctionWebService/V2/auctionItem?auctionID=k410215318,2084044778,☆ Nikon Nikon F2 body,Nikon Nikon F2 body
222,2,【超美品】Nikon D810ボディ ＋ 未使用付属品、箱一式,98000.0,,,https://auctions.yahooapis.jp/AuctionWebService/V2/auctionItem?auctionID=l548580096,2084261636,"[Super beauty] Nikon D810 body + unused accessories, complete box",Super beauty Nikon D810 body accessories box
223,3,■■Nikon / ニコン NIKKOR-M 200mm 1:8 ニッコール 大判カメラ用 交換レンズ 現状品 中古 92K6117,1296.0,,,https://auctions.yahooapis.jp/AuctionWebService/V2/auctionItem?auctionID=g372206564,23692,■■ Nikon / Nikon NIKKOR-M 200mm 1: 8 Nikkor Large Format Interchangeable Lens Current product Used 92K6117,Nikon Nikon NIKKORM 200 mm 1 8 Nikkor Format Interchangeable Lens product 92K6117
224,4,▼Nikon フィルムカメラ F2 フォトミック NIKKOR 50mm 1:1.8 ニコン 現状品 95Y530,1080.0,,,https://auctions.yahooapis.jp/AuctionWebService/V2/auctionItem?auctionID=p713421908,2084261693,▼ Nikon film camera F2 photomic NIKKOR 50mm 1: 1.8 Nikon current product 95Y530,Nikon film camera F2 NIKKOR 50 mm 1 18 Nikon product 95Y530
225,5,☆（レンズ）　ニコン　Nikkor-S.C AUTO　５５ｍｍ　１：１．２,7750.0,,,https://auctions.yahooapis.jp/AuctionWebService/V2/auctionItem?auctionID=c771812690,2084261693,☆ (Lens) Nikon Nikkor-S.C AUTO 55mm 1: 1.2,Lens Nikon NikkorSC AUTO 55 mm 1 12
226,6,☆メーカーメンテ済み☆ ニコン用 SIGMA APO 50-500mm F4.5-6.3 DG OS HSM,53000.0,65000.0,,https://auctions.yahooapis.jp/AuctionWebService/V2/auctionItem?auctionID=x645884460,2084261684,☆ Manufactured maintenance ☆ For Nikon SIGMA APO 50-500mm F4.5-6.3 DG OS HSM,maintenance Nikon SIGMA APO 50500 mm F4563 DG OS HSM
227,7,★ハローカメラ★ 5042 Nikon COOLPIX P90 光学24倍ズーム【 1210万画素 】バッテリーなし/ ニコンデジカメ 撮影/再生OK 動作品,2765.0,,,https://auctions.yahooapis.jp/AuctionWebService/V2/auctionItem?auctionID=m358372038,2084261644,★ Hello camera ★ 5042 Nikon COOLPIX P90 Optical 24x zoom [12.1 million pixels] No battery / Nikon digital camera Shooting / playback OK,camera 5042 Nikon COOLPIX P90 Optical 24x 121 million pixels battery Nikon camera Shooting
228,8,【新品級極美】★Nikon AF-P NIKKOR 70-300mm F4.5-5.6 E ED VR 望遠ズームレンズ／フルサイズ対応／(防湿庫保管)★,15500.0,,,https://auctions.yahooapis.jp/AuctionWebService/V2/auctionItem?auctionID=k411362408,2084261684,[New grade extreme beauty] ★ Nikon AF-P NIKKOR 70-300mm F4.5-5.6 E ED VR Telephoto zoom lens / Full size compatible / (Moisture storage) ★,grade beauty Nikon AFP NIKKOR 70300 mm F4556 E ED VR Telephoto zoom lens size Moisture storage
229,9,★Nikonの本格一眼入門機　ニコン　Ｄ７０ｓ レンズキット・豪華付属品多数♪,14500.0,17800.0,,https://auctions.yahooapis.jp/AuctionWebService/V2/auctionItem?auctionID=p713139095,2084261636,"★ Nikon's full-fledged single-lens introduction machine, Nikon D70s lens kit, and many luxury accessories ♪",Nikons singlelens introduction machine Nikon kit luxury accessories
230,10,KIPON TILT NIK-m4/3 ニコンFマウントレンズ → マイクロフォーサーズ　マウントアダプター アオリ(ティルト)機構搭載 回転式,11250.0,,,https://auctions.yahooapis.jp/AuctionWebService/V2/auctionItem?auctionID=c756772727,2084261693,KIPON TILT NIK-m4 / 3 Nikon F mount lens → Micro Four Thirds mount adapter Aori (tilt) mechanism equipped Rotation type,KIPON TILT NIKm4 3 Nikon F mount lens Micro Four Thirds adapter Aori tilt mechanism Rotation type
231,11,激レア保管品NIKON ニコン SP Limited リミテッド 新品購入時のフルセットで,271000.0,,,https://auctions.yahooapis.jp/AuctionWebService/V2/auctionItem?auctionID=m355507283,2084204375,Super rare storage goods NIKON Nikon SP Limited Limited Full set at the time of new purchase,storage goods NIKON Nikon SP Limited Limited Full set time purchase
232,12,NIKON ニコン◆AF-S MICRO NIKKOR 105㎜ f2.8G ED/単焦点レンズ◆ニコンFマウント系,40000.0,,,https://auctions.yahooapis.jp/AuctionWebService/V2/auctionItem?auctionID=l549159950,2084261684,NIKON Nikon AF-S MICRO NIKKOR 105㎜ f2.8G ED / single focus lens Nikon F mount system,NIKON Nikon AFS MICRO NIKKOR 105 f28 G ED focus lens Nikon F mount system
233,13,"☆注目 美品☆Nikon ニコン　D5300　18-55 VR Ⅱ　レンズキット　元箱あります！　Shot数：3,889回",15000.0,39000.0,,https://auctions.yahooapis.jp/AuctionWebService/V2/auctionItem?auctionID=x641848166,2084261636,"☆ Attention Beauty Goods ☆ Nikon Nikon D5300 18-55 VR II Lens Kit Original Box Available! Shot number: 3,889 times",Attention Beauty Goods Nikon Nikon D5300 1855 VR II Lens Kit Original Box Available Shot number 3889 times
234,14,ニコン　NIKON　 ブルー　 L35AW AD　NIKON　AF　LENS　35ｍｍ　1：2.8　ケース付,4000.0,,,https://auctions.yahooapis.jp/AuctionWebService/V2/auctionItem?auctionID=g373627238,2084005100,Nikon NIKON Blue L35AW AD NIKON AF LENS 35mm 1: 2.8 with case,Nikon NIKON Blue AD NIKON AF LENS 35 mm 1 28 case
235,15,ニコン デジタルカメラ、ミラーレス用レンズ、ジャンク扱い,2100.0,,,https://auctions.yahooapis.jp/AuctionWebService/V2/auctionItem?auctionID=e381163734,2084305445,"Nikon digital camera, mirrorless lens, junk treatment",Nikon camera lens junk treatment
236,16,ニコン　NIKON　 　 L35 AD　NIKON　AF　LENS　35ｍｍ　1：2.8　ケース付,4000.0,,,https://auctions.yahooapis.jp/AuctionWebService/V2/auctionItem?auctionID=l549246923,2084005100,Nikon NIKON L35 AD NIKON AF LENS 35mm 1: 2.8 with case,Nikon NIKON AD NIKON AF LENS 35 mm 1 28 case
237,17,ニコン　NIKON L35AW AD　NIKON　AF　LENS　35ｍｍ　1：2.8　ケース付,4000.0,,,https://auctions.yahooapis.jp/AuctionWebService/V2/auctionItem?auctionID=e382528116,2084005100,Nikon NIKON L35AW AD NIKON AF LENS 35mm 1: 2.8 with case,Nikon NIKON AD NIKON AF LENS 35 mm 1 28 case
238,18,中古　Nikon F シリアルナンバー709万　1970年3月～5月製造品 　レンズ　NIKKOR-S　Auto　1：1・4　ｆ＝50ｍｍ　FTN　FINDER,1200.0,,,https://auctions.yahooapis.jp/AuctionWebService/V2/auctionItem?auctionID=l548460449,2084044785,"Used Nikon F serial number 7.09 million, manufactured from March to May 1970 Lenses NIKKOR-S Auto 1: 1/4 f = 50mm FTN FINDER",Nikon F number 709 million March May 1970 Lenses NIKKORS Auto 1 14 50 mm FTN FINDER
239,19,COOLPIX A10,3100.0,,,https://auctions.yahooapis.jp/AuctionWebService/V2/auctionItem?auctionID=k410655749,2084261644,COOLPIX A10,COOLPIX A10
240,0,ニコンＦ、完動美品・ニッコール35～200ｍｍ・1：3.5～4.5付き,10500.0,25000.0,,https://auctions.yahooapis.jp/AuctionWebService/V2/auctionItem?auctionID=c758796829,2084044778,"Nikon F, complete movement beauty ・ Nikkor 35-200mm ・ 1: 3.5-4.5 included",Nikon F movement beauty Nikkor 35200 mm 1 3545
241,1,Nikon F2 フォトミックＳ　ブラックボディ　ニコンフィルムカメラ,12800.0,,,https://auctions.yahooapis.jp/AuctionWebService/V2/auctionItem?auctionID=b416270791,2084044778,Nikon F2 Photomic S Black Body Nikon Film Camera,Nikon F2 Photomic S Black Body Nikon Film Camera
242,2,ほぼ無傷 Nikon NIKONOS V ニコノス 5 水中 フィルムカメラ ボディ 元箱付 (23),3655.0,,,https://auctions.yahooapis.jp/AuctionWebService/V2/auctionItem?auctionID=p713452728,2084044778,Almost intact Nikon NIKONOS V underwater film camera body with original box (23),Nikon NIKONOS V film camera body box 23
243,3,☆☆☆ ニコン AI AF-S 17-35mm F/2.8D ☆☆☆,27000.0,,,https://auctions.yahooapis.jp/AuctionWebService/V2/auctionItem?auctionID=d388206747,2084261684,☆☆☆ Nikon AI AF-S 17-35mm F / 2.8D ☆☆☆,Nikon AI AFS 1735 mm F 28D
244,4,ニコンＦ2フォトミックＡ、完動美品　ニッコールＥシリーズ36～７２ｍｍ・1：3.5付き,13000.0,30000.0,,https://auctions.yahooapis.jp/AuctionWebService/V2/auctionItem?auctionID=c772071534,2084044778,"Nikon F2 photomic A, complete movement beautiful goods Nikkor E series 36-72mm, with 1: 3.5",Nikon F2 movement goods Nikkor E series 3672 mm 1 35
245,5,ニコンF 美品 ファインダーキレイです。,5750.0,20000.0,,https://auctions.yahooapis.jp/AuctionWebService/V2/auctionItem?auctionID=n369891558,2084044778,Nikon F beautiful product.,Nikon F product
246,6,Tamron タムロン SP AF 28-105mm F2.8 LD Aspherical For Nikon AF ニコンマウント 176DN (17),1350.0,,,https://auctions.yahooapis.jp/AuctionWebService/V2/auctionItem?auctionID=c759342428,2084261684,Tamron Tamron SP AF 28-105mm F2.8 LD Aspherical For Nikon AF Nikon Mount 176DN (17),Tamron Tamron SP AF 28105 mm F28 LD Aspherical Nikon AF Nikon Mount 176DN 17
247,7,Nikon COOLSHOT ニコン 80 i VR 箱無し,25000.0,30000.0,,https://auctions.yahooapis.jp/AuctionWebService/V2/auctionItem?auctionID=r349356416,2084063253,Nikon COOLSHOT Nikon 80 i VR without box,Nikon COOLSHOT Nikon 80 i VR box
248,8,新品未使用保管　ニコン Nikon AF-S ED NIKKOR 17-35mm F2.8 D フルサイズ対応 オートフォーカス レンズ,50000.0,,,https://auctions.yahooapis.jp/AuctionWebService/V2/auctionItem?auctionID=x646601871,2084261684,New unused storage Nikon Nikon AF-S ED NIKKOR 17-35mm F2.8 D Full-size autofocus lens,storage Nikon Nikon AFS ED NIKKOR 1735 mm F28 D Fullsize autofocus lens
249,9,NIKON ニコン　D850ボディ　美品！,260000.0,,,https://auctions.yahooapis.jp/AuctionWebService/V2/auctionItem?auctionID=q314607916,2084261636,NIKON Nikon D850 body beauty!,NIKON Nikon D850 body beauty
250,10,■極上美品■　ニコン NIKON REFLEX-NIKKOR・C 500ｍｍ F8,8000.0,,,https://auctions.yahooapis.jp/AuctionWebService/V2/auctionItem?auctionID=h422953405,2084261693,■ Exquisite beauty ■ Nikon NIKON REFLEX-NIKKOR ・ C 500mm F8,beauty Nikon NIKON REFLEXNIKKOR C 500 mm F8
251,11,coolpix P5000 　EN-EL5(純正充電池)　　1000万画素（1/1.8型CCD、顔認識AF、光学ファインダー　　等）,2300.0,,,https://auctions.yahooapis.jp/AuctionWebService/V2/auctionItem?auctionID=b413552928,2084261644,"coolpix P5000 EN-EL5 (genuine rechargeable battery) 10 million pixels (1 / 1.8-type CCD, face recognition AF, optical viewfinder, etc.)",coolpix P5000 battery 10 million pixels 1 18type CCD face recognition AF viewfinder
252,12,【新品】【送料無料】1　NIKKOR 18.5mm f/1.8 保証書付き　nikon 1用,8000.0,,,https://auctions.yahooapis.jp/AuctionWebService/V2/auctionItem?auctionID=e382604340,2084261684,[New] [Free Shipping] 1 NIKKOR 18.5mm f / 1.8 with warranty card for nikon 1,New Free Shipping 1 NIKKOR 185 mm 18 warranty card nikon 1
253,13,【新品】ニコン クールショットプロ スタビライズド（手ブレ補正機能搭載モデル,42000.0,,,https://auctions.yahooapis.jp/AuctionWebService/V2/auctionItem?auctionID=f352011978,2084063253,[New] Nikon Cool Shot Pro Stabilized (model with camera shake correction function,New Nikon Cool Shot Pro Stabilized model camera shake correction function
254,14,ニコンＦＥ２実用品。おまけレンズ２本付き。これからフィルムカメラを初めて見ようという方にも。,8000.0,,,https://auctions.yahooapis.jp/AuctionWebService/V2/auctionItem?auctionID=h421331859,2084044778,Nikon FE2 practical product. With 2 extra lenses. For those who want to see film cameras for the first time.,Nikon product 2 lenses film cameras time
255,15,"【完全新品】AF-P DX NIKKOR 18-55mm f/3.5-5.6G VR　Nikon ニコン標準ズームレンズ　希望小売価格40,500円 ■保証書付き",4600.0,,,https://auctions.yahooapis.jp/AuctionWebService/V2/auctionItem?auctionID=s686839142,2084261684,"[Complete new] AF-P DX NIKKOR 18-55mm f / 3.5-5.6G VR Nikon Nikon standard zoom lens Suggested retail price 40,500 yen ■ Warranty included",AFP DX NIKKOR 1855 mm f 3556 G VR Nikon Nikon zoom lens price 40500 yen Warranty
256,16,ジャンク ニコン キヤノン ペンタックス オリンパス ミノルタ 他 MF AF レンズ 等 27台 まとめ まとめて 大量 セット #3165,1500.0,,,https://auctions.yahooapis.jp/AuctionWebService/V2/auctionItem?auctionID=t672622975,2084261693,"<!DOCTYPE html><html><head><link rel=""shortcut icon"" href=""//ssl.gstatic.com/docs/script/images/favicon.ico""><title>エラー</title><style type=""text/css"">body {background-color: #fff; margin: 0; padding: 0;}.errorMessage {font-family: Arial,sans-serif; font-size: 12pt; font-weight: bold; line-height: 150%; padding-top: 25px;}</style></head><body style=""margin:20px""><div><img alt=""Google Apps Script"" src=""//ssl.gstatic.com/docs/script/images/logo.png""></div><div style=""text-align:center;font-family:monospace;margin:50px auto 0;max-width:600px"">無効な引数: source（行 3、ファイル「コード」、プロジェクト「Translation」）</div></body></html>",DOCTYPE relshortcut icon hrefsslgstaticcomdocsscriptimagesfaviconicotitletitlestyle typetextcssbody backgroundcolor fff margin 0 padding 0errorMessage Arialsansserif fontsize fontweight lineheight 150 paddingtop 25pxstyleheadbody stylemargin20pxdivimg altGoogle Apps Script srcsslgstaticcomdocsscriptimageslogopngdivdiv auto 0maxwidth600px source 3Translationdivbodyhtml
257,17,【美品】 ニコン クールピクス Nikon COOLPIX A100 レッド【スタイリッシュで高画質】【HD動画もOK】（19Se19M-CN）,111.0,12800.0,,https://auctions.yahooapis.jp/AuctionWebService/V2/auctionItem?auctionID=g373883769,2084261644,[Good Condition] Nikon Coolpix Nikon COOLPIX A100 Red [Stylish and high quality] [HD video is OK] (19Se19M-CN),Condition Nikon Coolpix Nikon COOLPIX Red quality HD video 19Se19MCN
258,18,"【新品】【送料無料】Nikon ニコン超望遠ズームレンズ　AF-P DX NIKKOR 70-300mm f/4.5-6.3G ED VR　希望小売価格47,500円 ■保証書付き",7000.0,,,https://auctions.yahooapis.jp/AuctionWebService/V2/auctionItem?auctionID=g372407780,2084261684,"[New] [Free Shipping] Nikon Nikon super telephoto zoom lens AF-P DX NIKKOR 70-300mm f / 4.5-6.3G ED VR Suggested retail price 47,500 yen ■ With warranty",New Free Shipping Nikon Nikon telephoto lens AFP DX NIKKOR 70300 mm 4563 G ED VR Suggested price 47500 yen warranty
259,19,Nikon ニコン 専用 28-105mm AF 高級ズームレンズ 希少・作動品,2300.0,10000.0,,https://auctions.yahooapis.jp/AuctionWebService/V2/auctionItem?auctionID=q314237886,2084261684,Nikon dedicated Nikon 28-105mm AF high-end zoom lens,Nikon Nikon 28105 mm AF zoom lens
260,0,Nikon ニコン 純正 NIKKOR 50mm 高級単焦点レンズ 1:2 綺麗な作動品,700.0,,,https://auctions.yahooapis.jp/AuctionWebService/V2/auctionItem?auctionID=c758663572,2084261693,Nikon Nikon Genuine NIKKOR 50mm High-quality single focus lens 1: 2 Beautiful working product,Nikon Nikon Genuine NIKKOR 50 mm Highquality focus lens 1 2 working product
261,1,Nikon ニコン Ai AF DC-Nikkor 135mm f/2D,54000.0,80000.0,,https://auctions.yahooapis.jp/AuctionWebService/V2/auctionItem?auctionID=s686628997,2084261684,Nikon Nikon Ai AF DC-Nikkor 135mm f / 2D,Nikon Nikon Ai AF DCNikkor 135 mm 2D
262,2,新品同様　Nikon AF-S Nikkor 70-200mm F2.8 G ED VR2,102511.0,,,https://auctions.yahooapis.jp/AuctionWebService/V2/auctionItem?auctionID=r348365529,2084261684,"Like new, Nikon AF-S Nikkor 70-200mm F2.8 G ED VR2",Nikon AFS Nikkor 70200 mm F28 G ED VR2
263,3,【ecoま】ニコン Nikomat/EM/FG20 お得★4台セット フィルムカメラ,11.0,,,https://auctions.yahooapis.jp/AuctionWebService/V2/auctionItem?auctionID=b415494349,2084044778,[Eco] Nikon Nikomat / EM / FG20 deals ★ 4 sets film camera,Eco Nikon Nikomat EM FG20 4 sets film camera
264,4,SIGMA 150-600mm F5-6.3 DG OS HSM TELECONVERTER TC-1401 KIT テレコンバーターキット For NIKON ニコン シグマ 付属品,23500.0,98000.0,,https://auctions.yahooapis.jp/AuctionWebService/V2/auctionItem?auctionID=l549190315,2084261684,SIGMA 150-600mm F5-6.3 DG OS HSM TELECONVERTER TC-1401 KIT Teleconverter Kit For NIKON Nikon Sigma Accessories,SIGMA 150600 mm F563 DG OS HSM TELECONVERTER TC1401 KIT Teleconverter Kit NIKON Nikon Sigma Accessories
265,5,AF-S NIKKOR 24-85mm f/3.5-4.5G ED VR,23000.0,40000.0,,https://auctions.yahooapis.jp/AuctionWebService/V2/auctionItem?auctionID=v663905985,2084261684,AF-S NIKKOR 24-85mm f / 3.5-4.5G ED VR,AFS NIKKOR 2485 mm f 3545 G ED VR
266,6,AF NIKKOR 85mm 1:1.8 New w/HN-23 HOOD,2500.0,,,https://auctions.yahooapis.jp/AuctionWebService/V2/auctionItem?auctionID=w336945051,2084261684,AF NIKKOR 85mm 1: 1.8 New w / HN-23 HOOD,AF NIKKOR 85 mm 1 18 New w HN23 HOOD
267,7,【ecoま】ニコン NIKON D100 レンズ付き デジタル一眼レフカメラ,1.0,,,https://auctions.yahooapis.jp/AuctionWebService/V2/auctionItem?auctionID=w337151202,2084261636,[Eco] Nikon NIKON D100 Digital SLR camera with lens,Eco Nikon NIKON D100 Digital SLR camera lens
268,8,Nikon ニコン 最高峰 人気の高級一眼レフカメラ F3ボディ + ウエストレベルファインダー付 作動品 （腐食無し）,11055.0,,,https://auctions.yahooapis.jp/AuctionWebService/V2/auctionItem?auctionID=c759106387,2084044778,Nikon Nikon highest peak popular luxury single-lens reflex camera F3 body with waist level finder working product (no corrosion),Nikon Nikon luxury singlelens camera F3 body waist level finder working product corrosion
269,9,一眼レフ 距離計連動 CANON NIKON MINOLTA KONICA PENTAX デジカメ レンジファインダー レンズ ストロボ 部品 等 まとめてジャンク 大量b3,1.0,,,https://auctions.yahooapis.jp/AuctionWebService/V2/auctionItem?auctionID=u302816136,2084044787,SLR linked with distance meter CANON NIKON MINOLTA KONICA PENTAX digital camera range finder lens strobe parts etc junk mass b3,SLR distance meter CANON NIKON MINOLTA KONICA PENTAX camera range finder lens strobe parts junk mass b3
270,10,Nikon ニコン AF-S DX NIKKOR 10-24mm f/3.5-4.5G ED ケンコーの最高級フィルター、Zataプロテクター付き（8000円相当）,47000.0,65000.0,,https://auctions.yahooapis.jp/AuctionWebService/V2/auctionItem?auctionID=d388314204,2084261684,Nikon Nikon AF-S DX NIKKOR 10-24mm f / 3.5-4.5G ED Kenko's finest filter with Zata protector (equivalent to 8000 yen),Nikon Nikon AFS DX NIKKOR 1024 mm 3545 G ED Kenkos filter protector 8000 yen
271,11,Nikon ニコン D750 フルサイズ一眼レフボディ 2019年1月ニコンにて清掃点検済み,90000.0,120000.0,,https://auctions.yahooapis.jp/AuctionWebService/V2/auctionItem?auctionID=e380891975,2084261636,Nikon Nikon D750 full-size SLR body January 2019 cleaning completed,Nikon Nikon SLR body January 2019 cleaning
272,12,【ecoま】シグマ SIGMA 600mm F8 ミラーレンズ ニコンマウント NIKON用,1.0,,,https://auctions.yahooapis.jp/AuctionWebService/V2/auctionItem?auctionID=418441880,2084261693,[Eco] Sigma SIGMA 600mm F8 mirror lens for Nikon mount NIKON,Eco Sigma SIGMA 600 mm F8 mirror lens Nikon mount NIKON
273,13,一眼 カメラ 水中ハウジングセット【NIKON D80】すぐに水中撮影可能です！！超極上完動品シャッター回数少　レンズ４個付き,35000.0,78000.0,,https://auctions.yahooapis.jp/AuctionWebService/V2/auctionItem?auctionID=u302095287,25316,"Single-lens camera underwater housing set [NIKON D80] Underwater photography is possible immediately! ! Super best finished product with few shutters, with 4 lenses",Singlelens camera housing NIKON D80 Underwater photography Super product shutters 4 lenses
274,14,【1スタ 最落無し】ニコン L35 AF 、 AD2 、ペンタックス Super A 、オリンパス 35 DC 、mju Zoom カメラ レンズ 大量セット まとめ,1300.0,,,https://auctions.yahooapis.jp/AuctionWebService/V2/auctionItem?auctionID=f372903895,2084005100,"[No loss of 1 star] Nikon L35 AF, AD2, Pentax Super A, Olympus 35 DC, mju Zoom camera lens Mass set Summary",loss 1 star Nikon L35 AF AD2 Pentax Super A Olympus 35 DC mju Zoom camera lens Mass Summary
275,15,小型ディフューザー　なんやかんや3点セット　クリップオンストロボ用　　Nikonスピードライトスタンド AS-22（2個） ルミクエスト,980.0,,,https://auctions.yahooapis.jp/AuctionWebService/V2/auctionItem?auctionID=n369687537,2084261979,"Small diffuser, Nyankanya 3-piece set, clip-on strobe, Nikon Speedlight Stand AS-22 (2) Lumi Quest",diffuser Nyankanya 3piece set clipon strobe Nikon Speedlight AS22 2 Lumi Quest
276,16,Nikon ニコン F2 ボディ アイレベル ファインダー 一眼レフカメラ,16250.0,,,https://auctions.yahooapis.jp/AuctionWebService/V2/auctionItem?auctionID=q314523952,2084044778,Nikon Nikon F2 Body Eye Level Finder SLR Camera,Nikon Nikon F2 Body Eye Level Finder SLR Camera
277,17,☆NIKON　ニコマートFTN ＋ニッコール-S 58mm F1.4　綺麗なフード付　ジャンク扱いで！,1000.0,,,https://auctions.yahooapis.jp/AuctionWebService/V2/auctionItem?auctionID=c760069851,2084044778,"☆ NIKON Nicomart FTN + Nikkor-S 58mm F1.4 with clean hood, treated as junk!",NIKON Nicomart FTN NikkorS 58 mm F14 hood junk
278,18,Nikon ニコン Ai AF Micro-Nikkor 60mm f/2.8D,19000.0,33000.0,,https://auctions.yahooapis.jp/AuctionWebService/V2/auctionItem?auctionID=e381096118,2084261684,Nikon Nikon Ai AF Micro-Nikkor 60mm f / 2.8D,Nikon Nikon Ai AF MicroNikkor 60 mm 28D
279,19,Nikon D5300 18-55 VR ⅡKit　送料無料,20000.0,,,https://auctions.yahooapis.jp/AuctionWebService/V2/auctionItem?auctionID=l548758261,2084261636,Nikon D5300 18-55 VR II Kit Free shipping,Nikon D5300 1855 VR II Kit shipping
280,0,【Nikon】デジタルカメラ　COOLPIX 　S6100　ノーブルブラック　 S6100BK　1600万画素　光学７倍ズーム　中古,4000.0,,,https://auctions.yahooapis.jp/AuctionWebService/V2/auctionItem?auctionID=t671740855,2084261644,[Nikon] Digital camera COOLPIX S6100 Noble Black S6100BK 16 million pixels 7x optical zoom used,Nikon Digital camera COOLPIX S6100 Noble Black 16 million pixels 7x zoom
281,1,Nikon ニコン Nikomat 昔の一眼レフカメラ FT-N 黒ボディ 希少な作動品 （腐食無し）,520.0,,,https://auctions.yahooapis.jp/AuctionWebService/V2/auctionItem?auctionID=c758663564,2084044778,Nikon Nikon Nikomat Old single-lens reflex camera FT-N Black body Rare working product (No corrosion),Nikon Nikon Nikomat Old singlelens camera FTN Black body Rare working product corrosion
282,2,★新品★Tokina トキナ AT-X SD 70-200mm F4 PRO FX (IF) VCM-S Nikon★付属品多数！試写のみ！新品時の色艶をそのままキープ！,59800.0,62800.0,,https://auctions.yahooapis.jp/AuctionWebService/V2/auctionItem?auctionID=b410782447,2084261684,★ New ★ Tokina Tokina AT-X SD 70-200mm F4 PRO FX (IF) VCM-S Nikon ★ Many accessories! Only preview! Keep the gloss when new!,New Tokina Tokina ATX SD 70200 mm F4 PRO FX VCMS Nikon accessories preview
