,Title,CurrentPrice,BidOrBuy,shopName,ItemUrl,CategoryId,en_Title,en_short_Title,short_Title
6,★新品同様!!★ニコン NIKON D610 ボディ ダブルレンズセット★標準&望遠セット!! 付属品多数ですぐに使えます!! 安心の返品対応!!#647,5000.00,87800.00,,https://page.auctions.yahoo.co.jp/jp/auction/g373732807,2084261636,"<!DOCTYPE html><html><head><link rel=""shortcut icon"" href=""//ssl.gstatic.com/docs/script/images/favicon.ico""><title>エラー</title><style type=""text/css"">body {background-color: #fff; margin: 0; padding: 0;}.errorMessage {font-family: Arial,sans-serif; font-size: 12pt; font-weight: bold; line-height: 150%; padding-top: 25px;}</style></head><body style=""margin:20px""><div><img alt=""Google Apps Script"" src=""//ssl.gstatic.com/docs/script/images/logo.png""></div><div style=""text-align:center;font-family:monospace;margin:50px auto 0;max-width:600px"">無効な引数: source（行 3、ファイル「コード」、プロジェクト「Translation」）</div></body></html>",DOCTYPE relshortcut icon hrefsslgstaticcomdocsscriptimagesfaviconicotitletitlestyle typetextcssbody backgroundcolor fff margin 0 padding 0errorMessage Arialsansserif fontsize fontweight lineheight 150 paddingtop 25pxstyleheadbody stylemargin20pxdivimg altGoogle Apps Script srcsslgstaticcomdocsscriptimageslogopngdivdiv auto 0maxwidth600px source 3Translationdivbodyhtml,新品 ニコン NIKON 610 ボディ ダブル レンズ セット 標準 望遠 付属品 多数 返品 647
7,即決！COOLPIX Ａ　希少機　APS-Cフォーマットのコンパクトデジカメ　センサーゴミあり,19800.00,29800.00,,https://page.auctions.yahoo.co.jp/jp/auction/418751612,2084261644,Prompt decision! COOLPIX A rare machine APS-C format compact digital camera with sensor dust,decision COOLPIX machine APSC format camera sensor dust,COOLPIX 機 APS コンパクトデジカメ センサー ゴミ あり
8,★極上品★Nikon ニコン D3S ボディ★日常をドラマに変える抜群の描画力が愛されるプロ機！★#241,10500.00,149800.00,,https://page.auctions.yahoo.co.jp/jp/auction/j592438089,2084261636,"<!DOCTYPE html><html><head><link rel=""shortcut icon"" href=""//ssl.gstatic.com/docs/script/images/favicon.ico""><title>エラー</title><style type=""text/css"">body {background-color: #fff; margin: 0; padding: 0;}.errorMessage {font-family: Arial,sans-serif; font-size: 12pt; font-weight: bold; line-height: 150%; padding-top: 25px;}</style></head><body style=""margin:20px""><div><img alt=""Google Apps Script"" src=""//ssl.gstatic.com/docs/script/images/logo.png""></div><div style=""text-align:center;font-family:monospace;margin:50px auto 0;max-width:600px"">無効な引数: source（行 3、ファイル「コード」、プロジェクト「Translation」）</div></body></html>",DOCTYPE relshortcut icon hrefsslgstaticcomdocsscriptimagesfaviconicotitletitlestyle typetextcssbody backgroundcolor fff margin 0 padding 0errorMessage Arialsansserif fontsize fontweight lineheight 150 paddingtop 25pxstyleheadbody stylemargin20pxdivimg altGoogle Apps Script srcsslgstaticcomdocsscriptimageslogopngdivdiv auto 0maxwidth600px source 3Translationdivbodyhtml,極上 品 Nikon ニコン D3 ボディ 日常 ドラマ 描画 力 プロ 機 241
9,★極上美品★Nikon ニコン D750 超望遠300mm ダブルレンズセット 元箱付・付属品充実★高い機動力と高品位画質が大人気です！！★#210,119800.00,206800.00,,https://page.auctions.yahoo.co.jp/jp/auction/o342099599,2084261684,"<!DOCTYPE html><html><head><link rel=""shortcut icon"" href=""//ssl.gstatic.com/docs/script/images/favicon.ico""><title>エラー</title><style type=""text/css"">body {background-color: #fff; margin: 0; padding: 0;}.errorMessage {font-family: Arial,sans-serif; font-size: 12pt; font-weight: bold; line-height: 150%; padding-top: 25px;}</style></head><body style=""margin:20px""><div><img alt=""Google Apps Script"" src=""//ssl.gstatic.com/docs/script/images/logo.png""></div><div style=""text-align:center;font-family:monospace;margin:50px auto 0;max-width:600px"">無効な引数: source（行 3、ファイル「コード」、プロジェクト「Translation」）</div></body></html>",DOCTYPE relshortcut icon hrefsslgstaticcomdocsscriptimagesfaviconicotitletitlestyle typetextcssbody backgroundcolor fff margin 0 padding 0errorMessage Arialsansserif fontsize fontweight lineheight 150 paddingtop 25pxstyleheadbody stylemargin20pxdivimg altGoogle Apps Script srcsslgstaticcomdocsscriptimageslogopngdivdiv auto 0maxwidth600px source 3Translationdivbodyhtml,極上 美品 Nikon ニコン 750 超 望遠 300 mm ダブル レンズ セット 元箱 付 付属品 充実 機動力 高 品位 画質 210
10,★美品★ニコン Nikon AF-S NIKKOR 24-85mm F3.5-4.5G★フルサイズの軽量標準ズーム！コスパ最高の高画質が人気です！★#234,17800.00,29800.00,,https://page.auctions.yahoo.co.jp/jp/auction/o331058905,2084261684,"<!DOCTYPE html><html><head><link rel=""shortcut icon"" href=""//ssl.gstatic.com/docs/script/images/favicon.ico""><title>エラー</title><style type=""text/css"">body {background-color: #fff; margin: 0; padding: 0;}.errorMessage {font-family: Arial,sans-serif; font-size: 12pt; font-weight: bold; line-height: 150%; padding-top: 25px;}</style></head><body style=""margin:20px""><div><img alt=""Google Apps Script"" src=""//ssl.gstatic.com/docs/script/images/logo.png""></div><div style=""text-align:center;font-family:monospace;margin:50px auto 0;max-width:600px"">無効な引数: source（行 3、ファイル「コード」、プロジェクト「Translation」）</div></body></html>",DOCTYPE relshortcut icon hrefsslgstaticcomdocsscriptimagesfaviconicotitletitlestyle typetextcssbody backgroundcolor fff margin 0 padding 0errorMessage Arialsansserif fontsize fontweight lineheight 150 paddingtop 25pxstyleheadbody stylemargin20pxdivimg altGoogle Apps Script srcsslgstaticcomdocsscriptimageslogopngdivdiv auto 0maxwidth600px source 3Translationdivbodyhtml,美品 ニコン Nikon AF NIKKOR 24 85 mm F3 5 4. 5 フルサイズ 軽量 標準 コスパ 高画質 人気 234
11,★極上美品★ニコン Nikon AF-S NIKKOR 24-85mm F3.5-4.5G★フルサイズの軽量標準ズーム！コスパ最高の高画質が人気です！★#233,18800.00,34800.00,,https://page.auctions.yahoo.co.jp/jp/auction/r337234611,2084261684,"<!DOCTYPE html><html><head><link rel=""shortcut icon"" href=""//ssl.gstatic.com/docs/script/images/favicon.ico""><title>エラー</title><style type=""text/css"">body {background-color: #fff; margin: 0; padding: 0;}.errorMessage {font-family: Arial,sans-serif; font-size: 12pt; font-weight: bold; line-height: 150%; padding-top: 25px;}</style></head><body style=""margin:20px""><div><img alt=""Google Apps Script"" src=""//ssl.gstatic.com/docs/script/images/logo.png""></div><div style=""text-align:center;font-family:monospace;margin:50px auto 0;max-width:600px"">無効な引数: source（行 3、ファイル「コード」、プロジェクト「Translation」）</div></body></html>",DOCTYPE relshortcut icon hrefsslgstaticcomdocsscriptimagesfaviconicotitletitlestyle typetextcssbody backgroundcolor fff margin 0 padding 0errorMessage Arialsansserif fontsize fontweight lineheight 150 paddingtop 25pxstyleheadbody stylemargin20pxdivimg altGoogle Apps Script srcsslgstaticcomdocsscriptimageslogopngdivdiv auto 0maxwidth600px source 3Translationdivbodyhtml,極上 美品 ニコン Nikon AF NIKKOR 24 85 mm F3 5 4. 5 フルサイズ 軽量 標準 コスパ 高画質 人気 233
12,★綺麗！動作OK★Nikon AF-S DX Nikkor 55-300mm F4.5-5.6G ED VR ニコン★493405-5508,4340.00,,,https://page.auctions.yahoo.co.jp/jp/auction/421543231,2084261684,★ Beautiful! Operation OKNikon AF-S DX Nikkor 55-300mm F4.5-5.6G ED VR Nikon ★ 493405-5508,Operation OKNikon AFS DX Nikkor 55300 mm F4556 G ED VR Nikon 4934055508,動作 OK Nikon AF DX Nikkor 55 300 mm F4 5 5 6 ED VR ニコン 493405 5508
13,★新品級★ニコン Nikon AF-S NIKKOR 18-140mm f3.5-5.6G ED DX VR★全領域でシャープな描画の万能ズームレンズ！★#244,23800.00,35800.00,,https://page.auctions.yahoo.co.jp/jp/auction/v653297822,2084261684,"<!DOCTYPE html><html><head><link rel=""shortcut icon"" href=""//ssl.gstatic.com/docs/script/images/favicon.ico""><title>エラー</title><style type=""text/css"">body {background-color: #fff; margin: 0; padding: 0;}.errorMessage {font-family: Arial,sans-serif; font-size: 12pt; font-weight: bold; line-height: 150%; padding-top: 25px;}</style></head><body style=""margin:20px""><div><img alt=""Google Apps Script"" src=""//ssl.gstatic.com/docs/script/images/logo.png""></div><div style=""text-align:center;font-family:monospace;margin:50px auto 0;max-width:600px"">無効な引数: source（行 3、ファイル「コード」、プロジェクト「Translation」）</div></body></html>",DOCTYPE relshortcut icon hrefsslgstaticcomdocsscriptimagesfaviconicotitletitlestyle typetextcssbody backgroundcolor fff margin 0 padding 0errorMessage Arialsansserif fontsize fontweight lineheight 150 paddingtop 25pxstyleheadbody stylemargin20pxdivimg altGoogle Apps Script srcsslgstaticcomdocsscriptimageslogopngdivdiv auto 0maxwidth600px source 3Translationdivbodyhtml,新品 級 ニコン Nikon AF 18 140mm f 3 5 5 6 ED DX VR 全 領域 描画 万能 ズームレンズ 244
14,ニコン Nikon F100 - ブラック ボディ + MB-15 オートフォーカス / AF一眼レフ カメラ [273205],11500.00,36800.00,,https://page.auctions.yahoo.co.jp/jp/auction/p708753465,2084044785,Nikon Nikon F100-Black Body MB-15 Autofocus / AF SLR Camera [273205],Nikon Nikon F100Black Body MB15 Autofocus AF SLR Camera 273205,ニコン Nikon 100 ブラック ボディ MB 15 オートフォーカス AF 一 眼 レフ カメラ 273205
15,〓外観綺麗 テレコンバーター〓ニコン Nikon Tele Converter TC-E3ED 3X,2980.00,19800.00,,https://page.auctions.yahoo.co.jp/jp/auction/b415692938,2084041624,〓 Appearance beautiful Teleconverter 〓 Nikon Nikon Tele Converter TC-E3ED 3X,Appearance Teleconverter Nikon Nikon Tele Converter TCE3ED 3X,外観 テレコン バーター ニコン Tele Converter TC 3 ED 3
16,★極上美品!!★ニコン NIKON AF-S NIKKOR 70-200mm F4G ED VR !!★非常にきれいな外観!! クリアな光学系!! AF動作も完璧!!#723,40000.00,81800.00,,https://page.auctions.yahoo.co.jp/jp/auction/b416331644,2084261684,"<!DOCTYPE html><html><head><link rel=""shortcut icon"" href=""//ssl.gstatic.com/docs/script/images/favicon.ico""><title>エラー</title><style type=""text/css"">body {background-color: #fff; margin: 0; padding: 0;}.errorMessage {font-family: Arial,sans-serif; font-size: 12pt; font-weight: bold; line-height: 150%; padding-top: 25px;}</style></head><body style=""margin:20px""><div><img alt=""Google Apps Script"" src=""//ssl.gstatic.com/docs/script/images/logo.png""></div><div style=""text-align:center;font-family:monospace;margin:50px auto 0;max-width:600px"">無効な引数: source（行 3、ファイル「コード」、プロジェクト「Translation」）</div></body></html>",DOCTYPE relshortcut icon hrefsslgstaticcomdocsscriptimagesfaviconicotitletitlestyle typetextcssbody backgroundcolor fff margin 0 padding 0errorMessage Arialsansserif fontsize fontweight lineheight 150 paddingtop 25pxstyleheadbody stylemargin20pxdivimg altGoogle Apps Script srcsslgstaticcomdocsscriptimageslogopngdivdiv auto 0maxwidth600px source 3Translationdivbodyhtml,極上 美品 ニコン NIKON AF NIKKOR 70 200 mm 4 ED VR 外観 光学系 AF 動作 723
17,◆初心者入門＆付属品多数◆ Nikon ニコン D70 超望遠Ｗズームレンズセット,1.00,31300.00,,https://page.auctions.yahoo.co.jp/jp/auction/r350353018,2084261636,◆ Introduction to beginners and many accessories ◆ Nikon Nikon D70 Super telephoto W zoom lens set,Introduction beginners accessories Nikon Nikon D70 Super telephoto W zoom lens,初心者 入門 付属品 多数 Nikon ニコン 70 超 望遠 ズームレンズ セット
18,ニコン Nikon FE - シルバー ボディ マニュアルフォーカス / MF一眼レフ カメラ + MD-12、ハンドグリップ付き [3062818],4600.00,36800.00,,https://page.auctions.yahoo.co.jp/jp/auction/x647253303,2084044778,Nikon Nikon FE-Silver Body Manual Focus / MF SLR Camera MD-12 with Hand Grip [3062818],Nikon Nikon FESilver Body Manual Focus MF SLR Camera MD12 Hand Grip 3062818,ニコン Nikon FE シルバー ボディ マニュアル フォーカス MF 一 眼 レフ カメラ MD 12 ハンド グリップ 付き 3062818
19,■得々■Nikon/ニコン/光学顕微鏡/OPTIPHOTO/オプチフォト/正立型/金属顕微鏡＆カメラ＆撮影装置/実験/研究/ラボ/対物レンズ（5本）/10,85320.00,,,https://page.auctions.yahoo.co.jp/jp/auction/k387438800,2084045044,■ Tokutoku ■ Nikon / Nikon / Optical microscope / OPTIPHOTO / Optical photo / Erecting type / Metal microscope & Camera & Camera / Experiment / Research / Lab / Objective lens (5) / 10,Tokutoku Nikon Nikon Optical microscope OPTIPHOTO photo type Metal microscope Camera Camera Experiment Research Lab lens 5 10,得々 Nikon ニコン 光学 顕微鏡 OPTI PHOTO オプチ フォト 正立 型 金属 顕微鏡 カメラ 撮影 装置 実験 研究 ラボ 対物 レンズ 5 本 10
0,Nikon ニコン 純正 NIKKOR 50mm MF 高級単焦点レンズ 1:1.4 作動品,5250.00,,,https://page.auctions.yahoo.co.jp/jp/auction/c759700739,2084261693,Nikon Nikon Genuine NIKKOR 50mm MF High-quality single focus lens 1: 1.4,Nikon Nikon Genuine NIKKOR 50 mm MF Highquality focus lens 1 14,Nikon ニコン 純正 NIKKOR 50 mm MF 高級 単 焦点 レンズ 1 1 4 作動 品
1,ニコン ニッコール Nikon AF NIKKOR 85mm F1.8 D オートフォーカス / AF レンズ [449030],5251.00,38800.00,,https://page.auctions.yahoo.co.jp/jp/auction/g373054424,2084261684,Nikon Nikkor Nikon AF NIKKOR 85mm F1.8 D Autofocus / AF lens [449030],Nikon Nikkor Nikon AF NIKKOR 85 mm F18 D Autofocus AF lens 449030,ニコン ニッコール Nikon AF NIKKOR 85 mm 1 8 オートフォーカス AF レンズ 449030
2,ニコン 日本光学 ニッコール Nippon Kogaku Japan Nikon NIKKOR-S Auto 50mm F1.4 マニュアルフォーカス/MF 単焦点 レンズ [846164],3200.00,19800.00,,https://page.auctions.yahoo.co.jp/jp/auction/k411942292,2084261697,Nikon Nihon Kogaku Japan Nikon NIKKOR-S Auto 50mm F1.4 Manual focus / MF single focus lens [846164],Nikon Nihon Kogaku Japan Nikon NIKKORS Auto 50 mm F14 Manual focus MF focus lens 846164,ニコン 日本 光学 ニッコール Nippon Kogaku Japan Nikon NIKKOR 50 mm F 1 . 4 マニュアル フォーカス MF 単 焦点 レンズ 846164
3,ニコン ニッコール Nikon AF NIKKOR 24-120mm F3.5-5.6 D オートフォーカス/AF 一眼 レンズ [263230],2600.00,19800.00,,https://page.auctions.yahoo.co.jp/jp/auction/x646804496,2084261684,Nikon Nikkor Nikon AF NIKKOR 24-120mm F3.5-5.6 D Autofocus / AF single lens [263230],Nikon Nikkor Nikon AF NIKKOR 24120 mm F3556 D Autofocus AF lens 263230,ニコン ニッコール Nikon AF NIKKOR 24 120 mm F 3 5 5 . 6 オートフォーカス AF 一 眼 レンズ 263230
4,Nikon ニコン純正 Zoom-NIKKOR 35-70mm MF 高級ズームレンズ 1:3.5 希少な作動品 (Ai),900.00,,,https://page.auctions.yahoo.co.jp/jp/auction/d388610547,2084261693,Nikon Nikon genuine Zoom-NIKKOR 35-70mm MF High-end zoom lens 1: 3.5 Rare working product (Ai),Nikon Nikon ZoomNIKKOR 3570 mm MF Highend zoom lens 1 35 Rare working product Ai,Nikon ニコン Zoom NIKKOR 35 70 mm MF 高級 ズームレンズ 3 5 作動 品 Ai
5,ジャンク扱い カメラ デジタル一眼/レンズ付きボディ レトロ ニコン FE/キャノン EOS/ミノルタ/オリンパス＆レンズ&ストロボなど 20点以上,6550.00,,,https://page.auctions.yahoo.co.jp/jp/auction/d387778998,23660,Junk treatment Camera Digital SLR / Body with lens Retro Nikon FE / Canon EOS / Minolta / Olympus & Lens,Junk treatment Camera Digital SLR Body lens Retro Nikon FE Canon EOS Minolta Olympus Lens,ジャンク 扱い カメラ デジタル 一 眼 レンズ 付き ボディ レトロ ニコン FE キャノン EOS ミノルタ オリンパス レンズ ストロボ 20 点 以上
6,★極上美品★ NIKON ニコン F2 フォトミックA ボディ ブラック 付属品付★非常に綺麗な外観! カビ・クモリなし! 動作確認済 D007,31900.00,59800.00,,https://page.auctions.yahoo.co.jp/jp/auction/w337593936,2084044778,★ Superb Beauty ★ NIKON Nikon F2 Photomic A Body Black With Accessories ★ Very Beautiful Appearance! No Mold / Spider! Operation Confirmed D007,Superb Beauty NIKON Nikon F2 Photomic A Body Black Accessories Appearance Mold Spider Operation Confirmed,極上 美品 NIKON ニコン F 2 フォトミック ボディ ブラック 付属品 付 外観 カビ クモリ なし 動作 確認 済 007
7,〓外観綺麗 フード付〓Nikon ニコン AF-S 55-200 F4-5.6 VR,3980.00,19800.00,,https://page.auctions.yahoo.co.jp/jp/auction/g373944563,2084261684,〓Beautiful appearance with hood〓Nikon Nikon AF-S 55-200 F4-5.6 VR,appearance hoodNikon Nikon AFS 55200 F456 VR,外観 フード 付 Nikon ニコン AF S 55 200 F 4- 5. 6 VR
8,〓外観綺麗〓ニコン Nikon ZOOM Ai-s NIKKOR 100-300mm F5.6,2980.00,19800.00,,https://page.auctions.yahoo.co.jp/jp/auction/t673458721,2084261693,〓 Nikon ZOOM Ai-s NIKKOR 100-300mm F5.6,Nikon ZOOM Ais NIKKOR 100300 mm F56,外観 ニコン Ai NIKKOR 100 300 mm F5 6
9,〓外観非常に綺麗〓ニコン Nikon ニコン D80,4980.00,24800.00,,https://page.auctions.yahoo.co.jp/jp/auction/d345290195,2084261636,〓Appearance is very beautiful〓 Nikon Nikon D80,Appearance Nikon Nikon D80,外観 ニコン Nikon ニコン 80
10,〓フード付の望遠レンズ付き〓ニコン　NIkon D80,7980.00,19800.00,,https://page.auctions.yahoo.co.jp/jp/auction/t674338366,2084261636,〓Nikon D80 with a hood with a telephoto lens,Nikon D80 hood telephoto lens,フード 付 望遠 レンズ 付き ニコン NIkon 80
11,〓レリーズたった数4773回 レンズ付〓Nikon ニコン D80 付属品完備,12980.00,34800.00,,https://page.auctions.yahoo.co.jp/jp/auction/v638605556,2084261636,〓Release only 4773 times 〓Nikon Nikon D80 with accessories,4773 times Nikon Nikon D80 accessories,レリーズ 数 4773 回 レンズ 付 Nikon ニコン 80 付属品 完備
12,★新品同様!!★ニコン NIKON D500 トリプルレンズセット★標準・望遠・単焦点!!新品と見間違う外観!!透き通る程クリアなファインダー!!#756,30000.00,174800.00,,https://page.auctions.yahoo.co.jp/jp/auction/x647432903,2084261636,"<!DOCTYPE html><html><head><link rel=""shortcut icon"" href=""//ssl.gstatic.com/docs/script/images/favicon.ico""><title>エラー</title><style type=""text/css"">body {background-color: #fff; margin: 0; padding: 0;}.errorMessage {font-family: Arial,sans-serif; font-size: 12pt; font-weight: bold; line-height: 150%; padding-top: 25px;}</style></head><body style=""margin:20px""><div><img alt=""Google Apps Script"" src=""//ssl.gstatic.com/docs/script/images/logo.png""></div><div style=""text-align:center;font-family:monospace;margin:50px auto 0;max-width:600px"">無効な引数: source（行 3、ファイル「コード」、プロジェクト「Translation」）</div></body></html>",DOCTYPE relshortcut icon hrefsslgstaticcomdocsscriptimagesfaviconicotitletitlestyle typetextcssbody backgroundcolor fff margin 0 padding 0errorMessage Arialsansserif fontsize fontweight lineheight 150 paddingtop 25pxstyleheadbody stylemargin20pxdivimg altGoogle Apps Script srcsslgstaticcomdocsscriptimageslogopngdivdiv auto 0maxwidth600px source 3Translationdivbodyhtml,新品 ニコン NIKON D 500 トリプル レンズ セット 標準 望遠 単 焦点 新品 間違う 外観 ファインダー 756
13,〓人気レンズ〓ニコン Nikon AF-S DX 18-200 F3.5-5.6G VR ED Ⅱ2型,12980.00,34800.00,,https://page.auctions.yahoo.co.jp/jp/auction/p691644626,2084261684,〓 Popular lens 〓 Nikon Nikon AF-S DX 18-200 F3.5-5.6G VR ED Ⅱ type 2,lens Nikon Nikon AFS DX 18200 F3556 G VR ED type 2,人気 レンズ ニコン Nikon AF DX 18- 200 F 3 5 5 6 VR ED Ⅱ2 型
14,〓人気レンズ〓シグマ 28-105 F2.8-4　D ニコン用,2480.00,14800.00,,https://page.auctions.yahoo.co.jp/jp/auction/e381312185,2084261684,〓 Popular lens 〓 Sigma 28-105 F2.8-4 D for Nikon,lens Sigma 28105 F284 D Nikon,人気 レンズ 28- 105 F 2 8 4 ニコン 用
15,〓人気カメラ〓Nikon ニコン COOLPIX P7700,13980.00,34800.00,,https://page.auctions.yahoo.co.jp/jp/auction/u302776520,2084261644,〓Popular camera 〓Nikon Nikon COOLPIX P7700,camera Nikon Nikon COOLPIX P7700,人気 カメラ Nikon ニコン COOLPIX 7700
16,〓望遠レンズ付き〓Nikon ニコン D300,17980.00,34800.00,,https://page.auctions.yahoo.co.jp/jp/auction/w332877257,2084261636,〓 Nikon Nikon D300 with telephoto lens,Nikon Nikon D300 telephoto lens,望遠 レンズ 付き Nikon ニコン D3 00
17,Nikon ニコン　Li-ion リチャージャブルバッテリー　EN-EL15b　　Z6 Z7 D850,3550.00,,,https://page.auctions.yahoo.co.jp/jp/auction/419747929,2084261636,Nikon Nikon Li-ion Rechargeable Battery EN-EL15b Z6 Z7 D850,Nikon Nikon Liion Rechargeable Battery ENEL15b Z6 Z7 D850,Nikon ニコン Li リチャージャブル バッテリー EN EL 15 6 7 850
18,★ハローカメラ★ 5147 珍品 日本光学 ズーム ファインダー 35-135 NIPPON KOGAKU 革ケース付 難有り 動作品 即決あり,16200.00,27000.00,,https://page.auctions.yahoo.co.jp/jp/auction/418035632,2084204375,★ Hello Camera ★ 5147 Rare items Nippon Optical Zoom Finder 35-135 NIPPON KOGAKU With leather case,Camera 5147 Rare items Nippon Optical Zoom Finder 35135 NIPPON KOGAKU leather case,ハロー カメラ 5147 珍品 日本 光学 ファインダー 35 135 NIPPON KOGAKU 革 ケース 付 難 動作 品
19,〓外観綺麗〓ニコン Nikon Ai-s Zoom NIKKOR 28-50mm F3.5,9980.00,24800.00,,https://page.auctions.yahoo.co.jp/jp/auction/v652964371,2084261693,Nikon Ai-s Zoom NIKKOR 28-50mm F3.5,Nikon Ais Zoom NIKKOR 2850 mm F35,外観 ニコン Nikon Ai- Zoom NIKKOR 28 50 mm F3 5
0,〓レリーズ数たった579回 望遠レンズ付き〓ニコン Nikon D50,9980.00,24800.00,,https://page.auctions.yahoo.co.jp/jp/auction/g358494516,2084261636,579Release number 579 times 〓Nikon Nikon D50 with telephoto lens,579Release number 579 times Nikon Nikon D50 telephoto lens,数 579 回 望遠 レンズ 付き ニコン Nikon 50
1,★希少銘玉★ニコン Nikon Ai 135mm F2.8♯1510,5000.00,16800.00,,https://page.auctions.yahoo.co.jp/jp/auction/k412047698,2084261693,★ Rare inscription ★ Nikon Nikon Ai 135mm F2.8♯1510,inscription Nikon Nikon Ai 135 mm F281510,銘 玉 ニコン Ai 135 mm 8 1510
2,〓人気レンズ〓ニコン NIKON Ai NIKKOR-Q AUTO 200m F4,2480.00,19800.00,,https://page.auctions.yahoo.co.jp/jp/auction/j584298423,2084261693,〓 Popular lens 〓 Nikon NIKON Ai NIKKOR-Q AUTO 200m F4,lens Nikon NIKON Ai NIKKORQ AUTO 200 m F4,人気 レンズ ニコン NIKON Ai NIKKOR AUTO 200 m 4
3,〓人気品〓Nikon ニコン SB-24 スピードライト フラッシュ,1480.00,14800.00,,https://page.auctions.yahoo.co.jp/jp/auction/n369922880,2084261969,〓Popular Products〓Nikon Nikon SB-24 Speedlight Flash,Popular ProductsNikon Nikon SB24 Speedlight Flash,人気 品 Nikon ニコン SB 24 スピードライト フラッシュ
4,〓外観綺麗〓ニコン Nikon Tele Converter TC-E2 2x テレコンバーター,3980.00,19800.00,,https://page.auctions.yahoo.co.jp/jp/auction/t674121606,2084041624,Nikon Tele Converter TC-E2 2x Teleconverter,Nikon Tele Converter TCE2 2x Teleconverter,外観 ニコン Nikon Tele Converter TC 2 2 テレコン バーター
5,〓外観綺麗　三脚座付〓ニコン Nikon ED AF NIKKOR 300mm F4,29980.00,49800.00,,https://page.auctions.yahoo.co.jp/jp/auction/n326180925,2084261684,〓 Appearance beautiful Nikon with tripod seat Nikon ED AF NIKKOR 300mm F4,Appearance Nikon tripod seat Nikon ED AF NIKKOR 300 mm F4,外観 三脚 座付 ニコン ED AF NIKKOR 300 mm 4
6,〓人気カメラ〓ニコン Nikon FG,2980.00,14800.00,,https://page.auctions.yahoo.co.jp/jp/auction/q311399735,2084044778,〓Popular camera 〓Nikon FG,camera Nikon FG,人気 カメラ ニコン Nikon FG
7,〓外観綺麗〓Nikon ニコン AF-S NIKKOR 17-35mm F2.8D ED,44980.00,74800.00,,https://page.auctions.yahoo.co.jp/jp/auction/s677298562,2084261684,Nikon Nikon AF-S NIKKOR 17-35mm F2.8D ED,Nikon Nikon AFS NIKKOR 1735 mm ED,外観 Nikon ニコン AF NIKKOR 17 35 mm F2 8 ED
8,〓レリーズ数7252回　超望遠300㎜レンズ付き〓ニコン Nikon D70,5980.00,19800.00,,https://page.auctions.yahoo.co.jp/jp/auction/b414015324,2084261636,〓Release number 7252 times 〓Nikon D70 with super-telephoto 300㎜ lens,number 7252 times Nikon D70 supertelephoto 300 lens,数 7252 回 超 望遠 300 ㎜ レンズ 付き ニコン Nikon 70
9,〓非常に綺麗 フード 三脚座付〓ニコン Nikon AF NIKKOR 80-200 F2.8 D ED NEW,32980.00,69800.00,,https://page.auctions.yahoo.co.jp/jp/auction/u244611210,2084261684,〓 Nikon AF NIKKOR 80-200 F2.8 D ED NEW,Nikon AF NIKKOR 80200 F28 D ED NEW,フード 三脚 座付 ニコン Nikon AF NIKKOR 80 F2 8 ED NEW
10,〓全く出回っていない希少レンズ〓日本光学 NIKKOR-T 105mm F4 ケース フード付,39980.00,79800.00,,https://page.auctions.yahoo.co.jp/jp/auction/n272896754,2084261693,希 Rare lens that is not on the market 〓 Nihon Kogaku NIKKOR-T 105mm F4 case with hood,lens market Nihon Kogaku NIKKORT 105 mm F4 case hood,レンズ 日本 光学 NIKKOR 105 mm 4 ケース フード 付
