,Unnamed: 0,Title,CurrentPrice,BidOrBuy,shopName,ItemUrl,CategoryId,en_Title,en_short_Title
101,1,◆初心者入門＆付属品多数◆ Nikon ニコン D70 超望遠Ｗズームレンズセット,410.0,31800.0,,https://auctions.yahooapis.jp/AuctionWebService/V2/auctionItem?auctionID=h422565952,2084261636,◆ Introduction to beginners and many accessories ◆ Nikon Nikon D70 Super telephoto W zoom lens set,Introduction beginners accessories Nikon Nikon D70 Super telephoto W zoom lens
102,2,★送料一律★Nikon F3 一眼フィルムカメラ レンズ NIKKOR 35mm 1:1.4 データバック:MF-14 シャッターOK ニコン 中古現状品 91N3200,36288.0,,,https://auctions.yahooapis.jp/AuctionWebService/V2/auctionItem?auctionID=u302683909,2084044778,★ postage uniform ★ Nikon F3 single-lens film camera lens NIKKOR 35mm 1: 1.4 Data back: MF-14 Shutter OK Nikon Used current product 91N3200,postage uniform Nikon F3 film camera lens NIKKOR 35 mm 1 14 Data MF14 Shutter Nikon product 91N3200
103,3,★☆綺麗です。 ニコン Nikon COOLPIX S3700 2005万画素 WiFi シルバー 《元箱・付属品・8GB SD》☆★,10000.0,10000.0,,https://auctions.yahooapis.jp/AuctionWebService/V2/auctionItem?auctionID=q290635947,2084261644,★ ☆ It is beautiful. Nikon Nikon COOLPIX S3700 2005 million pixel WiFi Silver 《Original box ・ Accessories ・ 8GB SD》 ☆ ★,Nikon Nikon COOLPIX S3700 2005 million pixel WiFi Silver Original box Accessories 8 GB SD
104,4,〓 外観綺麗〓 NIKON ニコン UW-NIKKOR 35mm F2.5,3980.0,19800.0,,https://auctions.yahooapis.jp/AuctionWebService/V2/auctionItem?auctionID=w283415896,2084261693,外 観 Appearance is beautiful NIKON Nikon UW-NIKKOR 35mm F2.5,Appearance NIKON Nikon UWNIKKOR 35 mm F25
105,5,〓非常に綺麗 フード付〓タムロン SP AF 17-50 F2.8 XR DiII VC B005 ニコン用,17980.0,34800.0,,https://auctions.yahooapis.jp/AuctionWebService/V2/auctionItem?auctionID=t666581328,2084261684,〓 very beautiful hooded 〓 Tamron SP AF 17-50 F2.8 XR DiII VC B005 for Nikon,Tamron SP AF 1750 F28 XR DiII VC B005 Nikon
106,6,〓レンズ付き〓Nikon ニコン F4,13980.0,34980.0,,https://auctions.yahooapis.jp/AuctionWebService/V2/auctionItem?auctionID=n358743966,2084044785,〓Nikon Nikon F4 with lens,Nikon Nikon F4 lens
107,7,〓外観綺麗〓Nikon ニコン D600 元箱 付属品多数,51980.0,79800.0,,https://auctions.yahooapis.jp/AuctionWebService/V2/auctionItem?auctionID=j512840645,2084261636,〓 Nikon Nikon D600 original box Many accessories,Nikon Nikon box accessories
108,8,〓レリーズ数たった6320回　非常に綺麗〓Nikon ニコン D5000 レンズ付き,15980.0,39800.0,,https://auctions.yahooapis.jp/AuctionWebService/V2/auctionItem?auctionID=c756953163,2084261636,"〓Release only 6320 times, very beautiful 綺 Nikon Nikon D5000 with lens",6320 times Nikon Nikon lens
109,9,〓非常に綺麗 フード 三脚座付〓ニコン Nikon AF NIKKOR 80-200 F2.8 D ED NEW,32980.0,69800.0,,https://auctions.yahooapis.jp/AuctionWebService/V2/auctionItem?auctionID=u244611210,2084261684,〓 Nikon AF NIKKOR 80-200 F2.8 D ED NEW,Nikon AF NIKKOR 80200 F28 D ED NEW
110,10,★ワンオーナー 完動品★ Nikon ニコン AF ED 80-400mm 4.5-5.6 D VR カビ・クモリなしの光学系！動作絶好調！ ご満足いただけます！ A198,44800.0,63800.0,,https://auctions.yahooapis.jp/AuctionWebService/V2/auctionItem?auctionID=e371822937,2084261684,★ One owner complete work ★ Nikon Nikon AF ED 80-400mm 4.5-5.6 D VR Optical system without mold and spider! Works very well! Satisfied! A198,One owner work Nikon Nikon AF ED 80400 mm 4556 D VR Optical system mold spider Works Satisfied A198
111,11,★奇跡の超美品★ Nikon ニコン AF-S NIKKOR 58mm 1.4 G 外観・光学ともに非常に綺麗なコンディション！ 確実にご満足いただけます！ A252,107800.0,132800.0,,https://auctions.yahooapis.jp/AuctionWebService/V2/auctionItem?auctionID=n367562658,2084261684,★ Miracle Super Beauty ★ Nikon Nikon AF-S NIKKOR 58mm 1.4 G Appearance and optics are very beautiful! You will definitely be satisfied! A252,Miracle Super Beauty Nikon Nikon AFS 58 mm 14 G Appearance optics A252
112,12,★極上品★ Nikon ニコン Ai-s NIKKOR 35mm F2 形状・光学性能ともにバランスがとれた広角35mmレンズ！ 綺麗な外観！ 動作絶好調！ A216,21800.0,34800.0,,https://auctions.yahooapis.jp/AuctionWebService/V2/auctionItem?auctionID=o335511394,2084261693,★ Finest ★ Nikon Nikon Ai-s NIKKOR 35mm F2 Wide-angle 35mm lens with balanced shape and optical performance! Beautiful appearance! Works very well! A216,Finest Nikon Nikon Ais NIKKOR 35 mm F2 Wideangle 35 mm lens shape performance appearance A216
113,13,〓全く出回っていない希少レンズ〓日本光学 NIKKOR-T 105mm F4 ケース フード付,39980.0,79800.0,,https://auctions.yahooapis.jp/AuctionWebService/V2/auctionItem?auctionID=n272896754,2084261693,希 Rare lens that is not on the market 〓 Nihon Kogaku NIKKOR-T 105mm F4 case with hood,lens market Nihon Kogaku NIKKORT 105 mm F4 case hood
114,14,〓レリーズ数7252回　超望遠300㎜レンズ付き〓ニコン Nikon D70,5980.0,19800.0,,https://auctions.yahooapis.jp/AuctionWebService/V2/auctionItem?auctionID=b414015324,2084261636,725Release number 7252 times 〓Nikon D70 with super telephoto 300㎜ lens,725Release number 7252 times Nikon telephoto 300 lens
115,15,★送料一律★Nikon ニコン GN Auto NIKKOR・C 1:2.8 f=45mm ニッコール 単焦点レンズ パンケーキレンズ 中古現状品 91C4183-A,5670.0,,,https://auctions.yahooapis.jp/AuctionWebService/V2/auctionItem?auctionID=r348721334,2084044778,★ postage uniform ★ Nikon Nikon GN Auto NIKKOR · C 1: 2.8 f = 45mm Nikkor single focus lens pancake lens used current product 91C4183-A,postage uniform Nikon Nikon GN Auto NIKKOR C 1 28 f 45 mm Nikkor focus lens pancake lens product 91C4183A
116,16,〓外観綺麗〓Nikon ニコン AF-S NIKKOR 17-35mm F2.8D ED,44980.0,74800.0,,https://auctions.yahooapis.jp/AuctionWebService/V2/auctionItem?auctionID=s677298562,2084261684,Nikon Nikon AF-S NIKKOR 17-35mm F2.8D ED,Nikon Nikon AFS NIKKOR 1735 mm ED
117,17,〓人気カメラ〓ニコン Nikon FG,2980.0,14800.0,,https://auctions.yahooapis.jp/AuctionWebService/V2/auctionItem?auctionID=q311399735,2084044778,〓Popular camera 〓Nikon FG,camera Nikon FG
118,18,〓外観綺麗　三脚座付〓ニコン Nikon ED AF NIKKOR 300mm F4,29980.0,49800.0,,https://auctions.yahooapis.jp/AuctionWebService/V2/auctionItem?auctionID=n326180925,2084261684,〓 Appearance beautiful Nikon with tripod seat Nikon ED AF NIKKOR 300mm F4,Appearance Nikon tripod seat Nikon ED AF NIKKOR 300 mm F4
119,19,★1円スタート★Nikon ニコン FM2 一眼レフカメラ フィルムカメラ ★動作未確認品★,10050.0,,,https://auctions.yahooapis.jp/AuctionWebService/V2/auctionItem?auctionID=m358497387,2084044778,★ 1 yen start ★ Nikon Nikon FM2 SLR camera Film camera ★ Unconfirmed operation ★,1 yen start Nikon Nikon FM2 SLR camera Film camera operation
120,0,純正品！Nikonマルチパワーバッテリーパック MB-D10訳有り！値下げ,5880.0,5880.0,,https://auctions.yahooapis.jp/AuctionWebService/V2/auctionItem?auctionID=k408323967,23760,Genuine product! Nikon Multi-Power Battery Pack MB-D10 is available! Price cut,product Nikon MultiPower Battery Pack MBD10 Price cut
121,1,〓人気レンズ〓ニコン NIKON Ai NIKKOR-Q AUTO 200m F4,2480.0,19800.0,,https://auctions.yahooapis.jp/AuctionWebService/V2/auctionItem?auctionID=j584298423,2084261693,〓 Popular lens 〓 Nikon NIKON Ai NIKKOR-Q AUTO 200m F4,lens Nikon NIKON Ai NIKKORQ AUTO 200 m F4
122,2,★奇跡のワンオーナー 超美品★ COSINA コシナ Carl Zeiss Makro Planar 2 100mm ZF.2 T* ニコン用 外観・光学ともに非常に綺麗！ A236,127800.0,142800.0,,https://auctions.yahooapis.jp/AuctionWebService/V2/auctionItem?auctionID=414601731,2084261693,★ Miracle One Owner Super Beauty Item ★ COSINA Cosina Carl Zeiss Makro Planar 2 100mm ZF.2 T * For Nikon The appearance and optics are very beautiful! A236,Miracle One Owner Super Beauty Item COSINA Cosina Carl Zeiss Makro Planar 2 100 mm ZF2 T Nikon appearance optics A236
123,3,〓レリーズ数たった579回 望遠レンズ付き〓ニコン Nikon D50,9980.0,24800.0,,https://auctions.yahooapis.jp/AuctionWebService/V2/auctionItem?auctionID=g358494516,2084261636,579Release number 579 times 〓Nikon Nikon D50 with telephoto lens,579Release number 579 times Nikon Nikon D50 telephoto lens
124,4,〓外観綺麗〓ニコン Nikon Ai-s Zoom NIKKOR 28-50mm F3.5,9980.0,24800.0,,https://auctions.yahooapis.jp/AuctionWebService/V2/auctionItem?auctionID=v652964371,2084261693,Nikon Ai-s Zoom NIKKOR 28-50mm F3.5,Nikon Ais Zoom NIKKOR 2850 mm F35
125,5,〓外観綺麗 レンズ付き〓ニコン NIKON D80,12980.0,34800.0,,https://auctions.yahooapis.jp/AuctionWebService/V2/auctionItem?auctionID=o306341325,2084261636,〓Appearance beautiful 〓Nikon NIKON D80 with lens,Appearance Nikon NIKON D80 lens
126,6,★いろいろ付属★使用感激低★超極上美品★ Nikon F100 ボディ 元箱、説明書、純正赤黒PROFESSIONALストラップなどいろいろ付属 #OK567,22080.0,22580.0,,https://auctions.yahooapis.jp/AuctionWebService/V2/auctionItem?auctionID=g362541370,2084044785,"<!DOCTYPE html><html><head><link rel=""shortcut icon"" href=""//ssl.gstatic.com/docs/script/images/favicon.ico""><title>エラー</title><style type=""text/css"">body {background-color: #fff; margin: 0; padding: 0;}.errorMessage {font-family: Arial,sans-serif; font-size: 12pt; font-weight: bold; line-height: 150%; padding-top: 25px;}</style></head><body style=""margin:20px""><div><img alt=""Google Apps Script"" src=""//ssl.gstatic.com/docs/script/images/logo.png""></div><div style=""text-align:center;font-family:monospace;margin:50px auto 0;max-width:600px"">無効な引数: source（行 3、ファイル「コード」、プロジェクト「Translation」）</div></body></html>",DOCTYPE relshortcut icon hrefsslgstaticcomdocsscriptimagesfaviconicotitletitlestyle typetextcssbody backgroundcolor fff margin 0 padding 0errorMessage Arialsansserif fontsize fontweight lineheight 150 paddingtop 25pxstyleheadbody stylemargin20pxdivimg altGoogle Apps Script srcsslgstaticcomdocsscriptimageslogopngdivdiv auto 0maxwidth600px source 3Translationdivbodyhtml
127,7,〓望遠レンズ付き〓Nikon ニコン D300,17980.0,34800.0,,https://auctions.yahooapis.jp/AuctionWebService/V2/auctionItem?auctionID=w332877257,2084261636,〓 Nikon Nikon D300 with telephoto lens,Nikon Nikon D300 telephoto lens
128,8,R▽【USED】1円スタート！Nikon ニコン 一眼レフ フィルムカメラ F4 ボディ/レンズ/ストロボ/バッグ 4点セット,3910.0,,,https://auctions.yahooapis.jp/AuctionWebService/V2/auctionItem?auctionID=c758061904,2084044785,R ▽ [USED] Starts 1 yen! Nikon Nikon SLR film camera F4 body / lens / strobe / bag 4-piece set,R Starts 1 yen Nikon Nikon SLR film camera F4 body lens strobe bag 4piece set
129,9,★極上品★ Nikon ニコン ED AF-S NIKKOR 70-300mm 4.5-5.6 G VR カビ・クモリなしの光学系！動作絶好調！ 人気の望遠ズームレンズ！ A146,19800.0,34800.0,,https://auctions.yahooapis.jp/AuctionWebService/V2/auctionItem?auctionID=m344197565,2084261684,★ Finest ★ Nikon Nikon ED AF-S NIKKOR 70-300mm 4.5-5.6 G VR Optical system without mold and spider! Works very well! Popular telephoto zoom lens! A146,Finest Nikon Nikon ED AFS NIKKOR 70300 mm 4556 G VR Optical system mold spider Works Popular telephoto lens A146
130,10,★ワンオーナー 奇跡の超美品★ Nikon ニコン AF-S 24-70mm 2.8 G ED おまけ付き！ 外観・光学ともに非常に綺麗なコンディション！ A194,92800.0,108800.0,,https://auctions.yahooapis.jp/AuctionWebService/V2/auctionItem?auctionID=406070625,2084261684,★ One owner Miracle super beauty ★ Nikon Nikon AF-S 24-70mm 2.8 G ED With bonus! The appearance and optics are very beautiful! A194,One owner Miracle beauty Nikon Nikon AFS 2470 mm 28 G ED bonus appearance optics A194
131,11,送料無料 新品 ニコン AF-S NIKKOR 16-35mm F4G ED VR,99800.0,,,https://auctions.yahooapis.jp/AuctionWebService/V2/auctionItem?auctionID=t673436314,2084261684,Free shipping New Nikon AF-S NIKKOR 16-35mm F4G ED VR,shipping New Nikon AFS NIKKOR 1635 mm F4 G ED VR
132,12,★極上美品★ニコン NIKON NEW NIKKOR 105mm F2.5 #3425,7800.0,7980.0,,https://auctions.yahooapis.jp/AuctionWebService/V2/auctionItem?auctionID=k411383600,2084261693,"<!DOCTYPE html><html><head><link rel=""shortcut icon"" href=""//ssl.gstatic.com/docs/script/images/favicon.ico""><title>エラー</title><style type=""text/css"">body {background-color: #fff; margin: 0; padding: 0;}.errorMessage {font-family: Arial,sans-serif; font-size: 12pt; font-weight: bold; line-height: 150%; padding-top: 25px;}</style></head><body style=""margin:20px""><div><img alt=""Google Apps Script"" src=""//ssl.gstatic.com/docs/script/images/logo.png""></div><div style=""text-align:center;font-family:monospace;margin:50px auto 0;max-width:600px"">無効な引数: source（行 3、ファイル「コード」、プロジェクト「Translation」）</div></body></html>",DOCTYPE relshortcut icon hrefsslgstaticcomdocsscriptimagesfaviconicotitletitlestyle typetextcssbody backgroundcolor fff margin 0 padding 0errorMessage Arialsansserif fontsize fontweight lineheight 150 paddingtop 25pxstyleheadbody stylemargin20pxdivimg altGoogle Apps Script srcsslgstaticcomdocsscriptimageslogopngdivdiv auto 0maxwidth600px source 3Translationdivbodyhtml
133,13,〓非常に綺麗〓Nikon ニコン モータードライブ MD-2 バッテリーパック MB-1,17980.0,34800.0,,https://auctions.yahooapis.jp/AuctionWebService/V2/auctionItem?auctionID=h422280619,2084044778,KonNikon Nikon Motor Drive MD-2 Battery Pack MB-1,KonNikon Nikon Motor Drive MD2 Battery Pack MB1
134,14,〓人気カメラ〓Nikon ニコン COOLPIX P7700,13980.0,34800.0,,https://auctions.yahooapis.jp/AuctionWebService/V2/auctionItem?auctionID=u302776520,2084261644,〓Popular camera 〓Nikon Nikon COOLPIX P7700,camera Nikon Nikon COOLPIX P7700
135,15,純正新品！Nikon Li-ion リチャージャブルバッテリー EN-EL10,1780.0,1780.0,,https://auctions.yahooapis.jp/AuctionWebService/V2/auctionItem?auctionID=f354007870,2084261672,Genuine new article! Nikon Li-ion Rechargeable Battery EN-EL10,article Nikon Liion Rechargeable Battery ENEL10
136,16,〓外観綺麗〓ニコン Nikon ZOOM Ai-s NIKKOR 100-300mm F5.6,2980.0,19800.0,,https://auctions.yahooapis.jp/AuctionWebService/V2/auctionItem?auctionID=t673458721,2084261693,〓 Nikon ZOOM Ai-s NIKKOR 100-300mm F5.6,Nikon ZOOM Ais NIKKOR 100300 mm F56
137,17,純正品未使用！NIKON ニコン 純正 EN-EL19 バッテリー　訳あり,1280.0,1280.0,,https://auctions.yahooapis.jp/AuctionWebService/V2/auctionItem?auctionID=r342290447,2084261672,Genuine product unused! NIKON Nikon Genuine EN-EL19 Battery In translation,product NIKON Nikon Genuine ENEL19 Battery translation
138,18,〓極美級〓 ★ トキナー TOKINA AT-X 80-400mm F4.5-5.6D ニコン用 ★,23800.0,26800.0,,https://auctions.yahooapis.jp/AuctionWebService/V2/auctionItem?auctionID=g364600385,2084261684,〓Extreme Beauty Class ★ Tokina TOKINA AT-X 80-400mm F4.5-5.6D For Nikon ★,Extreme Beauty Class Tokina TOKINA ATX 80400 mm F4556D Nikon
139,19,〓極美級〓 ★ ニコン Nikon D610 超望遠 Wレンズセット ★ ダブルレンズセット ♪,76800.0,82800.0,,https://auctions.yahooapis.jp/AuctionWebService/V2/auctionItem?auctionID=w334326330,2084261636,Nikon Nikon D610 Super telephoto W lens set ★ Double lens set ♪,Nikon Nikon D610 Super telephoto W lens lens
140,0,〓至高の名機〓 ★ ニコン Nikon F3 + Ai-s 28mm F2.8 ＆ モータードライブ付　★,24800.0,28800.0,,https://auctions.yahooapis.jp/AuctionWebService/V2/auctionItem?auctionID=o328170736,2084044778,〓 Supreme masterpiece 〓 ★ Nikon Nikon F3 Ai-s 28mm F2.8 & with motor drive ★,Supreme masterpiece Nikon Nikon F3 Ais 28 mm F28 motor drive
141,1,〓新品級〓 ニコン Nikon D7500 超望遠 Wレンズセット ★　ダブルレンズセット　♪,104800.0,108800.0,,https://auctions.yahooapis.jp/AuctionWebService/V2/auctionItem?auctionID=f369522781,2084261636,〓 New grade 〓 Nikon Nikon D7500 Super telephoto W lens set ★ Double lens set ♪,grade Nikon Nikon D7500 Super telephoto W lens lens
142,2,〓AF不良〓 ★ ニコン Nikon Ai AF-S ED 28-70mm F2.8D ★,24800.0,27800.0,,https://auctions.yahooapis.jp/AuctionWebService/V2/auctionItem?auctionID=c758286870,2084261693,〓 AF failure 〓 ★ Nikon Nikon Ai AF-S ED 28-70mm F2.8D ★,AF failure Nikon Nikon Ai AFS ED 2870 mm
143,3,〓超美級〓 ニコン Nikon NIKKOR-P 600mm F5.6　♪,23800.0,27800.0,,https://auctions.yahooapis.jp/AuctionWebService/V2/auctionItem?auctionID=s661699570,2084261693,〓Super beauty class Nikon Nikon NIKKOR-P 600mm F5.6 ♪,beauty class Nikon Nikon NIKKORP 600 mm F56
144,4,★即決★価格交渉あり★ニコン Nikon DP-1フォトミックファインダー F２用☆＃2952,9980.0,9980.0,,https://auctions.yahooapis.jp/AuctionWebService/V2/auctionItem?auctionID=j589456749,2084044778,★ prompt decision ★ price negotiations ★ Nikon Nikon DP-1 photomic finder for F2 ☆ # 2952,decision price negotiations Nikon Nikon DP1 finder F2 2952
145,5,★即決★値下げ交渉あり★ニコン Nikon Ai 50mm F1.8★単焦点レンズ★＜フィルター、前後キャップ＞#2547,9780.0,9780.0,,https://auctions.yahooapis.jp/AuctionWebService/V2/auctionItem?auctionID=r341841437,2084261693,"<!DOCTYPE html><html><head><link rel=""shortcut icon"" href=""//ssl.gstatic.com/docs/script/images/favicon.ico""><title>エラー</title><style type=""text/css"">body {background-color: #fff; margin: 0; padding: 0;}.errorMessage {font-family: Arial,sans-serif; font-size: 12pt; font-weight: bold; line-height: 150%; padding-top: 25px;}</style></head><body style=""margin:20px""><div><img alt=""Google Apps Script"" src=""//ssl.gstatic.com/docs/script/images/logo.png""></div><div style=""text-align:center;font-family:monospace;margin:50px auto 0;max-width:600px"">無効な引数: source（行 3、ファイル「コード」、プロジェクト「Translation」）</div></body></html>",DOCTYPE relshortcut icon hrefsslgstaticcomdocsscriptimagesfaviconicotitletitlestyle typetextcssbody backgroundcolor fff margin 0 padding 0errorMessage Arialsansserif fontsize fontweight lineheight 150 paddingtop 25pxstyleheadbody stylemargin20pxdivimg altGoogle Apps Script srcsslgstaticcomdocsscriptimageslogopngdivdiv auto 0maxwidth600px source 3Translationdivbodyhtml
146,6,☆フイルム現像 CD入力　 新現像機 導入 さらに安心！ 高品質☆,200.0,200.0,,https://auctions.yahooapis.jp/AuctionWebService/V2/auctionItem?auctionID=x646149148,2084044778,☆ Film development CD input New development machine introduced High quality ☆,Film development CD input development machine quality
147,7,★即決★価格交渉あり★ニコン Nikon Ai-S Micro NIKKOR 105mm F2.8 単焦点レンズ ★＜フィルター、前キャップ＞＃2950,27800.0,27800.0,,https://auctions.yahooapis.jp/AuctionWebService/V2/auctionItem?auctionID=k407735926,2084261693,"★ Prompt decision ★ There is price negotiation ★ Nikon Nikon Ai-S Micro NIKKOR 105mm F2.8 single focus lens ★ <Filter, front cap> # 2950",decision price negotiation Nikon Nikon AiS Micro NIKKOR 105 mm F28 focus lens Filter cap 2950
148,8,■Nikon Zoom - NIKKOR 80-200mm F4.5 　オリーブペイント,1.0,,,https://auctions.yahooapis.jp/AuctionWebService/V2/auctionItem?auctionID=t672866015,2084261693,■ Nikon Zoom-NIKKOR 80-200mm F4.5 Olive Paint,Nikon ZoomNIKKOR 80200 mm F45 Olive Paint
149,9,【美品・付属品完備】Nikon ニコン テレコンバーター AF-S TELECONVERTER TC-14E II 354,24500.0,24500.0,,https://auctions.yahooapis.jp/AuctionWebService/V2/auctionItem?auctionID=b409842133,2084261684,[Goods and accessories complete] Nikon Nikon Teleconverter AF-S TELECONVERTER TC-14E ​​II 354,Goods accessories Nikon Nikon Teleconverter AFS TELECONVERTER II 354
150,10,"★即決★価格交渉あり★ニコン Nikon Coolpix L810＋WIDE ED VR 搭載★光学26倍★1644万画素★マクロ撮影★＜CD-ROM,元箱,メモリー＞＃2994",9980.0,9980.0,,https://auctions.yahooapis.jp/AuctionWebService/V2/auctionItem?auctionID=x645086749,2084261644,"★ Prompt decision ★ There is price negotiation ★ Nikon Nikon Coolpix L810 + WIDE ED VR installed ★ Optical 26 times ★ 16.44 million pixels ★ Macro shooting ★ <CD-ROM, original box, memory> # 2994",decision price negotiation Nikon Nikon Coolpix L810 WIDE ED VR Optical 26 times 1644 million pixels shooting box memory 2994
151,11,ニコン Nikon NIKKOR 50mm F1.4 Ai 単焦点レンズ 美品,4150.0,,,https://auctions.yahooapis.jp/AuctionWebService/V2/auctionItem?auctionID=x645328904,2084261693,Nikon Nikon NIKKOR 50mm F1.4 Ai single focus lens beautiful goods,Nikon Nikon NIKKOR 50 mm F14 Ai focus lens goods
152,12,防水 タフカメラ Nikon COOLPIX W300 中古美品,24000.0,,,https://auctions.yahooapis.jp/AuctionWebService/V2/auctionItem?auctionID=d387618437,2084261644,Waterproof Tough Camera Nikon COOLPIX W300 Used Goods,Waterproof Tough Camera Nikon COOLPIX W300 Goods
153,13,■□ニコン・Nikon★DX★AF-S DX NIKKOR 55-300mm f/4.5-5.6G ED VR □■,4600.0,,,https://auctions.yahooapis.jp/AuctionWebService/V2/auctionItem?auctionID=n369834982,2084261684,Nikon / DX / AF-S DX NIKKOR 55-300mm f / 4.5-5.6G ED VR,Nikon DX AFS DX NIKKOR 55300 mm f 4556 G ED VR
154,14,■□ニコン・Nikon★FX★タムロン★AF70-300mm F/4-5.6 XR Di　A17□■,1800.0,,,https://auctions.yahooapis.jp/AuctionWebService/V2/auctionItem?auctionID=g372572255,2084261684,■ □ Nikon ・ FX ★ Tamron ★ AF70-300mm F / 4-5.6 XR Di A17 □ ■,Nikon FX Tamron AF70300 mm F 456 XR Di A17
155,15,■□ニコン・Nikon★MS-D12 [単3形ホルダー]★マルチパワーバッテリーパック MB-D12用★D810 D810A D800/D800E用★2個有□■,580.0,1580.0,,https://auctions.yahooapis.jp/AuctionWebService/V2/auctionItem?auctionID=j590998302,2084261661,■ □ Nikon ・ Nikon ★ MS-D12 [AA size holder] ★ Multi-power battery pack For MB-D12 ★ D810 D810A For D800 / D800E ★ 2 available □ ■,Nikon Nikon MSD12 AA size holder Multipower battery pack MBD12 D810 D800 D800E 2
156,16,■□ニコン・Nikon★MS-D12EN★マルチパワーバッテリーパック MB-D12用★D810 D810A D800/D800E用□■,580.0,1580.0,,https://auctions.yahooapis.jp/AuctionWebService/V2/auctionItem?auctionID=e382147308,2084261661,■ □ Nikon / Nikon ★ MS-D12EN ★ Multi-Power Battery Pack for MB-D12 ★ D810 D810A D800 / D800E □ ■,Nikon Nikon MSD12EN MultiPower Battery Pack MBD12 D810 D800 D800E
157,17,■□ニコン・Nikon★MS-D14 [単3形ホルダー]★MB-D16、MB-D15、MB-D14用★D750・D610 ・D600・D7200・D7100用□■,580.0,1580.0,,https://auctions.yahooapis.jp/AuctionWebService/V2/auctionItem?auctionID=d388356652,2084261661,"■ □ Nikon ・ Nikon ★ MS-D14 [AA size holder] ★ For MB-D16, MB-D15, MB-D14 ★ For D750 ・ D610 ・ D600 ・ D7200 ・ D7100 □ ■",Nikon Nikon MSD14 AA size holder MBD16 MBD15 MBD14 D750 D610 D600 D7200 D7100
158,18,■□ニコン・Nikon★クイックチャージャーMH-16 (D1 D1H D1x バッテリーEN-4専用)2個有□■,1000.0,4980.0,,https://auctions.yahooapis.jp/AuctionWebService/V2/auctionItem?auctionID=q314704943,2084261661,■ □ Nikon ・ Nikon ★ Quick Charger MH-16 (D1 D1H D1x Battery EN-4 only) 2 available □ ■,Nikon Nikon Quick Charger MH16 D1 D1H D1x Battery 2
159,19,■□ニコン・Nikon★マルチパワーバッテリーパック MB-D10★D300、D700、D300S用□■,790.0,,,https://auctions.yahooapis.jp/AuctionWebService/V2/auctionItem?auctionID=j590998802,2084261661,"■ □ Nikon Multi-Power Battery Pack MB-D10 ★ For D300, D700, D300S □ ■",Nikon MultiPower Battery Pack MBD10 D300 D700 D300S
160,0,NIKON D200 +28-105mm+75-300mm +バッテリーグリップ　　まあまあ健全,12500.0,,,https://auctions.yahooapis.jp/AuctionWebService/V2/auctionItem?auctionID=g371930972,2084261636,NIKON D200 28-105mm 75-300mm Battery Grip OK,NIKON D200 28105 mm 75300 mm Battery Grip
161,1,即決 動作保証 Nikon ニコン AF-S NIKKOR 200-400mm F4G ED VR ケース付き 良品 通常送料無料,261000.0,261000.0,,https://auctions.yahooapis.jp/AuctionWebService/V2/auctionItem?auctionID=b394760266,2084261684,Prompt operation guarantee Nikon Nikon AF-S NIKKOR 200-400mm F4G ED VR with case,operation guarantee Nikon Nikon AFS NIKKOR 200400 mm F4 G ED VR case
162,2,即決 Nikon ニコン Nikon AF-S NIKKOR 70-200mm F2.8G ED VR II 実用品,115000.0,115000.0,,https://auctions.yahooapis.jp/AuctionWebService/V2/auctionItem?auctionID=407159520,2084261684,Prompt decision Nikon Nikon Nikon AF-S NIKKOR 70-200mm F2.8G ED VR II,decision Nikon Nikon Nikon AFS NIKKOR 70200 mm F28 G ED VR II
163,3,NIKON D70+万能tamron　XR DiⅡ　18-200ｍｍ　+シグマAPOmacro　70-300,5500.0,9700.0,,https://auctions.yahooapis.jp/AuctionWebService/V2/auctionItem?auctionID=g372461835,2084261636,NIKON D70 Universal tamron XR DiII 18-200mm Sigma APOmacro 70-300,NIKON D70 Universal tamron XR DiII 18200 mm Sigma APOmacro 70300
164,4,美品◆Nikon D3400 ブラック ボディ◆予備バッテリー付き,16500.0,,,https://auctions.yahooapis.jp/AuctionWebService/V2/auctionItem?auctionID=k410322506,2084261636,Beautiful goods ◆ Nikon D3400 black body ◆ with spare battery,goods Nikon D3400 body battery
