,Unnamed: 0,Title,CurrentPrice,BidOrBuy,shopName,ItemUrl,CategoryId,en_Title,en_short_Title
165,5,【極美品】NIKON D810+24-85 VR セット デジタル一眼レフカメラ,170000.0,170000.0,,https://auctions.yahooapis.jp/AuctionWebService/V2/auctionItem?auctionID=s686175596,2084261636,[Extreme Beauty] NIKON D810 24-85 VR Set Digital SLR Camera,Extreme Beauty NIKON D810 2485 VR Set Digital SLR Camera
166,6,新品 未開封 Nikon COOLSHOT PRO STABILIZED 携帯型 レーザー 距離計 ニコン クールショット ゴルフ,30501.0,,,https://auctions.yahooapis.jp/AuctionWebService/V2/auctionItem?auctionID=g372969167,2084063253,New goods not opened Nikon COOLSHOT PRO STABILIZED portable laser distance meter Nikon cool shot golf,goods Nikon COOLSHOT PRO STABILIZED laser distance meter Nikon shot golf
167,7,美品！ニコン 50mm f1.8【フィルター付属】special edition,11520.0,20000.0,,https://auctions.yahooapis.jp/AuctionWebService/V2/auctionItem?auctionID=d386929990,2084261684,Beauty products! Nikon 50mm f1.8 [with filter] special edition,Beauty products Nikon 50 mm f18 filter edition
168,8,【良品】AF-S NIKKOR 24-70mm f/2.8G ED,63000.0,82000.0,,https://auctions.yahooapis.jp/AuctionWebService/V2/auctionItem?auctionID=c759323399,2084261684,[Good] AF-S NIKKOR 24-70mm f / 2.8G ED,AFS NIKKOR 2470 mm 28 G ED
169,9,【新品】 Nikon　ニコン D850 デジタル一眼レフカメラ 本体,270000.0,,,https://auctions.yahooapis.jp/AuctionWebService/V2/auctionItem?auctionID=o342149336,2084261636,[New] Nikon Nikon D850 digital SLR camera body,New Nikon Nikon D850 SLR camera body
170,10,★美品★Nikon ニコン Ai-S Nikkor 45mm F2.8P シルバー MF 純正メタルフード付 ワンオーナー,38800.0,,,https://auctions.yahooapis.jp/AuctionWebService/V2/auctionItem?auctionID=t669497442,2084261693,★ Beautiful ★ Nikon Nikon Ai-S Nikkor 45mm F2.8P Silver MF One metal owner with genuine metal hood,Nikon Nikon AiS Nikkor 45 mm MF One metal owner metal hood
171,11,ミラーレスで軽いかわいい、NIKON1　J1　+明るい単焦点18.5㎜,8250.0,16800.0,,https://auctions.yahooapis.jp/AuctionWebService/V2/auctionItem?auctionID=x641378322,2084261636,"Mirrorless and light cute, NIKON1 J1 Bright single focus 18.5mm",Mirrorless NIKON1 J1 focus 185 mm
172,12,NIKON ニコン　D800,45500.0,,,https://auctions.yahooapis.jp/AuctionWebService/V2/auctionItem?auctionID=q315086628,2084261636,NIKON Nikon D800,NIKON Nikon D800
173,13,送料無料　清原光学 KIYOHARA KOGAKU KOPTIC VK70R 　Nikonマウント　コンタックス（Y/C）マウント　セット,8000.0,,,https://auctions.yahooapis.jp/AuctionWebService/V2/auctionItem?auctionID=q312265362,2084261693,Free shipping Kiyohara optics KIYOHARA KOGAKU KOPTIC VK70R Nikon mount Contax (Y / C) mount set,shipping Kiyohara optics KIYOHARA KOGAKU KOPTIC Nikon mount Contax Y C mount
174,14,新品純正Nikon COOLPIX P900 / COOLPIX P610 / COOLPIX P600 用バッテリーEN-EL23,2980.0,2980.0,,https://auctions.yahooapis.jp/AuctionWebService/V2/auctionItem?auctionID=o341837460,2084261636,New genuine Nikon COOLPIX P900 / COOLPIX P610 / COOLPIX P600 battery EN-EL23,Nikon COOLPIX P900 COOLPIX P610 COOLPIX P600 battery ENEL23
175,15,Nikon NIKKOR AF-S 24-70mm f/2.8G ED 大三元レンズ FXフォーマット,59000.0,,,https://auctions.yahooapis.jp/AuctionWebService/V2/auctionItem?auctionID=x641675890,2084261684,Nikon NIKKOR AF-S 24-70mm f / 2.8G ED large ternary lens FX format,Nikon NIKKOR AFS 2470 mm 28 G ED lens FX format
176,16,ニコン Nikon AF-S NIKKOR 24-70mm 1:2.8G ED,35500.0,,,https://auctions.yahooapis.jp/AuctionWebService/V2/auctionItem?auctionID=n369769201,2084261684,Nikon Nikon AF-S NIKKOR 24-70mm 1: 2.8G ED,Nikon Nikon AFS NIKKOR 2470 mm 1 28 G ED
177,17,ほぼ無傷 Nikon ニコン Micro-Nikkor 105mm F2.8 元箱付 ヘリコイド小難有 (24),1710.0,,,https://auctions.yahooapis.jp/AuctionWebService/V2/auctionItem?auctionID=e381029162,2084261693,Almost intact Nikon Nikon Micro-Nikkor 105mm F2.8 With original box Helicoid small difficulty (24),Nikon Nikon MicroNikkor 105 mm F28 box Helicoid difficulty 24
178,18,【ジャンク】 Nikon DX AF-S NIKKOR 10-24ｍｍ 1:3.5-4.5G ED,3000.0,,,https://auctions.yahooapis.jp/AuctionWebService/V2/auctionItem?auctionID=b415168649,2084261684,[Junk] Nikon DX AF-S NIKKOR 10-24mm 1: 3.5-4.5G ED,Junk Nikon DX AFS NIKKOR 1024 mm 1 3545 G ED
179,19,【訳あり格安】これは名機だわ！NIKON D90　+AFnikkor35-70㎜（3.3-4.5）　+TAMURON　DiⅡ　18-270ｍｍ（3.5-6.3）,12500.0,,,https://auctions.yahooapis.jp/AuctionWebService/V2/auctionItem?auctionID=e380599369,2084261636,"[In translation, cheap] This is a famous machine! NIKON D90 AFnikkor 35-70mm (3.3-4.5) TAMURON DiII 18-270mm (3.5-6.3)",translation machine NIKON D90 AFnikkor 3570 mm 3345 TAMURON DiII 18270 mm 3563
180,0,★希少・美品★Nikon ベローズ BELLOWS NIKKOR-P 105mm F4★純正ケース付き,14800.0,,,https://auctions.yahooapis.jp/AuctionWebService/V2/auctionItem?auctionID=k407146376,2084261693,★ rare and beautiful goods ★ Nikon bellows BELLOWS NIKKOR-P 105mm F4 ★ with genuine case,goods Nikon BELLOWS NIKKORP 105 mm F4 case
181,1,純正品！Nikonマルチパワーバッテリーパック MB-D14 訳有り！値下げ,5880.0,5880.0,,https://auctions.yahooapis.jp/AuctionWebService/V2/auctionItem?auctionID=x639928462,23760,Genuine product! Nikon Multi Power Battery Pack MB-D14 In translation! Price cut,product Nikon Multi Power Battery Pack MBD14 translation Price cut
182,2,★箱付美品★ ニコン Nikon D200 ボディ ■ M-18SE19-354,2100.0,16800.0,,https://auctions.yahooapis.jp/AuctionWebService/V2/auctionItem?auctionID=g373576693,2084261636,★ Beauty goods with box ★ Nikon Nikon D200 Body ■ M-18SE19-354,Beauty goods box Nikon Nikon D200 Body
183,3,純正新品！未使用！ニコン Li-ionリチャージャブルバッテリーEN-EL20(EN-EL20 ),1980.0,1980.0,,https://auctions.yahooapis.jp/AuctionWebService/V2/auctionItem?auctionID=u301727996,2084261672,Genuine new article! unused! Nikon Li-ion Rechargeable Battery EN-EL20 (EN-EL20),article Nikon Liion Rechargeable Battery ENEL20 ENEL20
184,4,顕微鏡 中古 ニコン 実体顕微鏡 SMZ 双眼 接眼レンズ N10× AL5 取説付き 箱入り Nikon,4968.0,,,https://auctions.yahooapis.jp/AuctionWebService/V2/auctionItem?auctionID=r348667693,2084045044,Microscope Used Nikon Stereo Microscope SMZ Binocular Eyepiece N10 × AL5 With Instructions Boxed Nikon,Microscope Nikon Stereo Microscope SMZ Binocular Eyepiece N10 AL5 Instructions Boxed Nikon
185,5,Nikon デジタルカメラ COOLPIX S9300 /ニコン/デジカメ/9-152,1296.0,,,https://auctions.yahooapis.jp/AuctionWebService/V2/auctionItem?auctionID=n369378255,2084261644,Nikon Digital Camera COOLPIX S9300 / Nikon / Digital Camera / 9-152,Nikon Digital Camera COOLPIX S9300 Nikon Digital Camera 9152
186,6,● ニコン CANON NIKON PENTAX 等 カメラ 大量まとめ,1.0,,,https://auctions.yahooapis.jp/AuctionWebService/V2/auctionItem?auctionID=b416248735,2084044778,● Nikon CANON NIKON PENTAX and other cameras,Nikon CANON NIKON PENTAX cameras
187,7,【極上品】 Nikon ニコン Df ブラック ★漆黒の稀少なブラックモデルです！,100000.0,148000.0,,https://auctions.yahooapis.jp/AuctionWebService/V2/auctionItem?auctionID=c759963083,2084261636,[Exquisite] Nikon Nikon Df Black ★ Rare black model of jet black!,Exquisite Nikon Nikon Df Black Rare model jet
188,8,●Nikon AFカメラ F5 ニコン LENS:AF NIKKOR 24-120mm 1:3.5-5.6D オートフォーカス一眼レフ シャッターOK 中古 93N365,10260.0,,,https://auctions.yahooapis.jp/AuctionWebService/V2/auctionItem?auctionID=q314836070,2084044785,● Nikon AF Camera F5 Nikon LENS: AF NIKKOR 24-120mm 1: 3.5-5.6D Autofocus SLR Shutter OK Used 93N365,Nikon AF Camera F5 Nikon LENS AF NIKKOR 24120 mm 1 3556D Autofocus SLR Shutter 93N365
189,9,● ニコン キヤノン CANON NIKON PENTAX 等 カメラ 大量まとめ,1.0,,,https://auctions.yahooapis.jp/AuctionWebService/V2/auctionItem?auctionID=420121527,23660,● Nikon Canon CANON NIKON PENTAX and other cameras,Nikon Canon CANON NIKON PENTAX cameras
190,10,ジャンク ニコン キヤノン ペンタックス オリンパス ミノルタ他 MFフィルム一眼 レンジファインダ-等 25台 まとめ まとめて 大量SET #3122,3060.0,,,https://auctions.yahooapis.jp/AuctionWebService/V2/auctionItem?auctionID=s686088270,2084044778,"<!DOCTYPE html><html><head><link rel=""shortcut icon"" href=""//ssl.gstatic.com/docs/script/images/favicon.ico""><title>エラー</title><style type=""text/css"">body {background-color: #fff; margin: 0; padding: 0;}.errorMessage {font-family: Arial,sans-serif; font-size: 12pt; font-weight: bold; line-height: 150%; padding-top: 25px;}</style></head><body style=""margin:20px""><div><img alt=""Google Apps Script"" src=""//ssl.gstatic.com/docs/script/images/logo.png""></div><div style=""text-align:center;font-family:monospace;margin:50px auto 0;max-width:600px"">無効な引数: source（行 3、ファイル「コード」、プロジェクト「Translation」）</div></body></html>",DOCTYPE relshortcut icon hrefsslgstaticcomdocsscriptimagesfaviconicotitletitlestyle typetextcssbody backgroundcolor fff margin 0 padding 0errorMessage Arialsansserif fontsize fontweight lineheight 150 paddingtop 25pxstyleheadbody stylemargin20pxdivimg altGoogle Apps Script srcsslgstaticcomdocsscriptimageslogopngdivdiv auto 0maxwidth600px source 3Translationdivbodyhtml
191,11,Nikon/ニコン ズームデマンド●TZ-D3 中古,21600.0,,,https://auctions.yahooapis.jp/AuctionWebService/V2/auctionItem?auctionID=j590688575,2084239145,Nikon / Nikon Zoom Demand TZ-D3 used,Nikon Nikon Zoom Demand TZD3
192,12,★NIKON☆ニコン レンズ AF-S VR-NIKKOR 70-200mm 1:2.8G 元箱・取説付 中古 現状品 91Y7286,11340.0,,,https://auctions.yahooapis.jp/AuctionWebService/V2/auctionItem?auctionID=w337346547,2084261684,★ NIKON ☆ Nikon lens AF-S VR-NIKKOR 70-200mm 1: 2.8G former box with manual used current product 91Y7286,NIKON Nikon lens AFS VRNIKKOR 70200 mm 1 28 G box product 91Y7286
193,13,★極上美品!!★ニコン NIKON D750 ダブルレンズセット★標準・望遠セット!! 透き通るほどクリアなファインダー!! 非常にきれいな外観!!#704,1.0,145800.0,,https://auctions.yahooapis.jp/AuctionWebService/V2/auctionItem?auctionID=f373584741,2084261636,"<!DOCTYPE html><html><head><link rel=""shortcut icon"" href=""//ssl.gstatic.com/docs/script/images/favicon.ico""><title>エラー</title><style type=""text/css"">body {background-color: #fff; margin: 0; padding: 0;}.errorMessage {font-family: Arial,sans-serif; font-size: 12pt; font-weight: bold; line-height: 150%; padding-top: 25px;}</style></head><body style=""margin:20px""><div><img alt=""Google Apps Script"" src=""//ssl.gstatic.com/docs/script/images/logo.png""></div><div style=""text-align:center;font-family:monospace;margin:50px auto 0;max-width:600px"">無効な引数: source（行 3、ファイル「コード」、プロジェクト「Translation」）</div></body></html>",DOCTYPE relshortcut icon hrefsslgstaticcomdocsscriptimagesfaviconicotitletitlestyle typetextcssbody backgroundcolor fff margin 0 padding 0errorMessage Arialsansserif fontsize fontweight lineheight 150 paddingtop 25pxstyleheadbody stylemargin20pxdivimg altGoogle Apps Script srcsslgstaticcomdocsscriptimageslogopngdivdiv auto 0maxwidth600px source 3Translationdivbodyhtml
194,14,純正新品！ニコン Li-ionリチャージャブルバッテリー「EN-EL20」,1780.0,1780.0,,https://auctions.yahooapis.jp/AuctionWebService/V2/auctionItem?auctionID=g370298762,2084261661,Genuine new article! Nikon Li-ion Rechargeable Battery “EN-EL20”,article Nikon Liion Rechargeable Battery ENEL20
195,15,★新品同様!!★ニコン NIKON D800 ダブルレンズセット★標準・望遠!!新品と見間違ってしまう外観!!透き通る程クリアなファインダー!!#782,1.0,114800.0,,https://auctions.yahooapis.jp/AuctionWebService/V2/auctionItem?auctionID=h422226663,2084261636,"<!DOCTYPE html><html><head><link rel=""shortcut icon"" href=""//ssl.gstatic.com/docs/script/images/favicon.ico""><title>エラー</title><style type=""text/css"">body {background-color: #fff; margin: 0; padding: 0;}.errorMessage {font-family: Arial,sans-serif; font-size: 12pt; font-weight: bold; line-height: 150%; padding-top: 25px;}</style></head><body style=""margin:20px""><div><img alt=""Google Apps Script"" src=""//ssl.gstatic.com/docs/script/images/logo.png""></div><div style=""text-align:center;font-family:monospace;margin:50px auto 0;max-width:600px"">無効な引数: source（行 3、ファイル「コード」、プロジェクト「Translation」）</div></body></html>",DOCTYPE relshortcut icon hrefsslgstaticcomdocsscriptimagesfaviconicotitletitlestyle typetextcssbody backgroundcolor fff margin 0 padding 0errorMessage Arialsansserif fontsize fontweight lineheight 150 paddingtop 25pxstyleheadbody stylemargin20pxdivimg altGoogle Apps Script srcsslgstaticcomdocsscriptimageslogopngdivdiv auto 0maxwidth600px source 3Translationdivbodyhtml
196,16,☆希少新品級 コシナ COSINA AF 100-400mm F4.5-6.7　Nikon 即日発送,19800.0,19800.0,,https://auctions.yahooapis.jp/AuctionWebService/V2/auctionItem?auctionID=f199472441,2084261684,☆ Rare new class Cosina COSINA AF 100-400mm F4.5-6.7 Nikon ships same day,class Cosina COSINA AF 100400 mm F4567 Nikon ships day
197,17,★NIKON☆ニコン レンズ NIKKOR ED AF 300mm 1:2.8 動作OK! 取説・ケース付 中古 91Y7285,19602.0,,,https://auctions.yahooapis.jp/AuctionWebService/V2/auctionItem?auctionID=n369986568,2084261684,★ NIKON ☆ Nikon lens NIKKOR ED AF 300mm 1: 2.8 Operation OK! With manual and case Used 91Y7285,NIKON Nikon lens NIKKOR ED AF 300 mm 1 28 Operation manual case 91Y7285
198,18,★希少銘玉★ニコン Nikon Ai 135mm F2.8♯1510,1.0,16800.0,,https://auctions.yahooapis.jp/AuctionWebService/V2/auctionItem?auctionID=k411436028,2084261693,★ Rare inscription ★ Nikon Nikon Ai 135mm F2.8♯1510,inscription Nikon Nikon Ai 135 mm F281510
199,19,"★新品同様!!★ニコン Nikon D800E ボディ★新品と見間違ってしまう外観!!透き通る程クリアなファインダー!!シャッター回数10,028回!!#784",1.0,109800.0,,https://auctions.yahooapis.jp/AuctionWebService/V2/auctionItem?auctionID=j591764281,2084261636,"<!DOCTYPE html><html><head><link rel=""shortcut icon"" href=""//ssl.gstatic.com/docs/script/images/favicon.ico""><title>エラー</title><style type=""text/css"">body {background-color: #fff; margin: 0; padding: 0;}.errorMessage {font-family: Arial,sans-serif; font-size: 12pt; font-weight: bold; line-height: 150%; padding-top: 25px;}</style></head><body style=""margin:20px""><div><img alt=""Google Apps Script"" src=""//ssl.gstatic.com/docs/script/images/logo.png""></div><div style=""text-align:center;font-family:monospace;margin:50px auto 0;max-width:600px"">無効な引数: source（行 3、ファイル「コード」、プロジェクト「Translation」）</div></body></html>",DOCTYPE relshortcut icon hrefsslgstaticcomdocsscriptimagesfaviconicotitletitlestyle typetextcssbody backgroundcolor fff margin 0 padding 0errorMessage Arialsansserif fontsize fontweight lineheight 150 paddingtop 25pxstyleheadbody stylemargin20pxdivimg altGoogle Apps Script srcsslgstaticcomdocsscriptimageslogopngdivdiv auto 0maxwidth600px source 3Translationdivbodyhtml
200,0,1円スタート Nikon 顕微鏡 モデル CL 通電確認済み 動作未確認 ジャンク扱い ケース付き ニコン,1.0,,,https://auctions.yahooapis.jp/AuctionWebService/V2/auctionItem?auctionID=419457591,2084045044,1 yen start Nikon microscope model CL energization confirmed operation not confirmed junk treatment with case Nikon,1 yen Nikon microscope model CL energization operation junk treatment case Nikon
201,1,★極上美品!!★ニコン NIKON AF-S NIKKOR 24-70mm F2.8G ED★大三元レンズ!!非常にきれいな外観!!非常にクリアな光学系!!動作絶好調!!#657,1.0,89800.0,,https://auctions.yahooapis.jp/AuctionWebService/V2/auctionItem?auctionID=l548594397,2084261684,"<!DOCTYPE html><html><head><link rel=""shortcut icon"" href=""//ssl.gstatic.com/docs/script/images/favicon.ico""><title>エラー</title><style type=""text/css"">body {background-color: #fff; margin: 0; padding: 0;}.errorMessage {font-family: Arial,sans-serif; font-size: 12pt; font-weight: bold; line-height: 150%; padding-top: 25px;}</style></head><body style=""margin:20px""><div><img alt=""Google Apps Script"" src=""//ssl.gstatic.com/docs/script/images/logo.png""></div><div style=""text-align:center;font-family:monospace;margin:50px auto 0;max-width:600px"">無効な引数: source（行 3、ファイル「コード」、プロジェクト「Translation」）</div></body></html>",DOCTYPE relshortcut icon hrefsslgstaticcomdocsscriptimagesfaviconicotitletitlestyle typetextcssbody backgroundcolor fff margin 0 padding 0errorMessage Arialsansserif fontsize fontweight lineheight 150 paddingtop 25pxstyleheadbody stylemargin20pxdivimg altGoogle Apps Script srcsslgstaticcomdocsscriptimageslogopngdivdiv auto 0maxwidth600px source 3Translationdivbodyhtml
202,2,☆希少超美品☆トキナーTokina AT-X PRO 28-80mm F2.8 Nikon　フード付　即日発送,23800.0,25800.0,,https://auctions.yahooapis.jp/AuctionWebService/V2/auctionItem?auctionID=d260441332,2084261684,"☆ rare super beauty ☆ Tokina Tokina AT-X PRO 28-80mm F2.8 Nikon with hood, same day shipping",beauty Tokina Tokina ATX PRO 2880 mm F28 Nikon hood day shipping
203,3,★極上美品!!★ニコン NIKON D3S ボディ★非常にきれいな外観!! 視界良好クリアなファインダー!! 一連の動作も完璧!! #751,1.0,99800.0,,https://auctions.yahooapis.jp/AuctionWebService/V2/auctionItem?auctionID=m358819852,2084261636,"<!DOCTYPE html><html><head><link rel=""shortcut icon"" href=""//ssl.gstatic.com/docs/script/images/favicon.ico""><title>エラー</title><style type=""text/css"">body {background-color: #fff; margin: 0; padding: 0;}.errorMessage {font-family: Arial,sans-serif; font-size: 12pt; font-weight: bold; line-height: 150%; padding-top: 25px;}</style></head><body style=""margin:20px""><div><img alt=""Google Apps Script"" src=""//ssl.gstatic.com/docs/script/images/logo.png""></div><div style=""text-align:center;font-family:monospace;margin:50px auto 0;max-width:600px"">無効な引数: source（行 3、ファイル「コード」、プロジェクト「Translation」）</div></body></html>",DOCTYPE relshortcut icon hrefsslgstaticcomdocsscriptimagesfaviconicotitletitlestyle typetextcssbody backgroundcolor fff margin 0 padding 0errorMessage Arialsansserif fontsize fontweight lineheight 150 paddingtop 25pxstyleheadbody stylemargin20pxdivimg altGoogle Apps Script srcsslgstaticcomdocsscriptimageslogopngdivdiv auto 0maxwidth600px source 3Translationdivbodyhtml
204,4,Nikon 単焦点レンズ 35mm F1.8 ニコン AF-S,12100.0,,,https://auctions.yahooapis.jp/AuctionWebService/V2/auctionItem?auctionID=w337635737,2084261693,Nikon single focus lens 35mm F1.8 Nikon AF-S,Nikon focus lens 35 mm F18 Nikon AFS
205,5,銘玉☆ニコン Nikon AF 35-70mm F2.8 訳あり,1.0,5980.0,,https://auctions.yahooapis.jp/AuctionWebService/V2/auctionItem?auctionID=k411195699,2084261684,Inscription ☆ Nikon Nikon AF 35-70mm F2.8 In translation,Inscription Nikon Nikon AF 3570 mm F28 translation
206,6,在庫処分 まとめ カメラ レンズ 大量 Nikon Nikomat/PENTAX SPOTMATIC/MINOLTA/Canon/CASIO/Kodak/SONY/動作未確認 ジャンク 色々 まとめて,166.0,,,https://auctions.yahooapis.jp/AuctionWebService/V2/auctionItem?auctionID=w337074030,2084044776,Stock disposal Summary Camera Lens Mass Nikon Nikomat / PENTAX SPOTMATIC / MINOLTA / Canon / CASIO / Kodak / SONY / Operation unconfirmed junk Various Collectively,Stock disposal Summary Camera Lens Mass Nikon Nikomat PENTAX MINOLTA Canon CASIO Kodak SONY Operation junk
207,7,★新品同様!!★ニコン NIKON D7500 ダブルレンズセット★新品と見間違ってしまう外観!!透き通る程クリアなファインダー!!付属品多数!!#743,1.0,139800.0,,https://auctions.yahooapis.jp/AuctionWebService/V2/auctionItem?auctionID=v664235509,2084261636,"<!DOCTYPE html><html><head><link rel=""shortcut icon"" href=""//ssl.gstatic.com/docs/script/images/favicon.ico""><title>エラー</title><style type=""text/css"">body {background-color: #fff; margin: 0; padding: 0;}.errorMessage {font-family: Arial,sans-serif; font-size: 12pt; font-weight: bold; line-height: 150%; padding-top: 25px;}</style></head><body style=""margin:20px""><div><img alt=""Google Apps Script"" src=""//ssl.gstatic.com/docs/script/images/logo.png""></div><div style=""text-align:center;font-family:monospace;margin:50px auto 0;max-width:600px"">無効な引数: source（行 3、ファイル「コード」、プロジェクト「Translation」）</div></body></html>",DOCTYPE relshortcut icon hrefsslgstaticcomdocsscriptimagesfaviconicotitletitlestyle typetextcssbody backgroundcolor fff margin 0 padding 0errorMessage Arialsansserif fontsize fontweight lineheight 150 paddingtop 25pxstyleheadbody stylemargin20pxdivimg altGoogle Apps Script srcsslgstaticcomdocsscriptimageslogopngdivdiv auto 0maxwidth600px source 3Translationdivbodyhtml
208,8,★新品同様!!★ニコン NIKON AF-S NIKKOR 14-24mm F2.8G ED★状態が良い商品をお探しの方に!! 透き通る程キレイな光学系!! #641,1.0,139800.0,,https://auctions.yahooapis.jp/AuctionWebService/V2/auctionItem?auctionID=d388643508,2084261684,"<!DOCTYPE html><html><head><link rel=""shortcut icon"" href=""//ssl.gstatic.com/docs/script/images/favicon.ico""><title>エラー</title><style type=""text/css"">body {background-color: #fff; margin: 0; padding: 0;}.errorMessage {font-family: Arial,sans-serif; font-size: 12pt; font-weight: bold; line-height: 150%; padding-top: 25px;}</style></head><body style=""margin:20px""><div><img alt=""Google Apps Script"" src=""//ssl.gstatic.com/docs/script/images/logo.png""></div><div style=""text-align:center;font-family:monospace;margin:50px auto 0;max-width:600px"">無効な引数: source（行 3、ファイル「コード」、プロジェクト「Translation」）</div></body></html>",DOCTYPE relshortcut icon hrefsslgstaticcomdocsscriptimagesfaviconicotitletitlestyle typetextcssbody backgroundcolor fff margin 0 padding 0errorMessage Arialsansserif fontsize fontweight lineheight 150 paddingtop 25pxstyleheadbody stylemargin20pxdivimg altGoogle Apps Script srcsslgstaticcomdocsscriptimageslogopngdivdiv auto 0maxwidth600px source 3Translationdivbodyhtml
209,9,MVOTH101　ジェームス・ディーン写真展葉書 ニコン NIKON S2 1957年 銀座松坂屋,2000.0,,,https://auctions.yahooapis.jp/AuctionWebService/V2/auctionItem?auctionID=e381562536,22148,MVOTH101 James Dean Photo Exhibition Postcard Nikon NIKON S2 1957 Ginza Matsuzakaya,MVOTH101 James Dean Photo Exhibition Postcard Nikon NIKON S2 1957 Ginza Matsuzakaya
210,10,★新品未使用品 AF-P DX NIKKOR 18-55mm f/3.5-5.6G VR★Nikon ニコン,7980.0,7980.0,,https://auctions.yahooapis.jp/AuctionWebService/V2/auctionItem?auctionID=j591231942,2084261684,★ New unused AF-P DX NIKKOR 18-55mm f / 3.5-5.6G VR ★ Nikon Nikon,New AFP DX NIKKOR 1855 mm f 3556 G VR Nikon Nikon
211,11,■得々■Nikon/ニコン/光学顕微鏡/OPTIPHOTO/オプチフォト/正立型/金属顕微鏡＆カメラ＆撮影装置/実験/研究/ラボ/対物レンズ（5本）/10,85320.0,,,https://auctions.yahooapis.jp/AuctionWebService/V2/auctionItem?auctionID=k387438800,2084045044,■ Tokutsu ■ Nikon / Nikon / Optical microscope / OPTIPHOTO / Optical photo / Erecting type / Metal microscope & Camera & Camera / Experiment / Research / Lab / Objective lens (5) / 10,Tokutsu Nikon Nikon Optical microscope OPTIPHOTO photo type Metal microscope Camera Camera Experiment Research Lab lens 5 10
212,12,■美品■**Nikon/NIKKOR 24mm 1:2.8/前後キャップ付**463,1600.0,,,https://auctions.yahooapis.jp/AuctionWebService/V2/auctionItem?auctionID=c759799899,2084261693,■ Beauty ■ ** Nikon / NIKKOR 24mm 1: 2.8 / With front and rear caps ** 463,Beauty Nikon NIKKOR 24 mm 1 28 caps 463
213,13,高級ミラーレス　NIKON1　V1　　レンズキット　（使用感少ない）,9577.0,,,https://auctions.yahooapis.jp/AuctionWebService/V2/auctionItem?auctionID=r348783358,2084305445,Luxury mirrorless NIKON1 V1 lens kit (less feeling),Luxury mirrorless NIKON1 V1 lens kit feeling
214,14,★★【 1 nikkorVR10-30 + J1 】　Nikkorレンズ + ボディ　　　　　[ジャンク],239.0,,,https://auctions.yahooapis.jp/AuctionWebService/V2/auctionItem?auctionID=h421600792,2084261684,★★ [1 nikkorVR10-30 J1] Nikkor Lens Body [Junk],1 J1 Nikkor Lens Body Junk
215,15,Canon Nikon 等 レンズ 大量 色々 まとめ 在庫処分 動作未確認 ジャンク まとめて　ニコン,1.0,,,https://auctions.yahooapis.jp/AuctionWebService/V2/auctionItem?auctionID=l548945292,2084261700,"Canon Nikon, etc. Lens A lot of various items Summary Stock disposal Operation unconfirmed Junk collectively Nikon",Canon Nikon Lens lot items Summary Stock disposal Operation Junk Nikon
216,16,★超美品★Nikon ニコン AF-S 24mm F1.8G ED,5750.0,59800.0,,https://auctions.yahooapis.jp/AuctionWebService/V2/auctionItem?auctionID=m358449045,2084261684,★ Super beauty ★ Nikon Nikon AF-S 24mm F1.8G ED,Super beauty Nikon Nikon AFS 24 mm F18 G ED
