,Title,CurrentPrice,BidOrBuy,shopName,ItemUrl,CategoryId,en_Title,en_short_Title,short_Title
8,"★送料無料★即決 新品未使用品★GoPro AHD3D-301 2台のHERO3+ ブラックエディションをセットできる★標準小売価格で24,000円税抜です★",9800.00,9800.00,,https://page.auctions.yahoo.co.jp/jp/auction/n370073672,2084261684,"★ Free shipping ★ Prompt decision New unused item ★ GoPro AHD3D-301 2 HERO3 Black Edition can be set ★ Standard retail price is 24,000 yen excluding tax ★",shipping Prompt decision New item GoPro AHD3D301 2 HERO3 Black Edition price 24000 yen tax,送料 無料 即決 新品 未 使用 品 Go Pro AHD 3 301 2 台 HERO 3 ブラック エディション 標準 小売 価格 24 000 円 税抜
9,★即決★価格交渉あり★Nikon FM ＋ MD-11一眼レフカメラ ＜ボディキャップ付属＞＃3192,21980.00,21980.00,,https://page.auctions.yahoo.co.jp/jp/auction/420733053,2084044778,★ Prompt decision ★ Price negotiations available ★ Nikon FM + MD-11 SLR camera <Body cap included> # 3192,decision Price negotiations Nikon FM MD11 SLR camera Body cap 3192,即決 価格 交渉 あり Nikon FM MD 11 一 眼 レフ カメラ ボディ キャップ 付属 3192
10,フイルム現像 CD入力　 新現像機 導入 さらに安心！☆高品質,200.00,200.00,,https://page.auctions.yahoo.co.jp/jp/auction/s687921806,2084044785,Film development CD input New development machine introduced ☆ High quality,Film development CD input development machine quality,フイルム 現像 CD 入力 新 現像 機 導入 高品質
11,Tokina AT-X Pro D 100mm f2.8 Macro Nikon用　トキナー　ニコン用　マクロ　元箱付き,26500.00,28000.00,,https://page.auctions.yahoo.co.jp/jp/auction/e382027393,2084261684,Tokina AT-X Pro D 100mm f2.8 Macro Nikon for Tokina Nikon Macro with original box,Tokina ATX Pro D 100 mm f28 Macro Nikon Tokina Nikon Macro box,Tokina AT Pro 100 mm f2 8 Macro Nikon 用 トキナー ニコン 用 マクロ 元箱 付き
12,ニコン Nikon NIKKOR 50mm F1.4 Ai 単焦点レンズ 美品,5000.00,,,https://page.auctions.yahoo.co.jp/jp/auction/l549343378,2084261693,Nikon Nikon NIKKOR 50mm F1.4 Ai single focus lens beautiful goods,Nikon Nikon NIKKOR 50 mm F14 Ai focus lens goods,ニコン Nikon NIKKOR 50 mm F 1 4 Ai 単 焦点 レンズ 美品
13,ニコンNikon F フォトミック + 日本光学　Nikkor-S Auto 50mm 1:1.4 カビ有り　訳あり品　美品,31.00,12800.00,,https://page.auctions.yahoo.co.jp/jp/auction/380547632,2084044778,Nikon Nikon F Photomic Nihon Optic Nikkor-S Auto 50mm 1: 1.4 Mold available,Nikon Nikon F Photomic Nihon Optic NikkorS Auto 50 mm 1 14 Mold,ニコン Nikon フォトミック 日本 光学 Nikkor 50 mm 1 1. 4 有り 訳あり 品 美品
14,〓外観綺麗〓Nikon ニコン 800mm F13.3 フィールドスコープ用レンズ,2980.00,19800.00,,https://page.auctions.yahoo.co.jp/jp/auction/r349839057,2084261693,〓 Nikon Nikon 800mm F13.3 Fieldscope lens,Nikon Nikon 800 mm F133 Fieldscope lens,外観 Nikon ニコン 800 mm 13 . 3 フィールド スコープ 用 レンズ
15,Ｎｉｋｏｎ　Ｅｙｅｐｉｅｃｅ　Ａｔｔａｃｈｍｅｎｔ　日本製　＋２．０,1.00,,,https://page.auctions.yahoo.co.jp/jp/auction/f373526978,23760,Nikon Eyepiece Attachment Made in Japan +2.0,Nikon Eyepiece Attachment Japan 20,Ｎｉｋｏｎ Ｅｙｅ ｐｉｅｃｅ Ａｔｔａｃｈｍｅｎｔ 日本製 ２ ０
16,〓外観綺麗〓ニコン Nikon コマ速変換機 MK-1,12980.00,34800.00,,https://page.auctions.yahoo.co.jp/jp/auction/l550491579,2084044778,〓 Appearance 〓 Nikon Nikon frame speed converter MK-1,Appearance Nikon Nikon frame speed converter MK1,外観 ニコン Nikon コマ 速 変換 機 MK 1
17,【新品即決】安！Metz/メッツ５８AF-1デジタル　コン用ストロボ,27000.00,27000.00,,https://page.auctions.yahoo.co.jp/jp/auction/r106215224,2084261969,[New prompt decision] Cheap! Metz / Metz 58AF-1 Digital Con strobe,decision Cheap Metz Metz 58AF1 Digital Con strobe,新品 即決 安 Metz メッツ ５８ AF 1 デジタル コン 用 ストロボ
18,【新品即決】ケンコー・トキナー　レンズベビーSCOUT/ニコン,13300.00,13300.00,,https://page.auctions.yahoo.co.jp/jp/auction/w321855178,2084261684,[New prompt decision] Kenko Tokina Lens Baby SCOUT / Nikon,decision Kenko Tokina Lens Baby SCOUT Nikon,新品 即決 トキナー レンズ ベビー SCOUT ニコン
19,【新品即決】ケンコー・トキナー　レンズベビーコントロールフリーク/ニコン,12980.00,12980.00,,https://page.auctions.yahoo.co.jp/jp/auction/r203164432,2084261684,[New prompt decision] Kenko Tokina Lens Baby Control Freak / Nikon,decision Kenko Tokina Lens Baby Control Freak Nikon,新品 即決 トキナー レンズ ベビー コントロール フリーク ニコン
0,DC16 2種入D-BC78/LI-50C/LI-60C/BJ-10/BC-CSKA充電器互換品 （USBとACの2個セット） 2種セット,907.00,907.00,,https://page.auctions.yahoo.co.jp/jp/auction/l500194493,2084261672,DC16 type 2 D-BC78 / LI-50C / LI-60C / BJ-10 / BC-CSKA charger compatible product (USB and AC set of 2) 2 types set,DC16 type 2 DBC78 LI50C LI60C BJ10 BCCSKA charger product USB AC set 2 2 types,DC 16 2 種 入 BC 78 LI 50 LI 60 BJ 10 BC CSKA 充電器 互換 品 USB AC 2 個 セット 2 種 セット
1,DC03 2種入Nikon COOLPIX S9700等対応互換バッテリーチャージャ （USBとACの2個セット） 2種セット,907.00,907.00,,https://page.auctions.yahoo.co.jp/jp/auction/v656200274,2084261672,DC03 2 types Nikon COOLPIX S9700 compatible battery charger (USB and AC set of 2) 2 types set,DC03 2 types Nikon COOLPIX battery charger USB AC set 2 2 types,DC 03 2 入 Nikon COOLPIX 9700 等 対応 互換 バッテリー チャージ ャ USB AC 2 個 セット 2 種 セット
2,NIKON F2 フィルムカメラ/nikkor 50mm 1:1.4単焦点レンズ付き,4000.00,,,https://page.auctions.yahoo.co.jp/jp/auction/p708165837,2084044778,NIKON F2 film camera / nikkor 50mm 1: 1.4 with single focus lens,NIKON F2 film camera nikkor 50 mm 1 14 focus lens,NIKON F フィルム カメラ 50 mm 1 1. 4 単 焦点 レンズ 付き
3,即決 美品 動作保証 Nikon ニコン AF-S Nikkor ED 600mm F4D II（IF）通常送料無料,418000.00,418000.00,,https://page.auctions.yahoo.co.jp/jp/auction/d369512396,2084261684,Prompt decision beautiful goods operation guarantee Nikon Nikon AF-S Nikkor ED 600mm F4D II (IF) normal free shipping,decision goods operation guarantee Nikon Nikon AFS Nikkor ED 600 mm F4D II shipping,美品 動作 保証 Nikon ニコン AF S Nikkor ED 600 mm 4 II IF 通常 送料 無料
4,即決 美品 動作保証 ニコン Nikon PC-E Micro NIKKOR 45mm F2.8D ED,161000.00,161000.00,,https://page.auctions.yahoo.co.jp/jp/auction/x608717290,2084261684,Prompt decision beautiful goods operation guarantee Nikon Nikon PC-E Micro NIKKOR 45mm F2.8D ED,decision goods operation guarantee Nikon Nikon PCE Micro NIKKOR 45 mm ED,美品 動作 保証 ニコン Nikon PC Micro NIKKOR 45 mm F 2 8 ED
5,即決 ニコン AF-S Nikkor ED 300mm F2.8D II（IF）フード付き 良品,199800.00,199800.00,,https://page.auctions.yahoo.co.jp/jp/auction/g326127455,2084261684,Prompt decision Nikon AF-S Nikkor ED 300mm F2.8D II (IF) Hooded Good,decision Nikon AFS Nikkor ED 300 mm II Good,即決 ニコン AF Nikkor ED 300 mm F 2 8 II IF フード 付き 良品
6,即決 ニコン AF-S Nikkor ED 300mm F2.8D II（IF）実用品,159800.00,159800.00,,https://page.auctions.yahoo.co.jp/jp/auction/b253117363,2084261684,Prompt decision Nikon AF-S Nikkor ED 300mm F2.8D II (IF) practical product,decision Nikon AFS Nikkor ED 300 mm II product,即決 ニコン AF Nikkor ED 300 mm F 2 8 II IF 実用品
7,即決 ニコン AF ED 300mm F2.8 S (IF) NEW 美品 ケース付,103800.00,103800.00,,https://page.auctions.yahoo.co.jp/jp/auction/t564501138,2084261684,Prompt decision Nikon AF ED 300mm F2.8 S (IF) NEW beautiful goods with case,decision Nikon AF ED 300 mm F28 S goods case,即決 ニコン AF ED 300 mm F 2 8 IF NEW 美品 ケース 付
8,Nikon ニコン昔の一眼レフカメラFT-Nボディ ＋ 純正43-86mmズームレンズ付,1100.00,,,https://page.auctions.yahoo.co.jp/jp/auction/418988165,2084044778,Nikon Nikon old single-lens reflex camera FT-N body + with genuine 43-86mm zoom lens,Nikon Nikon singlelens camera FTN body 4386 mm zoom lens,Nikon ニコン 昔 一 眼 レフ カメラ FT ボディ 純正 43 86 mm ズームレンズ 付
9,NIKON ニコン AF NIKKOR 70-300mm 4-5.6 G ジャンク品,1000.00,,,https://page.auctions.yahoo.co.jp/jp/auction/n371092536,2084261684,NIKON Nikon AF NIKKOR 70-300mm 4-5.6 G Junk,NIKON Nikon AF NIKKOR 70300 mm 456 G Junk,NIKON ニコン AF NIKKOR 70 300 mm 4 5. 6 ジャンク 品
10,Nikon ニコン 純正 AF NIKKOR 50mm オートフォーカス高級単焦点レンズ 1:1.4 希少品,4900.00,,,https://page.auctions.yahoo.co.jp/jp/auction/419957663,2084261684,Nikon Nikon Genuine AF NIKKOR 50mm Autofocus luxury single focus lens 1: 1.4 Rare,Nikon Nikon Genuine AF NIKKOR 50 mm Autofocus luxury focus lens 1 14 Rare,Nikon ニコン 純正 AF NIKKOR 50 mm オートフォーカス 高級 単 焦点 レンズ 1 1. 4 品
11,★美品★Nikon ニコン Ai-S Nikkor 45mm F2.8P シルバー MF 純正メタルフード付 ワンオーナー,37800.00,,,https://page.auctions.yahoo.co.jp/jp/auction/t669497442,2084261693,★ Beautiful ★ Nikon Nikon Ai-S Nikkor 45mm F2.8P Silver MF One metal owner with genuine metal hood,Nikon Nikon AiS Nikkor 45 mm MF One metal owner metal hood,美品 Nikon ニコン Nikkor 45 mm F 2 8 シルバー MF 純正 メタル フード 付 ワン オーナー
12,◆◇【AF動作OK♪】Nikon ニコン AF-S DX VR 55-200mm 1:4-5.6G ED◇◆,4500.00,5980.00,,https://page.auctions.yahoo.co.jp/jp/auction/b416522304,2084261684,◆ ◇ [AF operation OK ♪] Nikon Nikon AF-S DX VR 55-200mm 1: 4-5.6G ED ◇ ◆,AF operation Nikon Nikon AFS DX VR 55200 mm 1 456 G ED,AF 動作 OK Nikon ニコン AF DX VR 55 200 mm 1 4 5. 6 ED
13,★ドイツ製★希少なニコン用単焦点シフトレンズ Schneider KREUZACH PC-SUPER ANGULON 2.8/28,88000.00,,,https://page.auctions.yahoo.co.jp/jp/auction/w332419102,2084261693,★ Made in Germany ★ Rare Nikon single focus shift lens Schneider KREUZACH PC-SUPER ANGULON 2.8 / 28,Germany Rare Nikon focus shift lens Schneider KREUZACH ANGULON 28 28,ドイツ 製 ニコン 用 単 焦点 シフト レンズ Schneider KREUZACH PC SUPER ANGULON 2 8 28
14,ＮＩＫＯＮ　Ｆ４の付属品／フォトミックファインダ－　ＤＰ－２０,1100.00,,,https://page.auctions.yahoo.co.jp/jp/auction/d388915987,2084044785,NIKON F4 Accessories / Photomic Finder DP-20,NIKON F4 Accessories Photomic Finder DP20,ＮＩＫＯＮ ４ 付属品 フォトミック ファイン ダ ＤＰ ２０
15,ＮＩＫＯＮ　Ｆ４Ｓの付属品／ハイパワ－バッテリ－パック　ＭＢ－２１,3100.00,,,https://page.auctions.yahoo.co.jp/jp/auction/d388531201,2084044785,NIKON F4S Accessories / High Power Battery Pack MB-21,NIKON F4S Accessories High Power Battery Pack MB21,ＮＩＫＯＮ ４ 付属品 ハイ パワ バッテリ パック ＭＢ ２１
16,Nikon レンズ AF NIKKOR 75-300mm F4.5-5.6 ニコン,1500.00,,,https://page.auctions.yahoo.co.jp/jp/auction/v660837982,2084261684,Nikon lens AF NIKKOR 75-300mm F4.5-5.6 Nikon,Nikon lens AF NIKKOR 75300 mm F4556 Nikon,Nikon レンズ AF NIKKOR 75 300 mm F4 5 5 6 ニコン
17,★光学クリア★ ニコン Nikon AF-S NIKKOR 24-70mm F2.8G ED フード付き,10500.00,78800.00,,https://page.auctions.yahoo.co.jp/jp/auction/h422766846,2084261636,★ Optical clear ★ Nikon Nikon AF-S NIKKOR 24-70mm F2.8G ED With hood,Optical Nikon Nikon AFS NIKKOR 2470 mm F28 G ED hood,光学 ニコン Nikon AF NIKKOR 24 70 mm F2 8 ED フード 付き
18,ＮＩＫＯＮ　Ｆ４の付属品／フィルム室蓋,500.00,,,https://page.auctions.yahoo.co.jp/jp/auction/h422347999,2084044785,NIKON F4 accessories / film chamber lid,NIKON F4 accessories film chamber lid,ＮＩＫＯＮ ４ 付属品 フィルム 室 蓋
19,Nikon / ニコン F2 DW-3 NIKKOR Auto 1:2 f=50mm 1:2.8 アイレベルファインダー付,2220.00,,,https://page.auctions.yahoo.co.jp/jp/auction/k411544383,2084044778,Nikon / Nikon F2 DW-3 NIKKOR Auto 1: 2 f = 50mm 1: 2.8 with eye level finder,Nikon Nikon F2 DW3 NIKKOR Auto 1 2 50 mm 1 28 eye level finder,Nikon ニコン 2 DW 3 NIKKOR Auto 1 2 f 50 mm 1 2. 8 アイ レベル ファインダー 付
0,NIKON ニコン COOLSHOT 40i レーザー距離器 ブラック系 [240001273380]【中古】ゴルフウェア,22734.00,,,https://page.auctions.yahoo.co.jp/jp/auction/q311879963,25094,NIKON Nikon COOLSHOT 40i laser distance meter black system [240001273380] [used] golf wear,NIKON Nikon COOLSHOT 40i laser distance meter system 240001273380 golf wear,NIKON ニコン COOL SHOT 40 レーザー 距離 器 ブラック 系 240001273380 中古 ゴルフウェア
1,一眼レフ 距離計連動 CANON NIKON MINOLTA KONICA PENTAX デジカメ レンジファインダー レンズ ストロボ 部品 等 まとめてジャンク 大量c3,50.00,,,https://page.auctions.yahoo.co.jp/jp/auction/l549801360,2084044787,SLR rangefinder linked CANON NIKON MINOLTA KONICA PENTAX digital camera range finder lens strobe parts etc junk mass c3,SLR rangefinder CANON NIKON MINOLTA KONICA PENTAX camera range finder lens strobe parts junk mass c3,一 眼 レフ 距離 計 連動 CANON NIKON MINOLTA KONICA PENTAX デジカメ レンジファインダー レンズ ストロボ 部品 等 ジャンク 大量 c 3
2,ＮＩＫＯＮ　Ｆ４の付属品／バッテリ－パック　ＭＢ－２０,3409.00,,,https://page.auctions.yahoo.co.jp/jp/auction/u302062739,2084044785,NIKON F4 Accessories / Battery Pack MB-20,NIKON F4 Accessories Battery Pack MB20,ＮＩＫＯＮ ４ 付属品 バッテリ パック ＭＢ ２０
3,★ジャンク★Nikon用 希少な単焦点の望遠レンズ SIGMA APO TELE MACRO 300mm 1:4 D★ニコンFマウント,3150.00,,,https://page.auctions.yahoo.co.jp/jp/auction/j592911104,2084261693,★ Junk ★ Rare single focus telephoto lens for Nikon SIGMA APO TELE MACRO 300mm 1: 4 D ★ Nikon F mount,Junk Rare focus telephoto lens Nikon SIGMA APO TELE MACRO 300 mm 1 4 D Nikon F mount,ジャンク Nikon 用 単 焦点 望遠 レンズ SIGMA APO TELE MACRO 300 mm 1 4 ニコン マウント
4,Nikon ニコン 純正 NIKKOR 85mm 高級単焦点レンズ 1:2 (Ai) 希少・良好品,8440.00,30000.00,,https://page.auctions.yahoo.co.jp/jp/auction/r348548109,2084261693,Nikon Nikon Genuine NIKKOR 85mm High-quality single focus lens 1: 2 (Ai) Rare and good,Nikon Nikon Genuine NIKKOR 85 mm Highquality focus lens 1 2 Ai Rare,Nikon ニコン 純正 NIKKOR 85 mm 高級 単 焦点 レンズ 1 2 Ai 品
5,美品 トキナー TOKINA opera 16-28mm F2.8 FF ニコン用 保証付き,32000.00,78000.00,,https://page.auctions.yahoo.co.jp/jp/auction/j592386958,2084261684,Beautiful goods Tokina TOKINA opera 16-28mm F2.8 FF Nikon warranty,goods Tokina TOKINA opera 1628 mm F28 FF Nikon warranty,美品 トキナー TOKINA opera 16 28 mm F2 8 FF ニコン 用 保証 付き
6,▼NIKON レンズ NIKKOR-AM * ED 120mm 1：5.6 ニコン ハードケース付き 現状品 95K4282,3456.00,,,https://page.auctions.yahoo.co.jp/jp/auction/c760870091,23692,▼ NIKON lens NIKKOR-AM * ED 120mm 1: 5.6 Nikon with hard case Current product 95K4282,NIKON lens NIKKORAM ED 120 mm 1 56 Nikon case product 95K4282,NIKON レンズ NIKKOR AM ED 120 mm 1 5. 6 ニコン ハード ケース 付き 現状 品 95 4282
7,Nikon AI AF Nikkor 20mm f2.8 動作も写りもOKです。概ねキレイです。前後キャップ、フィルターNikon L37c 62mm付きです,21.00,,,https://page.auctions.yahoo.co.jp/jp/auction/q316232129,2084261684,"Nikon AI AF Nikkor 20mm f2.8 Operation and reflection are OK. It is almost beautiful. Front and rear caps, with filter Nikon L37c 62mm",Nikon AI AF Nikkor 20 mm f28 Operation reflection caps filter Nikon 62 mm,Nikon AI AF Nikkor 20 mm f 2 8 動作 写り 前後 キャップ フィルター Nikon 37 62 mm 付き
8,Nikon Ai AF Nikkor 85mm f1.4D IF 動作も写りもOKです。クリア&かなりキレイです。前後キャップ、フィルターNikon L37c 77mm付き,1.00,,,https://page.auctions.yahoo.co.jp/jp/auction/l550150492,2084261684,Nikon Ai AF Nikkor 85mm f1.4D IF Operation and reflection are OK. clear,Nikon Ai AF Nikkor 85 mm Operation reflection,Nikon Ai AF Nikkor 85 mm f 1 4 IF 動作 写り クリア 前後 キャップ フィルター Nikon 37 77 mm 付き
9,Nikon AF-S DX Micro NIKKOR 40mm f2.8G 動作も写りもOKです。概ねキレイです。前後キャップ、フードHB-61付きです。,1.00,24980.00,,https://page.auctions.yahoo.co.jp/jp/auction/r331875705,2084261684,Nikon AF-S DX Micro NIKKOR 40mm f2.8G Operation and reflection are OK. It is almost beautiful. Comes with front and rear caps and hood HB-61.,Nikon AFS DX Micro NIKKOR 40 mm f28 G Operation reflection caps HB61,Nikon AF Micro NIKKOR 40mm f 2 8 動作 写り 前後 キャップ フード HB 61 付き
10,ニコン F100 ボディ 箱、説明書付き [2105799],12555.00,41800.00,,https://page.auctions.yahoo.co.jp/jp/auction/m359784040,2084044785,Nikon F100 body box with instructions [2105799],Nikon F100 body box instructions 2105799,ニコン 100 ボディ 箱 説明書 付き 2105799
11,★Nikon/ニコン COOLPIX A300★,5000.00,,,https://page.auctions.yahoo.co.jp/jp/auction/t674334441,2084261644,★ Nikon / Nikon COOLPIX A300 ★,Nikon Nikon COOLPIX A300,Nikon ニコン COOLPIX 300
12,Sigma 17-70mm F2.8-4 DC MACRO OS HSM Contemporary Nikon用AFレンズ 動作も写りもOK 新品時のマット感あり、かなりキレイ 無記入保証書付,1.00,24980.00,,https://page.auctions.yahoo.co.jp/jp/auction/p708308827,2084261684,AF lens for Sigma 17-70mm F2.8-4 DC MACRO OS HSM Contemporary Nikon Operation and reflection are OK.,AF lens Sigma 1770 mm F284 DC MACRO OS HSM Contemporary Nikon Operation reflection,Sigma 17 70 mm F2 8 4 DC MACRO OS HS Contemporary Nikon 用 AF レンズ 動作 写り OK 新品 時 マット 感 無 記入 保証 書付
13,★新品同様!!★ ニコン NIKON D750 ダブルレンズセット★標準・望遠レンズセット!!付属品充実!! 高い機動力と高品位画質が大人気です!!#705,1.00,145800.00,,https://page.auctions.yahoo.co.jp/jp/auction/f374644582,2084261636,"<!DOCTYPE html><html><head><link rel=""shortcut icon"" href=""//ssl.gstatic.com/docs/script/images/favicon.ico""><title>エラー</title><style type=""text/css"">body {background-color: #fff; margin: 0; padding: 0;}.errorMessage {font-family: Arial,sans-serif; font-size: 12pt; font-weight: bold; line-height: 150%; padding-top: 25px;}</style></head><body style=""margin:20px""><div><img alt=""Google Apps Script"" src=""//ssl.gstatic.com/docs/script/images/logo.png""></div><div style=""text-align:center;font-family:monospace;margin:50px auto 0;max-width:600px"">無効な引数: source（行 3、ファイル「コード」、プロジェクト「Translation」）</div></body></html>",DOCTYPE relshortcut icon hrefsslgstaticcomdocsscriptimagesfaviconicotitletitlestyle typetextcssbody backgroundcolor fff margin 0 padding 0errorMessage Arialsansserif fontsize fontweight lineheight 150 paddingtop 25pxstyleheadbody stylemargin20pxdivimg altGoogle Apps Script srcsslgstaticcomdocsscriptimageslogopngdivdiv auto 0maxwidth600px source 3Translationdivbodyhtml,新品 ニコン NIKON 750 ダブル レンズ セット 標準 望遠 レンズ 付属品 機動力 高 品位 画質 705
14,Nikon ニコン 専用 28-300mm オートフォーカス 高級ズームレンズ (MACRO) 綺麗・希少な作動品,8751.00,,,https://page.auctions.yahoo.co.jp/jp/auction/r349232696,2084261684,Nikon dedicated Nikon 28-300mm autofocus luxury zoom lens (MACRO) beautiful and rare working product,Nikon Nikon 28300 mm autofocus luxury zoom lens MACRO working product,Nikon ニコン 専用 28 300 mm オートフォーカス 高級 ズームレンズ MACRO 作動 品
15,新品純正 D600/D610/D750/D7000/D7100/D7200/D7500/D800/D800A/D850D/810A /D810/D800E/D800A用バッテリーEN-EL15a,3680.00,3680.00,,https://page.auctions.yahoo.co.jp/jp/auction/k412134588,2084261636,New genuine D600 / D610 / D750 / D7000 / D7100 / D7200 / D7500 / D800 / D800A / D850D / 810A / D810 / D800E / D800A battery EN-EL15a,D600 D610 D750 D7000 D7100 D7200 D7500 D800 D800A D850D 810A D810 D800E D800A battery ENEL15a,新品 純正 600 D 610 D 750 7000 7100 7200 7500 800 800 850 810 810 800 800 用 バッテリー EN EL 15
16,★新品同様!!★ニコン Nikon D610 レンズセット★標準・望遠!! 新品と見間違ってしまう外観!! 透き通る程クリアなファインダー!! #783,1.00,99800.00,,https://page.auctions.yahoo.co.jp/jp/auction/w339011421,2084261636,"<!DOCTYPE html><html><head><link rel=""shortcut icon"" href=""//ssl.gstatic.com/docs/script/images/favicon.ico""><title>エラー</title><style type=""text/css"">body {background-color: #fff; margin: 0; padding: 0;}.errorMessage {font-family: Arial,sans-serif; font-size: 12pt; font-weight: bold; line-height: 150%; padding-top: 25px;}</style></head><body style=""margin:20px""><div><img alt=""Google Apps Script"" src=""//ssl.gstatic.com/docs/script/images/logo.png""></div><div style=""text-align:center;font-family:monospace;margin:50px auto 0;max-width:600px"">無効な引数: source（行 3、ファイル「コード」、プロジェクト「Translation」）</div></body></html>",DOCTYPE relshortcut icon hrefsslgstaticcomdocsscriptimagesfaviconicotitletitlestyle typetextcssbody backgroundcolor fff margin 0 padding 0errorMessage Arialsansserif fontsize fontweight lineheight 150 paddingtop 25pxstyleheadbody stylemargin20pxdivimg altGoogle Apps Script srcsslgstaticcomdocsscriptimageslogopngdivdiv auto 0maxwidth600px source 3Translationdivbodyhtml,新品 ニコン Nikon 610 レンズ セット 標準 望遠 新品 外観 ファインダー 783
17,Nikon ニコン 純正 NIKKOR-S 50mm 高級単焦点レンズ 1:1.4 作動品,1330.00,,,https://page.auctions.yahoo.co.jp/jp/auction/p713702950,2084261693,Nikon Nikon Genuine NIKKOR-S 50mm high-grade single focus lens 1: 1.4,Nikon Nikon Genuine NIKKORS 50 mm focus lens 1 14,Nikon ニコン 純正 NIKKOR 50 mm 高級 単 焦点 レンズ 1 1 4 作動 品
18,純正新品！Nikon Li-ion リチャージャブルバッテリー EN-EL21,1480.00,1480.00,,https://page.auctions.yahoo.co.jp/jp/auction/c773709922,2084305445,Genuine new article! Nikon Li-ion Rechargeable Battery EN-EL21,article Nikon Liion Rechargeable Battery ENEL21,純正 新品 Nikon Li ion リチャージャブル バッテリー EN EL 21
19,1円～★動作未確認 Nikonニコン デジタルカメラD80 本体ボディのみ デジカメ(管/60)★同梱不可/注意事項・自己紹介文必読,3000.00,,,https://page.auctions.yahoo.co.jp/jp/auction/w338445459,2084261636,1 yen-★ operation unconfirmed Nikon Nikon digital camera D80 body only digital camera (pipe / 60) ★ can not be bundled / notes · self-introduction must,1 yen operation Nikon Nikon camera D80 body camera pipe 60 notes selfintroduction,1 円 動作 Nikon ニコン デジタルカメラ 80 本体 ボディ デジカメ 管 60 同梱 不可 注意 事項 自己 紹介 文 必読
0,ニコン　トリンブル　トータルステーション　FALDY-EF2　校正済,112000.00,,,https://page.auctions.yahoo.co.jp/jp/auction/x629959833,2084211050,Nikon Trimble Total Station FALDY-EF2 calibrated,Nikon Trimble Total Station FALDYEF2,ニコン トリンブル トータル ステーション FALDY EF 2 校正 済
1,新品純正Nikon Coolpix P340 S640 S800c S1200pj S9050 S1000pj S9600 S6000 S9500 S9600 AW100 AW110s AW120s等用バッテリーEN-EL12,1980.00,1980.00,,https://page.auctions.yahoo.co.jp/jp/auction/o343015418,2084261636,New genuine Nikon Coolpix P340 S640 S800c S1200pj S9050 S1000pj S9600 S6000 S9500 S9600 AW100 AW110s AW120s etc.Battery EN-EL12,Nikon Coolpix P340 S640 S800c S1200pj S9050 S1000pj S9600 S9500 S9600 AW100 AW110s AW120s etcBattery,新品 純正 Nikon Coolpix 340 640 800 c 1200 pj 9050 1000 pj 9600 6000 9500 9600 AW 100 AW 110 s AW 120 s 等 用 バッテリー EN EL 12
2,馬仲y790 ニコン トータルステーション『NST-10CHG』★ピンポールプリズム付き☆充電器・バッテリー×2個付き・ケース有り！,12528.00,,,https://page.auctions.yahoo.co.jp/jp/auction/r349674126,2084211050,"Unaka y790 Nikon Total Station ""NST-10CHG"" ★ Pinpole prism included ☆ Charger / Battery x2 included ・ Case available!",Unaka y790 Nikon Total Station NST10CHG Pinpole prism Charger Battery x2 Case,馬 仲 y 790 ニコン トータル ステーション NS 10 CH ピン ポール プリズム 付き 充電器 バッテリー 2 個 付き ケース 有り
