,Title,CurrentPrice,BidOrBuy,shopName,ItemUrl,CategoryId,en_Title,en_short_Title,short_Title
4,★特上★TAMRON タムロン AF 18-270mm F 3.5-6.3 DI II VC PZD NIKON★完動品★,12900.00,19900.00,,https://page.auctions.yahoo.co.jp/jp/auction/e386118756,2084261684,★ Special ★ TAMRON Tamron AF 18-270mm F 3.5-6.3 DI II VC PZD NIKON ★ Complete item ★,TAMRON Tamron AF 18270 mm F 3563 DI II VC PZD NIKON item,特上 TAMRON タムロン AF 18 270 mm F 3 5 3 DI II VC PZD NIKON 完動 品
5,美品★SIGMA シグマ 55-200mm F4.5-5.6 DC ニコン用★動作絶好調,3500.00,4500.00,,https://page.auctions.yahoo.co.jp/jp/auction/e381691605,2084261684,Beautiful goods ★ SIGMA Sigma 55-200mm F4.5-5.6 DC For Nikon ★ Works well,goods SIGMA Sigma 55200 mm F4556 DC Nikon,美品 SIGMA 55- 200 mm F4 5 5. 6 DC ニコン 用 動作 絶好調
6,極上品★SIGMA シグマ Art24mm F1.4 DG HSM ニコン用 ★元箱付き,66000.00,68000.00,,https://page.auctions.yahoo.co.jp/jp/auction/e384616159,2084261684,Finest ★ SIGMA Sigma Art24mm F1.4 DG HSM For Nikon ★ With original box,SIGMA Sigma Art24 mm F14 DG HSM Nikon box,極上 品 SIGMA Art 24 mm 4 DG HS ニコン 用 元箱 付き
7,極上品★NIKON ニコン Ｄ3Ｓ　ボディ★元箱付き,120000.00,122000.00,,https://page.auctions.yahoo.co.jp/jp/auction/t676558567,2084261636,Finest goods ★ NIKON Nikon D3S body ★ with original box,goods NIKON Nikon D3S body box,極上 品 NIKON ニコン Ｄ3 ボディ 元箱 付き
8,【S:8000回／極上品】 ニコン Nikon D7000 ボディ 元箱・付属品 ★使いやすさに定評のあるカメラです！非常に綺麗な状態です！,27800.00,32800.00,,https://page.auctions.yahoo.co.jp/jp/auction/l543740397,2084261636,[S: 8000 times / excellent product] Nikon Nikon D7000 body Original box and accessories ★ It is a camera with a reputation for ease of use! It is in a very beautiful state!,S 8000 times product Nikon Nikon D7000 body box accessories camera reputation ease use state,8000 回 極上 品 ニコン Nikon 7000 ボディ 元箱 付属品 やす さ 定評 カメラ 状態
9,1円スタート●MF10●フォルツァZ●250Fi●オーディオPKG●ガーミン●ナビ●ギャザーズM●スマートキー●コーティング●ブレーキ整備●,91508.00,,,https://page.auctions.yahoo.co.jp/jp/auction/e383896707,2084008692,1 yen start ● MF10 ● Forza Z ● 250Fi ● Audio PKG ● Garmin ● Navi ● Gathers M ● Smart Key ● Coating ● Brake Maintenance ●,1 yen MF10 Forza Z 250Fi Audio PKG Garmin Navi M Smart Key Brake Maintenance,1 円 スタート MF 10 フォルツァ 250 Fi オーディオ PKG ガー ミン ナビ ギャザー ズ キー コーティング ブレーキ 整備
10,極上品★NIKON ニコン D7100 ダブルレンズセット★元箱付き,51000.00,53000.00,,https://page.auctions.yahoo.co.jp/jp/auction/x649736760,2084261636,Finest ★ NIKON Nikon D7100 Double lens set ★ With original box,NIKON Nikon D7100 lens set box,極上 品 NIKON ニコン 7100 ダブル レンズ セット 元箱 付き
11,MC21S HN21S HE21S MC22S MF21S プチハイフロー ターボ タービン ボルトオン フルノーマル車対応 強化調整式アクチェーター付き セット付き,45441.00,45441.00,,https://page.auctions.yahoo.co.jp/jp/auction/t676848414,2084199173,MC21S HN21S HE21S MC22S MF21S Petit High Flow Turbo Turbine Bolt-on Full Normal Car Compatible With Adjustable Actuator With Set,MC21S HN21S MF21S Petit High Flow Turbo Turbine Bolton Full Car Adjustable Actuator Set,MC 21 HN 21 HE 21 MC 22 MF 21 プチ ハイ フロー ターボ タービン ボルト 車 対応 強化 調整 式 アク チェ 付き セット 付き
12,"★　　シャッター　巻上OK　　★　 　　NIKON 　　　4 　　 ～　　　FE,　　　EM,　　EL　 　BL & WH",1300.00,,,https://page.auctions.yahoo.co.jp/jp/auction/q319148596,2084044778,"★ Shutter roll-up OK ★ NIKON 4 ~ FE, EM, EL BL",Shutter rollup NIKON 4 FE EM EL BL,シャッター 巻上 OK NIKON 4 FE EM EL BL WH
13,★新品未開封！★ニコン Nikon D7500＆ダブルレンズ セット★元箱、保証書、付属品完備！★オマケ付き★,110000.00,114800.00,,https://page.auctions.yahoo.co.jp/jp/auction/s691779211,2084261636,"★ New unopened! ★ Nikon Nikon D7500 & Double Lens Set ★ Original box, warranty card and accessories! ★ With bonus ★",Nikon Nikon D7500 Lens Set box warranty card accessories bonus,新品 未 ニコン Nikon 7500 ダブル レンズ セット 元箱 保証書 付属品 オマケ 付き
14,極上品★NIKON　ニコン D80 ダブルレンズ★元箱付き,22000.00,24000.00,,https://page.auctions.yahoo.co.jp/jp/auction/s690707755,2084261636,Finest goods ★ NIKON Nikon D80 double lens ★ with original box,goods NIKON Nikon D80 lens box,極上 品 NIKON ニコン 80 ダブル レンズ 元箱 付き
15,〓超望遠レンズ付き〓nikon ニコン D70S,3980.00,14800.00,,https://page.auctions.yahoo.co.jp/jp/auction/f365509818,2084261636,〓Nikon Nikon D70S with super telephoto lens,Nikon Nikon D70S telephoto lens,超 望遠 レンズ 付き nikon ニコン 70
16,美品★NIKON　ニコン D300 ボディ★元箱付き,22000.00,24000.00,,https://page.auctions.yahoo.co.jp/jp/auction/v667862661,2084261636,Beautiful goods ★ NIKON Nikon D300 body ★ with original box,goods NIKON Nikon D300 body box,美品 NIKON ニコン D3 00 ボディ 元箱 付き
17,大人気 フォルツァMF08/MF10 LEDヘッドライト H4 車検対応 Hi/Lo 8000LM ホワイト 6500K 正規品 安心の1年保証,3980.00,3980.00,,https://page.auctions.yahoo.co.jp/jp/auction/n354255739,2084289651,Popular Forza MF08 / MF10 LED headlight H4 vehicle inspection Hi / Lo 8000LM White 6500K Genuine 1 year warranty for peace of mind,Forza MF08 MF10 H4 vehicle inspection Lo 8000LM White 6500 K Genuine 1 year warranty peace mind,フォルツァ MF 08 MF 10 LED ヘッドライト 4 車検 対応 Hi Lo 8000 ホワイト 6500 正規 品 安心 1 年 保証
18,■ Nikon AF-S DX NIKKOR 55-300mm F4.5-5.6G ED VR + Nikon純正フード HB-57付属 望遠ズームレンズ 【極めて美品 送料込】,16000.00,,,https://page.auctions.yahoo.co.jp/jp/auction/l552414131,2084261684,■ Nikon AF-S DX NIKKOR 55-300mm F4.5-5.6G ED VR Nikon genuine hood HB-57 included Telephoto zoom lens [Very beautiful goods including shipping],Nikon AFS DX NIKKOR 55300 mm F4556 G ED VR Nikon hood HB57 Telephoto zoom lens goods shipping,Nikon AF DX NIKKOR 55 300 mm F 4 5 5 6 ED VR Nikon 純正 フード HB 57 付属 望遠 ズームレンズ 美品 送料 込
19,★最安 ワゴンR MH21S MH22S MH23S MRワゴン MF22S アルト HA24S モコ MG22S クーラーコンデンサー (レシーバータンク付き) 95310-58J00 ①,6380.00,6380.00,,https://page.auctions.yahoo.co.jp/jp/auction/s690393436,2084199178,★ Cheapest Wagon R MH21S MH22S MH23S MR Wagon MF22S Alto HA24S Moko MG22S Cooler condenser (with receiver tank) 95310-58J00 ①,Wagon R MH21S MH22S MR Wagon MF22S Alto HA24S Moko MG22S Cooler condenser receiver tank 9531058J00,最安 ワゴン 21 MH 22 MH 23 MR ワゴン MF 22 アルト HA 24 モコ MG 22 クーラー コンデンサー レシーバー タンク 付き 95310 58 00 ①
0,☆激レア新品級☆広角 タムロンSP　AF20-40mm F2.7-3.5　ＴＡＭＲＯＮ 動作保証1カ月 即日発送 Nikon,19980.00,21980.00,,https://page.auctions.yahoo.co.jp/jp/auction/w195304128,2084261684,☆ Super rare new grade ☆ Wide angle Tamron SP AF20-40mm F2.7-3.5 TAMRON Operation guarantee 1 month Same day shipping Nikon,grade angle Tamron SP AF2040 mm F2735 TAMRON Operation guarantee 1 month day Nikon,激 新品 級 広角 タムロン SP AF 20 40 mm F2 7 3. 5 ＴＡＭＲＯＮ 動作 保証 1 カ月 即日 発送 Nikon
1,☆Nikon FE2 カメラ USED☆,10000.00,,,https://page.auctions.yahoo.co.jp/jp/auction/n373823005,2084044778,☆ Nikon FE2 camera USED ☆,Nikon FE2 camera,Nikon FE 2 カメラ USED
2,極上品★NIKON ニコン AF-S 24-120mm F4G ED VR★元箱付き,52000.00,54000.00,,https://page.auctions.yahoo.co.jp/jp/auction/s690578921,2084261684,Finest ★ NIKON Nikon AF-S 24-120mm F4G ED VR ★ With original box,NIKON Nikon AFS 24120 mm F4 G ED VR box,極上 品 NIKON ニコン AF 24 120 mm 4 ED VR 元箱 付き
3,〓ニコン望遠レンズセット〓Nikon 70-300 4-5.6 G シグマ 28-200 3.5-5.6 Macro,4980.00,19800.00,,https://page.auctions.yahoo.co.jp/jp/auction/x650346352,2084261684,〓Nikon telephoto lens set〓Nikon 70-300 4-5.6 G Sigma 28-200 3.5-5.6 Macro,Nikon telephoto lens setNikon 70300 456 G Sigma 28200 3556 Macro,ニコン 望遠 レンズ Nikon 70- 300 4 5. 6 G シグマ 28- 200 3 5 5. 6 Macro
4,【爆売り★絶賛販売中】高品質 腕時計 メンズ 海外厳選逸品MF多機能 防水3ATM日付 夜光 クォーツ式 クロノグラフ 高級感 ビジネス オシャレ,1800.00,14500.00,,https://page.auctions.yahoo.co.jp/jp/auction/n374508726,2084223465,[Explosive sale ★ highly acclaimed sale] high quality wristwatch men overseas carefully selected MF multi-function waterproof 3ATM date luminescent quartz chronograph luxury business fashion,sale sale quality wristwatch men MF multifunction 3ATM date luminescent quartz chronograph luxury business fashion,爆 売り 絶賛 販売中 高品質 腕時計 メンズ 海外 厳選 逸品 MF 多 機能 防水 3 ATM 日付 夜光 クォーツ 式 クロノグラフ 高級 感 ビジネス
5,超珍品●NPS Special 特注モデル Nikon F3 P Press プロ仕様・カスタムモデル 動作・外観良品 プレス フィルムカメラ ニコン,520000.00,650000.00,,https://page.auctions.yahoo.co.jp/jp/auction/e384918732,2084044778,Super rare item ● NPS Special Custom model Nikon F3 P Press Professional / Custom model Operation / Appearance good Press Film camera Nikon,item NPS Special Custom model Nikon F3 P Press Custom model Operation Appearance Press Film camera Nikon,超 珍品 NPS Special 特注 モデル Nikon 3 プロ 仕様 カスタム モデル 動作 外観 良品 プレス フィルム カメラ ニコン
6,★美品★ニコン Nikon AF-S NIKKOR 24-85mm F3.5-4.5G★フルサイズの軽量標準ズーム！コスパ最高の高画質が人気です！★#234,15800.00,29800.00,,https://page.auctions.yahoo.co.jp/jp/auction/o331058905,2084261684,"<!DOCTYPE html><html><head><link rel=""shortcut icon"" href=""//ssl.gstatic.com/docs/script/images/favicon.ico""><title>Error</title><style type=""text/css"">body {background-color: #fff; margin: 0; padding: 0;}.errorMessage {font-family: Arial,sans-serif; font-size: 12pt; font-weight: bold; line-height: 150%; padding-top: 25px;}</style></head><body style=""margin:20px""><div><img alt=""Google Apps Script"" src=""//ssl.gstatic.com/docs/script/images/logo.png""></div><div style=""text-align:center;font-family:monospace;margin:50px auto 0;max-width:600px"">無効な引数: source (line 3, file &quot;コード&quot;, project &quot;Translation&quot;)</div></body></html>",DOCTYPE htmlhtmlheadlink relshortcut icon typetextcssbody backgroundcolor fff margin 0 fontfamily Arialsansserif fontsize 12pt fontweight bold lineheight 150 paddingtop 25pxstyleheadbody stylemargin20pxdivimg altGoogle Apps Script srcsslgstaticcomdocsscriptimageslogopngdivdiv auto 0maxwidth600px source line 3 file quotquot project quotTranslationquotdivbodyhtml,美品 ニコン Nikon AF NIKKOR 24 85 mm F3 5 4. 5 フルサイズ 軽量 標準 コスパ 高画質 人気 234
7,★極上品★Nikon ニコン D800E ボディ★あえてローパスフィルタを排除した高画素・高解像度の上級機！★#255,89800.00,128800.00,,https://page.auctions.yahoo.co.jp/jp/auction/s689275449,2084261636,"<!DOCTYPE html><html><head><link rel=""shortcut icon"" href=""//ssl.gstatic.com/docs/script/images/favicon.ico""><title>Error</title><style type=""text/css"">body {background-color: #fff; margin: 0; padding: 0;}.errorMessage {font-family: Arial,sans-serif; font-size: 12pt; font-weight: bold; line-height: 150%; padding-top: 25px;}</style></head><body style=""margin:20px""><div><img alt=""Google Apps Script"" src=""//ssl.gstatic.com/docs/script/images/logo.png""></div><div style=""text-align:center;font-family:monospace;margin:50px auto 0;max-width:600px"">無効な引数: source (line 3, file &quot;コード&quot;, project &quot;Translation&quot;)</div></body></html>",DOCTYPE htmlhtmlheadlink relshortcut icon typetextcssbody backgroundcolor fff margin 0 fontfamily Arialsansserif fontsize 12pt fontweight bold lineheight 150 paddingtop 25pxstyleheadbody stylemargin20pxdivimg altGoogle Apps Script srcsslgstaticcomdocsscriptimageslogopngdivdiv auto 0maxwidth600px source line 3 file quotquot project quotTranslationquotdivbodyhtml,極上 品 Nikon ニコン 800 ボディ ロー パス フィルタ 高 画素 高 解像度 上級 機 255
8,〓魚眼レンズ　フィッシュアイコンバーター〓ニコン Fisheye Converter FC-E8 0.21×,4980.00,19800.00,,https://page.auctions.yahoo.co.jp/jp/auction/r349663692,2084041624,ア イ コ ン Fisheye Lens Fish Icon Converter 〓 Nikon Fisheye Converter FC-E8 0.21 ×,Fisheye Lens Fish Icon Converter Nikon Fisheye Converter FCE8 021,魚眼 レンズ フィッシュ アイ コンバーター ニコン Fish eye Converter FC 8 0 21
9,◆お得3点セット ST9B-BS【バッテリー+充電器+スマホUSBチャージャー】YT9B-BS互換【MF密閉型タイプ】【バイクでスマホ充電!超便利!】,7840.00,7840.00,,https://page.auctions.yahoo.co.jp/jp/auction/j596663108,2084005528,◆ Discount 3-piece set ST9B-BS [Battery Charger Smartphone USB Charger] Compatible with YT9B-BS [MF sealed type] [Charging a smartphone with a motorcycle! Super convenient!],Discount 3piece set ST9BBS Battery Charger Smartphone USB Charger YT9BBS MF type smartphone motorcycle Super,お 得 3 点 セット ST 9 BS バッテリー 充電器 スマホ USB チャージャー YT 9 BS 互換 MF 密閉型 タイプ バイク スマホ 超
10,★極上美品★ 超クリアな光学系！ Nikon ニコン ED AF-S NIKKOR 70-300mm F4.5-5.6G VR 動作絶好調！ #R025,7275.00,34800.00,,https://page.auctions.yahoo.co.jp/jp/auction/p717281915,2084261684,"<!DOCTYPE html><html><head><link rel=""shortcut icon"" href=""//ssl.gstatic.com/docs/script/images/favicon.ico""><title>Error</title><style type=""text/css"">body {background-color: #fff; margin: 0; padding: 0;}.errorMessage {font-family: Arial,sans-serif; font-size: 12pt; font-weight: bold; line-height: 150%; padding-top: 25px;}</style></head><body style=""margin:20px""><div><img alt=""Google Apps Script"" src=""//ssl.gstatic.com/docs/script/images/logo.png""></div><div style=""text-align:center;font-family:monospace;margin:50px auto 0;max-width:600px"">無効な引数: source (line 3, file &quot;コード&quot;, project &quot;Translation&quot;)</div></body></html>",DOCTYPE htmlhtmlheadlink relshortcut icon typetextcssbody backgroundcolor fff margin 0 fontfamily Arialsansserif fontsize 12pt fontweight bold lineheight 150 paddingtop 25pxstyleheadbody stylemargin20pxdivimg altGoogle Apps Script srcsslgstaticcomdocsscriptimageslogopngdivdiv auto 0maxwidth600px source line 3 file quotquot project quotTranslationquotdivbodyhtml,極上 美品 超 光学系 Nikon ニコン ED AF NIKKOR 70 300 mm F 4 5 5 6 VR 動作 025
11,フォルツァ MF08 MF10 MF12※ワンタッチ取付 PHILIPS CREE製 XHP50 LEDチップ 16000LM H4 LEDヘッドライト 車検対応,5500.00,5500.00,,https://page.auctions.yahoo.co.jp/jp/auction/o344597491,2084289646,Forza MF08 MF10 MF12 * One-touch mounting PHILIPS CREE XHP50 LED chip 16000LM H4 LED headlight,Forza MF08 MF10 MF12 Onetouch PHILIPS XHP50 chip 16000LM H4,フォルツァ MF 08 MF 10 MF 12 ワンタッチ 取付 PHILIPS CREE 製 XHP 50 LED チップ 16000 4 LED ヘッドライト 車検 対応
12,〓外観綺麗 〓Nikon ニコン ストラップ for Professional,1980.00,14800.00,,https://page.auctions.yahoo.co.jp/jp/auction/g372097962,23760,〓Beautiful appearance 〓Nikon Nikon strap for Professional,appearance Nikon Nikon strap Professional,外観 Nikon ニコン ストラップ for
13,〓外観綺麗 テレコンバーター〓ニコン Nikon Tele Converter TC-E3ED 3X,2980.00,19800.00,,https://page.auctions.yahoo.co.jp/jp/auction/b415692938,2084041624,〓 Appearance beautiful Teleconverter 〓 Nikon Nikon Tele Converter TC-E3ED 3X,Appearance Teleconverter Nikon Nikon Tele Converter TCE3ED 3X,外観 テレコン バーター ニコン Tele Converter TC 3 ED 3
14,〓レリーズ数たった3855回 望遠レンズ付き〓ニコン Nikon D50,9980.00,24800.00,,https://page.auctions.yahoo.co.jp/jp/auction/o344935295,2084261636,〓 Nikon Nikon D50 with 3855 telephoto lenses,Nikon Nikon D50 3855 telephoto lenses,数 3855 回 望遠 レンズ 付き ニコン Nikon 50
15,充電済MFタイプ YB9-B◆GB250クラブマン シルクロード　XL125R,2904.00,2915.00,,https://page.auctions.yahoo.co.jp/jp/auction/k414482964,2084005528,Charged MF type YB9-B ◆ GB250 Clubman Silk Road XL125R,MF type YB9B GB250 Clubman Silk Road XL125R,充電 済 MF タイプ YB 9 GB 250 クラブ マン シルクロード XL 125
16,Nikon ニコン 純正 NIKKOR 35mm 単焦点高級ワイドレンズ 1:2 希少な作動品 (Ai),3743.00,,,https://page.auctions.yahoo.co.jp/jp/auction/m361426605,2084261693,Nikon Nikon Genuine NIKKOR 35mm single focus luxury wide lens 1: 2 Rare working product (Ai),Nikon Nikon Genuine NIKKOR 35 mm focus luxury lens 1 2 working product Ai,Nikon ニコン 純正 NIKKOR 35 mm 単 焦点 高級 ワイド レンズ 1 2 作動 品 Ai
17,Canon TV ZOOM LENS J8×6B4 IRS SX12 キャノン放送用ビデオレンズ ショートズーム,6750.00,,,https://page.auctions.yahoo.co.jp/jp/auction/v663658394,2084239145,Canon TV ZOOM LENS J8 × 6B4 IRS SX12 Canon Broadcast Video Lens Short Zoom,Canon TV ZOOM LENS J8 6B4 IRS SX12 Canon Broadcast Video Lens Short Zoom,Canon TV ZOOM LENS 8 6 4 IRS SX 12 キャノン 放送 用 ビデオ レンズ ショート ズーム
18,〓外観綺麗 フード付〓ニコン Nikon AF NIKKOR 85 F1.8,18980.00,39800.00,,https://page.auctions.yahoo.co.jp/jp/auction/c726863851,2084261684,〓Appearance beautiful hooded 〓Nikon AF NIKKOR 85 F1.8,Appearance Nikon AF NIKKOR 85 F18,外観 フード 付 ニコン Nikon AF NIKKOR 85 1 8
19,☆PETRI MF-1 カメラ USED☆,10000.00,,,https://page.auctions.yahoo.co.jp/jp/auction/m362887719,2084044776,☆ PETRI MF-1 Camera USED ☆,PETRI MF1 Camera,PET RI MF 1 カメラ
0,Nikon ニコン 対物レンズ Plan Apo 20x/0.75 DIC M/N2 ∞/0.17 WD 1.0 中古 顕微鏡 20倍 生物 ケース 管理⑨,19860.00,32558.00,,https://page.auctions.yahoo.co.jp/jp/auction/r351232302,2084045044,Nikon Nikon Objective Lens Plan Apo 20x / 0.75 DIC M / N2 ∞ / 0.17 WD 1.0 Used Microscope 20x Biological Case Management Box,Nikon Nikon Objective Lens Plan Apo 075 DIC M N2 017 WD 10 Microscope Biological Case Management Box,Nikon ニコン 対物 レンズ Plan Apo 20 x 0 75 DIC M 2 0 17 WD 1 0 中古 顕微鏡 20 倍 生物 ケース 管理 ⑨
1,★希少 極上美品★ PLAUBEL プラウベル makina 67 ＆ Nikon NIKKOR 2.8 80mm 付属品多数！ 外観・光学ともに綺麗なコンディション！ A260,229800.00,259800.00,,https://page.auctions.yahoo.co.jp/jp/auction/422825532,2084204370,★ Rare Superb Beauty ★ PLAUBEL PROUBEL makina 67 & Nikon NIKKOR 2.8 80mm Many accessories! Beautiful appearance and optics! A260,Rare Superb Beauty PLAUBEL PROUBEL 67 Nikon NIKKOR 28 80 mm accessories appearance optics,極上 美品 PLAUBEL プラウ ベル makina 67 Nikon NIKKOR 2 8 80 mm 付属品 外観 光学 とも コンディション 260
2,〓人気カメラ〓Nikon ニコン Ｄ70s,2980.00,14800.00,,https://page.auctions.yahoo.co.jp/jp/auction/399398956,2084261636,〓Popular camera〓Nikon Nikon D70s,cameraNikon Nikon D70s,人気 カメラ Nikon ニコン 70 s
3,ワンタッチ取付 H4 LEDヘッドライト フォルツァMF08/MF10 2灯,5950.00,5980.00,,https://page.auctions.yahoo.co.jp/jp/auction/c751762607,2084289650,One-touch mounting H4 LED headlight Forza MF08 / MF10 2 lights,Onetouch H4 Forza MF08 MF10 2 lights,ワンタッチ 取付 4 LED ヘッドライト フォルツァ MF 08 MF 10 2 灯
4,H 未使用 CANON ZOOM LENS EF-S 55-250mm 1:4.5-5.6 STM レンズ,2200.00,,,https://page.auctions.yahoo.co.jp/jp/auction/j594772558,2084261683,H Unused CANON ZOOM LENS EF-S 55-250mm 1: 4.5-5.6 STM lens,H Unused CANON ZOOM LENS EFS 55250 mm 1 4556 STM lens,未 使用 CANON ZOOM LENS EF 55 250 mm 1 4. 5 5. 6 ST レンズ
5,【ランクＡ】 ニコン Nikon COOLPIX P900 予備バッテリー付き （#397）,38700.00,42700.00,,https://page.auctions.yahoo.co.jp/jp/auction/h426868648,2084261644,"<!DOCTYPE html><html><head><link rel=""shortcut icon"" href=""//ssl.gstatic.com/docs/script/images/favicon.ico""><title>Error</title><style type=""text/css"">body {background-color: #fff; margin: 0; padding: 0;}.errorMessage {font-family: Arial,sans-serif; font-size: 12pt; font-weight: bold; line-height: 150%; padding-top: 25px;}</style></head><body style=""margin:20px""><div><img alt=""Google Apps Script"" src=""//ssl.gstatic.com/docs/script/images/logo.png""></div><div style=""text-align:center;font-family:monospace;margin:50px auto 0;max-width:600px"">無効な引数: source (line 3, file &quot;コード&quot;, project &quot;Translation&quot;)</div></body></html>",DOCTYPE htmlhtmlheadlink relshortcut icon typetextcssbody backgroundcolor fff margin 0 fontfamily Arialsansserif fontsize 12pt fontweight bold lineheight 150 paddingtop 25pxstyleheadbody stylemargin20pxdivimg altGoogle Apps Script srcsslgstaticcomdocsscriptimageslogopngdivdiv auto 0maxwidth600px source line 3 file quotquot project quotTranslationquotdivbodyhtml,ランク ニコン Nikon COOLPIX 900 予備 バッテリー 付き 397
6,★極上品★ Nikon ニコン AF-S 24-120mm 4 G ED VR 綺麗な外観！ カビ・クモリなしの非常に綺麗な光学！ 必ずご満足いただけます！ A049,49800.00,65800.00,,https://page.auctions.yahoo.co.jp/jp/auction/u288778021,2084261684,★ Exquisite ★ Nikon Nikon AF-S 24-120mm 4 G ED VR Beautiful appearance! Very beautiful optics without mold and spider! You will definitely be satisfied! A049,Nikon Nikon AFS 24120 mm 4 G ED VR appearance optics mold spider,極上 品 Nikon ニコン AF 24 120 mm 4 ED VR 外観 カビ クモリ なし 光学 ご 049
7,〓外観非常に綺麗〓ニコン Nikon F2 フォトミック S,22980.00,54800.00,,https://page.auctions.yahoo.co.jp/jp/auction/342834488,2084044778,〓Appearance is very beautiful〓Nikon Nikon F2 Photomic S,Appearance Nikon F2 Photomic S,外観 ニコン 2 フォトミック
8,cherry★p9885mf★男性用 縞袴 単品 ★着用可！★成人式・結婚式に【行灯】中古◇,1650.00,,,https://page.auctions.yahoo.co.jp/jp/auction/q318302674,2084045098,cherry ★ p9885mf ★ Men's striped candy separately ★ Wearable! ★ Used for wedding ceremonies and weddings,cherry Mens candy wedding ceremonies weddings,cherry 9885 mf 男性 用 縞 袴 単品 着用 成人式 結婚式 行灯 中古
9,★極上品★ TAMRON タムロン SP AF 90mm 2.8 Di MACRO 1:1 ニコン用 非常に綺麗な外観！ カビ・クモリなしの光学系！ 動作絶好調！ A090,19800.00,34800.00,,https://page.auctions.yahoo.co.jp/jp/auction/t658633032,2084261684,★ Exquisite ★ TAMRON Tamron SP AF 90mm 2.8 Di MACRO 1: 1 For Nikon Very beautiful appearance! Optical system without mold and spider! Works very well! A090,TAMRON Tamron SP AF 90 mm 28 Di MACRO 1 1 Nikon appearance system mold spider,極上 品 TAMRON タムロン SP AF 90 mm 2 8 Di MACRO 1 1 ニコン 用 外観 カビ クモリ なし 光学系 動作 090
10,★ワンオーナー 極上品★ Nikon ニコン F3 HP ハイアイポイント ボディ 外観・光学ともに綺麗なコンディション！ 動作絶好調！ A243,29800.00,47800.00,,https://page.auctions.yahoo.co.jp/jp/auction/q312125949,2084044778,★ One owner finest ★ Nikon Nikon F3 HP High Eye Point Body Appearance and optics are beautiful! Works very well! A243,One owner Nikon Nikon F3 HP High Eye Point Body Appearance optics Works,ワン オーナー 極上 品 Nikon ニコン 3 HP ハイ アイポイント ボディ 外観 光学 とも コンディション 動作 243
11,★★買取専門★★1Nikon D80 ニコン デジタル 一眼レフカメラ 作動確認済！ 付属品有り,16000.00,,,https://page.auctions.yahoo.co.jp/jp/auction/422619545,2084261636,★★ Special purchase ★★ 1Nikon D80 Nikon digital SLR camera Confirmed operation! With accessories,purchase 1Nikon D80 Nikon SLR camera operation accessories,★ 買取 専門 1 Nikon 80 ニコン デジタル 眼 レフ カメラ 作動 確認 済 付属品 有り
12,★新品★Tokina トキナー AT-X SD 70-200mm F4 PRO FX (IF) VCM-S ニコン★付属品多数！試写のみ！清潔感溢れる黒々としたボディ！,11500.00,78000.00,,https://page.auctions.yahoo.co.jp/jp/auction/p718071928,2084261684,★ New ★ Tokina Tokina AT-X SD 70-200mm F4 PRO FX (IF) VCM-S Nikon ★ Many accessories! Only preview! A clean black body!,Tokina Tokina ATX SD 70200 mm F4 PRO FX VCMS Nikon accessories body,新品 Tokina トキナー AT SD 70 200 mm 4 PRO FX IF VCM ニコン 付属品 感 ボディ
13,〓外観綺麗　フード付〓Tokina トキナー AT-X PRO AF 28-70 F2.8 ニコン用,7980.00,24800.00,,https://page.auctions.yahoo.co.jp/jp/auction/h426383048,2084261684,〓Beautiful hooded kinTokina Tokina AT-X PRO AF 28-70 F2.8 for Nikon,kinTokina Tokina ATX PRO AF 2870 F28 Nikon,外観 フード 付 Tokina トキナー AT PRO AF 28- 70 F 2. 8 ニコン 用
