,Title,CurrentPrice,BidOrBuy,shopName,ItemUrl,CategoryId,en_Title,en_short_Title,short_Title
3,◆新品級◆ニコン Nikon D5500 Wズームキット 元箱・付属品多数 カメラケース付 #c19i9046i14,59800.00,68000.00,,https://page.auctions.yahoo.co.jp/jp/auction/d387898819,2084261636,"<!DOCTYPE html><html><head><link rel=""shortcut icon"" href=""//ssl.gstatic.com/docs/script/images/favicon.ico""><title>エラー</title><style type=""text/css"">body {background-color: #fff; margin: 0; padding: 0;}.errorMessage {font-family: Arial,sans-serif; font-size: 12pt; font-weight: bold; line-height: 150%; padding-top: 25px;}</style></head><body style=""margin:20px""><div><img alt=""Google Apps Script"" src=""//ssl.gstatic.com/docs/script/images/logo.png""></div><div style=""text-align:center;font-family:monospace;margin:50px auto 0;max-width:600px"">無効な引数: source（行 3、ファイル「コード」、プロジェクト「Translation」）</div></body></html>",DOCTYPE relshortcut icon hrefsslgstaticcomdocsscriptimagesfaviconicotitletitlestyle typetextcssbody backgroundcolor fff margin 0 padding 0errorMessage Arialsansserif fontsize fontweight lineheight 150 paddingtop 25pxstyleheadbody stylemargin20pxdivimg altGoogle Apps Script srcsslgstaticcomdocsscriptimageslogopngdivdiv auto 0maxwidth600px source 3Translationdivbodyhtml,新品 級 ニコン Nikon 5500 ズーム キット 元箱 付属品 多数 カメラ ケース 付 19 9046 14
4,▼NIKON レンズ NIKKOR-M 300mm 1.9 ニコン 光学機器　現状品 95K4283,1296.00,,,https://page.auctions.yahoo.co.jp/jp/auction/r349479349,23692,▼ NIKON lens NIKKOR-M 300mm 1.9 Nikon optical equipment current product 95K4283,NIKON lens NIKKORM 300 mm 19 Nikon equipment product 95K4283,NIKON レンズ NIKKOR 300 mm 1. 9 ニコン 光学 機器 現状 品 95 K 4283
5,純正新品！Nikon Li-ion リチャージャブルバッテリー EN-EL21 ！,1980.00,1980.00,,https://page.auctions.yahoo.co.jp/jp/auction/h356636879,2084261661,Genuine new article! Nikon Li-ion Rechargeable Battery EN-EL21!,article Nikon Liion Rechargeable Battery ENEL21,純正 新品 Nikon Li リチャージャブル バッテリー EN EL 21
6,NIKONのひと世代前の高級顕微鏡接眼17ｍｍ　31.7サイズリメイク　☆StarWorks,2300.00,,,https://page.auctions.yahoo.co.jp/jp/auction/d388995087,2084055381,NIKON's previous generation high-end microscope eyepiece 17mm 31.7 size remake ☆ StarWorks,generation microscope eyepiece 17 mm 317 size remake StarWorks,NIKON ひと 世代 前 高級 顕微鏡 接眼 17 ｍｍ 31 7 サイズ リメイク Star Works
7,新品純正NikonCoolPix P700 /P7100 /P7700 D3100 / D3200/D3300/D3400/D3500/D5100 /D5200/D5300/D5500/D5600用バッテリーEN-EL14a,2680.00,2680.00,,https://page.auctions.yahoo.co.jp/jp/auction/l546327712,2084261636,New genuine NikonCoolPix P700 / P7100 / P7700 D3100 / D3200 / D3300 / D3400 / D3500 / D5100 / D5200 / D5300 / D5500 / D5600 battery EN-EL14a,NikonCoolPix P700 P7100 P7700 D3100 D3200 D3300 D3400 D3500 D5100 D5200 D5300 D5500 battery ENEL14a,新品 純正 NikonCoolPix 700 7100 / 7700 D3 100 D3 200 D3 300 D3 400 D3 500 D 5100 D 5200 D 5300 D 5500 5600 用 バッテリー EN EL 14
8,■得々■Nikon＆HAKUBA/ニコン＆ハクバ/デジタル/一眼レフカメラ/レンズ(80～200mm)/アルミケース（カギ付き）/D90＆AS-S,12960.00,,,https://page.auctions.yahoo.co.jp/jp/auction/j568170227,2084261636,■ Profit ■ Nikon & HAKUBA / Nikon & Hakuba / Digital / SLR camera / Lens (80-200mm) / Aluminum case (with key) / D90 & AS-S,Profit Nikon HAKUBA Nikon Hakuba Digital SLR camera Lens 80200 mm Aluminum case D90 ASS,得々 Nikon ニコン ハクバ デジタル 一 眼 レフ カメラ レンズ 80 200 mm アルミ ケース カギ 付き 90 AS
9,Nikon/ニコン ズームデマンド●TZ-D3 中古,21600.00,,,https://page.auctions.yahoo.co.jp/jp/auction/j590688575,2084239145,Nikon / Nikon Zoom Demand TZ-D3 used,Nikon Nikon Zoom Demand TZD3,Nikon ニコン ズーム デマンド TZ D3 中古
10,Nikon SIGMA 一眼レフ用 レンズ まとめて11点 NIKKOR 200mm 1:4 NIKKOR-Q Auto 1:3.5 f=135mm 他,1400.00,,,https://page.auctions.yahoo.co.jp/jp/auction/u303447353,2084261693,Nikon SIGMA SLR lenses 11 points in total NIKKOR 200mm 1: 4 NIKKOR-Q Auto 1: 3.5 f = 135mm etc.,Nikon SIGMA SLR 11 points NIKKOR 200 mm 1 4 NIKKORQ Auto 1 35 f 135 mm,Nikon SIGMA 一 眼 レフ 用 レンズ 11 点 NIKKOR 200 mm 1 4 NIKKOR Q Auto 1 3. 5 f 135 mm 他
11,★新品級★ Nikon ニコン AF-S DX NIKKOR 18-200mm F3.5-5.6 G ED ＶＲ★新品級の外観! カビ・クモリなし! 完動品! A281,100.00,29800.00,,https://page.auctions.yahoo.co.jp/jp/auction/j593674912,2084261684,"★ New grade ★ Nikon Nikon AF-S DX NIKKOR 18-200mm F3.5-5.6 G ED VR ★ New grade appearance! No mold, spider! Complete product! A281",grade Nikon Nikon AFS DX NIKKOR 18200 mm F3556 G ED VR New grade appearance mold product A281,新品 級 Nikon ニコン AF DX NIKKOR 18 200 mm F3 5 5 6 ED ＶＲ 新品 級 外観 カビ クモリ なし 完動 品 281
12,★新品同様!!★ニコン NIKON AF-S NIKKOR 14-24mm F2.8G ED★新品と見間違ってしまう外観!! 透き通る程クリアな光学系!! 動作も完璧!! #742,1.00,152300.00,,https://page.auctions.yahoo.co.jp/jp/auction/q316105754,2084261684,"<!DOCTYPE html><html><head><link rel=""shortcut icon"" href=""//ssl.gstatic.com/docs/script/images/favicon.ico""><title>エラー</title><style type=""text/css"">body {background-color: #fff; margin: 0; padding: 0;}.errorMessage {font-family: Arial,sans-serif; font-size: 12pt; font-weight: bold; line-height: 150%; padding-top: 25px;}</style></head><body style=""margin:20px""><div><img alt=""Google Apps Script"" src=""//ssl.gstatic.com/docs/script/images/logo.png""></div><div style=""text-align:center;font-family:monospace;margin:50px auto 0;max-width:600px"">無効な引数: source（行 3、ファイル「コード」、プロジェクト「Translation」）</div></body></html>",DOCTYPE relshortcut icon hrefsslgstaticcomdocsscriptimagesfaviconicotitletitlestyle typetextcssbody backgroundcolor fff margin 0 padding 0errorMessage Arialsansserif fontsize fontweight lineheight 150 paddingtop 25pxstyleheadbody stylemargin20pxdivimg altGoogle Apps Script srcsslgstaticcomdocsscriptimageslogopngdivdiv auto 0maxwidth600px source 3Translationdivbodyhtml,新品 ニコン NIKON AF NIKKOR 14 24mm 2 8 ED 新品 外観 光学系 動作 742
13,★希少 極上美品★ PLAUBEL プラウベル makina 67 ＆ Nikon NIKKOR 2.8 80mm 付属品多数！ 外観・光学ともに綺麗なコンディション！ A260,21.00,254800.00,,https://page.auctions.yahoo.co.jp/jp/auction/f374798777,2084204370,★ Rare Superb Beauty ★ PLAUBEL PROUBEL makina 67 & Nikon NIKKOR 2.8 80mm Many accessories! Beautiful appearance and optics! A260,Rare Superb Beauty PLAUBEL PROUBEL makina 67 Nikon NIKKOR 28 80 mm accessories appearance optics A260,極上 美品 PLAUBEL プラウ ベル makina 67 Nikon NIKKOR 2 8 80 mm 付属品 外観 光学 とも コンディション 260
14,★Nikon AF-S DX NIKKOR 55-300mm F4.5-5.6 G ED VR ★あこがれの超望遠レンズ 手ブレ防止つき！！,15800.00,15800.00,,https://page.auctions.yahoo.co.jp/jp/auction/w335944316,2084261684,★ Nikon AF-S DX NIKKOR 55-300mm f / 4.5-5.6 G ED VR ★ A long-awaited super telephoto lens with anti-shake! !,Nikon AFS DX NIKKOR 55300 mm f 4556 G ED VR A telephoto lens antishake,Nikon AF DX NIKKOR 55 300 mm F 4 5 5 6 ED VR あこがれ 超 望遠 レンズ 手ブレ 防止 つき
15,★極上美品!!★ニコン NIKON D7000 ボディ★予備バッテリー付き!! 非常にきれいな外観!! 視界良好でクリアなファインダー!!#716,5000.00,34800.00,,https://page.auctions.yahoo.co.jp/jp/auction/t673999299,2084261636,"<!DOCTYPE html><html><head><link rel=""shortcut icon"" href=""//ssl.gstatic.com/docs/script/images/favicon.ico""><title>エラー</title><style type=""text/css"">body {background-color: #fff; margin: 0; padding: 0;}.errorMessage {font-family: Arial,sans-serif; font-size: 12pt; font-weight: bold; line-height: 150%; padding-top: 25px;}</style></head><body style=""margin:20px""><div><img alt=""Google Apps Script"" src=""//ssl.gstatic.com/docs/script/images/logo.png""></div><div style=""text-align:center;font-family:monospace;margin:50px auto 0;max-width:600px"">無効な引数: source（行 3、ファイル「コード」、プロジェクト「Translation」）</div></body></html>",DOCTYPE relshortcut icon hrefsslgstaticcomdocsscriptimagesfaviconicotitletitlestyle typetextcssbody backgroundcolor fff margin 0 padding 0errorMessage Arialsansserif fontsize fontweight lineheight 150 paddingtop 25pxstyleheadbody stylemargin20pxdivimg altGoogle Apps Script srcsslgstaticcomdocsscriptimageslogopngdivdiv auto 0maxwidth600px source 3Translationdivbodyhtml,極上 美品 ニコン NIKON 7000 ボディ 予備 バッテリー 付き 外観 視界 ファインダー 716
16,★新品同様!!★タムロン TAMRON SP 15-30mm F2.8 Di VC USD (Model A012) ニコン(Nikon)用★新品と見間違ってしまうキレイな外観!!#729,1.00,92800.00,,https://page.auctions.yahoo.co.jp/jp/auction/w339021665,2084261684,"<!DOCTYPE html><html><head><link rel=""shortcut icon"" href=""//ssl.gstatic.com/docs/script/images/favicon.ico""><title>エラー</title><style type=""text/css"">body {background-color: #fff; margin: 0; padding: 0;}.errorMessage {font-family: Arial,sans-serif; font-size: 12pt; font-weight: bold; line-height: 150%; padding-top: 25px;}</style></head><body style=""margin:20px""><div><img alt=""Google Apps Script"" src=""//ssl.gstatic.com/docs/script/images/logo.png""></div><div style=""text-align:center;font-family:monospace;margin:50px auto 0;max-width:600px"">無効な引数: source（行 3、ファイル「コード」、プロジェクト「Translation」）</div></body></html>",DOCTYPE relshortcut icon hrefsslgstaticcomdocsscriptimagesfaviconicotitletitlestyle typetextcssbody backgroundcolor fff margin 0 padding 0errorMessage Arialsansserif fontsize fontweight lineheight 150 paddingtop 25pxstyleheadbody stylemargin20pxdivimg altGoogle Apps Script srcsslgstaticcomdocsscriptimageslogopngdivdiv auto 0maxwidth600px source 3Translationdivbodyhtml,新品 タムロン TAMRON SP 15 30mm 2 8 VC USD Model A 012 ニコン Nikon 用 新品 外観 729
17,★極上美品!!★Nikon ニコン D7100 ボディ ダブルレンズセット★付属品多数!!視界良好でクリアなファインダー!!すぐに使えます!!#597,1.00,59800.00,,https://page.auctions.yahoo.co.jp/jp/auction/r350103291,2084261636,"<!DOCTYPE html><html><head><link rel=""shortcut icon"" href=""//ssl.gstatic.com/docs/script/images/favicon.ico""><title>エラー</title><style type=""text/css"">body {background-color: #fff; margin: 0; padding: 0;}.errorMessage {font-family: Arial,sans-serif; font-size: 12pt; font-weight: bold; line-height: 150%; padding-top: 25px;}</style></head><body style=""margin:20px""><div><img alt=""Google Apps Script"" src=""//ssl.gstatic.com/docs/script/images/logo.png""></div><div style=""text-align:center;font-family:monospace;margin:50px auto 0;max-width:600px"">無効な引数: source（行 3、ファイル「コード」、プロジェクト「Translation」）</div></body></html>",DOCTYPE relshortcut icon hrefsslgstaticcomdocsscriptimagesfaviconicotitletitlestyle typetextcssbody backgroundcolor fff margin 0 padding 0errorMessage Arialsansserif fontsize fontweight lineheight 150 paddingtop 25pxstyleheadbody stylemargin20pxdivimg altGoogle Apps Script srcsslgstaticcomdocsscriptimageslogopngdivdiv auto 0maxwidth600px source 3Translationdivbodyhtml,極上 美品 Nikon ニコン 7100 ボディ ダブル レンズ セット 付属品 視界 ファインダー 597
18,お得！即決！Nikon リモコン ML-L6(アクションカメラ KeyMission用)(お得アウトレット品！),1980.00,1980.00,,https://page.auctions.yahoo.co.jp/jp/auction/n365822508,2084044928,Save money! Prompt decision! Nikon Remote Control ML-L6 (for Action Camera KeyMission) (Discount Outlet Product!),money Prompt decision Nikon Remote Control MLL6 Action Camera KeyMission Discount Outlet Product,お 得 Nikon リモコン ML 6 アクション カメラ Key 用 お 得 アウトレット 品
19,★1円出品★ ニコン Nikon F2 フォトミックファインダー（DP-2）,1.00,9800.00,,https://page.auctions.yahoo.co.jp/jp/auction/t674526606,23760,★ 1 yen exhibition ★ Nikon Nikon F2 Photomic Finder (DP-2),1 yen exhibition Nikon Nikon F2 Photomic Finder,1 円 出品 ニコン Nikon 2 フォトミック ファインダー DP 2
0,Nikon ニコン 高級一眼レフカメラ F2ボディ +フォトミックファインダーDP-1付 良好品 （腐食無し）,1100.00,25000.00,,https://page.auctions.yahoo.co.jp/jp/auction/r349067435,2084044778,Nikon Nikon luxury SLR camera F2 body with photomic finder DP-1 Good (no corrosion),Nikon Nikon luxury SLR camera F2 body finder DP1 corrosion,Nikon ニコン 高級 眼 レフ カメラ 2 ボディ フォトミック ファインダー DP 1 付 品 腐食 無し
1,▼Nikon ニコン デジタル一眼レフカメラ D200 10.2メガピクセル 現状品 95K4264-A,4212.00,,,https://page.auctions.yahoo.co.jp/jp/auction/f374545814,2084261636,▼ Nikon Nikon digital SLR camera D200 10.2 megapixel current product 95K4264-A,Nikon Nikon SLR camera D200 102 megapixel product 95K4264A,Nikon ニコン デジタル 一 眼 レフ カメラ 200 10 2 メガ ピクセル 現状 品 95 4264
2,Nikon ニコン 人気の高級一眼レフカメラ FA 黒ボディ 希少な作動品　（腐食無し）,4600.00,,,https://page.auctions.yahoo.co.jp/jp/auction/r349067419,2084044778,Nikon Nikon popular luxury single-lens reflex camera FA black body rare operation product (no corrosion),Nikon Nikon luxury singlelens camera FA body operation product corrosion,Nikon ニコン 人気 高級 一 眼 レフ カメラ FA 黒 ボディ 作動 品 腐食 無し
3,新品 未使用☆ニコン☆NIKON COOLSHOT PRO STABILIZED クールショット ゴルフ レーザー距離測定器 スコープ,41800.00,,,https://page.auctions.yahoo.co.jp/jp/auction/h423545809,2084063253,New article unused ☆ Nikon ☆ NIKON COOLSHOT PRO STABILIZED cool shot golf laser distance measuring instrument scope,article Nikon NIKON COOLSHOT PRO STABILIZED shot golf laser distance instrument scope,新品 未 使用 ニコン☆ NIKON COOL SHOT PRO STABILIZED ショット ゴルフ レーザー 距離 測定 器 スコープ
4,▼Nikon 一眼レフカメラ ボディ F4 オートフォーカス 光学機器 マルチコントロールバックMF-23付き 現状品 95K4265,3564.00,,,https://page.auctions.yahoo.co.jp/jp/auction/e381951603,2084044785,▼ Nikon single-lens reflex camera body F4 auto focus optical equipment multi control back with MF-23 current product 95K4265,Nikon singlelens camera body F4 auto focus equipment multi control MF23 product 95K4265,Nikon 一 眼 レフ カメラ ボディ 4 オートフォーカス 光学 機器 マルチ コントロール バック MF 23 付き 現状 品 95 4265
5,☆希少超広角レン極上美品級☆タムロン TＡＭＲＯＭ　 AF 19-35mm　 F3.5-4.5 Nikon　動作保証１ヶ月付　即日発送,15980.00,17680.00,,https://page.auctions.yahoo.co.jp/jp/auction/x591503550,2084261684,☆ Rare super wide-angle len exquisite beauty class ☆ Tamron TAMROM AF 19-35mm F3.5-4.5 Nikon Operation guarantee 1 month shipping same day,Rare wideangle beauty class Tamron TAMROM AF 1935 mm F3545 Nikon Operation guarantee 1 month shipping day,超 広角 レン 極上 美品 タムロン TＡＭＲＯＭ AF 19 35 mm F3 5 4 5 Nikon 動作 保証 １ ヶ月 付 即日 発送
6,☆希少極上美品級☆シグマ SIGMA　APO 170-500mm F5-6.3　nikon 即日発送,1101.00,28800.00,,https://page.auctions.yahoo.co.jp/jp/auction/x642589449,2084261684,☆ rare exquisite beauty class ☆ Sigma SIGMA APO 170-500mm F5-6.3 nikon same day shipping,beauty class Sigma SIGMA APO 170500 mm F563 day shipping,極上 美品 級 SIGMA APO 170 500 mm F5 6. 3 nikon 即日 発送
7,980円即決！新品完全互換！NIKON/ニコン』EN-EL3e 互換 バッテリー （EL3ec),980.00,980.00,,https://page.auctions.yahoo.co.jp/jp/auction/h422552888,2084261672,980 yen prompt decision! New fully compatible! Nikon / Nikon ”EN-EL3e compatible battery (EL3ec),980 yen decision New Nikon Nikon ENEL3e battery EL3ec,980 円 新品 互換 NIKON ニコン EN EL 3 互換 バッテリー EL 3 ec
8,Ｎｉｋｏｎ　ＳＢ－１５,1.00,,,https://page.auctions.yahoo.co.jp/jp/auction/t672328838,2084261969,Nikon SB-15,Nikon SB15,Ｎｉｋｏｎ ＳＢ １５
9,LUMIX　GF-3　+シグマ・アートライン19ｍｍ（2.8）+キャノン単焦点50ｍｍ+NIKONなんでもレンズ,19800.00,19800.00,,https://page.auctions.yahoo.co.jp/jp/auction/k411850845,2084305449,LUMIX GF-3 Sigma Art Line 19mm (2.8) Canon single focus 50mm NIKON anything lens,LUMIX GF3 Sigma Art Line 19 mm 28 Canon focus 50 mm NIKON anything,LUMIX GF 3 アート ライン 19 ｍｍ 2. 8 キャノン 単 焦点 50 ｍｍ NIKON レンズ
10,Nikon D7200 (9/23正規店メンテ済) AF-S NIKKOR 18-140 f3.5-5.6/AF-S NIKKOR 35mm f1.8 Kenkoフィルター2種 セットでどうぞ,85000.00,,,https://page.auctions.yahoo.co.jp/jp/auction/d389794952,2084261636,Nikon D7200 (Maintened 9/23) AF-S NIKKOR 18-140 f3.5-5.6 / AF-S NIKKOR 35mm f1.8,Nikon D7200 923 AFS NIKKOR 18140 f3556 AFS NIKKOR 35 mm f18,Nikon 7200 9 23 正規 店 メンテ 済 AF NIKKOR 18 140 f 3. 5 5. 6 AF NIKKOR 35mm f1 8 Kenko フィルター 2 種 セット
11,★希少・美品★Nikon ベローズ BELLOWS NIKKOR-P 105mm F4★純正ケース付き,12800.00,,,https://page.auctions.yahoo.co.jp/jp/auction/k407146376,2084261693,★ rare and beautiful goods ★ Nikon bellows BELLOWS NIKKOR-P 105mm F4 ★ with genuine case,goods Nikon BELLOWS NIKKORP 105 mm F4 case,美品 Nikon ベローズ BELLOWS NIKKOR 105 mm 4 純正 ケース 付き
12,【新品】【送料無料】1　NIKKOR 18.5mm f/1.8 保証書付き　nikon 1用,8000.00,,,https://page.auctions.yahoo.co.jp/jp/auction/w338457583,2084261684,[New] [Free Shipping] 1 NIKKOR 18.5mm f / 1.8 Warranty card for nikon 1,New Free Shipping 1 NIKKOR 185 mm 18 Warranty card nikon 1,新品 送料 無料 1 NIKKOR 18 5 mm 8 保証書 付き nikon 1 用
13,Nikon ニコン NipponKogaku 日本光学 双眼鏡 J-B7 7×35 7.3° 専用革ケース付 光学 その他 日本製 専用皮ケース b6085e,2800.00,,,https://page.auctions.yahoo.co.jp/jp/auction/h422604839,2084263451,Nikon Nikon NipponKogaku Nihon Optics Binoculars J-B7 7 × 35 7.3 ° with exclusive leather case Optics Others made in Japan exclusive leather case b6085e,Nikon Nikon NipponKogaku Nihon Optics Binoculars JB7 7 35 73 leather case Optics Others Japan leather case b6085e,Nikon ニコン NipponKogaku 日本 光学 双眼鏡 7 7 35 7 3 ° 専用 革 ケース 付 光学 他 日本製 専用 皮 ケース 6085
14,Nikon1　J4　ほとんど未使用品,16000.00,,,https://page.auctions.yahoo.co.jp/jp/auction/e381627141,2084305445,Nikon1 J4 Almost unused,Nikon1 J4,Nikon 1 4 ほとんど 未 使用 品
15,カメラ 処分 Canon Nikon 4台,1.00,,,https://page.auctions.yahoo.co.jp/jp/auction/o344070543,23972,Camera disposal Canon Nikon 4 units,Camera disposal Canon Nikon 4 units,カメラ 処分 Canon Nikon 4 台
16,【Nikon】☆NPS点検調整済み☆ AF-S NIKKOR 70-200mm f/2.8G ED VR II,94000.00,,,https://page.auctions.yahoo.co.jp/jp/auction/u303239812,2084261684,[Nikon] ☆ NPS inspection adjusted ☆ AF-S NIKKOR 70-200mm f / 2.8G ED VR II,Nikon NPS inspection AFS NIKKOR 70200 mm 28 G ED VR II,Nikon NPS 点検 調整 済み AF NIKKOR 70 200 mm f 2 8 ED VR II
17,★　　綺麗　　★　　　NIKON 　 　 FA 　　 + 　　 MD - 15 　　 + 　　 NIKKOR 　　　80-200mm/F4,1100.00,,,https://page.auctions.yahoo.co.jp/jp/auction/k407718018,2084044778,★ Beautiful ★ NIKON FA FA MD-15 NIKKOR 80-200mm / F4,NIKON FA FA MD15 NIKKOR 80200 mm F4,MD 15 NIKKOR 80 200 mm 4
18,純正品！Nikonマルチパワーバッテリーパック MB-D14 訳有り！値下げ,5880.00,5880.00,,https://page.auctions.yahoo.co.jp/jp/auction/x642950262,23760,Genuine product! Nikon Multi Power Battery Pack MB-D14 In translation! Price cut,product Nikon Multi Power Battery Pack MBD14 translation Price cut,純正 品 Nikon マルチ パワー バッテリーパック MB 14 訳有り 値下げ
19,Nikon FE 2台 色々 まとめ Nikkor 50mm f1.4/Ai-s 35-70mm/セコニック その他色々 動作未確認　ジャンク　まとめて　在庫処分,3100.00,,,https://page.auctions.yahoo.co.jp/jp/auction/o344042681,2084044778,Nikon FE 2 units Various Summary Nikkor 50mm f1.4 / Ai-s 35-70mm / Seconic Others Various operation unconfirmed junk Collective disposal,Nikon FE 2 units Various Summary Nikkor 50 mm Ais 3570 mm Others operation junk disposal,Nikon FE 2 台 まとめ Nikkor 50 mm f 1. 4 - s 35 70 mm セコニック 他 動作 ジャンク 在庫 処分
0,voigtlander apo-lanthar 90mm F3.5 フォクトレンダー ニコン レンズ,9550.00,,,https://page.auctions.yahoo.co.jp/jp/auction/n370269997,2084261693,voigtlander apo-lanthar 90mm F3.5 Vogtlender Nikon lens,voigtlander apolanthar 90 mm F35 Vogtlender Nikon lens,voigtlander apo lan thar 90 mm F3 5 フォクトレンダー ニコン レンズ
1,ニコン　トリンブル　トータルステーションセット　調査済み,65000.00,,,https://page.auctions.yahoo.co.jp/jp/auction/k368459687,2084211050,Nikon Trimble Total Station Set has been investigated,Nikon Trimble Total Station Set,ニコン トリンブル トータル ステーション セット 調査 済み
2,◆初心者入門＆極上美品◆ NIKON ニコン AF-S 18-70mm F3.5-4.5G ED,1.00,19800.00,,https://page.auctions.yahoo.co.jp/jp/auction/s687696079,2084261684,◆ Introduction to Beginners & Finest Beauty ◆ NIKON Nikon AF-S 18-70mm F3.5-4.5G ED,Introduction Beginners Finest Beauty NIKON Nikon AFS 1870 mm F3545 G ED,初心者 入門 極上 美品 NIKON ニコン AF 18 70 mm 5 4. 5 ED
3,ニコン(Nikon) 用● レンズまとめて １２本 + おまけ ★いろいろ,6750.00,,,https://page.auctions.yahoo.co.jp/jp/auction/d387829026,2084261684,Nikon (Nikon) ● 12 lenses together Bonus ★ Various,Nikon Nikon 12 lenses Bonus,ニコン Nikon 用 レンズ １２ 本 おまけ
4,ニコン(Nikon) 用● レンズまとめて １０本 ★いろいろ,4000.00,,,https://page.auctions.yahoo.co.jp/jp/auction/u303394317,2084261693,For Nikon ● 10 lenses together ★ Various,Nikon 10 lenses,ニコン Nikon 用 レンズ １０ 本
5,【新品】 Nikon　ニコン D850 デジタル一眼レフカメラ 本体,88000.00,,,https://page.auctions.yahoo.co.jp/jp/auction/v661264415,2084261636,[New] Nikon Nikon D850 digital SLR camera body,New Nikon Nikon D850 SLR camera body,新品 Nikon ニコン 850 デジタル 一 眼 レフ カメラ 本体
6,ニコンＢ７００　値下げしました。　望遠ズーム24～1440ｍｍ　軽量コンパクト５７０ｇ　２１１4万画素,27000.00,27500.00,,https://page.auctions.yahoo.co.jp/jp/auction/l548082586,2084263446,"Nikon B700 has been price cut. Telephoto zoom 24 to 1440mm, lightweight compact 570g, 211.4 million pixels",Nikon B700 price Telephoto zoom 24 1440 mm 570 g 2114 million pixels,ニコン ７００ 望遠 24 1440 ｍｍ 軽量 コンパクト ５７０ ｇ ２１１4 万 画素
7,Nikon Nikkor NH-WM75 ワイドコンバータアタッチメント ニコン純正　元箱 取説付き,10000.00,,,https://page.auctions.yahoo.co.jp/jp/auction/j593313204,2084261684,Nikon Nikkor NH-WM75 Wide converter attachment Nikon genuine Original box with instruction manual,Nikon Nikkor NHWM75 converter attachment Nikon box instruction manual,Nikon Nikkor NH WM 75 ワイド コンバータ アタッチメント ニコン 純正 元箱 取説 付き
8,【美品】AF-S DX NIKKOR 35mm f/1.8G　元箱　保証書　付属品完備,12500.00,,,https://page.auctions.yahoo.co.jp/jp/auction/s687519526,2084261684,[Beautiful goods] AF-S DX NIKKOR 35mm f / 1.8G original box warranty card complete accessories,goods AFS DX NIKKOR 35 mm 18 G box warranty card accessories,美品 AF DX NIKKOR 35mm 1 8 元箱 保証書 付属品 完備
9,★　ニコン　Ａｐｏ　ＮＩＫＫＯＲ　１：１１　Ｆ＝７６０㎜　現状　ジャンク　★,5250.00,,,https://page.auctions.yahoo.co.jp/jp/auction/w338416799,23692,★ Nikon Apo NIKKOR 1:11 F = 760㎜ Current status Junk ★,Nikon Apo NIKKOR 111 F 760 status Junk,ニコン Ａｐｏ ＮＩＫＫＯＲ １ １１ ７６０ ㎜ 現状 ジャンク
10,希少 名機 1000円スタート NIKON ニコン Nikon F2 フィルムカメラ シルバー ボディ 日本製 52mm NIKKOR 50mm レトロ,1080.00,,,https://page.auctions.yahoo.co.jp/jp/auction/f374315782,2084044778,Rare name machine 1000 jpy start NIKON Nikon Nikon F2 film camera silver body made in Japan 52mm NIKKOR 50mm retro,name machine 1000 jpy start NIKON Nikon Nikon F2 film camera silver body Japan 52 mm NIKKOR 50 mm retro,名機 1000 円 スタート NIKON ニコン Nikon F 2 フィルム カメラ シルバー ボディ 日本製 52 mm NIKKOR 50 mm レトロ
11,[美品・元箱付き] Nikon Ai NIKKOR 24mm F2 元箱一式,22800.00,29800.00,,https://page.auctions.yahoo.co.jp/jp/auction/m356495400,2084261693,[Beautiful product with original box] Nikon Ai NIKKOR 24mm F2 original box set,product box Nikon Ai NIKKOR 24 mm F2 box set,美品 元箱 付き Nikon Ai NIKKOR 24 mm 2 元箱 一式
