,Unnamed: 0,Title,CurrentPrice,BidOrBuy,shopName,ItemUrl,CategoryId,en_Title,en_short_Title
0,0,ニコンＢ７００　望遠ズーム24～1440ｍｍ　軽量コンパクト５７０ｇ　２１１4万画素,29800.0,30000.0,,https://auctions.yahooapis.jp/AuctionWebService/V2/auctionItem?auctionID=l548082586,2084263446,"Nikon B700 telephoto zoom 24-1440mm, lightweight compact 570g, 211.4 million pixels",Nikon telephoto zoom 241440 mm 570 g 2114 million pixels
1,1,【シャッターOK】 Nikon L35AD コンパクトフィルムカメラ,9500.0,9500.0,,https://auctions.yahooapis.jp/AuctionWebService/V2/auctionItem?auctionID=q306790681,2084005100,[Shutter OK] Nikon L35AD Compact Film Camera,Shutter Nikon L35AD Compact Film Camera
2,2,即決 良品 動作保証 ニコン Nikon AF VR 80-400mm F4.5-5.6D ED ケース付き,56800.0,56800.0,,https://auctions.yahooapis.jp/AuctionWebService/V2/auctionItem?auctionID=o316803009,2084261684,Prompt decision good product operation guarantee Nikon Nikon AF VR 80-400mm F4.5-5.6D with ED case,decision product operation guarantee Nikon Nikon AF VR 80400 mm F4556D ED case
3,3,即決 動作保証 ニコン Nikon AF-S NIKKOR 400mm F2.8G ED VR ケース付き 通常送料無料,438000.0,438000.0,,https://auctions.yahooapis.jp/AuctionWebService/V2/auctionItem?auctionID=g363729652,2084261684,Prompt decision guarantee Nikon Nikon AF-S NIKKOR 400mm F2.8G ED VR with case Normal free shipping,decision guarantee Nikon Nikon AFS 400 mm F28 G ED VR case Normal shipping
4,4,即決 動作保証 ニコン AF-S NIKKOR 24-70mm F2.8G ED 箱、ケース付き,88000.0,88000.0,,https://auctions.yahooapis.jp/AuctionWebService/V2/auctionItem?auctionID=g363695350,2084261684,"Prompt decision operation guarantee Nikon AF-S NIKKOR 24-70mm F2.8G ED box, with case",decision operation guarantee Nikon AFS NIKKOR 2470 mm F28 G ED box case
5,5,即決 美品 動作保証 ニコン AF-S NIKKOR 24-70mm F2.8G ED 綺麗な物をお探しの方におすすめです。,92500.0,92500.0,,https://auctions.yahooapis.jp/AuctionWebService/V2/auctionItem?auctionID=k357467511,2084261684,Prompt decision beautiful goods operation guarantee Nikon AF-S NIKKOR 24-70mm F2.8G ED Recommended for those looking for a beautiful thing.,decision goods operation guarantee Nikon AFS NIKKOR 2470 mm F28 G ED thing
6,6,【送料無料】 Nikon PC-E Micro NIKKOR 85mm f/2.8D 【ニコンサービスにて改造済み】,135000.0,,,https://auctions.yahooapis.jp/AuctionWebService/V2/auctionItem?auctionID=f363308048,2084261684,[Free Shipping] Nikon PC-E Micro NIKKOR 85mm f / 2.8D [Modified by Nikon Service],Shipping Nikon PCE Micro NIKKOR 85 mm 28D Nikon Service
7,7,Nikon フィールドスコープ ED82 ＋ アイピースワイド MC 38X 付 (432-W234),64800.0,64800.0,,https://auctions.yahooapis.jp/AuctionWebService/V2/auctionItem?auctionID=m338266649,2084263446,With Nikon Fieldscope ED82 + Eyepiece Wide MC 38X (432-W234),Nikon Fieldscope ED82 Eyepiece Wide MC 38X 432W234
8,8,KS54 1円～ ジャンクカメラ 大量 まとめセット Nikon OLYMPUS Konica Canon MINOLTA PENTAX その他 など 【ジャンク】,28000.0,,,https://auctions.yahooapis.jp/AuctionWebService/V2/auctionItem?auctionID=j591674980,23660,KS54 1 Yen ~ Junk camera Large volume set Nikon OLYMPUS Konica Canon MINOLTA PENTAX Other etc. [Junk],KS54 1 Yen Junk camera volume Nikon OLYMPUS Konica Canon MINOLTA PENTAX Junk
9,9,新品!!　Nikon実体顕微鏡SMZ745(LEDリング照明付),85000.0,180000.0,,https://auctions.yahooapis.jp/AuctionWebService/V2/auctionItem?auctionID=t659806180,2084211051,New !! Nikon stereo microscope SMZ745 (with LED ring illumination),Nikon stereo microscope SMZ745 LED ring illumination
10,10,動作確認済 ニコン Nikon COOLPIX S8100 デジカメ レッド 内箱なし EC51-128jy/F3,2314.0,,,https://auctions.yahooapis.jp/AuctionWebService/V2/auctionItem?auctionID=e379626735,2084261644,Operation confirmed Nikon Nikon COOLPIX S8100 Digital camera Red Without inner box EC51-128jy / F3,Operation Nikon Nikon COOLPIX S8100 Digital camera Red box EC51128jy F3
11,11,★ドイツ製★希少なニコン用単焦点シフトレンズ Schneider KREUZACH PC-SUPER ANGULON 2.8/28,120000.0,,,https://auctions.yahooapis.jp/AuctionWebService/V2/auctionItem?auctionID=w332419102,2084261693,★ Made in Germany ★ Rare Nikon single focus shift lens Schneider KREUZACH PC-SUPER ANGULON 2.8 / 28,Germany Rare Nikon focus shift lens Schneider KREUZACH ANGULON 28 28
12,12,R091613 Nikon デジタル一眼レフカメラ D90 ボディ 通電動作未確認 ジャンク扱い,3100.0,,,https://auctions.yahooapis.jp/AuctionWebService/V2/auctionItem?auctionID=s686557215,2084261636,R091613 Nikon digital SLR camera D90 body energization operation unconfirmed junk treatment,R091613 Nikon SLR camera D90 body energization operation junk treatment
13,13,Nikon モータードライブMD-4 レアなコマ速変換機MK-1付,11000.0,15000.0,,https://auctions.yahooapis.jp/AuctionWebService/V2/auctionItem?auctionID=o342080034,2084044778,Nikon Motor Drive MD-4 with rare frame speed converter MK-1,Nikon Motor Drive MD4 frame speed converter MK1
14,14,Nikon TTLガンカプラーAS-17 レア,1000.0,,,https://auctions.yahooapis.jp/AuctionWebService/V2/auctionItem?auctionID=x641248914,2084261969,Nikon TTL Gun Coupler AS-17 Rare,Nikon TTL Gun Coupler AS17 Rare
15,15,NIKON ニコン COOLSHOT 40i レーザー距離器 ブラック系 [240001273380]【中古】ゴルフウェア,24159.0,,,https://auctions.yahooapis.jp/AuctionWebService/V2/auctionItem?auctionID=q311879963,25094,NIKON Nikon COOLSHOT 40i laser distance meter black [240001273380] [used] golf wear,NIKON Nikon COOLSHOT 40i laser distance meter 240001273380 golf wear
16,16,NIKON ニコン LASER 550AS 距離計 オレンジ系 [240001281014]【中古】ゴルフウェア,13186.0,,,https://auctions.yahooapis.jp/AuctionWebService/V2/auctionItem?auctionID=o339790444,25094,NIKON Nikon LASER 550AS distance meter orange system [240001281014] [used] golf wear,NIKON Nikon LASER 550AS distance meter orange system 240001281014 golf wear
17,17,☆新品☆送料無料☆Nikon AF-S DX NIKKOR 18-300mm f/3.5-5.6G ED VR [AFSDXVR18-300G],85000.0,,,https://auctions.yahooapis.jp/AuctionWebService/V2/auctionItem?auctionID=d377995033,23716,☆ New ☆ Free Shipping ☆ Nikon AF-S DX NIKKOR 18-300mm f / 3.5-5.6G ED VR [AFSDXVR18-300G],New Shipping Nikon AFS DX NIKKOR 18300 mm f 3556 G ED VR AFSDXVR18300 G
18,18,ニコン Nikon ミラーレス一眼Nikon 1 V3 ボディ ブラック　DF-N1000 電子ビューファインダー V3用　セット売り,40500.0,,,https://auctions.yahooapis.jp/AuctionWebService/V2/auctionItem?auctionID=b415254206,2084305445,Nikon Nikon Mirrorless interchangeable-lens camera Nikon 1 V3 Body Black DF-N1000 Electronic viewfinder V3 set sale,Nikon Nikon Mirrorless camera Nikon 1 V3 Body Black DFN1000 Electronic viewfinder V3 set sale
19,19,◆F2.8通しの標準ズームレンズ◆Nikon ニコン AF-S NIKKOR 24-70mm F2.8 G ED ナノクリスタルコート 09Y74102975,84800.0,87800.0,,https://auctions.yahooapis.jp/AuctionWebService/V2/auctionItem?auctionID=q311992175,2084261684,◆ F2.8 through standard zoom lens ◆ Nikon Nikon AF-S NIKKOR 24-70mm F2.8 G ED Nano Crystal Coat 09Y74102975,F28 zoom lens Nikon Nikon AFS NIKKOR 2470 mm F28 G ED Nano Crystal Coat 09Y74102975
20,0,６ウ289　Nikon COOLPIX P610 コンパクト デジタル ニコン カメラ　充電コード・電池・メモリーカード16GB付き,16311.0,,,https://auctions.yahooapis.jp/AuctionWebService/V2/auctionItem?auctionID=o342024794,2084261644,"6U289 Nikon COOLPIX P610 Compact Digital Nikon Camera with charging cord, battery and memory card 16GB",6U289 Nikon COOLPIX P610 Compact Digital Nikon Camera cord battery memory card 16 GB
21,1,★即決★価格交渉あり★ニコン Nikon AI-S 200mm F4 純正単焦点レンズ★＜フィルター、前後キャップ＞＃2917,9780.0,9780.0,,https://auctions.yahooapis.jp/AuctionWebService/V2/auctionItem?auctionID=c769246090,2084261693,"★ Prompt decision ★ Price negotiations available ★ Nikon Nikon AI-S 200mm F4 Genuine single focus lens ★ <Filter, front and rear caps> # 2917",decision Price negotiations Nikon Nikon AIS 200 mm F4 Genuine focus lens Filter front caps 2917
22,2,★即決★価格交渉あり★ニコン NIKON Ai-S NIKKOR 50mm f1.8 パンケーキレンズ★＜フィルター、前後キャップ＞＃2908,17800.0,17800.0,,https://auctions.yahooapis.jp/AuctionWebService/V2/auctionItem?auctionID=m354967445,2084261693,"★ Prompt decision ★ Price negotiated ★ Nikon NIKON Ai-S NIKKOR 50mm f1.8 Pancake lens ★ <Filter, front and rear cap> # 2908",decision Price Nikon NIKON AiS NIKKOR 50 mm Pancake lens Filter front cap 2908
23,3,★名機★ ニコン NIKON F3/T チタンボディ 視界良好なクリアーファインダー,16600.0,59800.0,,https://auctions.yahooapis.jp/AuctionWebService/V2/auctionItem?auctionID=d387034618,2084044778,★ Famous machine ★ Nikon NIKON F3 / T Titanium body Clear viewfinder with good visibility,machine Nikon NIKON F3 T Titanium body viewfinder visibility
24,4,★ハローカメラ★ 4314 Nikon BELIOWS FOCUSING ATTACH MENT PB-4 ベローズ(全長19ｃｍ 幅5ｃｍ ) 箱有り、動作品 美品,19440.0,19440.0,,https://auctions.yahooapis.jp/AuctionWebService/V2/auctionItem?auctionID=s686321128,2084261693,"★ Hello camera ★ 4314 Nikon BELIOWS FOCUSING ATTACH MENT PB-4 Bellows (19cm wide, 5cm wide) with box",camera 4314 Nikon BELIOWS ATTACH MENT PB4 Bellows 19 cm 5 cm box
25,5,★広角★実用級★外観きれい★ Tokina トキナー AF 19-35mm F3.5-4.5 ニコン用 #OK-592,6480.0,6680.0,,https://auctions.yahooapis.jp/AuctionWebService/V2/auctionItem?auctionID=b405727474,2084261684,"<!DOCTYPE html><html><head><link rel=""shortcut icon"" href=""//ssl.gstatic.com/docs/script/images/favicon.ico""><title>エラー</title><style type=""text/css"">body {background-color: #fff; margin: 0; padding: 0;}.errorMessage {font-family: Arial,sans-serif; font-size: 12pt; font-weight: bold; line-height: 150%; padding-top: 25px;}</style></head><body style=""margin:20px""><div><img alt=""Google Apps Script"" src=""//ssl.gstatic.com/docs/script/images/logo.png""></div><div style=""text-align:center;font-family:monospace;margin:50px auto 0;max-width:600px"">無効な引数: source（行 3、ファイル「コード」、プロジェクト「Translation」）</div></body></html>",DOCTYPE relshortcut icon hrefsslgstaticcomdocsscriptimagesfaviconicotitletitlestyle typetextcssbody backgroundcolor fff margin 0 padding 0errorMessage Arialsansserif fontsize fontweight lineheight 150 paddingtop 25pxstyleheadbody stylemargin20pxdivimg altGoogle Apps Script srcsslgstaticcomdocsscriptimageslogopngdivdiv auto 0maxwidth600px source 3Translationdivbodyhtml
26,6,〓人気レンズ〓ニコン Nikon AF-S DX 18-200 F3.5-5.6G VR ED Ⅱ2型,12980.0,34800.0,,https://auctions.yahooapis.jp/AuctionWebService/V2/auctionItem?auctionID=p691644626,2084261684,〓 Popular lens 〓 Nikon Nikon AF-S DX 18-200 F3.5-5.6G VR ED Ⅱ type 2,lens Nikon Nikon AFS DX 18200 F3556 G VR ED type 2
27,7,ニコン Binoculars ポロプリズム 双眼鏡 7X35E C　7.3°双眼鏡　美品,19800.0,,,https://auctions.yahooapis.jp/AuctionWebService/V2/auctionItem?auctionID=j592418179,2084263451,Nikon Binoculars Porro Prism Binoculars 7X35E C 7.3 ° Binoculars,Nikon Binoculars Porro Prism Binoculars 7X35E C 73 Binoculars
28,8,★送料一律★Nikon☆ニコン 35Ti コンパクトフィルムカメラ シャッターOK ソフトケース付き 中古現状品 91N349,12420.0,,,https://auctions.yahooapis.jp/AuctionWebService/V2/auctionItem?auctionID=w337078359,2084005100,★ Shipping uniform ★ Nikon ☆ Nikon 35Ti Compact film camera Shutter OK Soft case with used current product 91N349,uniform Nikon Nikon 35Ti Compact film camera Shutter OK case product 91N349
29,9,★新品同様!!★ニコン NIKON AF-S NIKKOR 14-24mm F2.8G ED★新品と見間違ってしまう外観!! 透き通る程クリアな光学系!! 動作も完璧!! #742,90000.0,152300.0,,https://auctions.yahooapis.jp/AuctionWebService/V2/auctionItem?auctionID=q314746243,2084261684,"<!DOCTYPE html><html><head><link rel=""shortcut icon"" href=""//ssl.gstatic.com/docs/script/images/favicon.ico""><title>エラー</title><style type=""text/css"">body {background-color: #fff; margin: 0; padding: 0;}.errorMessage {font-family: Arial,sans-serif; font-size: 12pt; font-weight: bold; line-height: 150%; padding-top: 25px;}</style></head><body style=""margin:20px""><div><img alt=""Google Apps Script"" src=""//ssl.gstatic.com/docs/script/images/logo.png""></div><div style=""text-align:center;font-family:monospace;margin:50px auto 0;max-width:600px"">無効な引数: source（行 3、ファイル「コード」、プロジェクト「Translation」）</div></body></html>",DOCTYPE relshortcut icon hrefsslgstaticcomdocsscriptimagesfaviconicotitletitlestyle typetextcssbody backgroundcolor fff margin 0 padding 0errorMessage Arialsansserif fontsize fontweight lineheight 150 paddingtop 25pxstyleheadbody stylemargin20pxdivimg altGoogle Apps Script srcsslgstaticcomdocsscriptimageslogopngdivdiv auto 0maxwidth600px source 3Translationdivbodyhtml
30,10,★送料一律★Nikon F3 一眼レフフィルムカメラ レンズ NIKKOR 24mm 1:2.8 ニコン MF-14/MD-14付 シャッターOK 中古現状品 91N3201,24300.0,,,https://auctions.yahooapis.jp/AuctionWebService/V2/auctionItem?auctionID=g373132858,2084044778,★ uniform postage ★ Nikon F3 SLR film camera lens NIKKOR 24mm 1: 2.8 with Nikon MF-14 / MD-14 Shutter OK used current product 91N3201,postage Nikon F3 SLR film camera lens NIKKOR 24 mm 1 28 Nikon MF14 MD14 Shutter OK product
31,11,★超美品★ NIKON ニコン AF-S DX Micro NIKKOR 40mm F2.8 G 外観・光学共に最高コンディションです！ 元箱・取説付,19800.0,29800.0,,https://auctions.yahooapis.jp/AuctionWebService/V2/auctionItem?auctionID=u302211232,2084261684,★ Super beauty ★ NIKON Nikon AF-S DX Micro NIKKOR 40mm F2.8 G The best appearance and optics! With original box and manual,Super beauty NIKON Nikon AFS DX Micro NIKKOR 40 mm F28 G appearance optics box manual
32,12,73◆極上美品◆ ニコン Nikon D800 元箱入り #0712AI360J,51000.0,74000.0,,https://auctions.yahooapis.jp/AuctionWebService/V2/auctionItem?auctionID=m358191917,2084261636,"<!DOCTYPE html><html><head><link rel=""shortcut icon"" href=""//ssl.gstatic.com/docs/script/images/favicon.ico""><title>エラー</title><style type=""text/css"">body {background-color: #fff; margin: 0; padding: 0;}.errorMessage {font-family: Arial,sans-serif; font-size: 12pt; font-weight: bold; line-height: 150%; padding-top: 25px;}</style></head><body style=""margin:20px""><div><img alt=""Google Apps Script"" src=""//ssl.gstatic.com/docs/script/images/logo.png""></div><div style=""text-align:center;font-family:monospace;margin:50px auto 0;max-width:600px"">無効な引数: source（行 3、ファイル「コード」、プロジェクト「Translation」）</div></body></html>",DOCTYPE relshortcut icon hrefsslgstaticcomdocsscriptimagesfaviconicotitletitlestyle typetextcssbody backgroundcolor fff margin 0 padding 0errorMessage Arialsansserif fontsize fontweight lineheight 150 paddingtop 25pxstyleheadbody stylemargin20pxdivimg altGoogle Apps Script srcsslgstaticcomdocsscriptimageslogopngdivdiv auto 0maxwidth600px source 3Translationdivbodyhtml
33,13,★極上美品!!★ニコン NIKON D7000 ボディ★予備バッテリー付き!! 非常にきれいな外観!! 視界良好でクリアなファインダー!!#716,5000.0,34800.0,,https://auctions.yahooapis.jp/AuctionWebService/V2/auctionItem?auctionID=t673155765,2084261636,"<!DOCTYPE html><html><head><link rel=""shortcut icon"" href=""//ssl.gstatic.com/docs/script/images/favicon.ico""><title>エラー</title><style type=""text/css"">body {background-color: #fff; margin: 0; padding: 0;}.errorMessage {font-family: Arial,sans-serif; font-size: 12pt; font-weight: bold; line-height: 150%; padding-top: 25px;}</style></head><body style=""margin:20px""><div><img alt=""Google Apps Script"" src=""//ssl.gstatic.com/docs/script/images/logo.png""></div><div style=""text-align:center;font-family:monospace;margin:50px auto 0;max-width:600px"">無効な引数: source（行 3、ファイル「コード」、プロジェクト「Translation」）</div></body></html>",DOCTYPE relshortcut icon hrefsslgstaticcomdocsscriptimagesfaviconicotitletitlestyle typetextcssbody backgroundcolor fff margin 0 padding 0errorMessage Arialsansserif fontsize fontweight lineheight 150 paddingtop 25pxstyleheadbody stylemargin20pxdivimg altGoogle Apps Script srcsslgstaticcomdocsscriptimageslogopngdivdiv auto 0maxwidth600px source 3Translationdivbodyhtml
34,14,★新品同様!!★タムロン TAMRON SP 15-30mm F2.8 Di VC USD (Model A012) ニコン(Nikon)用★新品と見間違ってしまうキレイな外観!!#729,38000.0,92800.0,,https://auctions.yahooapis.jp/AuctionWebService/V2/auctionItem?auctionID=w337121716,2084261684,"<!DOCTYPE html><html><head><link rel=""shortcut icon"" href=""//ssl.gstatic.com/docs/script/images/favicon.ico""><title>エラー</title><style type=""text/css"">body {background-color: #fff; margin: 0; padding: 0;}.errorMessage {font-family: Arial,sans-serif; font-size: 12pt; font-weight: bold; line-height: 150%; padding-top: 25px;}</style></head><body style=""margin:20px""><div><img alt=""Google Apps Script"" src=""//ssl.gstatic.com/docs/script/images/logo.png""></div><div style=""text-align:center;font-family:monospace;margin:50px auto 0;max-width:600px"">無効な引数: source（行 3、ファイル「コード」、プロジェクト「Translation」）</div></body></html>",DOCTYPE relshortcut icon hrefsslgstaticcomdocsscriptimagesfaviconicotitletitlestyle typetextcssbody backgroundcolor fff margin 0 padding 0errorMessage Arialsansserif fontsize fontweight lineheight 150 paddingtop 25pxstyleheadbody stylemargin20pxdivimg altGoogle Apps Script srcsslgstaticcomdocsscriptimageslogopngdivdiv auto 0maxwidth600px source 3Translationdivbodyhtml
35,15,即決★Nikon ニコン Ai-s Nikkor 50mm f1.8 Ais Lens パンケーキ マニュアルフォーカス 単焦点レンズ A949,15800.0,15800.0,,https://auctions.yahooapis.jp/AuctionWebService/V2/auctionItem?auctionID=x619510413,2084261693,Prompt decision ★ Nikon Nikon Ai-s Nikkor 50mm f1.8 Ais Lens Pancake Manual focus Single focus lens A949,decision Nikon Nikon Ais Nikkor 50 mm Ais Lens Pancake Manual focus lens
36,16,★極上美品!!★Nikon ニコン D7100 ボディ ダブルレンズセット★付属品多数!!視界良好でクリアなファインダー!!すぐに使えます!!#597,30000.0,59800.0,,https://auctions.yahooapis.jp/AuctionWebService/V2/auctionItem?auctionID=r348262645,2084261636,"<!DOCTYPE html><html><head><link rel=""shortcut icon"" href=""//ssl.gstatic.com/docs/script/images/favicon.ico""><title>エラー</title><style type=""text/css"">body {background-color: #fff; margin: 0; padding: 0;}.errorMessage {font-family: Arial,sans-serif; font-size: 12pt; font-weight: bold; line-height: 150%; padding-top: 25px;}</style></head><body style=""margin:20px""><div><img alt=""Google Apps Script"" src=""//ssl.gstatic.com/docs/script/images/logo.png""></div><div style=""text-align:center;font-family:monospace;margin:50px auto 0;max-width:600px"">無効な引数: source（行 3、ファイル「コード」、プロジェクト「Translation」）</div></body></html>",DOCTYPE relshortcut icon hrefsslgstaticcomdocsscriptimagesfaviconicotitletitlestyle typetextcssbody backgroundcolor fff margin 0 padding 0errorMessage Arialsansserif fontsize fontweight lineheight 150 paddingtop 25pxstyleheadbody stylemargin20pxdivimg altGoogle Apps Script srcsslgstaticcomdocsscriptimageslogopngdivdiv auto 0maxwidth600px source 3Translationdivbodyhtml
37,17,送料無料 新品 Nikon AF-S DX Zoom-Nikkor 17-55mm f/2.8G IF-ED,119800.0,,,https://auctions.yahooapis.jp/AuctionWebService/V2/auctionItem?auctionID=w337168328,2084261684,Free Shipping New Nikon AF-S DX Zoom-Nikkor 17-55mm f / 2.8G IF-ED,Shipping New Nikon AFS DX ZoomNikkor 1755 mm 28 G IFED
38,18,★送料一律★Nikon☆ニコン カメラアクセサリー MB-D10 DR-6 MC-30 グリップ ファインダーなど D300用？ 中古現状品 81H8335,1188.0,,,https://auctions.yahooapis.jp/AuctionWebService/V2/auctionItem?auctionID=m358361435,23760,★ Shipping uniform ★ Nikon ☆ Nikon Camera accessories MB-D10 DR-6 MC-30 Grip finder etc. For D300? Used current product 81H8335,uniform Nikon Nikon Camera accessories MBD10 MC30 Grip finder D300 product
39,19,★新品同様!!★ ニコン NIKON D750 ダブルレンズセット★標準・望遠レンズセット!!付属品充実!! 高い機動力と高品位画質が大人気です!!#705,80000.0,145800.0,,https://auctions.yahooapis.jp/AuctionWebService/V2/auctionItem?auctionID=f373506956,2084261636,"<!DOCTYPE html><html><head><link rel=""shortcut icon"" href=""//ssl.gstatic.com/docs/script/images/favicon.ico""><title>エラー</title><style type=""text/css"">body {background-color: #fff; margin: 0; padding: 0;}.errorMessage {font-family: Arial,sans-serif; font-size: 12pt; font-weight: bold; line-height: 150%; padding-top: 25px;}</style></head><body style=""margin:20px""><div><img alt=""Google Apps Script"" src=""//ssl.gstatic.com/docs/script/images/logo.png""></div><div style=""text-align:center;font-family:monospace;margin:50px auto 0;max-width:600px"">無効な引数: source（行 3、ファイル「コード」、プロジェクト「Translation」）</div></body></html>",DOCTYPE relshortcut icon hrefsslgstaticcomdocsscriptimagesfaviconicotitletitlestyle typetextcssbody backgroundcolor fff margin 0 padding 0errorMessage Arialsansserif fontsize fontweight lineheight 150 paddingtop 25pxstyleheadbody stylemargin20pxdivimg altGoogle Apps Script srcsslgstaticcomdocsscriptimageslogopngdivdiv auto 0maxwidth600px source 3Translationdivbodyhtml
40,0,"■美品■ニコン Nikon D7000 ボディ ショット数8,248 《付属品多数》 #0122I16",8800.0,25500.0,,https://auctions.yahooapis.jp/AuctionWebService/V2/auctionItem?auctionID=e381499970,2084261636,"<!DOCTYPE html><html><head><link rel=""shortcut icon"" href=""//ssl.gstatic.com/docs/script/images/favicon.ico""><title>エラー</title><style type=""text/css"">body {background-color: #fff; margin: 0; padding: 0;}.errorMessage {font-family: Arial,sans-serif; font-size: 12pt; font-weight: bold; line-height: 150%; padding-top: 25px;}</style></head><body style=""margin:20px""><div><img alt=""Google Apps Script"" src=""//ssl.gstatic.com/docs/script/images/logo.png""></div><div style=""text-align:center;font-family:monospace;margin:50px auto 0;max-width:600px"">無効な引数: source（行 3、ファイル「コード」、プロジェクト「Translation」）</div></body></html>",DOCTYPE relshortcut icon hrefsslgstaticcomdocsscriptimagesfaviconicotitletitlestyle typetextcssbody backgroundcolor fff margin 0 padding 0errorMessage Arialsansserif fontsize fontweight lineheight 150 paddingtop 25pxstyleheadbody stylemargin20pxdivimg altGoogle Apps Script srcsslgstaticcomdocsscriptimageslogopngdivdiv auto 0maxwidth600px source 3Translationdivbodyhtml
41,1,★新品同様!!★ニコン Nikon D610 レンズセット★標準・望遠!! 新品と見間違ってしまう外観!! 透き通る程クリアなファインダー!! #783,20500.0,99800.0,,https://auctions.yahooapis.jp/AuctionWebService/V2/auctionItem?auctionID=w337697137,2084261636,"<!DOCTYPE html><html><head><link rel=""shortcut icon"" href=""//ssl.gstatic.com/docs/script/images/favicon.ico""><title>エラー</title><style type=""text/css"">body {background-color: #fff; margin: 0; padding: 0;}.errorMessage {font-family: Arial,sans-serif; font-size: 12pt; font-weight: bold; line-height: 150%; padding-top: 25px;}</style></head><body style=""margin:20px""><div><img alt=""Google Apps Script"" src=""//ssl.gstatic.com/docs/script/images/logo.png""></div><div style=""text-align:center;font-family:monospace;margin:50px auto 0;max-width:600px"">無効な引数: source（行 3、ファイル「コード」、プロジェクト「Translation」）</div></body></html>",DOCTYPE relshortcut icon hrefsslgstaticcomdocsscriptimagesfaviconicotitletitlestyle typetextcssbody backgroundcolor fff margin 0 padding 0errorMessage Arialsansserif fontsize fontweight lineheight 150 paddingtop 25pxstyleheadbody stylemargin20pxdivimg altGoogle Apps Script srcsslgstaticcomdocsscriptimageslogopngdivdiv auto 0maxwidth600px source 3Translationdivbodyhtml
42,2,★送料一律★TAMRON☆タムロン カメラレンズ SP AF ASPHERICAL Di LD 17-35mm 1:2.8-4 Nikonマウント 中古現状品 91N3163,5670.0,,,https://auctions.yahooapis.jp/AuctionWebService/V2/auctionItem?auctionID=r348627111,2084261684,★ Shipping uniform ★ TAMRON ☆ Tamron camera lens SP AF ASPHERICAL Di LD 17-35mm 1: 2.8-4 Nikon mount used current product 91N3163,uniform TAMRON Tamron camera lens SP AF ASPHERICAL Di LD 1735 mm 1 284 Nikon mount product 91N3163
43,3,Nikon ニコン 対物レンズ Plan Apo 20x/0.75 DIC N2 ∞/0.17 WD 1.0 中古 顕微鏡 20倍 生物 ケース 管理⑩,24946.0,38338.0,,https://auctions.yahooapis.jp/AuctionWebService/V2/auctionItem?auctionID=c754062117,2084045044,Nikon Nikon objective lens Plan Apo 20x / 0.75 DIC N2 ∞ / 0.17 WD 1.0 Used microscope 20x Biological Case Management,Nikon Nikon lens Plan Apo 075 DIC N2 017 WD 10 microscope 20x Biological Case Management
