,Title,CurrentPrice,BidOrBuy,shopName,ItemUrl,CategoryId,en_Title,en_short_Title,short_Title
19,■■ＡＣデルコ同工場品■本州/四国送料一律■M31MF■HEXA M31MF Voyger　バスボート　キャンピングカー　サブバッテリー　ボイジャー,12650.00,12650.00,,https://page.auctions.yahoo.co.jp/jp/auction/g377546946,2084228242,■■ AC Delco factory products ■ Honshu / Shikoku shipping uniform ■ M31MF ■ HEXA M31MF Voyger bus boat camper sub battery voyager,AC Delco factory products Honshu Shikoku shipping uniform M31MF HEXA M31MF Voyger bus boat camper sub battery voyager,ＡＣ デルコ 同 工場 品 本州 四国 送料 一律 M3 1 MF HEXA M3 1 MF Voyger バス ボート キャンピング カー サブ バッテリー ボイジャー
0,送料無料。新同NIKON ズーム式実体顕微鏡SMZ-745 クラス最高の7.5倍ズームと115mmの作動距離。ＬＥＤ照明装置＋ ソニー1400万画素デジカメ,175000.00,175000.00,,https://page.auctions.yahoo.co.jp/jp/auction/g376877275,2084045044,free shipping. Shinni NIKON zoom stereo microscope SMZ-745 Best-in-class 7.5x zoom and 115mm working distance. LED lighting device + Sony 14 million pixel digital camera,shipping Shinni NIKON stereo microscope SMZ745 Bestinclass zoom 115 mm working distance lighting device Sony 14 million camera,送料 無料 新 同 NIKON 式 実体 顕微鏡 SMZ 745 クラス 7 5 倍 115 mm 作動 距離 ＬＥＤ 照明 装置 ソニー 1400 万 画素 デジカメ
1,◇ MINOLTA ミノルタ MD MACRO ROKKOR 100mm F3.5 中望遠単焦点レンズ MDレンズ MF一眼レフ用,4400.00,,,https://page.auctions.yahoo.co.jp/jp/auction/e384337439,2084261695,◇ MINOLTA Minolta MD MACRO ROKKOR 100mm F3.5 medium telephoto single focus lens MD lens for MF SLR,MINOLTA Minolta MD MACRO ROKKOR 100 mm F35 telephoto focus lens MD lens MF SLR,MINOLTA ミノルタ MD MACRO ROKKOR 100 mm F 3 5 中 望遠 単 焦点 レンズ MD レンズ MF 一 眼 レフ 用
2,〓外観綺麗 フード付〓ニコン Nikon AF-S NIKKOR 24-85mm F3.5-4.5 G ED VR,18980.00,34800.00,,https://page.auctions.yahoo.co.jp/jp/auction/v664570042,2084261684,〓Appearance beautiful hooded 〓Nikon AF-S NIKKOR 24-85mm F3.5-4.5 G ED VR,Appearance Nikon AFS NIKKOR 2485 mm F3545 G ED VR,外観 フード 付 ニコン Nikon AF NIKKOR 24 85 mm F3 5 4 5 ED VR
3,【美品】Nikon ニコン AF-S DX NIKKOR 18-55mm f/3.5-5.6 G VR,2600.00,,,https://page.auctions.yahoo.co.jp/jp/auction/l553185813,2084261684,[Good Condition] Nikon Nikon AF-S DX NIKKOR 18-55mm f / 3.5-5.6 G VR,Condition Nikon Nikon AFS DX NIKKOR 1855 mm 3556 G VR,美品 Nikon ニコン AF DX NIKKOR 18- 55 mm f 3. 5 5 6 VR
4,■タムロン TAMRON SP AF Di 90mm F2.8 MACRO 272E Nikon ニコン用,8000.00,,,https://page.auctions.yahoo.co.jp/jp/auction/s691709239,2084261684,■ Tamron TAMRON SP AF Di 90mm F2.8 MACRO 272E Nikon for Nikon,Tamron TAMRON SP AF Di 90 mm F28 MACRO 272E Nikon Nikon,タムロン TAMRON SP AF Di 90 mm F2 . 8 MACRO 272 Nikon ニコン 用
5,鍵/3種類/スズキ/マツダ/日産/ブランクキー/キーレス/382/367/421/JB23W/HC24S/MH22/MC22S/MH22S/MH21S/MF22/MG22/MH21/モコ/wakey,496.00,496.00,,https://page.auctions.yahoo.co.jp/jp/auction/u301611973,2084291408,Key / 3 types / Suzuki / Mazda / Nissan / Blank key / Keyless / 382/367/421 / JB23W / HC24S / MH22 / MC22S / MH22S / MH21S / MF22 / MG22 / MH21 / Moko / wakey,3 types Suzuki Mazda Nissan 382367421 JB23W HC24S MH22 MC22S MH22S MH21S MF22 MG22 MH21 Moko,鍵 3 種類 スズキ マツダ 日産 ブランク キー キーレス 382 367 421 JB 23 HC 24 MH 22 MC 22 MH 22 MH 21 MF 22 MG 22 MH 21 モコ wa key
6,★実用美品★ ニコン Nikon デジタル一眼レフカメラ D40 レンズセット ■ K-08OC19-372,11700.00,17800.00,,https://page.auctions.yahoo.co.jp/jp/auction/g377867174,2084261636,★ Practical Beauty ★ Nikon Nikon Digital SLR Camera D40 Lens Set ■ K-08OC19-372,Practical Beauty Nikon Nikon Digital SLR Camera D40 Lens Set K08OC19372,実用 美品 ニコン Nikon デジタル 一 眼 レフ カメラ 40 レンズ セット 08 OC 19 372
7,〓AF不良〓 ★ ニコン Nikon Ai AF-S ED 28-70mm F2.8D ★,22800.00,25800.00,,https://page.auctions.yahoo.co.jp/jp/auction/c758286870,2084261693,〓 AF failure 〓 ★ Nikon Nikon Ai AF-S ED 28-70mm F2.8D ★,AF failure Nikon Nikon Ai AFS ED 2870 mm F28D,AF ニコン Nikon Ai AF ED 28 70 mm F2 8
8,◇ Canon キヤノン CANON COMPACT-MACRO LENS EF 50mm F2.5 標準単焦点マクロレンズ EFマウント AFレンズ AF一眼レフ用,3410.00,,,https://page.auctions.yahoo.co.jp/jp/auction/g375728064,2084261683,◇ Canon Canon CANON COMPACT-MACRO LENS EF 50mm F2.5 Standard single focus macro lens EF mount AF lens For AF SLR,Canon Canon CANON COMPACTMACRO LENS EF 50 mm F25 focus lens EF mount AF lens AF SLR,Canon キヤノン CANON COMPACT MACRO LENS EF 50 mm 2 5 標準 単 焦点 マクロレンズ EF マウント AF レンズ AF 一 眼 レフ 用
9,★ Nikon ニコン F フォトミックFTN ブラック 735万台 + 非AI NIKKOR-S・C Auto 50mm F1.4 MF レンズ交換式一眼 標準 単焦点 オールド,25300.00,,,https://page.auctions.yahoo.co.jp/jp/auction/r352481070,2084044778,★ Nikon Nikon F Photomic FTN Black 7.35 million Non-AI NIKKOR-S ・ C Auto 50mm F1.4 MF Lens interchangeable interchangeable-lens camera standard single focus Old,Nikon Nikon F Photomic FTN Black 735 million NonAI NIKKORS C Auto 50 mm F14 MF Lens camera focus Old,Nikon ニコン フォトミック FTN ブラック 735 万 台 非 AI NIKKOR Auto 50 mm 1 4 MF レンズ 交換 式 一 眼 標準 単 焦点 オールド
10,特価品 送料無料 1年保証 ユアサバッテリー FTX7A-BS DTX7A-BS互換 YTX7A-BS 初期充電済み アドレスV125 アドレスV125G シグナスX 等,3652.00,3652.00,,https://page.auctions.yahoo.co.jp/jp/auction/w342384377,2084005528,Specials Free shipping 1 year warranty Yuasa Battery FTX7A-BS DTX7A-BS compatible YTX7A-BS Initial charged Address V125 Address V125G Cygnus X etc.,Specials shipping 1 year warranty Yuasa Battery DTX7ABS YTX7ABS Initial Address V125 Address V125 G Cygnus X,特価 品 送料 無料 1 年 保証 ユアサ バッテリー FTX 7 BS DTX 7 BS 互換 YTX 7 BS 初期 充電 済み アドレス 125 アドレス 125 シグナス 等
11,昭和18年製　旧日本軍 陸軍九二式　測距儀/レンズ 日本光学 ニコン カメラ　日本陸軍,13500.00,,,https://page.auctions.yahoo.co.jp/jp/auction/m362112444,2084005563,1951 made by the former Japanese Army Type 92 Rangefinder / Lens Nihon Optic Nikon Camera Japan Army,1951 Army Type 92 Rangefinder Lens Nihon Optic Nikon Camera Japan Army,昭和 18 年 製 旧 日本軍 陸軍 九二 式 測距儀 レンズ 日本 光学 ニコン カメラ 日本 陸軍
12,Nikon Repro Kit Model PF 複写装置 ニコン,3500.00,,,https://page.auctions.yahoo.co.jp/jp/auction/412302044,23760,Nikon Repro Kit Model PF Copier Nikon,Nikon Repro Kit Model PF Copier Nikon,Nikon Re pro Kit Model PF 複写 装置 ニコン
13,● Nikon ニコン F フォトミック FTN 700万台 + 非AI NIKKOR-H Auto 50mm F2 Fマウント 訳あり MFカメラ 標準単焦点レンズ,6600.00,,,https://page.auctions.yahoo.co.jp/jp/auction/r352481062,2084044778,● Nikon Nikon F Photomic FTN 7 million units Non-AI NIKKOR-H Auto 50mm F2 F mount In translation MF camera Standard single focus lens,Nikon Nikon F Photomic FTN 7 million units NonAI NIKKORH Auto 50 mm F2 F mount translation MF camera focus lens,Nikon ニコン フォトミック FTN 700 万 台 非 AI NIKKOR Auto 50 mm 2 マウント 訳あり MF カメラ 標準 単 焦点 レンズ
14,【外装美品】★NIKKOREX F 銀ボディ／NIKKOR-S Auto 50mm F2／Fメーター ★動作品★,1300.00,,,https://page.auctions.yahoo.co.jp/jp/auction/g377640526,2084044778,[Exterior Beauty] ★ NIKKOREX F Silver Body / NIKKOR-S Auto 50mm F2 / F Meter ★ Operational ★,Exterior Beauty NIKKOREX F Silver Body NIKKORS Auto 50 mm F2 F Meter,外装 美品 NIKKOREX 銀 ボディ NIKKOR Auto 50 mm 2 メーター 動作 品
15,◇ Nikon ニコン AI-S NIKKOR 105mm F1.8 Fマウント MF一眼レフ用 中望遠単焦点レンズ 大口径,33000.00,,,https://page.auctions.yahoo.co.jp/jp/auction/b419469795,2084261684,◇ Nikon Nikon AI-S NIKKOR 105mm F1.8 F mount MF single lens reflex medium telephoto single focus lens,Nikon Nikon AIS NIKKOR 105 mm F18 F mount MF lens reflex telephoto focus lens,Nikon ニコン AI NIKKOR 105 mm 1 8 F マウント MF 一 眼 レフ 用 中 望遠 単 焦点 レンズ 大 口径
16,Nikon F60 フィルムカメラ ボディ TAMRON AF ASPHERICAL LD 28-300㎜ 3.5-6.3 MACRO レンズ,4279.00,,,https://page.auctions.yahoo.co.jp/jp/auction/t674140127,2084044785,Nikon F60 Film Camera Body TAMRON AF ASPHERICAL LD 28-300㎜ 3.5-6.3 MACRO Lens,Nikon F60 Film Camera Body TAMRON AF ASPHERICAL LD 28300 3563 MACRO Lens,Nikon 60 フィルム カメラ ボディ TAMRON AF ASPHERICAL LD 28 300㎜ 3 5 6. 3 MACRO レンズ
17,特価品 送料無料 1年保証 ユアサバッテリー YTZ7S 互換 TTZ7S 初期充電済 VTR250 トリッカー セロー250 ズーマー ジャイロキャノピー等,5533.00,5533.00,,https://page.auctions.yahoo.co.jp/jp/auction/s691524347,2084005528,Specials Free Shipping 1 Year Warranty Yuasa Battery YTZ7S Compatible TTZ7S Initial Charged VTR250 Tricker Sero 250 Zoomer Gyro Canopy etc.,Specials Shipping 1 Year Warranty Yuasa Battery YTZ7S TTZ7S Initial VTR250 Tricker Sero 250 Zoomer Gyro Canopy etc,特価 品 送料 無料 1 年 保証 ユアサ バッテリー YTZ 7 互換 TTZ 7 初期 充電 済 VTR 250 トリッカー セロー 250 ズーマー ジャイロ キャノピー 等
18,◆ OLYMPUS オリンパス OM-SYSTEM ZUIKO AUTO-MACRO 90mm F2 中望遠単焦点レンズ OMマウント MFレンズ MF一眼レフ用,44000.00,,,https://page.auctions.yahoo.co.jp/jp/auction/p715343782,2084261696,◆ OLYMPUS Olympus OM-SYSTEM ZUIKO AUTO-MACRO 90mm F2 Medium telephoto single focus lens OM mount MF lens For MF SLR,OLYMPUS Olympus OMSYSTEM ZUIKO AUTOMACRO 90 mm F2 Medium telephoto focus lens OM mount MF lens MF SLR,OLYMPUS オリンパス OM SYSTEM ZUIKO AUTO MACRO 90 mm 2 中 望遠 単 焦点 レンズ OM マウント MF レンズ MF 一 眼 レフ 用
19,◇ Nikon ニコン F2 フォトミック A 729万台 + AI Zoom -NIKKOR 35-70mm F3.5 MF一眼レフ ズームレンズ レンズセット,13200.00,,,https://page.auctions.yahoo.co.jp/jp/auction/n373320183,2084044778,◇ Nikon Nikon F2 Photomic A 7.29 million AI Zoom -NIKKOR 35-70mm F3.5 MF SLR zoom lens Lens set,Nikon Nikon F2 Photomic A 729 million AI Zoom NIKKOR 3570 mm F35 MF SLR lens Lens set,Nikon ニコン 2 フォトミック 729 万 台 AI 35 70 mm F3 5 MF 一 眼 レフ ズームレンズ レンズ セット
0,★美品★ ニコン Nikon デジタル一眼レフカメラ D300 ■ K-08OC19-374,8250.00,27800.00,,https://page.auctions.yahoo.co.jp/jp/auction/m362627029,2084261636,★ Beauty ★ Nikon Nikon Digital SLR Camera D300 ■ K-08OC19-374,Beauty Nikon Nikon Digital SLR Camera D300 K08OC19374,美品 ニコン Nikon デジタル 一 眼 レフ カメラ D3 00 08 OC 19 374
1,■ PENTAX ペンタックス SMC PENTAX 50mm F1.2 大口径 標準単焦点レンズ Kマウント MF一眼レフ用 MFレンズ,16500.00,,,https://page.auctions.yahoo.co.jp/jp/auction/m362172084,2084261694,■ PENTAX Pentax SMC PENTAX 50mm F1.2 Large Diameter Standard Single Focal Length Lens K Mount MF Lens for MF SLR,PENTAX Pentax SMC PENTAX 50 mm F12 Diameter Standard Single Focal Length Lens K Mount MF Lens MF SLR,PENTAX ペンタックス SMC PENTAX 50 mm F1 . 2 大 口径 標準 単 焦点 レンズ マウント MF 一 眼 レフ 用 MF レンズ
2,特価品 送料無料 1年保証 ユアサバッテリー YTZ12S DTZ12S 互換 TTZ12S 初期充電済 FORZA フォルツァ MF06 MF08 MF10 シルバーウイング等,7227.00,7227.00,,https://page.auctions.yahoo.co.jp/jp/auction/d393249623,2084005528,Specials Free shipping 1 year warranty Yuasa battery YTZ12S DTZ12S compatible TTZ12S initial charged FORZA Forza MF06 MF08 MF10 Silver Wing etc.,Specials shipping 1 year warranty Yuasa battery YTZ12S initial FORZA Forza MF06 MF08 MF10 Silver Wing etc,特価 品 送料 無料 1 年 保証 ユアサ バッテリー YTZ 12 DTZ 12 互換 TTZ 12 初期 充電 済 FORZA フォルツァ MF 06 MF 08 MF 10 シルバー ウイング 等
3,【極上美品 フルセット】 Nikon ニコン AF-S DX NIKKOR 55-200mm f/4-5.6 G ED VR,3000.00,,,https://page.auctions.yahoo.co.jp/jp/auction/q319652558,2084261684,[Exquisite beauty full set] Nikon Nikon AF-S DX NIKKOR 55-200mm f / 4-5.6 G ED VR,beauty Nikon Nikon AFS DX NIKKOR 55200 mm 456 G ED VR,極上 美品 フルセット Nikon ニコン AF DX NIKKOR 55 200 mm f 4 5 6 ED VR
4,【極上美品・付属品完備】Nikon ニコン AF-S NIKKOR 24-85mm f/3.5-4.5 G ED VR,12111.00,,,https://page.auctions.yahoo.co.jp/jp/auction/e386156824,2084261684,[Exquisite beauty and accessories] Nikon Nikon AF-S NIKKOR 24-85mm f / 3.5-4.5 G ED VR,beauty accessories Nikon Nikon AFS NIKKOR 2485 mm 3545 G ED VR,極上 美品 付属品 Nikon ニコン AF NIKKOR 24 85 mm f 3. 5 4 5 ED VR
5,セール 保証付 フォルツァ MF06 ブレーキ ディスクローター リア,1485.00,1595.00,,https://page.auctions.yahoo.co.jp/jp/auction/r353465459,2084284094,Forza MF06 brake disc rotor rear with warranty,Forza MF06 brake disc rotor rear warranty,セール 保証 付 フォルツァ MF 06 ブレーキ ディスク ローター リア
6,◇ Nikon ニコン SPEEDLIGHT SB-800 ストロボ,9075.00,,,https://page.auctions.yahoo.co.jp/jp/auction/b419469823,2084261969,◇ Nikon Nikon SPEEDLIGHT SB-800 Strobe,Nikon Nikon SPEEDLIGHT SB800 Strobe,Nikon ニコン SPEEDLIGHT SB 800 ストロボ
7,【新品級の超美品】Nikon ニコン AF-S DX NIKKOR 18-140mm f/3.5-5.6 G ED VR,9000.00,,,https://page.auctions.yahoo.co.jp/jp/auction/v668131517,2084261684,[New-class super beauty] Nikon Nikon AF-S DX NIKKOR 18-140mm f / 3.5-5.6 G ED VR,Newclass beauty Nikon Nikon AFS DX NIKKOR 18140 mm f 3556 G ED VR,新品 級 超 美品 Nikon ニコン AF DX NIKKOR 18 140 mm f/ 3. 5 5 6 ED VR
8,◇ Nikon ニコン FE + AI NIKKOR 50mm F1.4 フィルムカメラ 標準単焦点レンズ セット MF一眼レフ,10560.00,,,https://page.auctions.yahoo.co.jp/jp/auction/m362172056,2084044778,◇ Nikon Nikon FE AI NIKKOR 50mm F1.4 Film Camera Standard Single Focal Lens Set MF SLR,Nikon Nikon FE AI NIKKOR 50 mm F14 Film Camera Standard Single Focal Lens MF SLR,Nikon ニコン FE AI NIKKOR 50 mm . 4 フィルム カメラ 標準 単 焦点 レンズ セット MF 一 眼 レフ
9,NIKON D5100 ＋ AF-S DX NIKKOR 16-85mm f/3.5-5.6G ED VR レンズセット　おまけ付き,25500.00,,,https://page.auctions.yahoo.co.jp/jp/auction/o347496083,2084261636,NIKON D5100 + AF-S DX NIKKOR 16-85mm f / 3.5-5.6G ED VR lens set with bonus,NIKON D5100 AFS DX NIKKOR 1685 mm 3556 G ED VR lens bonus,NIKON 5100 AF DX NIKKOR 16- 85 mm f 3. 5 5 6 ED VR レンズ セット おまけ 付き
10,◆13.ニコン Nikon 双眼鏡 3.5X レトロ/中古,1000.00,,,https://page.auctions.yahoo.co.jp/jp/auction/x648815173,2084263451,◆ 13.Nikon Binoculars 3.5X Retro / Used,13Nikon Binoculars 35X Retro,13 ニコン Nikon 双眼鏡 3 5 X レトロ 中古
11,◆9.ニコン Nikon 双眼鏡 オペラグラス 3× レザー×シルバー レトロ/中古,1000.00,,,https://page.auctions.yahoo.co.jp/jp/auction/e382454645,2084263451,9. Nikon Nikon Binoculars Opera Glass 3 × Leather × Silver Retro / Used,9 Nikon Nikon Binoculars Opera Glass 3 Leather Silver Retro,9 ニコン Nikon 双眼鏡 オペラグラス 3 レザー シルバー レトロ 中古
12,◇ Canon キヤノン AE-1 + CANON LENS NEW FD 50mm F3.5 + CANON LENS NEW FD 35-105mm F3.5 フィルムカメラ レンズ2本 セット MF一眼レフ,4020.00,,,https://page.auctions.yahoo.co.jp/jp/auction/w340373834,2084044777,◇ Canon Canon AE-1 CANON LENS NEW FD 50mm F3.5 CANON LENS NEW FD 35-105mm F3.5 Film Camera 2 Lens Set MF SLR,Canon Canon AE1 CANON LENS FD 50 mm F35 CANON LENS FD 35105 mm F35 Film Camera 2 Lens MF SLR,Canon キヤノン AE 1 CANON LENS NEW FD 50 mm F 3 5 CANON LENS NEW FD 35- 105 mm 3 5 フィルム カメラ レンズ 2 本 セット MF 一 眼 レフ
13,【新品級の超美品 4271ショット・付属品完備】Nikon ニコン D7500,64119.00,,,https://page.auctions.yahoo.co.jp/jp/auction/m363210902,2084261636,[New class super beautiful goods 4271 shots and accessories complete] Nikon Nikon D7500,class goods 4271 shots accessories Nikon Nikon D7500,新品 級 超 美品 4271 ショット 付属品 完備 Nikon ニコン 7500
14,特価品 送料無料 1年保証 ユアサバッテリー FTX14-BS FTZ14-BS互換 YTX14-BS 初期充電済 ZRX1200R ZRX1100 ZX-12R シャドウ400 CB1300SF等,6655.00,6655.00,,https://page.auctions.yahoo.co.jp/jp/auction/f377857963,2084005528,Specials Free shipping 1 year warranty Yuasa Battery FTX14-BS FTZ14-BS compatible YTX14-BS Initial charged ZRX1200R ZRX1100 ZX-12R Shadow 400 CB1300SF etc.,Specials shipping 1 year warranty Yuasa Battery FTX14BS FTZ14BS YTX14BS Initial ZRX1200R ZX12R Shadow 400 CB1300SF,特価 品 送料 無料 1 年 保証 ユアサ バッテリー FT X1 4 BS FTZ 14 BS 互換 YTX 14 BS 初期 充電 済 ZRX 1200 ZRX 1100 ZX 12 シャドウ 400 CB 1300 SF 等
15,【新品級の超美品 フルセット】Nikon ニコン AF-S NIKKOR 24-120mm f/4 G ED VR,31500.00,,,https://page.auctions.yahoo.co.jp/jp/auction/b419728457,2084261684,[New class super beautiful goods full set] Nikon Nikon AF-S NIKKOR 24-120mm f / 4 G ED VR,class goods Nikon Nikon AFS NIKKOR 24120 mm 4 G ED VR,新品 級 超 美品 フルセット Nikon ニコン AF NIKKOR 24 120 mm 4 ED VR
16,【美品・豪華セット】Nikon ニコン D3200 AF-S 55-200mm VR,14756.00,,,https://page.auctions.yahoo.co.jp/jp/auction/o347454985,2084261636,[Beautiful goods / luxury set] Nikon Nikon D3200 AF-S 55-200mm VR,goods luxury Nikon Nikon D3200 AFS 55200 mm VR,美品 豪華 セット Nikon ニコン D3 200 AF 55 200 mm VR
17,◇ Nikon ニコン AI-S NIKKOR 105mm F1.8 Fマウント MF一眼レフ用 中望遠単焦点レンズ 大口径,30800.00,,,https://page.auctions.yahoo.co.jp/jp/auction/q318651588,2084261693,◇ Nikon Nikon AI-S NIKKOR 105mm F1.8 F mount MF single lens reflex medium telephoto single focus lens,Nikon Nikon AIS NIKKOR 105 mm F18 F mount MF lens reflex telephoto focus lens,Nikon ニコン AI NIKKOR 105 mm 1 8 F マウント MF 一 眼 レフ 用 中 望遠 単 焦点 レンズ 大 口径
18,特価品 送料無料 1年保証 ユアサバッテリー GT12B-4 FT12B-4 互換 YT12B-BS 初期充電済 ドラッグスター ZX-10R モンスターS4等,6380.00,6380.00,,https://page.auctions.yahoo.co.jp/jp/auction/r352932637,2084005528,Specials Free shipping 1 year warranty Yuasa Battery GT12B-4 FT12B-4 compatible YT12B-BS initial charged Dragster ZX-10R Monster S4 etc.,Specials shipping 1 year warranty Yuasa Battery GT12B4 FT12B4 YT12BBS initial Dragster ZX10R Monster S4,特価 品 送料 無料 1 年 保証 ユアサ バッテリー GT 12 4 FT 12 4 互換 YT 12 BS 初期 充電 済 ドラッグ スター ZX 10 モンスター 4 等
19,● Nikon ニコン AF-S DX NIKKOR 18-55mm F3.5-5.6 G VR Fマウント AF交換レンズ ズームレンズ,3960.00,,,https://page.auctions.yahoo.co.jp/jp/auction/n373320175,2084261684,● Nikon Nikon AF-S DX NIKKOR 18-55mm F3.5-5.6 G VR F mount AF interchangeable lens Zoom lens,Nikon Nikon AFS DX NIKKOR 1855 mm F3556 G VR F mount AF lens Zoom lens,Nikon ニコン AF DX NIKKOR 18 55 mm F3 5 5 6 VR マウント AF 交換 レンズ ズームレンズ
0,セール 6ヶ月保証 フュージョン スクリーン メッキ ガーニッシュ,550.00,660.00,,https://page.auctions.yahoo.co.jp/jp/auction/q319747108,2084282350,Sale 6 Month Warranty Fusion Screen Plating Garnish,Sale 6 Month Warranty Fusion Screen Plating Garnish,セール 6 ヶ月 保証 フュージョン スクリーン メッキ ガーニッシュ
1,SIGMA ZOOM 28-300㎜ 1:3.5-6.3 Nikonマウント カメラ レンズ シグマ,4485.00,,,https://page.auctions.yahoo.co.jp/jp/auction/q315428698,2084261683,SIGMA ZOOM 28-300㎜ 1: 3.5-6.3 Nikon Mount Camera Lens Sigma,SIGMA ZOOM 28300 1 3563 Nikon Mount Camera Lens Sigma,SIGMA ZOOM 28 300 ㎜ 1 3. 5 3 Nikon マウント カメラ レンズ
2,◆当日発送 フロアマット MINI ミニ R56 クーパー/S MF16（ミニワン/ME14共通）右H H19.02-【全国一律送料無料】【色 選択式】,7040.00,7040.00,,https://page.auctions.yahoo.co.jp/jp/auction/w341957423,2084203810,◆ Same-day floor mat MINI Mini R56 Cooper / S MF16 (common to Mini One / ME14) Right H H19.02- [Free shipping nationwide] [Color selection formula],Sameday floor mat MINI Mini R56 Cooper S MF16 Mini One ME14 H shipping Color selection formula,当日 発送 フロア マット MINI ミニ 56 クーパー MF 16 ミニ ワン ME 14 右 19 02 全国 一律 送料 無料 色 選択 式
3,セール 6ヶ月保証 フュージョン 純正タイプ シート ブラウン,3980.00,3980.00,,https://page.auctions.yahoo.co.jp/jp/auction/o346896532,2084289637,Sale 6 months warranty Fusion Genuine type Sheet Brown,Sale 6 months warranty Fusion type Sheet Brown,セール 6 ヶ月 保証 フュージョン 純正 タイプ シート ブラウン
4,【セール】保証付 フュージョン 社外ユーロ フロント ウインカー,1089.00,1089.00,,https://page.auctions.yahoo.co.jp/jp/auction/n374556100,2084289652,[Sale] Warranty Fusion External Euro Front Turn Signal,Sale Warranty Fusion External Euro Front Turn Signal,セール 保証 付 フュージョン 社外 ユーロ フロント ウインカー
5,◇ Nikon ニコン PC-NIKKOR 35mm F2.8 Fマウント 広角単焦点レンズ　シフトレンズ MF一眼レフ用,11000.00,,,https://page.auctions.yahoo.co.jp/jp/auction/u306082496,2084261693,◇ Nikon Nikon PC-NIKKOR 35mm F2.8 F mount wide angle single focus lens shift lens for MF SLR,Nikon Nikon PCNIKKOR 35 mm F28 F angle focus lens shift lens MF SLR,Nikon ニコン PC NIKKOR 35 mm F2 8 F マウント 広角 単 焦点 レンズ シフト レンズ MF 一 眼 レフ 用
6,◆ニコン Nikon 最軽量 最薄・双眼鏡 遊 ゆう 4×10 ワインレッド/中古,3000.00,,,https://page.auctions.yahoo.co.jp/jp/auction/t676634891,2084263451,"◆ Nikon Nikon Lightest Thinnest, Binoculars Yu Yu 4 × 10 Wine Red / Used",Nikon Nikon Lightest Thinnest Binoculars Yu Yu 4 10 Wine Red,ニコン Nikon 最 最薄 双眼鏡 遊 ゆう 4 10 ワインレッド 中古
7,Nikon COOLPIX 5600 コンパクトデジタルカメラ exemooe DV505 デジタルビデオカメラ セット,1025.00,,,https://page.auctions.yahoo.co.jp/jp/auction/d388349349,2084261644,Nikon COOLPIX 5600 compact digital camera exemooe DV505 digital video camera set,Nikon COOLPIX 5600 camera DV505 video camera set,Nikon COOLPIX 5600 コンパクトデジタルカメラ exemooe DV 505 デジタル ビデオカメラ セット
8,☆NikonのVRダブルレンズ☆ニコン D5000 ダブルズームレンズセット・安心保証,33000.00,,,https://page.auctions.yahoo.co.jp/jp/auction/u303477811,2084261684,☆ Nikon VR double lens ☆ Nikon D5000 double zoom lens set,Nikon VR lens Nikon D5000 lens,Nikon VR ダブル レンズ ニコン 5000 ダブル ズームレンズ セット 安心 保証
9,【新品級の超美品 2274ショット・付属品完備】Nikon ニコン D750,86000.00,,,https://page.auctions.yahoo.co.jp/jp/auction/d391885374,2084261636,[New class super beautiful goods 2274 shots and accessories complete] Nikon Nikon D750,class goods 2274 shots accessories Nikon Nikon D750,新品 級 超 美品 2274 ショット 付属品 完備 Nikon ニコン 750
10,★遠くの撮影もバッチリ撮影可能☆Ｎｉｋｏｎおススメ一眼入門機★Ｎｉｋｏｎ　D80　大迫力のダブルズーム♪♪安心保証付き,26000.00,,,https://page.auctions.yahoo.co.jp/jp/auction/p715694967,2084261636,★ Perfect shots can be taken perfectly ☆ Nikon recommended single-lens introductory machine ★ Nikon D80 powerful double zoom ♪ ♪ with security guarantee,shots Nikon singlelens machine Nikon D80 security guarantee,遠く 撮影 撮影 Ｎｉｋｏｎ お 一 眼 入門 機 Ｎｉｋｏｎ 80 大 迫力 ダブル 安心 保証 付き
11,〓超美級〓 ニコン Nikon NIKKOR-P 600mm F5.6　♪,22800.00,26800.00,,https://page.auctions.yahoo.co.jp/jp/auction/s661699570,2084261693,〓 Super beautiful class Nikon Nikon NIKKOR-P 600mm F5.6 ♪,class Nikon Nikon NIKKORP 600 mm F56,超 美 級 ニコン NIKKOR 600 mm F5 6
12,特価品 送料無料 1年保証 ユアサバッテリー YTZ7S 互換 TTZ7S 初期充電済 VTR250 トリッカー セロー250 ズーマー ジャイロキャノピー等,5533.00,5533.00,,https://page.auctions.yahoo.co.jp/jp/auction/m363760898,2084005528,Specials Free Shipping 1 Year Warranty Yuasa Battery YTZ7S Compatible TTZ7S Initial Charged VTR250 Tricker Sero 250 Zoomer Gyro Canopy etc.,Specials Shipping 1 Year Warranty Yuasa Battery YTZ7S TTZ7S Initial VTR250 Tricker Sero 250 Zoomer Gyro Canopy etc,特価 品 送料 無料 1 年 保証 ユアサ バッテリー YTZ 7 互換 TTZ 7 初期 充電 済 VTR 250 トリッカー セロー 250 ズーマー ジャイロ キャノピー 等
13,■Nikon ニコン ターミナルシャッターレリーズ MR-3■,510.00,,,https://page.auctions.yahoo.co.jp/jp/auction/q319020837,2084261962,■ Nikon Nikon Terminal Shutter Release MR-3 ■,Nikon Nikon Terminal Shutter Release MR3,Nikon ニコン ターミナル シャッター MR 3
