,Title,CurrentPrice,BidOrBuy,shopName,ItemUrl,CategoryId,en_Title,en_short_Title,short_Title
0,★おススメ★美品★実写結果良好★ Nikon ニコン COOLPIX P310 バッテリー、ACアダプター、取扱い説明書等いろいろ付属！#OK-711,10431.00,11480.00,,https://page.auctions.yahoo.co.jp/jp/auction/r350159350,2084261644,"<!DOCTYPE html><html><head><link rel=""shortcut icon"" href=""//ssl.gstatic.com/docs/script/images/favicon.ico""><title>エラー</title><style type=""text/css"">body {background-color: #fff; margin: 0; padding: 0;}.errorMessage {font-family: Arial,sans-serif; font-size: 12pt; font-weight: bold; line-height: 150%; padding-top: 25px;}</style></head><body style=""margin:20px""><div><img alt=""Google Apps Script"" src=""//ssl.gstatic.com/docs/script/images/logo.png""></div><div style=""text-align:center;font-family:monospace;margin:50px auto 0;max-width:600px"">無効な引数: source（行 3、ファイル「コード」、プロジェクト「Translation」）</div></body></html>",DOCTYPE relshortcut icon hrefsslgstaticcomdocsscriptimagesfaviconicotitletitlestyle typetextcssbody backgroundcolor fff margin 0 padding 0errorMessage Arialsansserif fontsize fontweight lineheight 150 paddingtop 25pxstyleheadbody stylemargin20pxdivimg altGoogle Apps Script srcsslgstaticcomdocsscriptimageslogopngdivdiv auto 0maxwidth600px source 3Translationdivbodyhtml,お ススメ 美品 結果 Nikon ニコン COOLPIX 310 バッテリー AC アダプター 取扱い 説明書 等 OK 711
1,ニコンF3 アクアションファインダー　モータードライブ　レンズ7本　レアストラップ,40000.00,,,https://page.auctions.yahoo.co.jp/jp/auction/j593080715,2084044778,"Nikon F3 Aqua Finder, motor drive, 7 lenses, rare strap",Nikon F3 Aqua Finder motor drive 7 lenses strap,ニコン 3 アクア ション ファインダー モータードライブ レンズ 7 本 ストラップ
2,Nikon F2 Photomic フォトミック ブラック,10500.00,,,https://page.auctions.yahoo.co.jp/jp/auction/p712977331,2084044778,Nikon F2 Photomic Photomic Black,Nikon F2 Photomic Photomic Black,Nikon 2 Photo mic フォトミック ブラック
3,即決 良品 動作保証 ニコン Nikon AF-S NIKKOR 70-200mm F2.8G ED VR II 箱、ケース付き,134800.00,134800.00,,https://page.auctions.yahoo.co.jp/jp/auction/f359680244,2084261684,Prompt decision good product operation guarantee Nikon Nikon AF-S NIKKOR 70-200mm F2.8G ED VR II with box and case,decision product operation guarantee Nikon Nikon AFS NIKKOR 70200 mm F28 G ED VR II box case,良品 保証 ニコン Nikon AF NIKKOR 70 200 mm F 2 8 ED VR II 箱 ケース 付き
4,即決 美品 ニコン Nikon 1 V3 プレミアムキット ブラック 【交換レンズ1本/電子ビューファインダー/グリップ/予備バッテリーセット】,83800.00,83800.00,,https://page.auctions.yahoo.co.jp/jp/auction/o336017707,2084305445,Prompt decision beautiful goods Nikon Nikon 1 V3 premium kit black [1 interchangeable lens / electronic viewfinder / grip / spare battery set],decision goods Nikon Nikon 1 V3 premium kit 1 lens viewfinder grip battery set,即決 美品 ニコン Nikon 1 3 プレミアム キット ブラック 交換 レンズ 1 本 電子 ビュー ファインダー グリップ 予備 バッテリー セット
5,即決 動作保証 ニコン AF-S NIKKOR 200-400mm F4G ED VR ケース付き 通常送料無料,265000.00,265000.00,,https://page.auctions.yahoo.co.jp/jp/auction/c713737721,2084261684,Prompt decision guarantee Nikon AF-S NIKKOR 200-400mm F4G ED VR with case Normal free shipping,decision guarantee Nikon AFS NIKKOR 200400 mm F4 G ED VR case Normal shipping,即決 動作 保証 ニコン AF NIKKOR 200 400 mm 4 ED VR ケース 付き 通常 送料 無料
6,即決 良品 保証 ニコン Nikon AF VR 80-400mm F4.5-5.6D ED,55800.00,55800.00,,https://page.auctions.yahoo.co.jp/jp/auction/f361704486,2084261684,Prompt decision good product guarantee Nikon Nikon AF VR 80-400mm F4.5-5.6D ED,decision product guarantee Nikon Nikon AF VR 80400 mm F4556D ED,即決 良品 保証 ニコン Nikon AF VR 80 400 mm F4 5 5 . 6 ED
7,即決 美品 動作保証 Nikon ニコン PC-E NIKKOR 24mm F3.5D ED 平行型,157000.00,157000.00,,https://page.auctions.yahoo.co.jp/jp/auction/j593088596,2084261693,Prompt decision beautiful goods operation guarantee Nikon Nikon PC-E NIKKOR 24mm F3.5D ED parallel type,decision goods operation guarantee Nikon Nikon PCE NIKKOR 24 mm F35D ED type,美品 動作 保証 Nikon ニコン PC NIKKOR 24 mm 3 5 ED 型
8,ニコンAF NIKKOR 35mm-105mm F3.5-4.5,5000.00,,,https://page.auctions.yahoo.co.jp/jp/auction/l549229611,2084261684,Nikon AF NIKKOR 35mm-105mm F3.5-4.5,Nikon AF NIKKOR 35mm105 mm F3545,ニコン AF NIKKOR 35 mm 105 mm F3 5 4 5
9,単焦点マクロレンズ SP AF180mm F3.5 Di MACRO 1:1 TAMRONタムロン ニコン用,18000.00,,,https://page.auctions.yahoo.co.jp/jp/auction/s685421832,2084261684,Single focus macro lens SP AF180mm F3.5 Di MACRO 1: 1 TAMRON Tamron for Nikon,focus lens SP AF180 mm F35 Di MACRO 1 1 TAMRON Tamron Nikon,単 焦点 マクロレンズ SP AF 180 mm F3 5 MACRO 1 1 TAMRON タムロン ニコン 用
10,Nikon F3 HP ハイアイポイント ブラック,21000.00,,,https://page.auctions.yahoo.co.jp/jp/auction/g373601406,2084044778,Nikon F3 HP High Eye Point Black,Nikon F3 HP High Eye Point Black,Nikon 3 HP ハイ アイポイント ブラック
11,キャノンF-1 ニコンF 専用 MR-9電池　アダプター　　希少品,755.00,,,https://page.auctions.yahoo.co.jp/jp/auction/419638763,2084044777,"Canon F-1 MR-9 battery adapter for Nikon F, rare item",Canon F1 MR9 battery adapter Nikon F item,キャノン 1 ニコン 専用 MR 9 電池 アダプター 品
12,Nikon ニコンF　 ニッコールレンズ105mm 1:2.5 付き　ジャンク品,11501.00,,,https://page.auctions.yahoo.co.jp/jp/auction/t673318105,2084044778,Nikon Nikon F Nikkor lens 105mm 1: 2.5 with junk,Nikon Nikon F Nikkor lens 105 mm 1 25 junk,Nikon ニコン F ニッコール レンズ 105 mm 1 2. 5 付き ジャンク 品
13,珍品希少 Tokina AF 100mm f3.5 MACRO 完動中古良品　おまけF70ボディ,7900.00,,,https://page.auctions.yahoo.co.jp/jp/auction/t674853662,2084261684,Rare Items Rare Tokina AF 100mm f3.5 MACRO Fully Used Goods Bonus F70 Body,Rare Items Rare Tokina AF 100 mm f35 MACRO Fully Used Goods Bonus F70 Body,珍品 Tokina AF 100 mm f 3 5 MACRO 完動 中古 良品 おまけ 70 ボディ
14,ニコンAF NIKKOR 85mm F1.8,9000.00,,,https://page.auctions.yahoo.co.jp/jp/auction/419081917,2084261684,Nikon AF NIKKOR 85mm F1.8,Nikon AF NIKKOR 85 mm F18,ニコン AF NIKKOR 85 mm F 1 8
15,ニコン AF Nikkor 180mm f2.8ED,21000.00,,,https://page.auctions.yahoo.co.jp/jp/auction/w337446476,2084261684,Nikon AF Nikkor 180mm f2.8ED,Nikon AF Nikkor 180 mm f28ED,ニコン AF Nikkor 180 mm f2 8 ED
16,ニコンマクロ Micro-NIKKOR 105mm F2.8,5250.00,,,https://page.auctions.yahoo.co.jp/jp/auction/c759982551,2084261693,Nikon Macro Micro-NIKKOR 105mm F2.8,Nikon Macro MicroNIKKOR 105 mm F28,ニコン Micro 105 mm F 2 8
17,SIGMA 150-600mm F5-6.3 DG OS HSM Sports キヤノン 用 シグマ [277L] 新着,108800.00,110000.00,,https://page.auctions.yahoo.co.jp/jp/auction/j593549732,2084261683,SIGMA 150-600mm F5-6.3 DG OS HSM Sports For Sigma [277L] New,SIGMA 150600 mm F563 DG OS HSM Sports Sigma 277L New,SIGMA 150 600 mm 5 6. 3 DG OS HS キヤノン 用 277 新着
18,NIKON D600 最終ロット美品です、TOKINA ATX Pro 28~80 f2.8 レンズ付,53000.00,,,https://page.auctions.yahoo.co.jp/jp/auction/f363383014,2084261636,"NIKON D600 final lot beautiful item, TOKINA ATX Pro 28 ~ 80 f2.8 with lens",NIKON lot item TOKINA ATX Pro 28 80 lens,NIKON 600 最終 ロット 美品 TOKINA ATX Pro 28~ 80 f 2. 8 レンズ 付
19,【上質な描写力】 ニコン Nikon D200 ボディ ブラック 【バッテリーグリップ付き】（19Se22Y-KH）,11000.00,16800.00,,https://page.auctions.yahoo.co.jp/jp/auction/c773376402,2084261636,[High-quality descriptive power] Nikon Nikon D200 Body Black [With battery grip] (19Se22Y-KH),Highquality power Nikon Nikon D200 Body Black battery grip 19Se22YKH,上質 描写 力 ニコン Nikon 200 ボディ ブラック バッテリー グリップ 付き 19 22Y- KH
0,"フィルムkodak ex200,10ヶおまけ付！ 送料無料でお得！ ニコン nikon F-501 ボディ 本体 フラッシュ 手押しシャッター付 一眼レフ！",2501.00,,,https://page.auctions.yahoo.co.jp/jp/auction/p713847215,2084044785,"With film kodak ex200, 10 extras! Save money with free shipping! Nikon nikon F-501 Body Body Flash With a hand-held shutter SLR!",film kodak ex200 10 extras money shipping Nikon F501 Body Body Flash handheld SLR,フィルム kodak ex 200 10 おまけ 付 送料 無料 お 得 ニコン nikon 501 ボディ 本体 フラッシュ 手押し シャッター 付 一 眼 レフ
1,【新品】ニコン クールショットプロ スタビライズド（手ブレ補正機能搭載モデル,42000.00,,,https://page.auctions.yahoo.co.jp/jp/auction/f352011978,2084063253,[New] Nikon Cool Shot Pro Stabilized (model with camera shake correction function,New Nikon Cool Shot Pro Stabilized model camera shake correction function,新品 ニコン ショット プロ スタビライズド 手ブレ 補正 機能 搭載 モデル
2,ジャンク ニコン キヤノン ペンタックス オリンパス ミノルタ他 フィルム一眼レフ レンジファインダ-他 16台 まとめ まとめて セット#3248,9800.00,,,https://page.auctions.yahoo.co.jp/jp/auction/m359774127,2084044778,"<!DOCTYPE html><html><head><link rel=""shortcut icon"" href=""//ssl.gstatic.com/docs/script/images/favicon.ico""><title>エラー</title><style type=""text/css"">body {background-color: #fff; margin: 0; padding: 0;}.errorMessage {font-family: Arial,sans-serif; font-size: 12pt; font-weight: bold; line-height: 150%; padding-top: 25px;}</style></head><body style=""margin:20px""><div><img alt=""Google Apps Script"" src=""//ssl.gstatic.com/docs/script/images/logo.png""></div><div style=""text-align:center;font-family:monospace;margin:50px auto 0;max-width:600px"">無効な引数: source（行 3、ファイル「コード」、プロジェクト「Translation」）</div></body></html>",DOCTYPE relshortcut icon hrefsslgstaticcomdocsscriptimagesfaviconicotitletitlestyle typetextcssbody backgroundcolor fff margin 0 padding 0errorMessage Arialsansserif fontsize fontweight lineheight 150 paddingtop 25pxstyleheadbody stylemargin20pxdivimg altGoogle Apps Script srcsslgstaticcomdocsscriptimageslogopngdivdiv auto 0maxwidth600px source 3Translationdivbodyhtml,ジャンク ニコン キヤノン ペンタックス オリンパス ミノルタ 他 フィルム 一 眼 レフ レンジ ファイン ダ 他 16 台 まとめ セット 3248
3,良品 Nikon 1 J3 小型10倍ズームキット 高速AF&高速連写 ニコン1マウント NIKKOR VR 10-100mm f/4-5.6 ホワイト ニコン,15768.00,,,https://page.auctions.yahoo.co.jp/jp/auction/t673855995,2084261636,Good Nikon 1 J3 Compact 10x Zoom Kit High Speed ​​AF,Nikon 1 J3 Compact 10x Zoom Kit High Speed AF,良品 Nikon 1 3 小型 10 倍 キット AF 高速 ニコン 1 マウント NIKKOR VR 10 100 mm f 4- 5 6 ホワイト ニコン
4,■光学極上■ニコン Nikon AF-S DX VR Zoom-Nikkor 18-200mm f3.5-5.6 G IE-ED 《付属品完備》 #0135I12,11249.00,24400.00,,https://page.auctions.yahoo.co.jp/jp/auction/b417241707,2084261684,"<!DOCTYPE html><html><head><link rel=""shortcut icon"" href=""//ssl.gstatic.com/docs/script/images/favicon.ico""><title>エラー</title><style type=""text/css"">body {background-color: #fff; margin: 0; padding: 0;}.errorMessage {font-family: Arial,sans-serif; font-size: 12pt; font-weight: bold; line-height: 150%; padding-top: 25px;}</style></head><body style=""margin:20px""><div><img alt=""Google Apps Script"" src=""//ssl.gstatic.com/docs/script/images/logo.png""></div><div style=""text-align:center;font-family:monospace;margin:50px auto 0;max-width:600px"">無効な引数: source（行 3、ファイル「コード」、プロジェクト「Translation」）</div></body></html>",DOCTYPE relshortcut icon hrefsslgstaticcomdocsscriptimagesfaviconicotitletitlestyle typetextcssbody backgroundcolor fff margin 0 padding 0errorMessage Arialsansserif fontsize fontweight lineheight 150 paddingtop 25pxstyleheadbody stylemargin20pxdivimg altGoogle Apps Script srcsslgstaticcomdocsscriptimageslogopngdivdiv auto 0maxwidth600px source 3Translationdivbodyhtml,光学 極上 ニコン Nikon AF DX VR Zoom Nikkor 18- 200mm f 3 5 5. 6 IE ED 付属品 完備 0135 12
5,COSINA　100-400mm　1:4.5-6.7　MC　Nikon用（ニコン）,2150.00,,,https://page.auctions.yahoo.co.jp/jp/auction/b395438401,2084261684,COSINA 100-400mm 1: 4.5-6.7 MC for Nikon (Nikon),COSINA 100400 mm 1 4567 MC Nikon Nikon,COSINA 100 400 mm 1 4. 5 7 MC Nikon 用 ニコン
6,◯美品 おまけ付き 送料無料◯ SIGMA シグマ 18-200mm F3.5-6.3 DC OS HSM For NIKON ニコン用,12000.00,13000.00,,https://page.auctions.yahoo.co.jp/jp/auction/q307919416,2084261684,◯ beautiful goods with bonus free shipping ◯ SIGMA Sigma 18-200mm F3.5-6.3 DC OS HSM For NIKON for Nikon,goods bonus shipping SIGMA Sigma 18200 mm F3563 DC OS HSM NIKON Nikon,美品 おまけ 付き 送料 無料 SIGMA 18- 200 mm F3 5 6. 3 DC OS HS For NIKON ニコン 用
7,#J91R Nikon D70s ニコン デジタル一眼レフカメラ,1700.00,,,https://page.auctions.yahoo.co.jp/jp/auction/k411451394,2084261636,,,91 Nikon 70 s ニコン デジタル 一 眼 レフ カメラ
8,■ほぼ新品■ ニコン Nikon D5300 AF-P ダブルズームキット《18-55mm F3.5-5.6・70-300mm F4.5-6.3》元箱付 付属品完備 #B03993N01256,25500.00,52800.00,,https://page.auctions.yahoo.co.jp/jp/auction/n371319482,2084261636,"<!DOCTYPE html><html><head><link rel=""shortcut icon"" href=""//ssl.gstatic.com/docs/script/images/favicon.ico""><title>エラー</title><style type=""text/css"">body {background-color: #fff; margin: 0; padding: 0;}.errorMessage {font-family: Arial,sans-serif; font-size: 12pt; font-weight: bold; line-height: 150%; padding-top: 25px;}</style></head><body style=""margin:20px""><div><img alt=""Google Apps Script"" src=""//ssl.gstatic.com/docs/script/images/logo.png""></div><div style=""text-align:center;font-family:monospace;margin:50px auto 0;max-width:600px"">無効な引数: source（行 3、ファイル「コード」、プロジェクト「Translation」）</div></body></html>",DOCTYPE relshortcut icon hrefsslgstaticcomdocsscriptimagesfaviconicotitletitlestyle typetextcssbody backgroundcolor fff margin 0 padding 0errorMessage Arialsansserif fontsize fontweight lineheight 150 paddingtop 25pxstyleheadbody stylemargin20pxdivimg altGoogle Apps Script srcsslgstaticcomdocsscriptimageslogopngdivdiv auto 0maxwidth600px source 3Translationdivbodyhtml,新品 ニコン Nikon D 5300 AF ズーム キット 18 55 mm 5 5. 6 70 300 mm F4 5 6 3 元箱 付 付属品 完備 03993 01256
9,ニコン Nikon ミラーレス一眼Nikon 1 V3 ボディ ブラック　DF-N1000 電子ビューファインダー V3用　セット売り,40500.00,,,https://page.auctions.yahoo.co.jp/jp/auction/b416981739,2084305445,Nikon Nikon Mirrorless interchangeable-lens camera Nikon 1 V3 body black DF-N1000 Electronic viewfinder V3 set sale,Nikon Nikon Mirrorless camera Nikon 1 V3 body DFN1000 viewfinder V3 set sale,ニコン Nikon ミラー 一 眼 Nikon 1 3 ボディ ブラック DF 1000 電子 ビュー ファインダー 3 用 セット 売り
10,良品 Nikon F ボディ NIKKOR-H 1:2 50㎜ レンズ ニッコール NIPPON KOGAKU TOKYO 付属多数,14580.00,,,https://page.auctions.yahoo.co.jp/jp/auction/l549912246,2084044778,Good quality Nikon F body NIKKOR-H 1: 2 50mm lens Nikkor NIPPON KOGAKU TOKYO included many,quality Nikon F body NIKKORH 1 2 50 mm lens Nikkor NIPPON KOGAKU TOKYO,良品 Nikon ボディ NIKKOR 1 2 50 ㎜ レンズ ニッコール NIPPON KOGAKU TOKYO 付属 多数
11,#J90R AF-S NIKKOR DX 18-200mm F3.5-5.6 G VR ニコン,10000.00,,,https://page.auctions.yahoo.co.jp/jp/auction/b416536367,2084261684,,,90 AF NIKKOR DX 18 200 mm F3 5 5 6 VR ニコン
12,★ほぼ新品級★ Nikon ニコン AF-S DX Nikkor 18-70mm F3.5-4.5G ED フード付き,4000.00,13800.00,,https://page.auctions.yahoo.co.jp/jp/auction/p709127339,2084261684,★ Almost new ★ Nikon Nikon AF-S DX Nikkor 18-70mm F3.5-4.5G ED With hood,Nikon Nikon AFS DX Nikkor 1870 mm F3545 G ED hood,新品 級 Nikon ニコン AF DX Nikkor 18 70 mm F3 5 4. 5 ED フード 付き
13,#J89R TAMRON SP AF 200-500mm F5-6.3 Di LD IF タムロン ニコン用,9250.00,,,https://page.auctions.yahoo.co.jp/jp/auction/v664656541,2084261684,,,89 TAMRON SP AF 200 500mm 5 6. 3 LD IF タムロン ニコン 用
14,Nikon ニコン Nikonos SB 105 ニコノスV 水中カメラ用 フラッシュ スピードライト カメラベース アーム セット 中古,7936.00,10798.00,,https://page.auctions.yahoo.co.jp/jp/auction/k411175174,2084261969,Nikon Nikon Nikonos SB 105 Nikonos V Underwater Camera Flash Speedlight Camera Base Arm Set Used,Nikon Nikon Nikonos SB 105 Nikonos V Underwater Camera Flash Speedlight Camera Base Arm Set,Nikon ニコン Nikonos SB 105 ニコノス 水中 カメラ 用 フラッシュ スピードライト カメラ ベース アーム セット 中古
15,希少 Nikon S型 ボディ NIKKOR-H.C 1:2 5㎝ レンズ ニッコール NIPPON KOGAKU TOKYO,10800.00,,,https://page.auctions.yahoo.co.jp/jp/auction/r349919495,2084044778,Rare Nikon S Type Body NIKKOR-H.C 1: 2 5㎝ Lens Nikkor NIPPON KOGAKU TOKYO,Rare Nikon S Type Body NIKKORHC 1 2 5 Lens Nikkor NIPPON KOGAKU,Nikon 型 ボディ NIKKOR 1 2 5 ㎝ レンズ ニッコール NIPPON KOGAKU TOKYO
16,Nikon デジタル一眼レフカメラ D7100 まとめ売り セット付属品 あり MSD14EN 接眼目当て バッテリー ニコン,40000.00,,,https://page.auctions.yahoo.co.jp/jp/auction/n368612577,2084261636,Nikon Digital SLR Camera D7100 Collective Set Accessories Available MSD14EN Eyepiece Batteries Nikon,Nikon Digital SLR Camera D7100 Collective Set Accessories Available MSD14EN Eyepiece Batteries Nikon,Nikon デジタル 一 眼 レフ カメラ 7100 まとめ 売り セット 付属品 あり MSD 14 EN 接眼 目当て バッテリー ニコン
17,NY627s■新品 Nikon ニコン コンパクトデジタルカメラ COOLPIX クールピクス W100 1317万画素 防水10m 耐衝撃1.8m コンデジ,11340.00,,,https://page.auctions.yahoo.co.jp/jp/auction/j592138153,2084261644,NY627s New Nikon Nikon Compact Digital Camera COOLPIX Coolpix W100 13.17 million pixels Waterproof 10m Shock resistant 1.8m,NY627s New Nikon Nikon Compact Digital Camera COOLPIX Coolpix 1317 million Waterproof 10 m Shock 18 m,NY 627 s 新品 Nikon ニコン コンパクトデジタルカメラ COOLPIX クール ピクス 100 1317 万 画素 10 m 耐 衝撃 1 8 m コンデジ
18,Nikon ニコン　D700　美品,38000.00,,,https://page.auctions.yahoo.co.jp/jp/auction/t674044234,2084261636,Nikon Nikon D700 beautiful goods,Nikon Nikon goods,Nikon ニコン 700 美品
19,動作確認済 状態良し TAMRON 28-300mm F3.5-6.3 Di VC PZD Nikon ニコン用レンズ EC43-379jy/F3,34560.00,,,https://page.auctions.yahoo.co.jp/jp/auction/l549837360,2084261684,Operation confirmed Good condition TAMRON 28-300mm F3.5-6.3 Di VC PZD Nikon Lens for Nikon EC43-379jy / F3,Operation condition TAMRON 28300 mm F3563 Di VC PZD Nikon Lens Nikon EC43379jy F3,動作 確認 済 状態 TAMRON 28 300 mm F3 5 6. 3 Di VC PZD Nikon ニコン 用 レンズ EC 43 379 3
0,■ほぼ新品■ Nikon ニコン D5100 ダブルレンズセット 《バリアングルモニター》 #0055H12,19300.00,35000.00,,https://page.auctions.yahoo.co.jp/jp/auction/r350315640,2084261636,"<!DOCTYPE html><html><head><link rel=""shortcut icon"" href=""//ssl.gstatic.com/docs/script/images/favicon.ico""><title>エラー</title><style type=""text/css"">body {background-color: #fff; margin: 0; padding: 0;}.errorMessage {font-family: Arial,sans-serif; font-size: 12pt; font-weight: bold; line-height: 150%; padding-top: 25px;}</style></head><body style=""margin:20px""><div><img alt=""Google Apps Script"" src=""//ssl.gstatic.com/docs/script/images/logo.png""></div><div style=""text-align:center;font-family:monospace;margin:50px auto 0;max-width:600px"">無効な引数: source（行 3、ファイル「コード」、プロジェクト「Translation」）</div></body></html>",DOCTYPE relshortcut icon hrefsslgstaticcomdocsscriptimagesfaviconicotitletitlestyle typetextcssbody backgroundcolor fff margin 0 padding 0errorMessage Arialsansserif fontsize fontweight lineheight 150 paddingtop 25pxstyleheadbody stylemargin20pxdivimg altGoogle Apps Script srcsslgstaticcomdocsscriptimageslogopngdivdiv auto 0maxwidth600px source 3Translationdivbodyhtml,新品 Nikon ニコン 5100 ダブル レンズ セット バリ アングル モニター 0055 12
1,☆新品☆送料無料☆Nikon AF-S DX NIKKOR 18-300mm f/3.5-5.6G ED VR [AFSDXVR18-300G],85000.00,,,https://page.auctions.yahoo.co.jp/jp/auction/d377995033,23716,☆ New ☆ Free Shipping ☆ Nikon AF-S DX NIKKOR 18-300mm f / 3.5-5.6G ED VR [AFSDXVR18-300G],New Shipping Nikon AFS DX NIKKOR 18300 mm f 3556 G ED VR AFSDXVR18300 G,新品 送料 無料 Nikon AF DX NIKKOR 18 300 mm f/ 3. 5 5 6 ED VR AFSDXVR 18 300
2,NIKON ニコン 28Ti コンパクトカメラ 本体、専用ケース 電池交換済 撮影確認済,65880.00,,,https://page.auctions.yahoo.co.jp/jp/auction/h422300660,2084005100,"NIKON Nikon 28Ti compact camera body, special case battery exchange completed shooting confirmed",NIKON Nikon 28Ti camera body case battery exchange shooting,NIKON ニコン 28 Ti コンパクト カメラ 本体 専用 ケース 電池 交換 済 撮影 確認 済
3,【ecoま】ニコン NIKON Ai 105mm F2.5 no.709108 望遠単焦点 マニュアルレンズ,4000.00,,,https://page.auctions.yahoo.co.jp/jp/auction/k411972148,2084261693,[Eco] Nikon NIKON Ai 105mm F2.5 no.709108 Telephoto single focus manual lens,Eco Nikon NIKON Ai 105 mm F25 no709108 Telephoto focus lens,eco ま ニコン NIKON Ai 105 mm 2 5 no. 709108 望遠 単 焦点 マニュアル レンズ
4,◆実用◆ニコン NIKON AF NIKKOR 20-35mm f2.8 D/#1816/0923,3600.00,29800.00,,https://page.auctions.yahoo.co.jp/jp/auction/x646974300,2084261684,"<!DOCTYPE html><html><head><link rel=""shortcut icon"" href=""//ssl.gstatic.com/docs/script/images/favicon.ico""><title>エラー</title><style type=""text/css"">body {background-color: #fff; margin: 0; padding: 0;}.errorMessage {font-family: Arial,sans-serif; font-size: 12pt; font-weight: bold; line-height: 150%; padding-top: 25px;}</style></head><body style=""margin:20px""><div><img alt=""Google Apps Script"" src=""//ssl.gstatic.com/docs/script/images/logo.png""></div><div style=""text-align:center;font-family:monospace;margin:50px auto 0;max-width:600px"">無効な引数: source（行 3、ファイル「コード」、プロジェクト「Translation」）</div></body></html>",DOCTYPE relshortcut icon hrefsslgstaticcomdocsscriptimagesfaviconicotitletitlestyle typetextcssbody backgroundcolor fff margin 0 padding 0errorMessage Arialsansserif fontsize fontweight lineheight 150 paddingtop 25pxstyleheadbody stylemargin20pxdivimg altGoogle Apps Script srcsslgstaticcomdocsscriptimageslogopngdivdiv auto 0maxwidth600px source 3Translationdivbodyhtml,実用 ニコン NIKON AF NIKKOR 20 35 mm f 2 8 1816 0923
5,人気 ニコン Nikon Ai-s NIKKOR 50mm F1.8 ♯5959,1.00,8500.00,,https://page.auctions.yahoo.co.jp/jp/auction/x643014134,2084261693,Popular Nikon Nikon Ai-s NIKKOR 50mm F1.8 ♯5959,Popular Nikon Nikon Ais NIKKOR 50 mm F18 5959,人気 ニコン Nikon Ai- NIKKOR 50 mm F 1 8 5959
6,★新品級★ Nikon ニコン AF-S NIKKOR 70-200mm F2.8 G ED VR Ⅱ 元箱・付属品満載 ★外観・光学共に最高レベル! 完動品! E020,143900.00,159800.00,,https://page.auctions.yahoo.co.jp/jp/auction/h423013318,2084261684,★ New grade ★ Nikon Nikon AF-S NIKKOR 70-200mm F2.8 G ED VR Ⅱ Original box and accessories full load ★ The highest level of appearance and optics! Complete product! E020,grade Nikon Nikon AFS NIKKOR 70200 mm F28 G ED VR Original box accessories load level appearance optics product E020,新品 級 Nikon ニコン AF NIKKOR 70 200 mm F 2 8 ED VR Ⅱ 元箱 付属品 満載 外観 光学 共 最高 レベル 完動 品 020
7,★新品級★使用頻少★シグマ SIGMA 150-600mm F5-6.3 DG OS HSM Contemporary ニコン用 KENKOレンズフィルター95mm、元箱付★防湿庫保管,80000.00,,,https://page.auctions.yahoo.co.jp/jp/auction/p713529772,2084261684,"★ New grade ★ Frequent use ★ Sigma SIGMA 150-600mm F5-6.3 DG OS HSM Contemporary For Nikon KENKO lens filter 95mm, with original box ★ Moisture-proof storage",grade use Sigma SIGMA 150600 mm F563 DG OS HSM Contemporary Nikon KENKO lens 95 mm box Moistureproof storage,新品 級 使用 頻 少 SIGMA 150 600 mm F5 6. 3 DG OS HS Contemporary ニコン 用 KENKO レンズ フィルター 95 mm 元箱 付 防湿 庫 保管
